search URL:,https://patents.google.com/?q=Silica+wool&country=US&before=priority:20201231&after=priority:20201201&language=ENGLISH
id,title,assignee,inventor/author,priority date,filing/creation date,publication date,grant date,result link,representative figure link
US-11084961-B2,Highly flame-retardant adhesive for high polymer materials ,Shandong University,"Haifeng LU, Chuanjian Zhou, Hua Wang, Shengyu Feng, Chen An, Yuan Qu, Fanzhen Kong, Qingming Zeng",2020-12-09,2021-03-16,2021-08-10,2021-08-10,https://patents.google.com/patent/US11084961B2/en,https://patentimages.storage.googleapis.com/bb/ee/60/4f7bd31cac63a1/US11084961-20210810-D00001.png
US-2021371700-A1,Compositition for preparing a release coating ,Dow Silicones Corporation,"Zhenbin NIU, Nanguo Liu, Travis Sunderland, David Rich, Pierre Chevalier, Sze-Sze Ng, Alex Knott",,2020-12-02,2021-12-02,,https://patents.google.com/patent/US20210371700A1/en,
US-11192314-B2,Method for hybrid preforms ,Arris Composites Inc.,"Ethan Escowitz, Riley Reese, Erick Davidson, J. Scott PERKINS",,2020-12-16,2021-12-07,2021-12-07,https://patents.google.com/patent/US11192314B2/en,https://patentimages.storage.googleapis.com/6c/93/2a/bf1a9f28a86d36/US11192314-20211207-D00000.png
US-11089927-B1,Brushless vacuum device ,"Awesome Things That Work, LLC",Joseph C. Neill,2020-12-07,2020-12-07,2021-08-17,2021-08-17,https://patents.google.com/patent/US11089927B1/en,https://patentimages.storage.googleapis.com/37/42/8e/67713aef199830/US11089927-20210817-D00000.png
