US-2019357485-A1,Plants and seeds of corn variety cv676644 ,Monsanto Technology Llc,"Thanda Dhliwayo, Slobodan Trifunovic",2018-05-25,2018-05-25,2019-11-28,,https://patents.google.com/patent/US20190357485A1/en,
US-2019364797-A1,Plants and seeds of hybrid corn variety ch183898 ,Monsanto Technology Llc,"Rafael A. Mateo, Richard G. Stelpflug",2018-05-29,2018-05-29,2019-12-05,,https://patents.google.com/patent/US20190364797A1/en,
US-2019357475-A1,Plants and seeds of corn variety cv661150 ,Monsanto Technology Llc,Marvin L. Boerboom,2018-05-25,2018-05-25,2019-11-28,,https://patents.google.com/patent/US20190357475A1/en,
US-2019357473-A1,Plants and seeds of corn variety cv676562 ,Monsanto Technology Llc,Loren Trimble,2018-05-25,2018-05-25,2019-11-28,,https://patents.google.com/patent/US20190357473A1/en,
US-2019357488-A1,Plants and seeds of corn variety cv595836 ,Monsanto Technology Llc,Khusi R. Tiwari,2018-05-25,2018-05-25,2019-11-28,,https://patents.google.com/patent/US20190357488A1/en,
US-2019357464-A1,Plants and seeds of hybrid corn variety ch498598 ,Monsanto Technology Llc,"Christian J. Buffard, Jeffrey M. Sernett, Gary R. Stangland",2018-05-25,2018-05-25,2019-11-28,,https://patents.google.com/patent/US20190357464A1/en,
US-2019357490-A1,Plants and seeds of hybrid corn variety ch821068 ,Monsanto Technology Llc,"Fufa H. Birru, Christian J. Buffard, Richard G. Stelpflug",2018-05-25,2018-05-25,2019-11-28,,https://patents.google.com/patent/US20190357490A1/en,
US-2019357483-A1,Plants and seeds of hybrid corn variety ch356476 ,Monsanto Technology Llc,"Gregory J. Holland, Duane A. Potrzeba, Jeffrey M. Sernett, Gary R. Stangland",2018-05-25,2018-05-25,2019-11-28,,https://patents.google.com/patent/US20190357483A1/en,
US-2019357478-A1,Plants and seeds of hybrid corn variety ch342276 ,Monsanto Technology Llc,"Christian J. Buffard, Jeffrey M. Sernett, Gary R. Stangland",2018-05-25,2018-05-25,2019-11-28,,https://patents.google.com/patent/US20190357478A1/en,
US-10542709-B2,Plants and seeds of hybrid corn variety CH672558 ,Monsanto Technology Llc,"Fufa H. Birru, Christian J. Buffard, Richard G. Stelpflug",2018-05-29,2018-05-29,2020-01-28,2020-01-28,https://patents.google.com/patent/US10542709B2/en,
US-10455787-B1,Plants and seeds of hybrid corn variety CH901351 ,Monsanto Technology Llc,"Sandeep Bhatnagar, Gregory J. Holland, Duane A. Potrzeba, Gary R. Stangland",2018-05-29,2018-05-29,2019-10-29,2019-10-29,https://patents.google.com/patent/US10455787B1/en,
US-10448600-B1,Plants and seeds of hybrid corn variety CH182335 ,Monsanto Technology Llc,"Rafael A. Mateo, Richard G. Stelpflug",2018-05-29,2018-05-29,2019-10-22,2019-10-22,https://patents.google.com/patent/US10448600B1/en,
US-10462997-B1,Plants and seeds of hybrid corn variety CH814555 ,Monsanto Technology Llc,"Rafael A. Mateo, Richard G. Stelpflug",2018-05-29,2018-05-29,2019-11-05,2019-11-05,https://patents.google.com/patent/US10462997B1/en,
US-2019357487-A1,Plants and seeds of corn variety cv681019 ,Monsanto Technology Llc,Loren Trimble,2018-05-25,2018-05-25,2019-11-28,,https://patents.google.com/patent/US20190357487A1/en,
US-2019357471-A1,Plants and seeds of corn variety cv691303 ,Monsanto Technology Llc,"Thomas B. Carlson, Jeffrey M. Sernett",2018-05-25,2018-05-25,2019-11-28,,https://patents.google.com/patent/US20190357471A1/en,
US-2019357472-A1,Plants and seeds of corn variety cv644304 ,Monsanto Technology Llc,Paul T. Nelson,2018-05-25,2018-05-25,2019-11-28,,https://patents.google.com/patent/US20190357472A1/en,
US-2019357486-A1,Plants and seeds of corn variety cv685361 ,Monsanto Technology Llc,"Mark J. Brinkman, Louis R. Reeder",2018-05-25,2018-05-25,2019-11-28,,https://patents.google.com/patent/US20190357486A1/en,
US-2019357474-A1,Plants and seeds of corn variety cv696879 ,Monsanto Technology Llc,Clinton J. Turnbull,2018-05-25,2018-05-25,2019-11-28,,https://patents.google.com/patent/US20190357474A1/en,
US-2019357484-A1,Plants and seeds of hybrid corn variety ch883654 ,Monsanto Technology Llc,"Sandeep Bhatnagar, Gregory J. Holland, Duane A. Potrzeba, Gary R. Stangland",2018-05-25,2018-05-25,2019-11-28,,https://patents.google.com/patent/US20190357484A1/en,
US-2019357489-A1,Plants and seeds of corn variety cv679573 ,Monsanto Technology Llc,"Laron L. Peters, Loren Trimble",2018-05-25,2018-05-25,2019-11-28,,https://patents.google.com/patent/US20190357489A1/en,
US-2019357469-A1,Plants and seeds of corn variety cv579327 ,Monsanto Technology Llc,"Magen Starr Eller, Martin Medina",2018-05-25,2018-05-25,2019-11-28,,https://patents.google.com/patent/US20190357469A1/en,
US-2019357465-A1,Plants and seeds of hybrid corn variety ch341451 ,Monsanto Technology Llc,"Paul T. Nelson, Nicholas P. Ochs, Slobodan Trifunovic",2018-05-25,2018-05-25,2019-11-28,,https://patents.google.com/patent/US20190357465A1/en,
US-2019357477-A1,Plants and seeds of hybrid corn variety ch271387 ,Monsanto Technology Llc,"Nathaniel J. Page, Jon Popi",2018-05-25,2018-05-25,2019-11-28,,https://patents.google.com/patent/US20190357477A1/en,
US-2019357491-A1,Plants and seeds of hybrid corn variety ch820248 ,Monsanto Technology Llc,"Fufa H. Birru, Christian J. Buffard, Richard G. Stelpflug",2018-05-25,2018-05-25,2019-11-28,,https://patents.google.com/patent/US20190357491A1/en,
US-2019364796-A1,Plants and seeds of hybrid corn variety ch261313 ,Monsanto Technology Llc,"Gregory J. Holland, Duane A. Potrzeba, Jeffrey M. Sernett, Gary R. Stangland",2018-05-29,2018-05-29,2019-12-05,,https://patents.google.com/patent/US20190364796A1/en,
US-2019364755-A1,Plants and seeds of corn variety cv602186 ,Monsanto Technology Llc,"Franck Chopin, Joel Roucolle",2018-05-29,2018-05-29,2019-12-05,,https://patents.google.com/patent/US20190364755A1/en,
US-2019357467-A1,Plants and seeds of corn variety cv657038 ,Monsanto Technology Llc,Jon Popi,2018-05-25,2018-05-25,2019-11-28,,https://patents.google.com/patent/US20190357467A1/en,
US-10542705-B2,Plants and seeds of corn variety CV691449 ,Monsanto Technology Llc,"Slobodan Trifunovic, Clinton J. Turnbull",2018-05-29,2018-05-29,2020-01-28,2020-01-28,https://patents.google.com/patent/US10542705B2/en,
US-2019357466-A1,Plants and seeds of corn variety cv676326 ,Monsanto Technology Llc,Nathaniel J. Page,2018-05-25,2018-05-25,2019-11-28,,https://patents.google.com/patent/US20190357466A1/en,
US-10575486-B2,Plants and seeds of hybrid corn variety CH538091 ,Monsanto Technology Llc,"Fufa H. Birru, Christian J. Buffard, Jeffrey M. Sernett",2018-05-25,2018-05-25,2020-03-03,2020-03-03,https://patents.google.com/patent/US10575486B2/en,
US-10321649-B1,Plants and seeds of hybrid corn variety CH267703 ,Monsanto Technology Llc,"Fufa H. Birru, Rafael A. Mateo, Richard G. Stelpflug",2018-05-25,2018-05-25,2019-06-18,2019-06-18,https://patents.google.com/patent/US10321649B1/en,
US-2019364795-A1,Plants and seeds of hybrid corn variety ch816092 ,Monsanto Technology Llc,"Marvin L. Boerboom, Jon Popi",2018-05-29,2018-05-29,2019-12-05,,https://patents.google.com/patent/US20190364795A1/en,
US-10440921-B1,Plants and seeds of hybrid corn variety CH521189 ,Monsanto Technology Llc,"Christian J. Buffard, Jeffrey M. Sernett, Gary R. Stangland",2018-05-25,2018-05-25,2019-10-15,2019-10-15,https://patents.google.com/patent/US10440921B1/en,
US-2021079657-A1,Reinforced breathable sheet ,"Owens Corning Intellectual Capital, Llc","Martin Vido, Ronald Boisvert, Steve Thaxton",2018-05-11,2019-05-10,2021-03-18,,https://patents.google.com/patent/US20210079657A1/en,https://patentimages.storage.googleapis.com/2f/82/0a/d9360bac64366d/US20210079657A1-20210318-D00000.png
US-2019360593-A1,Sealing ring assembly ,Mahle International Gmbh,"Oliver Grill, Achim Herber",2018-05-07,2019-05-06,2019-11-28,,https://patents.google.com/patent/US20190360593A1/en,https://patentimages.storage.googleapis.com/18/b1/eb/bff8d416015f41/US20190360593A1-20191128-D00000.png
US-2019343996-A1,Percutaneous left ventricular assist device and non-invasive method for implanting same ,Safwan Kassas,Safwan Kassas,2018-05-10,2019-05-10,2019-11-14,,https://patents.google.com/patent/US20190343996A1/en,https://patentimages.storage.googleapis.com/21/fa/e0/81b86db9c23d86/US20190343996A1-20191114-D00000.png
US-2019350291-A1,Apparatus for Improving the Noticeability of a Hat ,"Santos Anthony Maldonado, Jodi Lynn Maldonado, Brent Allen Clothier","Santos Anthony Maldonado, Jodi Lynn Maldonado, Brent Allen Clothier",2018-05-16,2018-05-16,2019-11-21,,https://patents.google.com/patent/US20190350291A1/en,https://patentimages.storage.googleapis.com/ae/b6/2c/870ad05f5d01c4/US20190350291A1-20191121-D00000.png
US-2021038784-A1,Percutaneous long term left ventricular assist device and non-invasive method for implanting same ,"Cardiac Dynamics, LLC",Safwan Kassas,2018-05-10,2020-10-23,2021-02-11,,https://patents.google.com/patent/US20210038784A1/en,https://patentimages.storage.googleapis.com/92/06/d2/dbfc6a7724c404/US20210038784A1-20210211-D00000.png
US-11005104-B2,Battery ,"Panasonic Intellectual Property Management Co., Ltd.",Eiichi Koga,2018-05-28,2019-04-18,2021-05-11,2021-05-11,https://patents.google.com/patent/US11005104B2/en,https://patentimages.storage.googleapis.com/94/f7/45/0d8f43015b75bb/US11005104-20210511-D00000.png
US-2019350089-A1,Carbon-Based Direct Plating Process ,Macdermid Enthone Inc.,"Roger Bernards, James Martin, Jason J. Carver",2018-05-08,2018-05-08,2019-11-14,,https://patents.google.com/patent/US20190350089A1/en,
US-2021251085-A1,A method for increasing adhesion strength between a surface of copper or copper alloy and an organic layer ,Atotech Deutschland Gmbh,"Norbert Lützow, Wonjin Cho, Toshio Honda, Dirk Tews, Markku LAGER, Felix TANG, Mirko Kloppisch, Aaron HAHN, Gabriela SCHMIDT, Martin Thoms",2018-05-08,2019-05-06,2021-08-12,,https://patents.google.com/patent/US20210251085A1/en,
US-2021122809-A1,Eradication of bacterial biofilm using anti-amyloid monoclonal antibodies ,"Temple University-Of The Commonwealth System Of Higher Education, Lankenau Institute Of Medical Research","Cagla Tukel Wilson, Scott Dessain",2018-05-25,2019-05-24,2021-04-29,,https://patents.google.com/patent/US20210122809A1/en,https://patentimages.storage.googleapis.com/1f/ea/2d/498a9b9074a21c/US20210122809A1-20210429-D00001.png
US-2021363546-A1,"In vivo homology directed repair in heart, skeletal muscle, and muscle stem cells ",President And Fellows Of Harvard College,"Amy J. Wagers, Kexian Zhu",2018-05-03,2019-05-03,2021-11-25,,https://patents.google.com/patent/US20210363546A1/en,https://patentimages.storage.googleapis.com/93/0a/9b/47e0e4ca5e9c80/US20210363546A1-20211125-D00000.png
US-2021023877-A1,Wheel with spherical rim ,Serhan Kaptan YASAR,Serhan Kaptan YASAR,2018-05-22,2019-05-21,2021-01-28,,https://patents.google.com/patent/US20210023877A1/en,https://patentimages.storage.googleapis.com/ec/4c/ae/d7e417088ec128/US20210023877A1-20210128-D00000.png
US-2019337246-A1,Polymer matrix composite repair ,Rolls-Royce Plc,"Alexis LAMBOURNE, Alexander C. Smith, Jameel B. KHAN",2018-05-01,2019-04-17,2019-11-07,,https://patents.google.com/patent/US20190337246A1/en,https://patentimages.storage.googleapis.com/ce/dd/e7/d05fb8f0d2f475/US20190337246A1-20191107-D00000.png
US-2021154365-A1,Medical implants containing surface modified with gold nanoparticles ,Seljin Co. Ltd.,"Seil SOHN, Wan Kyu KO, Seong Jun Kim",2018-05-08,2020-11-08,2021-05-27,,https://patents.google.com/patent/US20210154365A1/en,https://patentimages.storage.googleapis.com/73/a6/65/45178825ead6f4/US20210154365A1-20210527-D00000.png
US-2021178682-A1,"Adhesion blocking element, three-dimensional printing device, and three-dimensional printing method ","Ningbo Sezen Technology Co., Ltd., Beijing Qingfeng Shidai Technology Co., Ltd.","Guang Zhu, Zhifeng YAO, Fang Li, Yi-Ho Lin, Yanhui Guo, Hu Wang",2018-05-05,2019-05-05,2021-06-17,,https://patents.google.com/patent/US20210178682A1/en,https://patentimages.storage.googleapis.com/50/bd/f9/5d2d0dc6c4202c/US20210178682A1-20210617-D00000.png
US-2021143227-A1,"Display device, display module, and electronic device ","Semiconductor Energy Laboratory Co., Ltd.","Hisao Ikeda, Kensuke Yoshizumi, Tomoya Aoyama",2018-05-11,2019-04-29,2021-05-13,,https://patents.google.com/patent/US20210143227A1/en,https://patentimages.storage.googleapis.com/05/5e/39/bf11b24997da35/US20210143227A1-20210513-D00000.png
US-2019355654-A1,Microelectronic assemblies having conductive structures with different thicknesses on a core substrate ,Intel Corporation,"Cheng Xu, JiWei Sun, Ji Yong Park, Kyu Oh Lee, Yikang Deng, Zhichao Zhang, Liwei Cheng, Andrew James Brown",2018-05-21,2018-05-21,2019-11-21,,https://patents.google.com/patent/US20190355654A1/en,https://patentimages.storage.googleapis.com/c6/24/80/d0cd052a2ade2b/US20190355654A1-20191121-D00000.png
US-2021189544-A1,"Use of a component in a composition, composition for laser transfer printing, and laser transfer printing method ",Lpkf Laser & Electronics Ag,"Robin Alexander Krüger, Malte Schulz-Ruhtenberg, Marc Hüske",2018-05-09,2020-11-09,2021-06-24,,https://patents.google.com/patent/US20210189544A1/en,
US-2021047913-A1,Well monitoring with magnetic tool ,King Abdullah University Of Science And Technology,"Juan Carlos Santamarina, Qi Liu",2018-05-07,2019-05-02,2021-02-18,,https://patents.google.com/patent/US20210047913A1/en,https://patentimages.storage.googleapis.com/ea/d2/e3/7ccc8346d1421e/US20210047913A1-20210218-D00000.png
US-2021230045-A1,Low alkali high transmission glasses ,Corning Incorporated,"Melissann Marie Ashton-Patton, Ellen Anne King",2018-05-01,2019-05-01,2021-07-29,,https://patents.google.com/patent/US20210230045A1/en,https://patentimages.storage.googleapis.com/2d/f4/20/615d4a19706cd9/US20210230045A1-20210729-D00000.png
US-2020040482-A1,Nitride crystal substrate and method for manufacturing the same ,"Sciocs Company Limited, Sumitomo Chemical Company, Limited","Fumimasa Horikiri, Takeshi Kimura",2018-05-16,2019-10-04,2020-02-06,,https://patents.google.com/patent/US20200040482A1/en,https://patentimages.storage.googleapis.com/a1/4e/15/8ea88f8504a5f7/US20200040482A1-20200206-D00000.png
US-2020098414-A1,Access line management for an array of memory cells ,"Micron Technology, Inc.",Daniele Vimercati,2018-05-04,2019-11-26,2020-03-26,,https://patents.google.com/patent/US20200098414A1/en,https://patentimages.storage.googleapis.com/be/e9/5c/5a90faa2caea99/US20200098414A1-20200326-D00000.png
US-2019337175-A1,Cutting device ,Pei-Keng Liu,Pei-Keng Liu,2018-05-01,2018-05-01,2019-11-07,,https://patents.google.com/patent/US20190337175A1/en,https://patentimages.storage.googleapis.com/d6/f6/e4/b7b5c40708c332/US20190337175A1-20191107-D00000.png
US-10768532-B2,Co-optimization of lithographic and etching processes with complementary post exposure bake by laser annealing ,International Business Machines Corporation,"Jing Sha, Ekmini Anuja De Silva, Nelson Felix, Derren DUNN",2018-05-15,2018-05-15,2020-09-08,2020-09-08,https://patents.google.com/patent/US10768532B2/en,https://patentimages.storage.googleapis.com/d1/9d/69/d680deee2abc73/US10768532-20200908-D00000.png
US-2019341092-A1,Access line management for an array of memory cells ,"Micron Technology, Inc.",Daniele Vimercati,2018-05-04,2018-05-04,2019-11-07,,https://patents.google.com/patent/US20190341092A1/en,https://patentimages.storage.googleapis.com/ef/b2/30/a1fa2c4b0a6988/US20190341092A1-20191107-D00000.png
US-2021172959-A1,Methods for proteome labeling ,"The Board Of Trustees Of The Leland Stanford Junior University, U.S. Government represented by the Department of veterans Affairs","Andrew Yang, Anton Wyss-Coray, Kyle BREWER",2018-05-10,2020-11-05,2021-06-10,,https://patents.google.com/patent/US20210172959A1/en,https://patentimages.storage.googleapis.com/6f/94/91/0cb0b2dad0efea/US20210172959A1-20210610-D00000.png
US-2021108087-A1,"A thermal and/or fire resistant panel, a mounting assembly, and a kit ",Cbg Systems International Pty Ltd,"Roberto Javier Herbon, Lukas KRELLMANN, Carmelo Dell'Olio",2018-05-19,2019-05-17,2021-04-15,,https://patents.google.com/patent/US20210108087A1/en,https://patentimages.storage.googleapis.com/87/4c/76/e6d1aeb6b062e2/US20210108087A1-20210415-D00000.png
US-2021138043-A1,Compounds and methods for the immobilization of myostatin-inhibitors on the extracellular matrix by transglutaminase ,Julius-Maximilians-Universität Würzburg,"Lorenz Meinel, Tessa LÜHMANN, Alexandra BRAUN",2018-05-18,2019-05-17,2021-05-13,,https://patents.google.com/patent/US20210138043A1/en,https://patentimages.storage.googleapis.com/2a/92/a3/28ffae46d884ef/US20210138043A1-20210513-D00000.png
US-2021070601-A1,Valve assembly ,"Ipet Technologies, Ltd.",Constantinos Sideris,2018-05-03,2019-05-03,2021-03-11,,https://patents.google.com/patent/US20210070601A1/en,https://patentimages.storage.googleapis.com/3c/8d/74/abf55603434cfb/US20210070601A1-20210311-D00000.png
US-2021233438-A1,Flexible display panel and mobile terminal ,"Huawei Technologies Co., Ltd.","Weihua Mao, Bo Wu, Jianqing SHENG, Haowen XU, Haiming He",2018-05-08,2018-07-26,2021-07-29,,https://patents.google.com/patent/US20210233438A1/en,https://patentimages.storage.googleapis.com/64/79/de/7da1c7034de4ad/US20210233438A1-20210729-D00000.png
US-2019343551-A1,Device guidewire management accessory ,"Boston Scientific Scimed, Inc.","Joel M. WasDyke, Jason T. Anderson, Patrick A. Haverkost, Joel N. Groff",2018-05-08,2019-05-07,2019-11-14,,https://patents.google.com/patent/US20190343551A1/en,https://patentimages.storage.googleapis.com/6b/69/7c/1916a96c81e2a4/US20190343551A1-20191114-D00000.png
US-2021229779-A1,Toggle ,Carbo-Link Ag,Andreas Winistörfer,2018-05-09,2019-04-16,2021-07-29,,https://patents.google.com/patent/US20210229779A1/en,https://patentimages.storage.googleapis.com/37/8c/4a/2437efed9d188e/US20210229779A1-20210729-D00000.png
US-2021052023-A1,Jackets with pockets and removable sleeves for use in the hospital setting ,Nuno ANTUNES,Nuno ANTUNES,2018-05-07,2019-05-06,2021-02-25,,https://patents.google.com/patent/US20210052023A1/en,https://patentimages.storage.googleapis.com/1f/ec/4d/c1ac735ef9e7c5/US20210052023A1-20210225-D00000.png
US-2019345826-A1,Tip member for blade structure and related method to form turbomachine component ,General Electric Company,"Travis J Packer, Jeffrey Clarence Jones, Nicholas William Rathay, Ian Darnall Reeves",2018-05-14,2018-05-14,2019-11-14,,https://patents.google.com/patent/US20190345826A1/en,https://patentimages.storage.googleapis.com/ce/76/a0/2d804748151611/US20190345826A1-20191114-D00000.png
US-2021237258-A1,Load transfer belt adapted to carry at least one accessory of a passive exoskeleton ,Ergosante Technologie,"Fabien Tourneux, Martin Jouet-Pastre, Pol Le Borgne, Kévin LEBEL",2018-05-02,2019-04-26,2021-08-05,,https://patents.google.com/patent/US20210237258A1/en,https://patentimages.storage.googleapis.com/13/3a/63/6a1a24fcf0dddb/US20210237258A1-20210805-D00000.png
US-2021115954-A1,Method for joining two workpieces ,Atlas Copco Ias Uk Limited,Samuel Williams,2018-05-17,2019-03-11,2021-04-22,,https://patents.google.com/patent/US20210115954A1/en,https://patentimages.storage.googleapis.com/34/f1/da/13056a57e88328/US20210115954A1-20210422-D00000.png
US-2019351611-A1,Electrical wiring harness assembly and process for manufacturing same ,Aptiv Technologies Limited,"David R. Peterson, Joseph Sudik, Jr., Jonathan D. Weidner, Sean P. Krompegel, Jared Bilas",2018-05-15,2018-11-29,2019-11-21,,https://patents.google.com/patent/US20190351611A1/en,https://patentimages.storage.googleapis.com/01/98/61/ed674efaa34e37/US20190351611A1-20191121-D00000.png
US-11054749-B2,Photoresist stripping composition and method ,"Versum Materials Us, Llc","Richard D. Peters, Michael Phenis, Travis Acra",2018-05-22,2019-05-15,2021-07-06,2021-07-06,https://patents.google.com/patent/US11054749B2/en,https://patentimages.storage.googleapis.com/d4/be/dc/369c3436cfcf40/US11054749-20210706-D00000.png
US-11037706-B2,Apparatus and method for manufacturing assembly having multiple separated conductors embedded within a substrate ,Aptiv Technologies Limited,"Jared Bilas, David R. Peterson, Gerald A. Rhinehart, Jr.",2018-05-15,2018-11-29,2021-06-15,2021-06-15,https://patents.google.com/patent/US11037706B2/en,https://patentimages.storage.googleapis.com/55/5d/ae/1f3db8d97b10eb/US11037706-20210615-D00000.png
US-10931091-B2,Misaligned deadend clamp ,Hubbell Incorporated,"Peter Chan, David Boudreau, Ben Crutcher",2018-05-25,2019-05-24,2021-02-23,2021-02-23,https://patents.google.com/patent/US10931091B2/en,https://patentimages.storage.googleapis.com/ef/ef/96/290063404769a3/US10931091-20210223-D00000.png
US-2021317506-A1,Chemical platform assisted proximity capture (cap-c) ,The University Of Chicago,"Chuan He, Qiancheng YOU",2018-05-08,2019-05-08,2021-10-14,,https://patents.google.com/patent/US20210317506A1/en,https://patentimages.storage.googleapis.com/a1/fc/4c/fac7beeaa9b1ea/US20210317506A1-20211014-D00000.png
US-10641575-B1,Gun lock for a rail riser ,"Overland Safety Systems, LLC",Richard P. Coulombre,2018-05-22,2019-05-22,2020-05-05,2020-05-05,https://patents.google.com/patent/US10641575B1/en,https://patentimages.storage.googleapis.com/b8/bc/4d/2a30f02e0a3fc1/US10641575-20200505-D00000.png
US-2019340820-A1,Systems and methods for updating a non-augmented reality display with user interactions in an augmented reality display ,"Rovi Guides, Inc.","Kanagasabai Sivanadian, Theresa Tokesky, Lucas Waye, Michael A. Montalto",2018-05-07,2018-05-07,2019-11-07,,https://patents.google.com/patent/US20190340820A1/en,https://patentimages.storage.googleapis.com/d2/1f/ba/b36bfc8e572ddc/US20190340820A1-20191107-D00000.png
US-2021331396-A1,Resource consumption control ,"Hewlett-Packard Development Company, L.P.","Josep Vallverdu Verge, Josep M. Asensio Buchaca",2018-05-15,2018-05-15,2021-10-28,,https://patents.google.com/patent/US20210331396A1/en,https://patentimages.storage.googleapis.com/6b/27/d1/c1c8bedbbb97f2/US20210331396A1-20211028-D00000.png
US-2019352341-A1,Modified peptides and their use for treating systemic lupus erythematosus ,"Immupharma France Sa, Centre National De La Recherche Scientifique (Cnrs)","Robert H. Zimmer, Fanny Valleix, Sylviane Muller",2018-05-17,2019-05-01,2019-11-21,,https://patents.google.com/patent/US20190352341A1/en,https://patentimages.storage.googleapis.com/f4/db/39/7ace12bf864f05/US20190352341A1-20191121-D00000.png
US-2021163850-A1,Method for producing ozone water ,"Tohoku University, Nomura Micro Science Co., Ltd.","Yasuyuki Shirai, Ken Sakai, Takayuki Jizaimaru",2018-05-02,2019-04-26,2021-06-03,,https://patents.google.com/patent/US20210163850A1/en,https://patentimages.storage.googleapis.com/6b/62/dd/7039990b8d2c59/US20210163850A1-20210603-D00000.png
US-2021233948-A1,Solid-state imaging element and manufacturing method thereof ,Sony Corporation,"Masahiro Joei, Kenichi Murata, Fumihiko Koga, Iwao Yagi, Shintarou Hirata, Hideaki Togashi, Yosuke Saito",2018-05-21,2019-04-19,2021-07-29,,https://patents.google.com/patent/US20210233948A1/en,https://patentimages.storage.googleapis.com/d4/58/8c/3d1638b708e5b4/US20210233948A1-20210729-D00000.png
US-2019343661-A1,Method for configuring a myoelectrically controlled prosthesis system and prosthesis system ,Otto Bock Healthcare Products Gmbh,"Christoph Messner, Sebastian AMSUESS, Georg Brandmayr, Martin Wehrle, Markus Friedrich, Johannes Steininger",2018-05-09,2019-05-08,2019-11-14,,https://patents.google.com/patent/US20190343661A1/en,https://patentimages.storage.googleapis.com/31/86/fc/bbe10d3a764e0c/US20190343661A1-20191114-D00000.png
US-2019342608-A1,Methods and systems for providing uncorrupted media assets ,"Rovi Guides, Inc.","Robert F. Watts, Scott D. Redman",2018-05-04,2018-08-24,2019-11-07,,https://patents.google.com/patent/US20190342608A1/en,https://patentimages.storage.googleapis.com/1d/56/b2/8bf40ede7d56df/US20190342608A1-20191107-D00000.png
US-2019357444-A1,Garden Scissors ,"Shang Gu Enterprise Co., Ltd.",Chu-Lan Lin,2018-05-28,2018-05-28,2019-11-28,,https://patents.google.com/patent/US20190357444A1/en,https://patentimages.storage.googleapis.com/41/3a/30/57d833a709ad37/US20190357444A1-20191128-D00000.png
US-2019345608-A1,Method of providing a plasma atomic layer deposition ,Lam Research Corporation,"Pulkit Agarwal, Purushottam Kumar, Adrien Lavoie",2018-05-08,2018-05-08,2019-11-14,,https://patents.google.com/patent/US20190345608A1/en,https://patentimages.storage.googleapis.com/33/0f/4b/49265b6a1ec35f/US20190345608A1-20191114-D00000.png
US-2021334733-A1,"Project Management Devices, Systems and Methods ","Christman Constructors, Inc.",Douglas J PETERS,2018-05-22,2019-05-22,2021-10-28,,https://patents.google.com/patent/US20210334733A1/en,https://patentimages.storage.googleapis.com/c3/fd/6d/f5fd1f6d4bab02/US20210334733A1-20211028-D00000.png
US-2021236652-A1,Nanoparticles for treatment of choroidal neovascularization and other indications ,Children's Medical Center Corporation,"Daniel S. Kohane, Yanfei Wang",2018-05-22,2019-05-21,2021-08-05,,https://patents.google.com/patent/US20210236652A1/en,https://patentimages.storage.googleapis.com/55/45/90/459bf286e5c4e1/US20210236652A1-20210805-D00000.png
US-2021208336-A1,Monolithic integrated quantum dot photonic integrated circuits ,The Regents Of The University Of California,"John E. Bowers, Arthur Gossard, Daehwan JUNG, Justin Norman, Chen SHANG, Yating WAN",2018-05-24,2019-05-24,2021-07-08,,https://patents.google.com/patent/US20210208336A1/en,https://patentimages.storage.googleapis.com/f8/94/f3/6d97c8ff27e1ce/US20210208336A1-20210708-D00000.png
US-2021190637-A1,Analysis system and analysis method ,"Horiba, Ltd.","Takashi Matsuyama, Ikue TAKAGI",2018-05-22,2019-05-21,2021-06-24,,https://patents.google.com/patent/US20210190637A1/en,https://patentimages.storage.googleapis.com/cd/d0/30/7d278f6f5dc12c/US20210190637A1-20210624-D00000.png
