US-2020190405-A1,"Liquid crystal alignment agent composition, method for preparing liquid crystal alignment film using same, and liquid crystal alignment film and liquid crystal display using same ","Lg Chem, Ltd.","Seongku KIM, Jung Ho Jo, Hoonseo PARK, Hee Han, Jun Young YOON",2018-05-17,2019-04-17,2020-06-18,,https://patents.google.com/patent/US20200190405A1/en,
US-2018244864-A1,Method for preparing rubber protective cover of expressway guardrail ,"Xinqiao He, Shan He","Xinqiao He, Shan He",2018-05-02,2018-05-02,2018-08-30,,https://patents.google.com/patent/US20180244864A1/en,
US-2021285152-A1,Grained leather-like sheet ,"Kuraray Co., Ltd.","Tetsuya Ashida, Kansai HARA",2018-05-09,2019-04-19,2021-09-16,,https://patents.google.com/patent/US20210285152A1/en,https://patentimages.storage.googleapis.com/f0/d6/c1/9a97ca0b2d6549/US20210285152A1-20210916-D00000.png
US-2021053048-A1,Analytical cartridge for soil testing and related methods ,Precision Planting Llc,"Todd Swanson, Dale Koch, Adam Vaccari",2018-05-01,2019-04-11,2021-02-25,,https://patents.google.com/patent/US20210053048A1/en,https://patentimages.storage.googleapis.com/53/5f/f7/b1a173d586bf6c/US20210053048A1-20210225-D00000.png
US-2019372148-A1,Fire-resistant lithium battery containing an electrode-protecting layer ,"Nanotek Instruments, Inc.","Hui He, Yu-Sheng Su, Aruna Zhamu, Bor Z. Jang",2018-05-29,2018-05-29,2019-12-05,,https://patents.google.com/patent/US20190372148A1/en,https://patentimages.storage.googleapis.com/b2/d1/e8/51d6e03dea6bc4/US20190372148A1-20191205-D00000.png
US-2019352473-A1,Flame-retardant and abrasion-resistant composite ,Niching Industrial Corp.,"Jian-Yuan Yu, Wei-Han HSIAO, Hsin-Chen CHUNG",2018-05-17,2019-05-16,2019-11-21,,https://patents.google.com/patent/US20190352473A1/en,https://patentimages.storage.googleapis.com/ab/72/21/f3f59a46ec2d7a/US20190352473A1-20191121-D00000.png
US-2019352589-A1,Automated Cell Culturing ,Huacells Corporation,"Jie Jing, Kenneth A. Collins, Fang Yuan, Zhonghua Zhang, Lawrence St. George, Jeffery J. Driscoll, Weijia Tan, Hao CAI, Dongping Lin, Jian Cheng",2018-05-18,2018-12-21,2019-11-21,,https://patents.google.com/patent/US20190352589A1/en,https://patentimages.storage.googleapis.com/93/13/87/c1d7ffed93969f/US20190352589A1-20191121-D00000.png
US-2021249664-A1,Metal-Air Battery and Method of Producing Air Electrode ,Nippon Telegraph And Telephone Corporation,"Mikayo IWATA, Masaya Nohara, Shuhei SAKAMOTO, Masahiko Hayashi, Takeshi Komatsu",2018-05-18,2019-05-09,2021-08-12,,https://patents.google.com/patent/US20210249664A1/en,https://patentimages.storage.googleapis.com/6e/87/78/316048d3434a77/US20210249664A1-20210812-D00000.png
US-2021268543-A1,Surfaces resistant to bacterial adhesion ,Evonik Canada Inc.,"Alexandra Piotrowicz, Kyle William Macdonald, Antonio Cillero Rodrigo, Sanjoy Mullick, Jamie Robert SWENOR, J. Paul Santerre, Jeannette Ho",2018-05-18,2019-05-17,2021-09-02,,https://patents.google.com/patent/US20210268543A1/en,https://patentimages.storage.googleapis.com/b3/12/20/1697f7c8892973/US20210268543A1-20210902-D00001.png
US-2019356033-A1,Reduced dispersion dielectric waveguides ,Intel Corporation,"Georgios Dogiamis, Adel A. Elsherbini, Telesphor Kamgaing, Henning Braunisch, Johanna M. Swan",2018-05-18,2018-06-21,2019-11-21,,https://patents.google.com/patent/US20190356033A1/en,https://patentimages.storage.googleapis.com/0a/e0/ae/cb4da9aa78857e/US20190356033A1-20191121-D00000.png
US-2021230199-A1,SIMPLE METHOD FOR THE PURIFICATION OF LACTO-N-NEOTETRAOSE (LNnT) FROM CARBOHYDRATES OBTAINED BY MICROBIAL FERMENTATION ,Jennewein Biotechnologie Gmbh,"Stefan Jennewein, Markus HELFRICH",2018-05-07,2019-05-06,2021-07-29,,https://patents.google.com/patent/US20210230199A1/en,https://patentimages.storage.googleapis.com/34/66/e8/ef939b08e7ab13/US20210230199A1-20210729-D00000.png
US-2019353354-A1,High efficiency convection oven ,Gas Technology Institute,"Paul Eric Glanville, Shawn Matthew Scott, Miroslaw K LISZKA",2018-05-15,2019-05-15,2019-11-21,,https://patents.google.com/patent/US20190353354A1/en,https://patentimages.storage.googleapis.com/be/b6/6f/dee1a160b27365/US20190353354A1-20191121-D00000.png
US-10965089-B2,"Laser device, laser machining apparatus, and method for controlling output of laser device ",Mitsubishi Electric Corporation,"Tomohiro Kyoto, Taira Ogita, Takeshi Morimoto, Hideyasu Machii, Hiroaki Kurokawa",2018-05-07,2018-05-07,2021-03-30,2021-03-30,https://patents.google.com/patent/US10965089B2/en,https://patentimages.storage.googleapis.com/19/b9/d3/91918d7e3f6518/US10965089-20210330-D00000.png
US-10553964-B2,Window assembly with solderless electrical connector ,"Agc Automotive Americas R&D, Inc.","Daniel Bennett, Christopher A. Imeson",2018-05-17,2019-08-05,2020-02-04,2020-02-04,https://patents.google.com/patent/US10553964B2/en,https://patentimages.storage.googleapis.com/e2/9c/1b/b2e0f51fe2f624/US10553964-20200204-D00000.png
US-2019339227-A1,Room temperature hydrogen gas sensor ,King Fahd University Of Petroleum And Minerals,"Qasem Ahmed DRMOSH, Zain Hassan Yamani, Amar Kamal MOHAMEDKHAIR, Abdulmajeed Hasan HENDI",2018-05-03,2018-05-03,2019-11-07,,https://patents.google.com/patent/US20190339227A1/en,https://patentimages.storage.googleapis.com/75/fd/ae/964e1184f748f4/US20190339227A1-20191107-D00000.png
US-2021147352-A1,"Sulfonium salt, photoacid generator, curable composition, and resist composition ",San-Apro Ltd.,"Takuto Nakao, Yusaku Takashima",2018-05-25,2019-04-09,2021-05-20,,https://patents.google.com/patent/US20210147352A1/en,
US-2021236028-A1,Analyte sensor antimicrobial configurations and adhesives ,Abbott Diabetes Care Inc.,"Jonathan D. McCanless, Udo Hoss, Benjamin J. Feldman, Frank David Fujimoto, Steven T. Mitchell",2018-05-17,2019-05-17,2021-08-05,,https://patents.google.com/patent/US20210236028A1/en,https://patentimages.storage.googleapis.com/c8/2f/6a/f40a42cbb82892/US20210236028A1-20210805-D00000.png
US-2019346776-A1,"Illumination Source for an Inspection Apparatus, Inspection Apparatus and Inspection Method ",Asml Netherlands B.V.,"David O DWYER, Petrus Wilhelmus SMORENBURG, Gerrit Jacobus Hendrik BRUSSAARD",2018-05-14,2019-04-30,2019-11-14,,https://patents.google.com/patent/US20190346776A1/en,https://patentimages.storage.googleapis.com/1e/74/37/948453f2819d95/US20190346776A1-20191114-D00000.png
US-2021053875-A1,High performance glossy finish green hybrid composites with variable density and an improved process for making thereof ,Council Of Scientific And Industrial Research,"Pappu ASOKAN, Manoj Kumar Gupta, Edward PETERS, Ajay KULSHRESHTH, Sanjai Kumar Singh RATHORE, Avanish Kumar SRIVASTAVA",2018-05-04,2019-02-09,2021-02-25,,https://patents.google.com/patent/US20210053875A1/en,https://patentimages.storage.googleapis.com/52/48/0e/f0665eebe5e560/US20210053875A1-20210225-D00000.png
US-2020030496-A1,Nanofiber-hydrogel composites for cell and tissue delivery ,The Johns Hopkins University,"Sashank Reddy, Russell Martin, Xiaowei Li, Calvin Chang, Kevin Colbert, Hai-quan Mao",2018-05-09,2019-07-18,2020-01-30,,https://patents.google.com/patent/US20200030496A1/en,https://patentimages.storage.googleapis.com/ba/aa/8f/b6a8c835ec196d/US20200030496A1-20200130-D00001.png
US-2019356028-A1,Battery and vehicle equipped with said battery ,Faurecia Systemes D'echappement,"Jean-Baptiste Cassard, Denis Lattay",2018-05-18,2019-05-17,2019-11-21,,https://patents.google.com/patent/US20190356028A1/en,https://patentimages.storage.googleapis.com/ee/42/f5/878632ea686f41/US20190356028A1-20191121-D00000.png
US-2021095062-A1,Olefin-Based Copolymer and Method for Preparing the Same ,"Lg Chem, Ltd.","In Sung PARK, Eun Jung Lee, Hyun Jin Ju, Sang Eun PARK, Choong Hoon Lee, Jin Sam GONG, Jung Ho JUN, Rae Keun GWAK",2018-05-04,2019-05-03,2021-04-01,,https://patents.google.com/patent/US20210095062A1/en,
US-2021123040-A1,High-resolution spatial macromolecule abundance assessment ,"The General Hospital Corporation, The Broad Institute, Inc., Massachusetts Institute Of Technology, President And Fellows Of Harvard College","Evan MACOSKO, Fei Chen, Sam Rodriques, Robert Stickels, Carly Martin",2018-05-02,2019-05-01,2021-04-29,,https://patents.google.com/patent/US20210123040A1/en,https://patentimages.storage.googleapis.com/ec/c9/ab/c559e05ff84429/US20210123040A1-20210429-D00000.png
US-2021236976-A1,Method for coating a wall-flow filter ,Umicore Ag & Co. Kg,"Martin Foerster, Antje Oltersdorf, Naina Deibel, Sascha Zoelle, Jürgen Koch, Manuel Gensch, Wolfgang Hasselmann",2018-05-09,2019-05-08,2021-08-05,,https://patents.google.com/patent/US20210236976A1/en,https://patentimages.storage.googleapis.com/9a/08/e9/4606663276b969/US20210236976A1-20210805-D00000.png
US-2021206267-A1,Multi-functional composite structure and process of its production ,"TMG - Tecidos Plastificados e Outros Revestimentos Para a Indústria Autómovel, S.A.","Luis Filipe CARVALHO DA SILVA, Tiago Filipe DA SILVA MAIA, Antonio Cesar RODRIGUES AGUIA, Elizabete de Pinho",2018-05-29,2019-05-14,2021-07-08,,https://patents.google.com/patent/US20210206267A1/en,https://patentimages.storage.googleapis.com/4c/58/63/b3be51dd183c92/US20210206267A1-20210708-D00000.png
US-2019352515-A1,Fire Protective Compositions and Associated Methods ,Unifrax I Llc,"Bruce K. Zoitos, Jonathan Cross, Adam Kelsall, Chad D. Cannan, Kenneth B. Miller, Gary A. Lee, Mark E. Beauharnois, Anastasia Keefe, Donald John Daniels, IV",2018-05-18,2019-05-17,2019-11-21,,https://patents.google.com/patent/US20190352515A1/en,https://patentimages.storage.googleapis.com/de/59/da/ac072e790736bb/US20190352515A1-20191121-D00000.png
US-2021206922-A1,Thiol-ene curable composition ,Showa Denko K.K.,Mina Onishi,2018-05-22,2019-05-13,2021-07-08,,https://patents.google.com/patent/US20210206922A1/en,
US-2021221776-A1,Perfluoroaminoolefins and methods of making and using the same ,3M Innovative Properties Company,"Sean M. SMITH, Michael J. Bulinski, Michael G. Costello, Klaus Hintzer, Markus E. Hirscherg, William M. Lamanna",2018-05-15,2019-05-10,2021-07-22,,https://patents.google.com/patent/US20210221776A1/en,https://patentimages.storage.googleapis.com/2a/c8/5e/d5418c38bd29c5/US20210221776A1-20210722-D00000.png
US-2019344214-A1,"Systems for generating water using exogenously generated heat, exogenously generated electricity, and exhaust process fluids and related methods therefor ","Zero Mass Water, Inc.","Cody Alden Friesen, Kamil SALLOUM, Jonathan Edward Goldberg, Grant Harrison Friesen",2018-05-11,2019-05-13,2019-11-14,,https://patents.google.com/patent/US20190344214A1/en,https://patentimages.storage.googleapis.com/51/1d/30/d5001f6f2dea36/US20190344214A1-20191114-D00000.png
US-2019353316-A1,Flames/smoke simulation ,Foshan Tonghui Electronic Fireplace Ltd.,"Antoine Andre Jacques BELVERGE, Jean-Luc Starczan",2018-05-16,2018-07-23,2019-11-21,,https://patents.google.com/patent/US20190353316A1/en,https://patentimages.storage.googleapis.com/3c/59/eb/f4bbf790b4005f/US20190353316A1-20191121-D00000.png
US-2019350869-A1,Magnetic nanoparticles sequentially irradiated by laser radiation for medical or chemical or biological or cosmetic applications ,Nanobacterie,Edouard ALPHANDÉRY,2018-05-16,2019-05-15,2019-11-21,,https://patents.google.com/patent/US20190350869A1/en,https://patentimages.storage.googleapis.com/bf/11/1e/02428b24a12ee9/US20190350869A1-20191121-D00000.png
US-2021230427-A1,Near-infrared harvesting transparent luminescent solar concentrators with engineered stokes shift ,Board Of Trustees Of Michigan State University,"Richard R. LUNT, III, Babak Borhan, Benjamin G. LEVINE, Wei SHENG, Jun Zhang, Chenchen YANG",2018-05-09,2019-05-08,2021-07-29,,https://patents.google.com/patent/US20210230427A1/en,https://patentimages.storage.googleapis.com/c1/d0/45/09d9a5d7ddd03b/US20210230427A1-20210729-D00000.png
US-2021309942-A1,"Quaternary Alkylammonium Hypochlorite Solution, Method for Manufacturing Same, and Method for Cleaning Semiconductor Wafer ",Tokuyama Corporation,"Takafumi Shimoda, Yuki Kikkawa, Takayuki Negishi, Seiji Tono",2018-05-23,2019-05-20,2021-10-07,,https://patents.google.com/patent/US20210309942A1/en,https://patentimages.storage.googleapis.com/80/0c/63/35b25910b1a621/US20210309942A1-20211007-D00000.png
US-2019344309-A1,Method of forming multilayer coating film ,"Kansai Paint Co., Ltd., Toyota Jidosha Kabushiki Kaisha","Keita Ono, Masahiro Omura, Masayoshi Asai, Tetsuya Nishiguchi",2018-05-11,2019-05-10,2019-11-14,,https://patents.google.com/patent/US20190344309A1/en,
US-2019336254-A1,Methods of three-dimensional printing for fabricating a dental appliance ,Dentsply Sirona Inc.,"Md Abu HASAN, Dan Ammon",2018-05-03,2019-05-03,2019-11-07,,https://patents.google.com/patent/US20190336254A1/en,https://patentimages.storage.googleapis.com/01/77/e1/bea8d16453d833/US20190336254A1-20191107-D00000.png
US-2021230505-A1,Branched fatty acids and esters thereof ,Oleon Nv,"Pieter Struelens, Andreas LAMBIN, Dirk PACKET",2018-05-07,2019-05-03,2021-07-29,,https://patents.google.com/patent/US20210230505A1/en,
US-2019363057-A1,"Method for Processing a Semiconductor Wafer, Semiconductor Composite Structure and Support Structure for Semiconductor Wafer ",Infineon Technologies Ag,"Francisco Javier Santos Rodriguez, Alexander Breymesser, Erich Griebl, Michael KNABL, Matthias Kuenle, Andreas Moser, Roland Rupp, Hans-Joachim Schulze, Sokratis Sgouridis, Stephan Voss",2018-05-25,2019-05-24,2019-11-28,,https://patents.google.com/patent/US20190363057A1/en,https://patentimages.storage.googleapis.com/96/1d/77/e5cf7126650042/US20190363057A1-20191128-D00000.png
US-2019345874-A1,Fluid ejector ,Rolls-Royce Plc,David P. Scothern,2018-05-10,2019-04-22,2019-11-14,,https://patents.google.com/patent/US20190345874A1/en,https://patentimages.storage.googleapis.com/cf/5f/d2/af3acbe0c80e6b/US20190345874A1-20191114-D00000.png
US-2019338673-A1,Oil Tank Filling System ,Rolls-Royce Plc,"David A. Edwards, Clare L. BEWICK, Samuel W. White, William A. Malewicz, Sebastian Ray, Cristina Diaz Garcia",2018-05-02,2019-04-18,2019-11-07,,https://patents.google.com/patent/US20190338673A1/en,https://patentimages.storage.googleapis.com/1b/57/6e/59202876ab0888/US20190338673A1-20191107-D00000.png
US-2021140111-A1,"Complex of polymers, preparation and use ",S.P.C.M. Sa,"Gatien Faucher, Damien FOUGEROUSE, René Hund",2018-05-07,2019-05-07,2021-05-13,,https://patents.google.com/patent/US20210140111A1/en,
US-2019359393-A1,Drink lid for a cup ,Dart Container Corporation,"Aaron Layos, Chengtao Li, Robert Brubaker, Jacob Purcell, Dean Garza",2018-05-25,2019-05-20,2019-11-28,,https://patents.google.com/patent/US20190359393A1/en,https://patentimages.storage.googleapis.com/c1/c4/77/0a45704be24719/US20190359393A1-20191128-D00000.png
US-2021238850-A1,Foam wall structures with high shear strength and methods for the manufacture thereof ,Covestro Llc,"David M. Baily, James L. Lambach, II Michael F. Palmosina",2018-05-07,2019-05-07,2021-08-05,,https://patents.google.com/patent/US20210238850A1/en,https://patentimages.storage.googleapis.com/5b/d1/3c/17c0d3d4ade482/US20210238850A1-20210805-D00000.png
US-2021138113-A1,Dermal fillers and applications thereof ,Collplant Ltd.,"Oded Shoseyov, Nadav Orr, Jasmine SEROR MAKNOUZ, Revital ZARKA",2018-05-03,2019-05-02,2021-05-13,,https://patents.google.com/patent/US20210138113A1/en,https://patentimages.storage.googleapis.com/7e/1f/0f/15b7ddd4372f0f/US20210138113A1-20210513-D00000.png
US-2019353143-A1,Method of manufacturing a spar cap ,Siemens Gamesa Renewable Energy A/S,Donato Girolamo,2018-05-17,2019-05-13,2019-11-21,,https://patents.google.com/patent/US20190353143A1/en,https://patentimages.storage.googleapis.com/ae/83/f8/d87ecfeee87d29/US20190353143A1-20191121-D00000.png
US-11038171-B2,"Active material including composite fluoride for fluoride ion secondary battery, and fluoride ion secondary battery using the same ","Panasonic Intellectual Property Management Co., Ltd.","Kazuko Asano, Kensuke Nakura, Mitsuhiro Hibino, Jin Zhang",2018-05-22,2019-05-07,2021-06-15,2021-06-15,https://patents.google.com/patent/US11038171B2/en,https://patentimages.storage.googleapis.com/1f/47/ce/7985c64b4be901/US11038171-20210615-D00001.png
US-2021171375-A1,Pretreatment to remove ammonia from high strength wastewater with memrbane aerated biofilm sidestream ,"Bl Technologies, Inc.","Dwight Cornelius HOUWELING, Douglas Joseph Thompson, Jeffrey Gerard Peeters",2018-05-11,2018-05-11,2021-06-10,,https://patents.google.com/patent/US20210171375A1/en,https://patentimages.storage.googleapis.com/ad/b4/82/799f0af196fb37/US20210171375A1-20210610-D00000.png
US-10765069-B2,Supplementing sub-optimal environmental conditions to optimize plant growth ,International Business Machines Corporation,"John S. Werner, Anuradha Rao, Pasquale A. Catalano, Arkadiy O. Tsfasman, Andrew G. Crimmins",2018-05-17,2018-05-17,2020-09-08,2020-09-08,https://patents.google.com/patent/US10765069B2/en,https://patentimages.storage.googleapis.com/ba/8f/d8/e4b8e8f6bea0d3/US10765069-20200908-D00000.png
US-10570022-B2,"Microstructured multicomposite copper microparticle with antibacterial and/or biocidal activity that comprises in its structure 5 different types of copper compounds, all regular and crystalline ",Copperprotek Spa,Javier Ignacio LAVIN CARRASCO,2018-05-29,2019-03-19,2020-02-25,2020-02-25,https://patents.google.com/patent/US10570022B2/en,https://patentimages.storage.googleapis.com/8c/b5/6a/78e6b027cd94f2/US10570022-20200225-D00000.png
US-2021216773-A1,Personal protective equipment system with augmented reality for safety event detection and visualization ,3M Innovative Properties Company,"Kandyce M. Bohannon, Britton G. Billingsley, Matthew J. Blackford, Ronald D. Jesme, Johannes P.M. Kusters, Caroline M. Ylitalo",2018-05-03,2019-05-01,2021-07-15,,https://patents.google.com/patent/US20210216773A1/en,https://patentimages.storage.googleapis.com/e9/ac/e7/4159aba5383a3e/US20210216773A1-20210715-D00000.png
US-2021223442-A1,Negative optical power liquid lens ,Corning Incorporated,"Joseph Marshall Kunick, Shawn Michael O'Malley",2018-05-21,2019-05-17,2021-07-22,,https://patents.google.com/patent/US20210223442A1/en,https://patentimages.storage.googleapis.com/28/57/82/7650ed4baf5fe6/US20210223442A1-20210722-D00000.png
US-11024683-B2,Display device including a sensing signal transmitter and a sensing signal receiver ,"Samsung Display Co., Ltd.","Soo Ho Kim, Han Na MA, Youngseok Kim",2018-05-16,2020-05-21,2021-06-01,2021-06-01,https://patents.google.com/patent/US11024683B2/en,https://patentimages.storage.googleapis.com/52/c0/73/8d0376c4529ee9/US11024683-20210601-D00000.png
US-2019343127-A1,Agricultural composition for increasing crop yields ,Inveran Corp Spa,Rene Alejandro ANDRADE NIKLITSCHEK,2018-05-08,2019-05-06,2019-11-14,,https://patents.google.com/patent/US20190343127A1/en,
US-2021228317-A1,Apparatus and method for dental clamping ,Cyberdontics Inc.,"Christopher John CIRIELLO, James Jackson, Nathan John Muller, Brian Edward King, Alec John Lillis",2018-05-10,2019-05-09,2021-07-29,,https://patents.google.com/patent/US20210228317A1/en,https://patentimages.storage.googleapis.com/76/8e/16/9fef82e94cf182/US20210228317A1-20210729-D00000.png
US-2021205180-A1,System and device for remote monitoring ,Chalant Health Inc.,Matthew PUGSLEY,2018-05-18,2019-05-17,2021-07-08,,https://patents.google.com/patent/US20210205180A1/en,https://patentimages.storage.googleapis.com/22/e4/cb/c8c73d90b99fa2/US20210205180A1-20210708-D00000.png
US-2021241880-A1,Method for the determination of processing influences on the energy value of feedstuff raw materials and/or feedstuffs ,Evonik Operations Gmbh,"Markus Wiltafsky-Martin, Johann Fickler",2018-05-09,2019-05-08,2021-08-05,,https://patents.google.com/patent/US20210241880A1/en,https://patentimages.storage.googleapis.com/35/ba/53/d0a708e53ebeab/US20210241880A1-20210805-D00000.png
US-2019357479-A1,Plants and seeds of hybrid corn variety ch908544 ,Monsanto Technology Llc,"Gregory J. Holland, Duane A. Potrzeba, Jeffrey M. Sernett, Gary R. Stangland",2018-05-25,2018-05-25,2019-11-28,,https://patents.google.com/patent/US20190357479A1/en,
US-10357000-B1,Plants and seeds of hybrid corn variety CH916258 ,Monsanto Technology Llc,"Gregory J. Holland, Duane A. Potrzeba, Jeffrey M. Sernett, Gary R. Stangland",2018-05-29,2018-05-29,2019-07-23,2019-07-23,https://patents.google.com/patent/US10357000B1/en,
US-10433507-B1,Plants and seeds of hybrid corn variety CH541065 ,Monsanto Technology Llc,"Fufa H. Birru, Christian J. Buffard, Jeffrey M. Sernett",2018-05-25,2018-05-25,2019-10-08,2019-10-08,https://patents.google.com/patent/US10433507B1/en,
US-10375913-B1,Plants and seeds of hybrid corn variety CH341398 ,Monsanto Technology Llc,"Gregory J. Holland, Nicholas P. Ochs, Slobodan Trifunovic",2018-05-25,2018-05-25,2019-08-13,2019-08-13,https://patents.google.com/patent/US10375913B1/en,
US-10412917-B1,Plants and seeds of corn variety CV691450 ,Monsanto Technology Llc,Duane A. Potrzeba,2018-05-25,2018-05-25,2019-09-17,2019-09-17,https://patents.google.com/patent/US10412917B1/en,
US-10448599-B1,Plants and seeds of hybrid corn variety CH184535 ,Monsanto Technology Llc,"Marvin L. Boerboom, Jon Popi",2018-05-29,2018-05-29,2019-10-22,2019-10-22,https://patents.google.com/patent/US10448599B1/en,
US-10542701-B2,Plants and seed of corn variety CV658586 ,Monsanto Technology Llc,Marvin L. Boerboom,2018-05-25,2018-05-25,2020-01-28,2020-01-28,https://patents.google.com/patent/US10542701B2/en,
US-2019357470-A1,Plants and seeds of corn variety cv663768 ,Monsanto Technology Llc,Paul T. Nelson,2018-05-25,2018-05-25,2019-11-28,,https://patents.google.com/patent/US20190357470A1/en,
US-2021244871-A1,"Systems and methods for closed loop, real-time modifications of patient cells ","Lupagen, Inc.","David Peritt, Nripendra DAS",2018-05-11,2019-05-13,2021-08-12,,https://patents.google.com/patent/US20210244871A1/en,https://patentimages.storage.googleapis.com/b5/69/19/6ad388f84ab885/US20210244871A1-20210812-D00000.png
US-11039520-B1,Electronic devices for controlling lights ,"Amazon Technologies, Inc.","James Siminoff, Ryan David Hruska, David Brett Levine, Michael Recker",2018-05-08,2019-04-29,2021-06-15,2021-06-15,https://patents.google.com/patent/US11039520B1/en,https://patentimages.storage.googleapis.com/99/eb/19/d03b7e38bf71f6/US11039520-20210615-D00000.png
US-2021188855-A1,Compounds ,Enterprise Therapeutics Limited,"Clive McCarthy, Duncan Alexander HAY, Thomas Beauregard SCHOFIELD",2018-05-18,2019-05-17,2021-06-24,,https://patents.google.com/patent/US20210188855A1/en,
US-2021198446-A1,Use of carbon-nanofibre comprising carbon networks ,CarbonX IP 5 B.V.,"Rutger Alexander David Van Raalten, Daniela SORDI",2018-05-25,2019-05-27,2021-07-01,,https://patents.google.com/patent/US20210198446A1/en,https://patentimages.storage.googleapis.com/46/cf/be/d1b56c05e1d22b/US20210198446A1-20210701-D00000.png
US-2021163929-A1,Methods and compositions for the treatment of hepatic and metabolic diseases ,The Regents Of The University Of California,Yu-Jui Yvonne Wan,2018-05-11,2020-11-09,2021-06-03,,https://patents.google.com/patent/US20210163929A1/en,https://patentimages.storage.googleapis.com/02/31/4c/230a36e1bbc69e/US20210163929A1-20210603-D00000.png
US-10814940-B2,"Board, watercraft or other vehicle body ",Dms Composites Pty Ltd,Daniel Pene MACDONALD,2018-05-15,2019-05-15,2020-10-27,2020-10-27,https://patents.google.com/patent/US10814940B2/en,https://patentimages.storage.googleapis.com/bc/fd/ca/006fb36c204cb3/US10814940-20201027-D00000.png
US-2021261728-A1,Soil Release Polyesters For Use In Detergent Compositions ,Clariant International Ltd.,"Matthias Arndt, Martijn GILLISSEN, Kevin Mutch",2018-05-24,2019-05-13,2021-08-26,,https://patents.google.com/patent/US20210261728A1/en,
US-2019346775-A1,Methods and Apparatus for Calculating Electromagnetic Scattering Properties of a Structure ,Asml Netherlands B.V.,"Markus Gerardus Martinus Maria Van Kraaij, Maxim PISARENCO, Richard QUINTANILHA",2018-05-14,2019-04-25,2019-11-14,,https://patents.google.com/patent/US20190346775A1/en,https://patentimages.storage.googleapis.com/3a/e7/f1/9a83a402fb2b4f/US20190346775A1-20191114-D00000.png
US-2019345067-A1,Method for preparing ceramic molded body for sintering and method for producing ceramic sintered body ,"Shin-Etsu Chemical Co., Ltd.","Masanori Ikari, Takuto Matsumoto",2018-05-11,2019-05-10,2019-11-14,,https://patents.google.com/patent/US20190345067A1/en,
US-2021228473-A1,Imac-enriched microalgal culture supernatant and uses thereof ,"Gat Biosciences, S.L.","Olga DURANY TURK, Jordi SEGURA DE YEBRA, Jaume MERCADE ROCA, Maria Teresa LOPEZ CERRO, Cristina LOPEZ PAZ",2018-05-08,2019-05-08,2021-07-29,,https://patents.google.com/patent/US20210228473A1/en,https://patentimages.storage.googleapis.com/ff/88/1b/3bea7ef439c74b/US20210228473A1-20210729-D00000.png
US-2021196520-A1,Vision Correction With Laser Refractive Index Changes ,"University Of Rochester, Clerio Vision, Inc., Arizona Board Of Regents On Behalf Of The University Of Arizona","Leonard Zheleznyak, Corey Leeson, Jonathan D. Ellis, Theodore Foos, Sam C. Butler",2018-05-14,2019-05-14,2021-07-01,,https://patents.google.com/patent/US20210196520A1/en,https://patentimages.storage.googleapis.com/12/24/db/02aeb359b0315b/US20210196520A1-20210701-D00000.png
US-2019366690-A1,Carrier substrate and method of manufacturing semiconductor package using the same ,"Samsung Electronics Co., Ltd.",Han Na JIN,2018-05-29,2018-10-11,2019-12-05,,https://patents.google.com/patent/US20190366690A1/en,https://patentimages.storage.googleapis.com/f0/3c/17/3540d7ce5c5306/US20190366690A1-20191205-D00000.png
