US-2021321684-A1,Belt with lighting element ,Jeffrey A. Menshouse,Jeffrey A. Menshouse,2020-02-26,2021-02-26,2021-10-21,,https://patents.google.com/patent/US20210321684A1/en,https://patentimages.storage.googleapis.com/35/0e/a9/dd2ba1c98769c5/US20210321684A1-20211021-D00000.png
US-2021273382-A1,Conductor for vehicle systems ,Rolls-Royce Corporation,David Loder,2020-02-27,2020-02-27,2021-09-02,,https://patents.google.com/patent/US20210273382A1/en,https://patentimages.storage.googleapis.com/d9/2a/dd/e2d3175b90456f/US20210273382A1-20210902-D00000.png
US-2021269597-A1,"Material for forming organic, film patterning process, and polymer ","Shin-Etsu Chemical Co., Ltd.","Daisuke Kori, Takashi Sawamura, Keisuke NIIDA, Seiichiro Tachibana",2020-02-19,2021-01-26,2021-09-02,,https://patents.google.com/patent/US20210269597A1/en,https://patentimages.storage.googleapis.com/07/8e/4b/4de76b60ddfa95/US20210269597A1-20210902-D00000.png
US-2021246142-A1,Bismaleimide compound and production method thereof ,"Shin-Etsu Chemical Co., Ltd.","Yuki Kudo, Yoshihiro Tsutsumi",2020-02-07,2021-01-22,2021-08-12,,https://patents.google.com/patent/US20210246142A1/en,https://patentimages.storage.googleapis.com/4c/2b/d9/50f85fc27cf51d/US20210246142A1-20210812-D00001.png
US-2021256899-A1,Electronic device ,Innolux Corporation,"Ker-Yih Kao, Ming Chun Tseng, Liang-Lu Chen, Li-Wei Mao, Shun-Yuan HU",2020-02-14,2021-01-21,2021-08-19,,https://patents.google.com/patent/US20210256899A1/en,https://patentimages.storage.googleapis.com/e8/28/66/01423d51be9dd3/US20210256899A1-20210819-D00000.png
US-2021264822-A1,Reflective flexible display device ,Innolux Corporation,"Toshiya Inada, Yu-Chih Tseng, Hsin-Hao Huang, Chu-Hong Lai, Cheng-Jen Chu",2020-02-25,2021-01-13,2021-08-26,,https://patents.google.com/patent/US20210264822A1/en,https://patentimages.storage.googleapis.com/f7/c7/18/80adc10b3ef676/US20210264822A1-20210826-D00000.png
US-2021259199-A1,Pet carrier ,"Doskocil Manufacturing Company, Inc.","Charles Lin, Jack Renforth",2020-02-25,2021-01-05,2021-08-26,,https://patents.google.com/patent/US20210259199A1/en,https://patentimages.storage.googleapis.com/74/28/3b/9f39ad9621c786/US20210259199A1-20210826-D00000.png
US-2021238914-A1,"Electrostatic latching stop bar for dynamic shade, and/or associated methods ","Guardian Glass, LLC","Jeffrey Koskulics, Joshua Finch, David Lawrence",2020-02-03,2020-12-30,2021-08-05,,https://patents.google.com/patent/US20210238914A1/en,https://patentimages.storage.googleapis.com/53/70/3a/926072cb803cfa/US20210238914A1-20210805-D00000.png
US-2021265436-A1,Display apparatus and flexible display apparatus ,"Samsung Display Co., Ltd.","Yujin Jeon, Wonse Lee, SuKyoung Kim, Donghyeon Jang",2020-02-21,2020-12-21,2021-08-26,,https://patents.google.com/patent/US20210265436A1/en,https://patentimages.storage.googleapis.com/07/f4/27/9a36491191cc80/US20210265436A1-20210826-D00000.png
US-2021267062-A1,Display device ,Innolux Corporation,"Wan-Ling Huang, Jian-Jung SHIH, Tsau-Hua Hsieh",2020-02-21,2020-12-08,2021-08-26,,https://patents.google.com/patent/US20210267062A1/en,https://patentimages.storage.googleapis.com/f2/2a/85/023b936f3573a3/US20210267062A1-20210826-D00000.png
US-2021259119-A1,Display device ,"Samsung Display Co., Ltd.","Dongwoo SEO, Dongjin PARK, Jaiku Shin, Sung Chul CHOI",2020-02-14,2020-12-07,2021-08-19,,https://patents.google.com/patent/US20210259119A1/en,https://patentimages.storage.googleapis.com/cb/34/87/88da0053c580ac/US20210259119A1-20210819-D00000.png
US-2021255367-A1,Display device ,"Samsung Display Co., Ltd.","Yunjae KIM, Jinhyoung Kim, Jin Yong SIM",2020-02-14,2020-11-24,2021-08-19,,https://patents.google.com/patent/US20210255367A1/en,https://patentimages.storage.googleapis.com/50/dc/6f/9fe457c50c4127/US20210255367A1-20210819-D00000.png
US-2021249480-A1,Organic light emitting display device and electronic device including the same ,"Samsung Display Co., Ltd.","Hyun-Been Hwang, Yong Chan Jeon, Chul Ho Jeong, Cheol Ho Choi, Hirotsugu Kishimoto",2020-02-10,2020-10-22,2021-08-12,,https://patents.google.com/patent/US20210249480A1/en,https://patentimages.storage.googleapis.com/29/2b/07/21d724ddc6e8bd/US20210249480A1-20210812-D00000.png
US-2021265537-A1,Display device ,"Samsung Display Co., Ltd.","Ha Yeon SHIN, Jong Woo Park, Dae Youn CHO, Young Tae Choi",2020-02-20,2020-10-21,2021-08-26,,https://patents.google.com/patent/US20210265537A1/en,https://patentimages.storage.googleapis.com/86/39/f8/2546a558db4115/US20210265537A1-20210826-D00000.png
US-2021247820-A1,Display apparatus ,"Samsung Display Co., Ltd.","Myong-Soo Oh, Doosan Park, Hyunchul Jin",2020-02-10,2020-10-20,2021-08-12,,https://patents.google.com/patent/US20210247820A1/en,https://patentimages.storage.googleapis.com/0a/4b/58/dd74dc8344a568/US20210247820A1-20210812-D00000.png
US-2021262755-A1,Hot Equipment And Thermal Reduction System ,"Frank J. Michal, Michael E. Stein","Frank J. Michal, Michael E. Stein",2020-02-20,2020-10-08,2021-08-26,,https://patents.google.com/patent/US20210262755A1/en,https://patentimages.storage.googleapis.com/5b/0c/19/06c077e0e73bf3/US20210262755A1-20210826-D00000.png
US-2021257275-A1,Semiconductor package ,"Samsung Electronics Co., Ltd.","Soo Jeoung Park, Yun Hyeok IM",2020-02-13,2020-09-29,2021-08-19,,https://patents.google.com/patent/US20210257275A1/en,https://patentimages.storage.googleapis.com/ab/50/cf/54f9df7751d19a/US20210257275A1-20210819-D00000.png
US-2021265599-A1,"Apparatus for manufacturing display device, method of manufacturing mask assembly, and method of manufacturing display device ","Samsung Display Co., Ltd.","Minho MOON, Jinoh KWAG, Inbae KIM, Seungyong Song, Duckjung Lee, HyeYong Chu",2020-02-21,2020-09-24,2021-08-26,,https://patents.google.com/patent/US20210265599A1/en,https://patentimages.storage.googleapis.com/82/cb/56/1036274bbb7750/US20210265599A1-20210826-D00000.png
US-2021265445-A1,Display device ,"Samsung Display Co., Ltd.","Sang Hoon Oh, Seung Gyu Tae, Hyun Woo Kang, Dong Hyeok Lee, Chang Ho YI",2020-02-21,2020-09-24,2021-08-26,,https://patents.google.com/patent/US20210265445A1/en,https://patentimages.storage.googleapis.com/7e/5f/c5/6e2587ba155e0c/US20210265445A1-20210826-D00000.png
US-2021247218-A1,Systems And Methods To Increase Sensor Robustness ,Hutchinson Technology Incorporated,"Clark T. Olsen, Michael W. Davis, Douglas P. Riemer, Matthew S. Lang",2020-02-10,2020-09-23,2021-08-12,,https://patents.google.com/patent/US20210247218A1/en,https://patentimages.storage.googleapis.com/8b/27/6f/c3e5147dfee9fd/US20210247218A1-20210812-D00000.png
US-2021259400-A1,Disposable Toothbrush Head ,Anne Ezell,Anne Ezell,2020-02-20,2020-09-23,2021-08-26,,https://patents.google.com/patent/US20210259400A1/en,https://patentimages.storage.googleapis.com/cf/74/99/9114b7b472a14e/US20210259400A1-20210826-D00000.png
US-2021265102-A1,Inductor component and resin sealing body ,"Murata Manufacturing Co., Ltd.",Yoshimasa YOSHIOKA,2020-02-26,2021-02-11,2021-08-26,,https://patents.google.com/patent/US20210265102A1/en,https://patentimages.storage.googleapis.com/2a/ff/a6/8343bef64b0ce1/US20210265102A1-20210826-D00000.png
US-2021249635-A1,Display device and electronic apparatus ,"Samsung Display Co., Ltd.","Junghyun Cho, Seunghoon Lee, JinKoo Chung, Beohmrock Choi",2020-02-12,2020-09-17,2021-08-12,,https://patents.google.com/patent/US20210249635A1/en,https://patentimages.storage.googleapis.com/c4/fe/e7/a3c75f6ee3c76c/US20210249635A1-20210812-D00000.png
US-2021257577-A1,Display device ,"Samsung Display Co., Ltd.","Kiho Bang, WonSuk Choi",2020-02-17,2020-09-03,2021-08-19,,https://patents.google.com/patent/US20210257577A1/en,https://patentimages.storage.googleapis.com/fa/17/5c/ba15e0c51a883e/US20210257577A1-20210819-D00000.png
US-2021255669-A1,"Chip-on-film package, display module including same, and electronic device including same ","Samsung Electronics Co., Ltd.",Jeongkyu Ha,2020-02-19,2020-08-26,2021-08-19,,https://patents.google.com/patent/US20210255669A1/en,https://patentimages.storage.googleapis.com/fd/26/7d/73d50a652beec0/US20210255669A1-20210819-D00000.png
US-2021273029-A1,Method of manufacturing display apparatus ,"Samsung Display Co., Ltd.","Kiho Bang, WonSuk Choi",2020-02-27,2020-08-26,2021-09-02,,https://patents.google.com/patent/US20210273029A1/en,https://patentimages.storage.googleapis.com/41/0e/62/0eeb754a5e6686/US20210273029A1-20210902-D00000.png
US-2021249492-A1,Display device and electronic apparatus ,"Samsung Display Co., Ltd.","Nakcho CHOI, Daegi KWEON, Minyeul RYU",2020-02-07,2020-08-24,2021-08-12,,https://patents.google.com/patent/US20210249492A1/en,https://patentimages.storage.googleapis.com/ef/dc/c1/06d0228c859ed7/US20210249492A1-20210812-D00000.png
US-2021272889-A1,Symmetrical substrate for semiconductor packaging ,"Taiwan Semiconductor Manufacturing Company, Ltd.","Jiun Yi Wu, Chen-Hua Yu",2020-02-27,2020-08-20,2021-09-02,,https://patents.google.com/patent/US20210272889A1/en,https://patentimages.storage.googleapis.com/f0/83/16/669c28503dcc6e/US20210272889A1-20210902-D00000.png
US-2021255019-A1,"Apparatus for manufacturing display apparatus, method of measuring droplet, and method of manufacturing display apparatus ","Samsung Display Co., Ltd.",Jeongwon HAN,2020-02-14,2020-08-14,2021-08-19,,https://patents.google.com/patent/US20210255019A1/en,https://patentimages.storage.googleapis.com/27/60/a5/987872037d1734/US20210255019A1-20210819-D00000.png
US-2021257433-A1,Display device ,"Samsung Display Co., Ltd.","Kiho Bang, WonSuk Choi",2020-02-19,2020-07-31,2021-08-19,,https://patents.google.com/patent/US20210257433A1/en,https://patentimages.storage.googleapis.com/de/38/23/100c65775fc4e6/US20210257433A1-20210819-D00000.png
US-2021244151-A1,Hair curling device ,Peng-Fei Chu,Peng-Fei Chu,2020-02-07,2020-07-07,2021-08-12,,https://patents.google.com/patent/US20210244151A1/en,https://patentimages.storage.googleapis.com/1c/ea/16/7258b05b69f975/US20210244151A1-20210812-D00000.png
US-2021239237-A1,Tow-Behind Rotary Spreader Driver Seat Operated Discharge Chute Control ,"Gary Michael Petrillo, SR., Gary Michael Petrillo, JR.","Gary Michael Petrillo, SR., Gary Michael Petrillo, JR.",2020-02-04,2020-06-02,2021-08-05,,https://patents.google.com/patent/US20210239237A1/en,https://patentimages.storage.googleapis.com/2f/c4/22/5fbd1d5fea36c7/US20210239237A1-20210805-D00000.png
US-2021249804-A1,Flexible cable connector fixing structure ,"Energy Full Electronics Co., Ltd.",Hsu-Shen CHIN,2020-02-10,2020-04-07,2021-08-12,,https://patents.google.com/patent/US20210249804A1/en,https://patentimages.storage.googleapis.com/9f/90/30/2841eb82f8a9a5/US20210249804A1-20210812-D00000.png
US-2021246937-A1,Sliding member ,Daido Metal Company Ltd.,Hideyuki Nakajima,2020-02-06,2021-01-27,2021-08-12,,https://patents.google.com/patent/US20210246937A1/en,https://patentimages.storage.googleapis.com/ec/ed/4a/82e678aed92fa3/US20210246937A1-20210812-D00000.png
US-2021254278-A1,Flame Retardant Fabric and Method ,"Daniel M. Honig, Larry Goldstein","Daniel M. Honig, Larry Goldstein",2020-02-13,2020-02-13,2021-08-19,,https://patents.google.com/patent/US20210254278A1/en,https://patentimages.storage.googleapis.com/3a/f8/ef/cbc6fe89e946ac/US20210254278A1-20210819-D00000.png
US-2021259328-A1,Sloughing skin sock ,Susan Jones,Susan Jones,2020-02-26,2020-02-26,2021-08-26,,https://patents.google.com/patent/US20210259328A1/en,https://patentimages.storage.googleapis.com/d5/b2/e2/91bf94225cd420/US20210259328A1-20210826-D00000.png
US-2021261763-A1,Static Discharging Dryer Disk ,"Albert Santelli, Jr.","Albert Santelli, Jr.",2020-02-26,2020-02-26,2021-08-26,,https://patents.google.com/patent/US20210261763A1/en,https://patentimages.storage.googleapis.com/de/ad/b4/db8961131ff153/US20210261763A1-20210826-D00000.png
US-2021265313-A1,Package and manufacturing method thereof ,"Taiwan Semiconductor Manufacturing Co., Ltd.","Hsien-Wei Chen, Jie Chen, Ming-Fa Chen",2020-02-26,2020-02-26,2021-08-26,,https://patents.google.com/patent/US20210265313A1/en,https://patentimages.storage.googleapis.com/53/16/1e/ad33a266ce08b0/US20210265313A1-20210826-D00000.png
US-2021260396-A1,Magnetic stimulation device having planar coil structure ,Po-Lei Lee,Po-Lei Lee,2020-02-24,2020-02-24,2021-08-26,,https://patents.google.com/patent/US20210260396A1/en,https://patentimages.storage.googleapis.com/b6/74/55/16547d230b5996/US20210260396A1-20210826-D00000.png
US-2021267065-A1,Electromagnet Coils Made From Flexible Circuits ,Kla Corporation,Oscar G. Florendo,2020-02-22,2020-02-22,2021-08-26,,https://patents.google.com/patent/US20210267065A1/en,https://patentimages.storage.googleapis.com/75/33/0e/6eebb76adc2b75/US20210267065A1-20210826-D00000.png
US-2021265225-A1,Semiconductor devices and methods of manufacturing semiconductor devices ,Amkor Technology Singapore Holding Pte. Ltd.,"Sang Jae Jang, Weilung Lu, Burt Barber, Adrian Arcedera, Shingo Nakamura",2020-02-21,2020-02-21,2021-08-26,,https://patents.google.com/patent/US20210265225A1/en,https://patentimages.storage.googleapis.com/1f/cf/02/75bcdf7d996e2a/US20210265225A1-20210826-D00000.png
US-2021259395-A1,Support strap with integrated windlass tourniquet ,Emergency Products and Research,"Kasey P. Larson, Jason A. Thompson, Jim Doherty",2020-02-20,2020-02-20,2021-08-26,,https://patents.google.com/patent/US20210259395A1/en,https://patentimages.storage.googleapis.com/58/88/87/f9c76df2dbb5e0/US20210259395A1-20210826-D00000.png
US-2021252201-A1,Breast pump flange assembly and method of use ,"Marcella Lee Post, Tina Louise Michael-Shine","Marcella Lee Post, Tina Louise Michael-Shine",2020-02-19,2020-02-19,2021-08-19,,https://patents.google.com/patent/US20210252201A1/en,https://patentimages.storage.googleapis.com/ab/b7/43/8b0be0d862c7fc/US20210252201A1-20210819-D00000.png
US-2021254393-A1,Ligaturee Safe Door ,"Norix Group, Inc.","Abdullah Shahzad, Benjamin Zeeb",2020-02-19,2020-02-19,2021-08-19,,https://patents.google.com/patent/US20210254393A1/en,https://patentimages.storage.googleapis.com/69/67/c2/1aa232eb725b00/US20210254393A1-20210819-D00000.png
US-2021254877-A1,Thermal control packages ,"Westrock Mwv, Llc","Trisha J. Massenzo, Casey P. Grey, Lucas Dallen",2020-02-14,2020-02-14,2021-08-19,,https://patents.google.com/patent/US20210254877A1/en,https://patentimages.storage.googleapis.com/98/a1/61/64c88a0a026976/US20210254877A1-20210819-D00000.png
US-2021257311-A1,Semiconductor device package ,"Advanced Semiconductor Engineering, Inc.","Hao-Chih HSIEH, Tzu-Cheng Lin, Chun-Jen Chen",2020-02-14,2020-02-14,2021-08-19,,https://patents.google.com/patent/US20210257311A1/en,https://patentimages.storage.googleapis.com/f6/c6/53/1c7fbe87911b32/US20210257311A1-20210819-D00000.png
US-2021251843-A1,Portable sex article ,"Rico Enterprises, LLC",Patrick B. Rivera,2020-02-13,2020-02-13,2021-08-19,,https://patents.google.com/patent/US20210251843A1/en,https://patentimages.storage.googleapis.com/a1/c1/da/b766a119cb8907/US20210251843A1-20210819-D00000.png
US-2021246944-A1,Sliding member ,Daido Metal Company Ltd.,Hideyuki Nakajima,2020-02-06,2021-01-27,2021-08-12,,https://patents.google.com/patent/US20210246944A1/en,https://patentimages.storage.googleapis.com/9d/1f/02/0db436b8254192/US20210246944A1-20210812-D00000.png
US-2021249381-A1,High bandwidth multichip module ,International Business Machines Corporation,John Knickerbocker,2020-02-12,2020-02-12,2021-08-12,,https://patents.google.com/patent/US20210249381A1/en,https://patentimages.storage.googleapis.com/26/04/d5/11157522165e6c/US20210249381A1-20210812-D00000.png
US-2021244208-A1,Washable weighted blanket having beads and nine layers ,Carey Sutton,Carey Sutton,2020-02-11,2020-02-11,2021-08-12,,https://patents.google.com/patent/US20210244208A1/en,https://patentimages.storage.googleapis.com/8c/41/92/609f7e2f096950/US20210244208A1-20210812-D00000.png
US-2021245858-A1,Methods for forming liquid flow paths on a surface of a structure ,The Boeing Company,"Xiaoxi Wang, Thomas Seth Perkins",2020-02-11,2020-02-11,2021-08-12,,https://patents.google.com/patent/US20210245858A1/en,https://patentimages.storage.googleapis.com/a3/09/06/98626bd635854c/US20210245858A1-20210812-D00000.png
US-2021245313-A1,Modular machine tool work holding system ,Derek Edward Pulsifer,Derek Edward Pulsifer,2020-02-10,2020-02-10,2021-08-12,,https://patents.google.com/patent/US20210245313A1/en,https://patentimages.storage.googleapis.com/e9/06/73/2a91b954c0b2ee/US20210245313A1-20210812-D00000.png
US-2021245316-A1,Machine tool t-slot protective device ,Derek Edward Pulsifer,Derek Edward Pulsifer,2020-02-10,2020-02-10,2021-08-12,,https://patents.google.com/patent/US20210245316A1/en,https://patentimages.storage.googleapis.com/13/a2/c9/a117fa9e579b3d/US20210245316A1-20210812-D00000.png
US-2021245314-A1,Modular machine tool work holding components ,Derek Edward Pulsifer,Derek Edward Pulsifer,2020-02-10,2020-02-10,2021-08-12,,https://patents.google.com/patent/US20210245314A1/en,https://patentimages.storage.googleapis.com/bb/bd/7a/a9d04ee35f1856/US20210245314A1-20210812-D00000.png
US-2021235815-A1,Vamp and shoe body including the vamp ,Ku-Ming Chen,Ku-Ming Chen,2020-02-05,2020-02-05,2021-08-05,,https://patents.google.com/patent/US20210235815A1/en,https://patentimages.storage.googleapis.com/2a/e5/1d/ae1d2c8e93d2ef/US20210235815A1-20210805-D00000.png
US-2021252087-A1,Oil extract of cannabis and method for obtaining ,Concept Matrix Solutions,"Toby W. Laughton, Darren J. Nist, Steven M. Shatkin, Tony LaRosa, David Reid",2020-02-19,2021-02-17,2021-08-19,,https://patents.google.com/patent/US20210252087A1/en,
US-2021247669-A1,Adjustable optical module and projector ,Coretronic Corporation,Yii-Wen Chen,2020-02-07,2021-01-28,2021-08-12,,https://patents.google.com/patent/US20210247669A1/en,https://patentimages.storage.googleapis.com/74/96/14/7fcf9e80f3dd3c/US20210247669A1-20210812-D00000.png
US-2021249448-A1,Display device ,Japan Display Inc.,"Yuki YOKOTANI, Masanobu Ikeda",2020-02-10,2021-01-29,2021-08-12,,https://patents.google.com/patent/US20210249448A1/en,https://patentimages.storage.googleapis.com/39/93/f4/40e4d94c6cb980/US20210249448A1-20210812-D00000.png
US-2021251834-A1,Methods of preparing a subject for rotation and rotating a subject using an overhead lift ,Liko Research & Development Ab,"Neal Wiggermann, Michael Buccieri, Alejandro Noe Conejo Castaño, Morgan Dreyer, Jie Zhou, Lori Ann Zapfe",2020-02-19,2021-02-01,2021-08-19,,https://patents.google.com/patent/US20210251834A1/en,https://patentimages.storage.googleapis.com/14/d0/2f/d5fea41593c017/US20210251834A1-20210819-D00000.png
US-2021236369-A1,Patient positioning system ,"Alphatec Spine, Inc.","James Lee, Christopher Joseph Sheehan, Andrew W. Rajek",2020-02-03,2021-02-01,2021-08-05,,https://patents.google.com/patent/US20210236369A1/en,https://patentimages.storage.googleapis.com/d6/ba/7a/81bc76e0d844da/US20210236369A1-20210805-D00000.png
US-2021235794-A1,"Washable, Hands-Free Hydration Glove for Unencumbered Motion ",Matthew Graham,Matthew Graham,2020-02-03,2021-02-01,2021-08-05,,https://patents.google.com/patent/US20210235794A1/en,https://patentimages.storage.googleapis.com/77/d5/28/d46ab7d783488d/US20210235794A1-20210805-D00000.png
US-2021300660-A1,Thermal regulating devices with condensation mitigation ,"Westrock Mwv, Llc","Trisha J. Massenzo, David J. Wiemann",2020-02-14,2021-02-02,2021-09-30,,https://patents.google.com/patent/US20210300660A1/en,https://patentimages.storage.googleapis.com/59/34/f7/0f6509da6650a1/US20210300660A1-20210930-D00000.png
US-2021247711-A1,Fuser ,Brother Kogyo Kabushiki Kaisha,"Kazuna Taguchi, Mingguang Zhang",2020-02-07,2021-02-03,2021-08-12,,https://patents.google.com/patent/US20210247711A1/en,https://patentimages.storage.googleapis.com/a1/11/df/a5ba86d86f6f21/US20210247711A1-20210812-D00000.png
US-2021235872-A1,Chair with flexible internal support ,Hni Technologies Inc.,John Koch,2020-02-04,2021-02-03,2021-08-05,,https://patents.google.com/patent/US20210235872A1/en,https://patentimages.storage.googleapis.com/9a/24/74/63199bed55ca41/US20210235872A1-20210805-D00000.png
US-2021265081-A1,"Hoisting cable with small diameter, high strength, and high flexibility, and manufacturing method thereof ",Jilin University,"Nan Zhang, Hui Liu, Youhong Sun, Pavel TALALAY, Ting Wang, Xiaopeng Fan, Bing Li, Rusheng WANG, Da GONG, Yunchen LIU, Yang Yang, Jialin HONG, An Liu, Yanji Chen",2020-02-21,2021-02-05,2021-08-26,,https://patents.google.com/patent/US20210265081A1/en,https://patentimages.storage.googleapis.com/e8/c3/fc/a8d8e78825294f/US20210265081A1-20210826-D00000.png
US-2021249564-A1,Unit pixel having light emitting device and displaying apparatus ,"Seoul Viosys Co., Ltd.","Namgoo CHA, Sangmin Kim, Jung Hwan AHN, Jae Hee Lim",2020-02-11,2021-02-05,2021-08-12,,https://patents.google.com/patent/US20210249564A1/en,https://patentimages.storage.googleapis.com/15/19/d7/58d1bd95227b70/US20210249564A1-20210812-D00000.png
US-2021260345-A1,Tubular instrument to reduce vein trauma and related devices and methods ,"Becton, Dickinson And Company","Jonathan Karl Burkholz, Curtis H. Blanchard, Megan Scherich, Weston F. Harding, Joseph Spataro, Yiping Ma, S. Ray Isaacson",2020-02-24,2021-02-05,2021-08-26,,https://patents.google.com/patent/US20210260345A1/en,https://patentimages.storage.googleapis.com/b0/a4/82/440ce1c13a44ae/US20210260345A1-20210826-D00000.png
US-2021257347-A1,Display panel and tiled display device ,Innolux Corporation,"Jian-Jung SHIH, Tsau-Hua Hsieh",2020-02-19,2021-02-08,2021-08-19,,https://patents.google.com/patent/US20210257347A1/en,https://patentimages.storage.googleapis.com/cc/16/38/c30be20038205b/US20210257347A1-20210819-D00000.png
US-2021261794-A1,Heat activated reinforcing fabric configured for intumescent material expansion ,"Textum Weaving, Inc.","James A. Crawford, Jr., Aaron Feinberg",2020-02-26,2020-02-26,2021-08-26,,https://patents.google.com/patent/US20210261794A1/en,https://patentimages.storage.googleapis.com/aa/8a/20/e9afe4a450daac/US20210261794A1-20210826-D00000.png
US-2021261734-A1,Polymers for use in electronic devices ,"Dupont Electronics, Inc.","Viacheslav V. Diev, Nora Sabina Radu",2020-02-19,2021-02-08,2021-08-26,,https://patents.google.com/patent/US20210261734A1/en,https://patentimages.storage.googleapis.com/70/ba/59/4e6fd1dff95538/US20210261734A1-20210826-D00000.png
US-2021251303-A1,No-show panty configuration ,"Chico's Brands Investments, Inc.","Vanessa Amber Collins, Ecka Maria Andersson, Bailey Anne Hagen, Alina Laura Sell, Sharon Theresa Tolnai, Lizette Hollenbeck, Valerie Ann McArdle, Sarah Marie Comunale, Tiffany Harris, Shiromala NILANTHI, Naveen Fernando",2020-02-14,2021-02-09,2021-08-19,,https://patents.google.com/patent/US20210251303A1/en,https://patentimages.storage.googleapis.com/b5/77/4f/b2c9e6adf64a81/US20210251303A1-20210819-D00000.png
US-2021247691-A1,Method For Forming Components Without Adding Tabs During Etching ,Hutchinson Technology Incorporated,"Clark T. Olsen, Jeffery G. Ribar",2020-02-12,2021-02-09,2021-08-12,,https://patents.google.com/patent/US20210247691A1/en,https://patentimages.storage.googleapis.com/23/36/ca/916cb745215c9b/US20210247691A1-20210812-D00000.png
US-2021244249-A1,Configuration of a cleaning head for an autonomous vacuum ,"Matician, Inc.","Anshuman KUMAR, Kyle Dhindsa, Jared O. Ruehr, Zhen Bo Bian, Nathan E. Madonia",2020-02-10,2021-02-09,2021-08-12,,https://patents.google.com/patent/US20210244249A1/en,https://patentimages.storage.googleapis.com/bb/03/7f/e9bb4a04de9657/US20210244249A1-20210812-D00000.png
US-2021247738-A1,Vehicle Computing System Cooling Systems ,"Uatc, Llc","Thomas Jeffery Watson, Jr., Scott Klaus Boehmke",2020-02-11,2020-03-27,2021-08-12,,https://patents.google.com/patent/US20210247738A1/en,https://patentimages.storage.googleapis.com/43/08/ed/4bf44e86174c0c/US20210247738A1-20210812-D00000.png
US-2021257305-A1,"Semiconductor package, and package on package having the same ","Samsung Electronics Co., Ltd.","ChoongBin YIM, Jungwoo Kim, Jihwang Kim, Jungsoo BYUN, JongBo Shim, Doohwan Lee, Kyoungsei Choi, Junggon CHOI, Sungeun PYO",2020-02-18,2020-09-18,2021-08-19,,https://patents.google.com/patent/US20210257305A1/en,https://patentimages.storage.googleapis.com/e0/46/47/81d7c861a7ef8a/US20210257305A1-20210819-D00000.png
US-2021257288-A1,Chip-Last Wafer-Level Fan-Out with Optical Fiber Alignment Structure ,"Ayar Labs, Inc.",Roy Edward Meade,2020-02-13,2021-02-12,2021-08-19,,https://patents.google.com/patent/US20210257288A1/en,https://patentimages.storage.googleapis.com/bf/32/05/854752318ebc2b/US20210257288A1-20210819-D00000.png
US-2021247653-A1,Display device ,Japan Display Inc.,Osamu Itou,2020-02-07,2021-01-27,2021-08-12,,https://patents.google.com/patent/US20210247653A1/en,https://patentimages.storage.googleapis.com/cf/16/d6/03c425da687aa6/US20210247653A1-20210812-D00000.png
US-2021259103-A1,Electronic device and method for manufacturing flexible circuit board ,Innolux Corporation,"Jia Sin Li, Tong-Jung Wang, Chia-Chieh FAN, Shan Shan Hsu, Chih Han Ma",2020-02-13,2021-01-22,2021-08-19,,https://patents.google.com/patent/US20210259103A1/en,https://patentimages.storage.googleapis.com/cf/ac/28/7ebcabd82694d5/US20210259103A1-20210819-D00000.png
US-2021238479-A1,Surfactants for electronics ,Advansix Resins & Chemicals Llc,Edward Asirvatham,2020-02-05,2020-12-18,2021-08-05,,https://patents.google.com/patent/US20210238479A1/en,https://patentimages.storage.googleapis.com/1c/28/e8/e4f2d818643b83/US20210238479A1-20210805-D00001.png
US-2021241689-A1,Pixel and display device including the same ,"Samsung Display Co., Ltd.","Jeongsoo LEE, Kyunghyun Baek, Sewan Son, Yoonjong Cho, Moosoon KO, Yeonha Baek, Seokje Seong, Jinsung An, Inhyuck YEO, Seongjun Lee, Jaehyun Lee",2020-02-04,2020-12-03,2021-08-05,,https://patents.google.com/patent/US20210241689A1/en,https://patentimages.storage.googleapis.com/ca/6a/62/d5a1d0b559b142/US20210241689A1-20210805-D00000.png
