US-2021262219-A1,Method and apparatus for providing cover over an object or area ,"TMH Industries, LLC",Timothy Michael Hannon,2020-02-20,2021-02-05,2021-08-26,,https://patents.google.com/patent/US20210262219A1/en,https://patentimages.storage.googleapis.com/c9/9d/e0/d1c656b1757562/US20210262219A1-20210826-D00000.png
US-2021235931-A1,Portable heating device ,"Warmer Products, LLC","Anthony M. Souris, Shane P. Rogers",2020-02-05,2021-02-05,2021-08-05,,https://patents.google.com/patent/US20210235931A1/en,https://patentimages.storage.googleapis.com/55/59/41/5ffad5d92bada5/US20210235931A1-20210805-D00000.png
US-2021257170-A1,Keypad for controlling loads ,Lutron Technology Company Llc,"Edward J. Blair, Samuel F. Chambers, George M. Drizos, Matthew P. McDonald",2020-02-07,2021-02-05,2021-08-19,,https://patents.google.com/patent/US20210257170A1/en,https://patentimages.storage.googleapis.com/10/2e/09/4f74cba9cad232/US20210257170A1-20210819-D00000.png
US-2021259474-A1,Shield Device for Use with a Utensil ,Josue Ortega,Josue Ortega,2020-02-23,2021-02-05,2021-08-26,,https://patents.google.com/patent/US20210259474A1/en,https://patentimages.storage.googleapis.com/db/02/9d/68061f4678bbb8/US20210259474A1-20210826-D00000.png
US-2021249478-A1,Display apparatus ,"Samsung Display Co., Ltd.","Keunchan OH, Jangsoo Kim, Jaecheol PARK, Gakseok LEE, Sunkyu JOO",2020-02-07,2021-02-04,2021-08-12,,https://patents.google.com/patent/US20210249478A1/en,https://patentimages.storage.googleapis.com/e8/a6/30/23e47a293d9175/US20210249478A1-20210812-D00000.png
US-2021235836-A1,Head and hair wrap ,Terri Lanita Winton,Terri Lanita Winton,2020-02-04,2021-02-04,2021-08-05,,https://patents.google.com/patent/US20210235836A1/en,https://patentimages.storage.googleapis.com/cc/76/18/2d4f15c3a2bc20/US20210235836A1-20210805-D00000.png
US-2021257343-A1,Display device and manufacturing method thereof ,Innolux Corporation,"Jian-Jung SHIH, Tsau-Hua Hsieh, Fang-Ying Lin, Kai Cheng",2020-02-19,2021-02-04,2021-08-19,,https://patents.google.com/patent/US20210257343A1/en,https://patentimages.storage.googleapis.com/aa/79/c2/d8effefcbee9a0/US20210257343A1-20210819-D00000.png
US-2021239535-A1,Sensor purge techniques and related systems and methods ,"Formlabs, Inc.",Justin Keenan,2020-02-05,2021-02-04,2021-08-05,,https://patents.google.com/patent/US20210239535A1/en,https://patentimages.storage.googleapis.com/1f/ae/c3/dc0499033f5ab7/US20210239535A1-20210805-D00000.png
US-2021245072-A1,Ultrafine bubble generating apparatus and ultrafine bubble generating method ,Canon Kabushiki Kaisha,"Toshio Kashino, Yoshiyuki Imanaka, Masahiko Kubota, Akitoshi Yamada, Akira Yamamoto, Yumi Yanai, Teruo Ozaki, Hiroyuki Ishinaga",2020-02-12,2021-02-04,2021-08-12,,https://patents.google.com/patent/US20210245072A1/en,https://patentimages.storage.googleapis.com/7c/c6/32/501e6af0bcf694/US20210245072A1-20210812-D00000.png
US-2021244591-A1,Rescue Strap for Carrying a Patient ,Timothy M. Romang,Timothy M. Romang,2020-02-09,2021-02-04,2021-08-12,,https://patents.google.com/patent/US20210244591A1/en,https://patentimages.storage.googleapis.com/7d/71/57/001ae7be8a95b4/US20210244591A1-20210812-D00000.png
US-2021247656-A1,Electrophoretic display layer with thin film top electrode ,E Ink Corporation,"Nishit Murari, Pavel Kamaev, David Darrell Miller, Richard J. Paolini, Jr., Jay William Anseth",2020-02-07,2021-02-04,2021-08-12,,https://patents.google.com/patent/US20210247656A1/en,https://patentimages.storage.googleapis.com/a9/ab/ba/34c94e5bd565be/US20210247656A1-20210812-D00000.png
US-2021245473-A1,Fiber with light-reflective and luminescent functions and textile with such fiber ,"Chance Line Industrial Co., Ltd.",Ming-Hsien YAO,2020-02-10,2021-02-04,2021-08-12,,https://patents.google.com/patent/US20210245473A1/en,https://patentimages.storage.googleapis.com/9c/3c/0b/26a7553eaa9bb1/US20210245473A1-20210812-D00000.png
US-2021236902-A1,Volleyball hitting training device ,Greg J. Allen,Greg J. Allen,2020-02-03,2021-02-03,2021-08-05,,https://patents.google.com/patent/US20210236902A1/en,https://patentimages.storage.googleapis.com/af/e9/a1/dfd85c688f3dde/US20210236902A1-20210805-D00000.png
US-2021237088-A1,Energy efficient configuration for thermal cycling device ,dxImpact LLC,Michael Roller,2020-02-03,2021-02-03,2021-08-05,,https://patents.google.com/patent/US20210237088A1/en,https://patentimages.storage.googleapis.com/1c/3e/da/5a3bba420e2655/US20210237088A1-20210805-D00000.png
US-2021235970-A1,Coupling of medical device components ,Boston Scientific Scimed Inc.,"Andrew GRAVELEY, Adam LAROUCHE, Daniel EADS, Steve Pickett, Caleb MCDANIEL",2020-02-04,2021-02-03,2021-08-05,,https://patents.google.com/patent/US20210235970A1/en,https://patentimages.storage.googleapis.com/f6/ca/dd/a9c5f4bfce23b1/US20210235970A1-20210805-D00000.png
US-2021247050-A1,Sweeping illuminator for aquarium tanks ,Zachary Daniel Ladner,Zachary Daniel Ladner,2020-02-10,2021-02-03,2021-08-12,,https://patents.google.com/patent/US20210247050A1/en,https://patentimages.storage.googleapis.com/96/73/3d/19ad8431823c7f/US20210247050A1-20210812-D00000.png
US-2021251077-A1,Anodic oxide film structure ,"Point Engineering Co., Ltd.","Bum Mo Ahn, Sung Hyun BYUN, Tae Hwan Song",2020-02-06,2021-02-03,2021-08-12,,https://patents.google.com/patent/US20210251077A1/en,https://patentimages.storage.googleapis.com/eb/30/c9/3dc2266763d788/US20210251077A1-20210812-D00000.png
US-2021246370-A1,"Cadmium free quantum dots, and composite and display device including the same ","Samsung Electronics Co., Ltd.","Seonmyeong CHOI, Eun Joo Jang, Hyo Sook JANG, Kun Su PARK",2020-02-07,2021-02-03,2021-08-12,,https://patents.google.com/patent/US20210246370A1/en,https://patentimages.storage.googleapis.com/ed/d3/a7/fb178c4c6d4aab/US20210246370A1-20210812-D00000.png
US-2021235799-A1,Stretch Belt with Pocket ,"Amphipod, Inc.","Keith S. Willows, June A. Angus, Antonio Del Rosario",2020-02-03,2021-02-02,2021-08-05,,https://patents.google.com/patent/US20210235799A1/en,https://patentimages.storage.googleapis.com/13/ab/ec/816534568a57c4/US20210235799A1-20210805-D00000.png
US-2021235825-A1,Jewelry Items Configured to Releasably Set One or More Beads ,Paul Derrick Williams,Paul Derrick Williams,2020-02-03,2021-02-02,2021-08-05,,https://patents.google.com/patent/US20210235825A1/en,https://patentimages.storage.googleapis.com/b1/4d/0a/5d490b0c16d6a7/US20210235825A1-20210805-D00000.png
US-2021236191-A1,Rf ablation cannula with injection port ,Boston Scientific Neuromodulation Corporation,"Kevin P. Wang, Frank Louro",2020-02-04,2021-02-02,2021-08-05,,https://patents.google.com/patent/US20210236191A1/en,https://patentimages.storage.googleapis.com/a9/cc/28/cb054491ccdd21/US20210236191A1-20210805-D00000.png
US-2021244154-A1,Hair Tie ,"Daniel Evans, Joey Evans","Daniel Evans, Joey Evans",2020-02-12,2021-02-02,2021-08-12,,https://patents.google.com/patent/US20210244154A1/en,https://patentimages.storage.googleapis.com/69/7a/30/479567adf13f91/US20210244154A1-20210812-D00000.png
US-2021243902-A1,Wiring board ,"Shinko Electric Industries Co., Ltd.","Yoko Nakabayashi, Yuta Sakaguchi",2020-02-05,2021-02-02,2021-08-05,,https://patents.google.com/patent/US20210243902A1/en,https://patentimages.storage.googleapis.com/38/4a/7c/1720d22a041d0c/US20210243902A1-20210805-D00000.png
US-2021252320-A1,Suspension and control head apparatus for aerial firefighting bucket ,Donmark Holdings Inc.,"Donald Arney, Peter Brooke",2020-02-04,2021-02-01,2021-08-19,,https://patents.google.com/patent/US20210252320A1/en,https://patentimages.storage.googleapis.com/8e/2c/ca/9bc09463a529f1/US20210252320A1-20210819-D00000.png
US-2021240025-A1,Liquid crystal display device ,Mikuni Electron Corporation,Sakae Tanaka,2020-02-05,2021-02-01,2021-08-05,,https://patents.google.com/patent/US20210240025A1/en,https://patentimages.storage.googleapis.com/a7/89/08/e33c64a26ba7c9/US20210240025A1-20210805-D00000.png
US-2021263313-A1,High refractive index optical device formed based on solid crystal and fabrication method thereof ,"Facebook Technologies, Llc","Tanya Malhotra, Tingling RAO, Andrew John Ouderkirk, Arman Boromand, Lafe Joseph PURVIS, Oleg Yaroshchuk, Sheng Ye, Sandeep Rekhi",2020-02-25,2021-01-27,2021-08-26,,https://patents.google.com/patent/US20210263313A1/en,https://patentimages.storage.googleapis.com/9c/e1/48/9c1fa6eca6aeaf/US20210263313A1-20210826-D00000.png
US-2021256900-A1,Stretchable display device ,Innolux Corporation,"Yuan-Lin WU, Chan-Feng CHIU, Kuan-Feng LEE",2020-02-14,2021-01-31,2021-08-19,,https://patents.google.com/patent/US20210256900A1/en,https://patentimages.storage.googleapis.com/f3/02/0f/8a0e12d7f9b9dc/US20210256900A1-20210819-D00000.png
US-2021239167-A1,Guide assembly ,Meritor Heavy Vehicle Braking Systems (Uk) Limited,"Gareth Rhys Holtham, Mark Norman, Mathew Morris, Alexander Howard",2020-02-03,2021-01-29,2021-08-05,,https://patents.google.com/patent/US20210239167A1/en,https://patentimages.storage.googleapis.com/0c/9e/a4/3c89d96bd45225/US20210239167A1-20210805-D00000.png
US-2021236767-A1,Filament wrapping and reflow system and methods to manufacture an elongate medical device ,"Medtronic, Inc.","Kenneth D. Warnock, Jr., Dale F. Seeley, Jonathan E. Baxter, Gonzalo Martinez",2020-02-05,2021-01-29,2021-08-05,,https://patents.google.com/patent/US20210236767A1/en,https://patentimages.storage.googleapis.com/f2/eb/47/41f52083496c61/US20210236767A1-20210805-D00000.png
US-2021249751-A1,Electronic device including antenna module to which dielectric sheet is attached ,"Samsung Electronics Co., Ltd.","Yunbum LEE, Seongbeom Hong, Kyunghoon MOON, Seunggil JEON, Jaeyoung Huh, Jinsang Kim, Sungchul Park",2020-02-06,2021-01-29,2021-08-12,,https://patents.google.com/patent/US20210249751A1/en,https://patentimages.storage.googleapis.com/35/af/78/447dd8e8a5c05d/US20210249751A1-20210812-D00000.png
US-2021247260-A1,Balance guide for a tubular element ,Pse Composites Limited,"Edmund GRAEF, Peter GRAEF",2020-02-10,2021-01-28,2021-08-12,,https://patents.google.com/patent/US20210247260A1/en,https://patentimages.storage.googleapis.com/fb/8b/a4/b028ca49b2ef43/US20210247260A1-20210812-D00000.png
US-2021272510-A1,Local Active Matrix Architecture ,Apple Inc.,"Hjalmar Edzer Ayco Huitema, Thomas Charisoulis, Xia Li",2020-02-27,2021-01-28,2021-09-02,,https://patents.google.com/patent/US20210272510A1/en,https://patentimages.storage.googleapis.com/83/97/f3/dbcbec3bf2031f/US20210272510A1-20210902-D00000.png
US-2021242163-A1,Semiconductor arrangement and method for producing the same ,Infineon Technologies Ag,Frank Sauerland,2020-02-03,2021-01-28,2021-08-05,,https://patents.google.com/patent/US20210242163A1/en,https://patentimages.storage.googleapis.com/17/ed/0c/2ec5eba82aca40/US20210242163A1-20210805-D00000.png
US-2021273034-A1,Electronic device ,Innolux Corporation,"Pai-Chiao Cheng, Meng-Kai Huang",2020-02-27,2021-01-27,2021-09-02,,https://patents.google.com/patent/US20210273034A1/en,https://patentimages.storage.googleapis.com/21/56/8e/7c38bef32ca840/US20210273034A1-20210902-D00000.png
US-2021262284-A1,Retractable screen systems ,Defender Screens International LLC,"Arthur James, Jan Gross",2020-02-24,2021-02-23,2021-08-26,,https://patents.google.com/patent/US20210262284A1/en,https://patentimages.storage.googleapis.com/d6/2f/4a/f256ae03f901a4/US20210262284A1-20210826-D00000.png
US-2021257224-A1,"Method for manufacturing wiring substrate, and wiring substrate ","Ibiden Co., Ltd.","Kazuhiko Kuranobu, Tomoya DAIZO",2020-02-14,2021-01-27,2021-08-19,,https://patents.google.com/patent/US20210257224A1/en,https://patentimages.storage.googleapis.com/17/0e/03/2adc2c4d71dffe/US20210257224A1-20210819-D00000.png
US-2021251087-A1,Printed wiring board ,"Ibiden Co., Ltd.","Satoru Kawai, Yasuki Kimishima",2020-02-06,2021-01-26,2021-08-12,,https://patents.google.com/patent/US20210251087A1/en,https://patentimages.storage.googleapis.com/09/b4/2a/96bd2ed709f4d7/US20210251087A1-20210812-D00000.png
US-2021255511-A1,Electronic device ,Innolux Corporation,Shu-Ming Kuo,2020-02-19,2021-01-25,2021-08-19,,https://patents.google.com/patent/US20210255511A1/en,https://patentimages.storage.googleapis.com/62/e1/9f/bcc4213a50c8e1/US20210255511A1-20210819-D00000.png
US-2021249477-A1,Display device ,"Samsung Display Co., Ltd.","Seok-Joon HONG, Jang-Il KIM, Tae Hyung HWANG",2020-02-12,2021-01-24,2021-08-12,,https://patents.google.com/patent/US20210249477A1/en,https://patentimages.storage.googleapis.com/84/a0/be/80341e10189ebc/US20210249477A1-20210812-D00000.png
US-2021247641-A1,Substrate for display device and display device ,Sharp Kabushiki Kaisha,"Yukio Shimizu, Shinzoh Murakami",2020-02-07,2021-01-22,2021-08-12,,https://patents.google.com/patent/US20210247641A1/en,https://patentimages.storage.googleapis.com/38/41/1c/49d1b9d87dace2/US20210247641A1-20210812-D00000.png
US-2021249759-A1,Electronic device including antenna module ,"Samsung Electronics Co., Ltd.","Jaewoong Jeon, Jaewun LEE, Jaeyoung Huh, Chanyoul PARK, Hojong Kim",2020-02-06,2021-01-21,2021-08-12,,https://patents.google.com/patent/US20210249759A1/en,https://patentimages.storage.googleapis.com/eb/21/10/c0be799bfa9f7e/US20210249759A1-20210812-D00000.png
US-2021244473-A1,System and method for pressure monitoring within a catheter system ,"Bolt Medical, Inc.","Christopher A. Cook, Eric Schultheis",2020-02-10,2021-01-21,2021-08-12,,https://patents.google.com/patent/US20210244473A1/en,https://patentimages.storage.googleapis.com/b8/0b/69/902e3584ce1044/US20210244473A1-20210812-D00000.png
US-2021244385-A1,"Ultrasound diagnostic apparatus, ultrasound probe switching method, and storage medium ","Konica Minolta, Inc.",Takashi Sakai,2020-02-07,2021-01-21,2021-08-12,,https://patents.google.com/patent/US20210244385A1/en,https://patentimages.storage.googleapis.com/60/ee/da/f1d214433441d6/US20210244385A1-20210812-D00000.png
US-2021249727-A1,Flexible printed circuit board and battery module ,"Nippon Mektron, Ltd.","Shunsuke Tomita, Tomoki Kanayama, Kazuyuki AZUMA",2020-02-06,2021-01-19,2021-08-12,,https://patents.google.com/patent/US20210249727A1/en,https://patentimages.storage.googleapis.com/6d/43/57/02e099a4207092/US20210249727A1-20210812-D00000.png
US-2021242451-A1,Metal-Doped Sodium Vanadium Fluorophosphate/Sodium Vanadium Phosphate (Na3V2(PO4)2F3/Na3V2(PO4)3) Composite for Sodium-Ion Storage Material ,Korea Advanced Institute Of Science And Technology,"Jong Min YUK, Jae Yeol Park, Ho Jun Lee, Jungjae PARK",2020-02-04,2021-01-19,2021-08-05,,https://patents.google.com/patent/US20210242451A1/en,https://patentimages.storage.googleapis.com/a7/71/2c/beaacfea22039c/US20210242451A1-20210805-D00001.png
US-2021263376-A1,Flexible display device ,Innolux Corporation,"Hsin-Hao Huang, Tzu-Yi Lin, Chu-Hong Lai",2020-02-20,2021-01-18,2021-08-26,,https://patents.google.com/patent/US20210263376A1/en,https://patentimages.storage.googleapis.com/d0/95/ba/0352c236ad9221/US20210263376A1-20210826-D00000.png
US-2021261725-A1,"Degradable microparticle, degradable product comprising the same and application thereof ",National Tsing Hua University,"Jane Wang, Pei-Hsuan HUNG",2020-02-20,2021-01-15,2021-08-26,,https://patents.google.com/patent/US20210261725A1/en,https://patentimages.storage.googleapis.com/c0/1f/96/c404d13a441c3d/US20210261725A1-20210826-D00000.png
US-2021243879-A1,Printed-circuit board ,"Nippon Mektron, Ltd.","Kenji KIYA, Tomoki Kanayama",2020-02-05,2021-01-14,2021-08-05,,https://patents.google.com/patent/US20210243879A1/en,https://patentimages.storage.googleapis.com/81/4c/81/ff7fc53fb144fd/US20210243879A1-20210805-D00000.png
US-2021249386-A1,Display device ,Innolux Corporation,"Jia-Yuan CHEN, Tsung-Han Tsai, Kuan-Feng LEE",2020-02-10,2021-01-13,2021-08-12,,https://patents.google.com/patent/US20210249386A1/en,https://patentimages.storage.googleapis.com/04/60/16/d7584263c59afa/US20210249386A1-20210812-D00000.png
US-2021251045-A1,Modular ceramic heater ,"Lexmark International, Inc.","Jerry Wayne Smith, James Douglas Gilmore, Jichang Cao",2020-02-10,2021-01-13,2021-08-12,,https://patents.google.com/patent/US20210251045A1/en,https://patentimages.storage.googleapis.com/f1/a3/d8/0d61649fa85cf6/US20210251045A1-20210812-D00000.png
US-2021278920-A1,Touch integrated display device ,Novatek Microelectronics Corp.,"Yu-Ying Tang, Ching-Yang Pai, Chih-Chang Lai",2020-02-20,2021-01-11,2021-09-09,,https://patents.google.com/patent/US20210278920A1/en,https://patentimages.storage.googleapis.com/06/a5/58/f7368bd17d786f/US20210278920A1-20210909-D00000.png
US-2021248942-A1,Foldable mobile electronic device capable of setting brightness of display through light sensor ,"Samsung Electronics Co., Ltd.","Heewoong YOON, Heejun CHOI, Oheon KWON, Jongah KIM, Kihyuk LEE, Donghan Lee, Jeongho Cho, Gwangho CHOI",2020-02-10,2021-01-08,2021-08-12,,https://patents.google.com/patent/US20210248942A1/en,https://patentimages.storage.googleapis.com/38/b6/ea/9f9acac89c57b9/US20210248942A1-20210812-D00000.png
US-2021246870-A1,Wind and water turbine apparatuses ,Dipak Kumar Sen,Dipak Kumar Sen,2020-02-07,2021-01-06,2021-08-12,,https://patents.google.com/patent/US20210246870A1/en,https://patentimages.storage.googleapis.com/e9/e6/9c/ed1885299e6d7b/US20210246870A1-20210812-D00000.png
US-2021245925-A1,Tray for display apparatus and method of transporting display apparatus by using the same ,"Samsung Display Co., Ltd.","Sangwon Lee, Jeong Ho Hwang",2020-02-11,2021-01-05,2021-08-12,,https://patents.google.com/patent/US20210245925A1/en,https://patentimages.storage.googleapis.com/ef/a5/3e/deefabdecdde26/US20210245925A1-20210812-D00000.png
US-2021273298-A1,Busbar for energy storage device ,Mersen France Angers Sas,"Maxime BABINOT, Thomas Fouet, Simon DARIO, Jean-François De Palma",2020-02-27,2021-02-23,2021-09-02,,https://patents.google.com/patent/US20210273298A1/en,https://patentimages.storage.googleapis.com/0e/05/e7/342ba655da8504/US20210273298A1-20210902-D00000.png
US-2021265340-A1,Semiconductor device and method for fabricating semiconductor device ,"Fuji Electric Co., Ltd.","Kaname MITSUZUKA, Yuichi Onozawa",2020-02-21,2020-12-24,2021-08-26,,https://patents.google.com/patent/US20210265340A1/en,https://patentimages.storage.googleapis.com/df/67/c9/56d3054947560f/US20210265340A1-20210826-D00000.png
US-2021259108-A1,Display device and film package ,"Samsung Display Co., Ltd.","Sehui Jang, Chongguk Lee",2020-02-13,2020-12-17,2021-08-19,,https://patents.google.com/patent/US20210259108A1/en,https://patentimages.storage.googleapis.com/8d/19/ae/abe81c2c3cdf3f/US20210259108A1-20210819-D00000.png
US-2021242432-A1,Display device ,"Samsung Display Co., Ltd.","Gwangteak Lee, Seongsik Choi, Yong-sik JUNG, Yong-Sik Hwang",2020-02-04,2020-12-10,2021-08-05,,https://patents.google.com/patent/US20210242432A1/en,https://patentimages.storage.googleapis.com/92/4f/97/7e48245d70c21c/US20210242432A1-20210805-D00000.png
US-2021242520-A1,Laminate battery and method of manufacturing the same ,Toyota Jidosha Kabushiki Kaisha,"Seigo FUJISHIMA, Satoshi TABARA",2020-02-04,2020-12-09,2021-08-05,,https://patents.google.com/patent/US20210242520A1/en,https://patentimages.storage.googleapis.com/ab/96/39/d352005816bc32/US20210242520A1-20210805-D00000.png
US-2021264821-A1,"Flexible printed circuit film, display apparatus and method of manufacturing the same ","Samsung Display Co., Ltd.",Eun Won SEO,2020-02-21,2020-12-07,2021-08-26,,https://patents.google.com/patent/US20210264821A1/en,https://patentimages.storage.googleapis.com/a5/65/b0/d3eb6024a5eaa9/US20210264821A1-20210826-D00000.png
US-2021239959-A1,Optical inspection apparatus ,"Samsung Display Co., Ltd.",Yong Woon Lim,2020-02-05,2020-12-01,2021-08-05,,https://patents.google.com/patent/US20210239959A1/en,https://patentimages.storage.googleapis.com/03/ad/61/47eb5dd357572a/US20210239959A1-20210805-D00000.png
US-2021255380-A1,Backlight unit and display device including the same ,"Samsung Display Co., Ltd.","Hyun Hyang KIM, Hyun Jeong Kim, Ji Eun NAM, Young Keun Lee, Hyeon Mi Lee",2020-02-13,2020-12-01,2021-08-19,,https://patents.google.com/patent/US20210255380A1/en,https://patentimages.storage.googleapis.com/6c/43/bf/651ef549b48876/US20210255380A1-20210819-D00000.png
US-2021262775-A1,Primer holder device and assembly ,Samuel George Aiken,Samuel George Aiken,2020-02-20,2020-11-24,2021-08-26,,https://patents.google.com/patent/US20210262775A1/en,https://patentimages.storage.googleapis.com/9e/c3/d1/d72845e744aa5f/US20210262775A1-20210826-D00000.png
US-2021263379-A1,Backlight unit and display device including the same ,"Samsung Display Co., Ltd.","Dong Hyeon LEE, Young Min Park",2020-02-25,2020-11-23,2021-08-26,,https://patents.google.com/patent/US20210263379A1/en,https://patentimages.storage.googleapis.com/e7/a2/17/9488d919c7da04/US20210263379A1-20210826-D00000.png
US-2021271002-A1,"Protection member for display, display device including the same and method for fabricating the protection member for display ","Samsung Display Co., Ltd.","Min Sang KOO, Kyung Man Kim, Sang Hoon Kim, Min Hoon CHOI, Seong Jin Hwang",2020-02-27,2020-11-19,2021-09-02,,https://patents.google.com/patent/US20210271002A1/en,https://patentimages.storage.googleapis.com/e2/f3/b0/eeb322dcf5fa51/US20210271002A1-20210902-D00000.png
US-2021261829-A1,Anisotropic conductive adhesives for thermo-compression bonding containing solder conductive particles and flux additives and method of connecting electronic parts using the same ,Korea Advanced Institute Of Science And Technology,"KyoungWook Paik, Jae Hyeong PARK",2020-02-26,2020-11-18,2021-08-26,,https://patents.google.com/patent/US20210261829A1/en,https://patentimages.storage.googleapis.com/5a/af/b9/080364eb129691/US20210261829A1-20210826-D00000.png
US-2021256881-A1,Display device ,"Samsung Display Co., Ltd.","Hyoyul Yoon, Min-Sung Kim, Jae Hoon Jeong, Hansun RYOU, Kyoungah Lee",2020-02-14,2020-11-18,2021-08-19,,https://patents.google.com/patent/US20210256881A1/en,https://patentimages.storage.googleapis.com/be/8e/8f/a0994a55f9597c/US20210256881A1-20210819-D00000.png
US-2021265491-A1,Semiconductor device ,Mitsubishi Electric Corporation,"Shinya SONEDA, Kenji Harada, Kakeru Otsuka",2020-02-26,2020-11-17,2021-08-26,,https://patents.google.com/patent/US20210265491A1/en,https://patentimages.storage.googleapis.com/60/87/b8/c1704de235dee6/US20210265491A1-20210826-D00000.png
US-2021262161-A1,Artificial leather and method for producing the same ,"San Fang Chemical Industry Co., Ltd.","Chih-Yi Lin, Kuo-Kuang Cheng, Chien-Chia Huang, Chia-Ho Lin, Yen-Lun TSENG, Chin-Wei Chen, Ching-Lo LIN",2020-02-24,2020-11-16,2021-08-26,,https://patents.google.com/patent/US20210262161A1/en,https://patentimages.storage.googleapis.com/71/9c/9b/baf85a21cae5a4/US20210262161A1-20210826-D00000.png
US-2021257437-A1,Display device ,"Samsung Display Co., Ltd.","Hwangsup Shin, Eungtaek Kim",2020-02-18,2020-11-12,2021-08-19,,https://patents.google.com/patent/US20210257437A1/en,https://patentimages.storage.googleapis.com/3c/e1/6b/122a9568cf49e5/US20210257437A1-20210819-D00000.png
US-2021265588-A1,Display device ,"Samsung Display Co., Ltd.",Donghyun YANG,2020-02-26,2020-11-11,2021-08-26,,https://patents.google.com/patent/US20210265588A1/en,https://patentimages.storage.googleapis.com/db/ba/bb/b49f2b3620bbfd/US20210265588A1-20210826-D00000.png
US-2021263605-A1,Display device ,"Samsung Display Co., Ltd.","Ji-Hyun Kim, Woongsik Kim, Jin-Su Byun, Tae Wook Kang, Gwangmin Cha, Saehee Han",2020-02-20,2020-11-11,2021-08-26,,https://patents.google.com/patent/US20210263605A1/en,https://patentimages.storage.googleapis.com/f0/8b/a6/fefe132d3bbc35/US20210263605A1-20210826-D00000.png
US-2021245488-A1,Display module manufacturing apparatus and display module manufacturing method ,"Samsung Display Co., Ltd, Jastech, Ltd.","Ohjune Kwon, Juchan Kang, Dongun Jin, Yumhyun Hwang",2020-02-06,2020-11-10,2021-08-12,,https://patents.google.com/patent/US20210245488A1/en,https://patentimages.storage.googleapis.com/c4/4a/fd/bbb30c96305f74/US20210245488A1-20210812-D00000.png
US-2021257483-A1,Parasitic Capacitance Reduction ,"Taiwan Semiconductor Manufacturing Co., Ltd.","Jia-Heng Wang, Chun-Han Chen, I-Wen Wu, Chen-Ming Lee, Fu-Kai Yang, Mei-Yun Wang",2020-02-19,2020-10-30,2021-08-19,,https://patents.google.com/patent/US20210257483A1/en,https://patentimages.storage.googleapis.com/fa/51/8d/97ade59861090c/US20210257483A1-20210819-D00000.png
US-2021247872-A1,Touch sensor and display device having the same ,"Samsung Display Co., Ltd.","Chun Gi YOU, Tae Ik Kim, Hyun Sik Park",2020-02-07,2020-10-05,2021-08-12,,https://patents.google.com/patent/US20210247872A1/en,https://patentimages.storage.googleapis.com/a2/e0/9e/27d3415d9b4ae6/US20210247872A1-20210812-D00000.png
US-2021265255-A1,Flip chip interconnection and circuit board thereof ,Chipbond Technology Corporation,"Yu-Chen Ma, Hsin-Hao Huang, Wen-Fu Chou, Gwo-Shyan Sheu",2020-02-26,2020-09-30,2021-08-26,,https://patents.google.com/patent/US20210265255A1/en,https://patentimages.storage.googleapis.com/5c/ec/7d/bf96c4e32422f1/US20210265255A1-20210826-D00000.png
US-2021272906-A1,Semiconductor package and method of manufacturing the same ,"Samsung Electronics Co., Ltd.","Junghwa KIM, Heeseok Lee",2020-02-27,2020-09-30,2021-09-02,,https://patents.google.com/patent/US20210272906A1/en,https://patentimages.storage.googleapis.com/14/0e/7a/a36b22d8f84697/US20210272906A1-20210902-D00000.png
US-2021257474-A1,Semiconductor device and method for fabricating the same ,"Samsung Electronics Co., Ltd.","In Yeal Lee, Ju Youn Kim, Jin-Wook Kim, Ju Hun Park, Deok Han Bae, Myung Yoon UM",2020-02-17,2020-09-30,2021-08-19,,https://patents.google.com/patent/US20210257474A1/en,https://patentimages.storage.googleapis.com/57/35/8a/eddaa7f46e4c79/US20210257474A1-20210819-D00000.png
