US-2021252372-A1,Methods for manufacturing individualized protective gear from body scan and resulting products ,Auburn University,"Michael Edgar ZABALA, Vitale Kyle CASTELLANO, Jacob Stuart LARSON, Austin J. HARRIS",2020-02-19,2021-02-19,2021-08-19,,https://patents.google.com/patent/US20210252372A1/en,https://patentimages.storage.googleapis.com/60/75/fa/1bab7abaeb7f1b/US20210252372A1-20210819-D00000.png
US-2021259441-A1,Post-surgical pillow ,Protektit Pillow Llc,"Rita Zylberman, Debbie Friedman",2020-02-20,2021-02-19,2021-08-26,,https://patents.google.com/patent/US20210259441A1/en,https://patentimages.storage.googleapis.com/18/aa/f1/c02abd847c5d45/US20210259441A1-20210826-D00000.png
US-2021275683-A1,Nectin-4 antibody conjugates and uses thereof ,"Silverback Therapeutics, Inc.","Peter R. Baum, Robert DuBose, Valerie Odegard, Brenda STEVENS, Philip Tan",2020-02-21,2021-02-19,2021-09-09,,https://patents.google.com/patent/US20210275683A1/en,https://patentimages.storage.googleapis.com/bf/fa/a3/542161ef268fd4/US20210275683A1-20210909-D00001.png
US-2021264322-A1,"Computer-implemented systems, methods and computer programs for adapting a machine-learning-architecture and for processing input data ",Sony Semiconductor Solutions Corporation,"Lev Markhasin, Shangyin GAO",2020-02-26,2021-02-19,2021-08-26,,https://patents.google.com/patent/US20210264322A1/en,https://patentimages.storage.googleapis.com/20/20/1e/220c84847624de/US20210264322A1-20210826-D00000.png
US-2021262652-A1,Enclosure for light fixture ,Eaton Intelligent Power Limited,"Srinath K. Aanegola, Parameswari V. L. Gundavarapu, Andrew F. SCARLATA, Chinmaya Rajiv Dandekar, Anand Kumar Ramachandran, Pushpak Paris Yabrer",2020-02-20,2021-02-19,2021-08-26,,https://patents.google.com/patent/US20210262652A1/en,https://patentimages.storage.googleapis.com/dc/9d/ff/580b6c64887b02/US20210262652A1-20210826-D00000.png
US-2021338804-A1,Vaccine Compositions For Preventing Coronavirus Disease ,"International Aids Vaccine Initiative Inc., Merck Sharp & Dohme Corp.","Christopher Lee Parks, Maoli Yuan, Mark Feinberg, Amy Espeseth, Andrew J. Bett",2020-02-21,2021-02-19,2021-11-04,,https://patents.google.com/patent/US20210338804A1/en,https://patentimages.storage.googleapis.com/0f/6e/0a/89f351461ed6df/US20210338804A1-20211104-D00000.png
US-2021261803-A1,"Pigment dispersion composition, curable composition, accommodating container, device for forming two or three dimensional images, method of forming two-dimensional or three-dimensional images, cured matter, and decoration ","Ricoh Company, Ltd.","Masahide Kobayashi, Mitsunobu Morita, Takashi Okada, Takenori Suenaga, Soh Noguchi, Tatsuki YAMAGUCHI",2020-02-20,2021-02-19,2021-08-26,,https://patents.google.com/patent/US20210261803A1/en,https://patentimages.storage.googleapis.com/6b/11/aa/33a865501d9dd1/US20210261803A1-20210826-D00000.png
US-2021260153-A1,Use of cyclosporine analogues for treating fibrosis ,"Hepion Pharmaceuticals, Inc.","Daren R. Ure, Daniel J. Trepanier, Patrick R. Mayo, Robert T. Foster",2020-02-19,2021-02-19,2021-08-26,,https://patents.google.com/patent/US20210260153A1/en,https://patentimages.storage.googleapis.com/47/3c/44/db27e86084c888/US20210260153A1-20210826-D00000.png
US-2021251966-A1,Methods of Using Androgen Receptor Inhibitors as Cancer Therapeutics ,The Trustees Of The University Of Pennsylvania,"Todd RIDKY, Christopher NATALE, Cristina AGUIRRE PORTOLES",2020-02-19,2021-02-19,2021-08-19,,https://patents.google.com/patent/US20210251966A1/en,https://patentimages.storage.googleapis.com/1c/f4/80/fc80313352260d/US20210251966A1-20210819-D00000.png
US-2021266429-A1,Imaging apparatus ,Canon Kabushiki Kaisha,Akira Tagaya,2020-02-26,2021-02-19,2021-08-26,,https://patents.google.com/patent/US20210266429A1/en,https://patentimages.storage.googleapis.com/ab/04/81/647ed02bb9a7a5/US20210266429A1-20210826-D00000.png
US-2021252770-A1,Overlay applicator machines and methods of providing the same ,"Belkin International, Inc.","Eric Lee, Stanley Cheung, Steven Lane, Kazuyoshi Raijin Otani, David A. Kleeman, John F. Wadsworth, Aaron Ka Hoo Poon",2020-02-19,2021-02-19,2021-08-19,,https://patents.google.com/patent/US20210252770A1/en,https://patentimages.storage.googleapis.com/cc/e2/b5/b9027f26df6434/US20210252770A1-20210819-D00000.png
US-2021251751-A1,"Cardiac repair structure, apparatus, and methods thereof ","Lsi Solutions, Inc.",Jude S. Sauer,2020-02-18,2021-02-18,2021-08-19,,https://patents.google.com/patent/US20210251751A1/en,https://patentimages.storage.googleapis.com/fe/66/88/a2d9ad52aa5cba/US20210251751A1-20210819-D00000.png
US-2021257155-A1,Inductor component and method for manufacturing the same ,"Murata Manufacturing Co., Ltd.","Shin Hasegawa, Tatsuya Sasaki, Shinya Hirai, Ikuno Sugiyama, Toshimitsu Tamura",2020-02-19,2021-02-18,2021-08-19,,https://patents.google.com/patent/US20210257155A1/en,https://patentimages.storage.googleapis.com/2f/2a/95/454ccd631bac1c/US20210257155A1-20210819-D00000.png
US-2021251796-A1,Outlet valve for an ostomy appliance ,Convatec Limited,"Simon HOLROYD, Dominic Baker, Stefan Taal",2020-02-19,2021-02-18,2021-08-19,,https://patents.google.com/patent/US20210251796A1/en,https://patentimages.storage.googleapis.com/89/89/df/279a2b4225cb20/US20210251796A1-20210819-D00000.png
US-2021262122-A1,Hydrolysis-resistant thermoplastic polyurethane fiber and method for producing the same ,"San Fang Chemical Industry Co., Ltd.","Chih-Yi Lin, Kuo-Kuang Cheng, Kao-Lung Yang, Shih-Peng Chang",2020-02-20,2021-02-18,2021-08-26,,https://patents.google.com/patent/US20210262122A1/en,https://patentimages.storage.googleapis.com/b1/55/3f/a16aebc469b4d8/US20210262122A1-20210826-D00000.png
US-2021251795-A1,Outlet valve for an ostomy appliance ,Convatec Limited,"Simon HOLROYD, Dominic Baker, Stefan Taal",2020-02-19,2021-02-18,2021-08-19,,https://patents.google.com/patent/US20210251795A1/en,https://patentimages.storage.googleapis.com/d2/80/a7/39ff6c742f231a/US20210251795A1-20210819-D00000.png
US-2021251638-A1,Bone fusion system ,"Fortus Medical, Inc.","Robert Assell, Andy Freeman",2020-02-19,2021-02-18,2021-08-19,,https://patents.google.com/patent/US20210251638A1/en,https://patentimages.storage.googleapis.com/4e/2a/0d/c2ba663095dc28/US20210251638A1-20210819-D00000.png
US-2021257153-A1,Inductor component and method for manufacturing the same ,"Murata Manufacturing Co., Ltd.","Shin Hasegawa, Tatsuya Sasaki, Shinya Hirai, Ikuno Sugiyama, Toshimitsu Tamura",2020-02-19,2021-02-18,2021-08-19,,https://patents.google.com/patent/US20210257153A1/en,https://patentimages.storage.googleapis.com/4d/b5/92/8e79b16dab127a/US20210257153A1-20210819-D00000.png
US-2021252944-A1,Laminated windshield vent ,"Taylor Made Group, Llc","Curtis MULVANE, Brian Castleman",2020-02-18,2021-02-18,2021-08-19,,https://patents.google.com/patent/US20210252944A1/en,https://patentimages.storage.googleapis.com/9a/ef/23/a205019eeda018/US20210252944A1-20210819-D00000.png
US-2021257154-A1,Inductor component and method for manufacturing the same ,"Murata Manufacturing Co., Ltd.","Shin Hasegawa, Tatsuya Sasaki, Shinya Hirai, Toshimitsu Tamura, Ikuno Sugiyama",2020-02-19,2021-02-18,2021-08-19,,https://patents.google.com/patent/US20210257154A1/en,https://patentimages.storage.googleapis.com/fb/b4/59/8eb4ee64162260/US20210257154A1-20210819-D00000.png
US-2021269496-A1,Tissue targeted immunotolerance with a cd39 effector ,"Pandion Operations, Inc.","Daniel Rios, Purvi Mande, Joanne L. Viney, Nathan Higginson-Scott, Kevin Lewis Otipoby, Susmita Borthakur, Salvatore Alioto, Lindsay J. Edwards",2020-02-21,2021-02-18,2021-09-02,,https://patents.google.com/patent/US20210269496A1/en,https://patentimages.storage.googleapis.com/86/4d/99/7ba85ed29e40e7/US20210269496A1-20210902-D00000.png
US-2021262102-A1,Device for solar light driven co2 reduction in water ,"Universite De Paris, Centre National De La Recherche Scientifique, Universite De Nantes","Marc Robert, Etienne BOUTIN, Palas Baran PATI, Fabrice Odobel, Nicolas BARREAU",2020-02-21,2021-02-18,2021-08-26,,https://patents.google.com/patent/US20210262102A1/en,https://patentimages.storage.googleapis.com/02/b8/3f/36c792eb8ef608/US20210262102A1-20210826-D00000.png
US-2021268594-A1,Dynamic torch head ,The Esab Group Inc.,Michael Nadler,2020-02-27,2021-02-18,2021-09-02,,https://patents.google.com/patent/US20210268594A1/en,https://patentimages.storage.googleapis.com/05/77/91/eac61d26c47944/US20210268594A1-20210902-D00000.png
US-2021251391-A1,"Mattresses, methods of manufacture and components ","Ashley Furniture Industries, LLC.",Travis Wagner,2020-02-18,2021-02-18,2021-08-19,,https://patents.google.com/patent/US20210251391A1/en,https://patentimages.storage.googleapis.com/ea/0d/43/0af5cd1ede6933/US20210251391A1-20210819-D00000.png
US-2021259337-A1,Thermal glove for use in hair styling ,"Rebecca H. Tomb, Sabrina Jahnigen","Rebecca H. Tomb, Sabrina Jahnigen",2020-02-20,2021-02-18,2021-08-26,,https://patents.google.com/patent/US20210259337A1/en,https://patentimages.storage.googleapis.com/cf/dd/e1/9d5b6123e0b79a/US20210259337A1-20210826-D00000.png
US-2021323963-A1,Functional Materials Based on Stable Chemical Structure ,Arizona Board Of Regents On Behalf Of Arizona State University,"Jian Li, Xinqiang Tan",2020-02-21,2021-02-18,2021-10-21,,https://patents.google.com/patent/US20210323963A1/en,https://patentimages.storage.googleapis.com/4c/95/70/a59aafb1e05849/US20210323963A1-20211021-D00000.png
US-2021253318-A1,Polymeric articles with electronic code formed thereon and process of making the same ,"Berry Global, Inc.","Jared B. Waterman, Jonathan Eickhoff, Jennye Scott, Kirk Birchler, Jeffrey A. Mann",2020-02-18,2021-02-17,2021-08-19,,https://patents.google.com/patent/US20210253318A1/en,https://patentimages.storage.googleapis.com/7d/6e/06/745060db691e25/US20210253318A1-20210819-D00000.png
US-2021251412-A1,Needles of decorative items and method of making same ,Belgravia Wood Limited,Hylke Pas,2020-02-18,2021-02-17,2021-08-19,,https://patents.google.com/patent/US20210251412A1/en,https://patentimages.storage.googleapis.com/35/9f/de/18eae1f0df3fc3/US20210251412A1-20210819-D00000.png
US-2021263148-A1,"Sonic wave sensor unit, and recording device ",Seiko Epson Corporation,"Shinya Yamazaki, Osamu Murayama",2020-02-20,2021-02-17,2021-08-26,,https://patents.google.com/patent/US20210263148A1/en,https://patentimages.storage.googleapis.com/d4/10/73/f97e45f77b8e1b/US20210263148A1-20210826-D00000.png
US-2021251890-A1,Hemostatic compositions and related methods ,"Boston Scientific Scimed, Inc.","Jessica L. Grimsby, Lauren Lydecker, Gerald Fredrickson",2020-02-18,2021-02-17,2021-08-19,,https://patents.google.com/patent/US20210251890A1/en,https://patentimages.storage.googleapis.com/08/5c/b2/2f192ce7fe3aab/US20210251890A1-20210819-D00000.png
US-2021254343-A1,Matrix assisted two component roof coating system and method ,Building Materials Investment Corporation,"Yan Zheng, Yixi Xiao, Daniel E. Boss, Adem Chich",2020-02-18,2021-02-17,2021-08-19,,https://patents.google.com/patent/US20210254343A1/en,https://patentimages.storage.googleapis.com/9d/b6/10/f700a528c3921f/US20210254343A1-20210819-D00000.png
US-2021284669-A1,Antiviral compounds ,"Gilead Sciences, Inc.","Byoung-Kwon Chun, Edward Doerffler, Dustin S. Siegel, Andrew C. Stevens, Tiago Vieira",2020-02-18,2021-02-17,2021-09-16,,https://patents.google.com/patent/US20210284669A1/en,https://patentimages.storage.googleapis.com/3c/92/cc/76ef4ccd4c1d47/US20210284669A1-20210916-D00001.png
US-2021267304-A1,Medially-Located Lateral Footwear Stabilizer ,"Nike, Inc.","Bryan N. Farris, Bruce Alan Barney, Rachel M. Savage, Alison Sheets-Singer",2020-02-27,2021-02-17,2021-09-02,,https://patents.google.com/patent/US20210267304A1/en,https://patentimages.storage.googleapis.com/4d/e2/57/3655631fbf7551/US20210267304A1-20210902-D00000.png
US-2021256332-A1,"Print control device, printing method, and print control program ",Seiko Epson Corporation,Shinichi Arazaki,2020-02-19,2021-02-17,2021-08-19,,https://patents.google.com/patent/US20210256332A1/en,https://patentimages.storage.googleapis.com/00/6d/b2/78d216d12bd30c/US20210256332A1-20210819-D00000.png
US-2021258250-A1,"Switching device, network access point, system, process and computer program for a switching device ",Drägerwerk AG & Co. KGaA,"Tobias Klotz, René Langer",2020-02-18,2021-02-17,2021-08-19,,https://patents.google.com/patent/US20210258250A1/en,https://patentimages.storage.googleapis.com/2e/3d/f0/dcfb42dfba41b7/US20210258250A1-20210819-D00000.png
US-2021260858-A1,Composite structures with embedded electrical grids ,"Wabash National, L.P.",Andrzej Wylezinski,2020-02-21,2021-02-17,2021-08-26,,https://patents.google.com/patent/US20210260858A1/en,https://patentimages.storage.googleapis.com/12/0a/b9/0b3815805f1d1e/US20210260858A1-20210826-D00000.png
US-2021272743-A1,Multilayer coil component ,Tdk Corporation,"Hajime Kato, Junichiro Urabe, Yuto SHIGA, Kazuya TOBITA, Youichi KAZUTA, Noriaki HAMACHI, Toshinori Matsuura, Yuichi TAKUBO, Munehiro Takaku",2020-02-27,2021-02-17,2021-09-02,,https://patents.google.com/patent/US20210272743A1/en,https://patentimages.storage.googleapis.com/40/00/17/7df221a6b2aa4c/US20210272743A1-20210902-D00000.png
US-2021259945-A1,Biodegradable Polyesters for Water-Resistant Oil-in-Water Suncare Formulations ,Nouryon Chemicals International B.V.,"Hanamanthsa Shankarsa Bevinakatti, Paul Michael Ferm, Allison M. Johnston, William F. Joyce, Karen L. White, Kristin Nicole Golas",2020-02-21,2021-02-16,2021-08-26,,https://patents.google.com/patent/US20210259945A1/en,https://patentimages.storage.googleapis.com/0a/eb/4d/b98a3d310fe045/US20210259945A1-20210826-D00000.png
US-2021251326-A1,Cap with an Interchangable or Removable Visor ,"Virlie J. Smith III, Ifejuluafo Odimgbe-Smith","Virlie J. Smith III, Ifejuluafo Odimgbe-Smith",2020-02-14,2021-02-16,2021-08-19,,https://patents.google.com/patent/US20210251326A1/en,https://patentimages.storage.googleapis.com/64/8e/3e/a1fe9ff218f0e5/US20210251326A1-20210819-D00000.png
US-2021252508-A1,Sample cartridges ,Heska Corporation,Andrew Hinsch,2020-02-15,2021-02-16,2021-08-19,,https://patents.google.com/patent/US20210252508A1/en,https://patentimages.storage.googleapis.com/3b/49/1d/4aad9e523e486d/US20210252508A1-20210819-D00000.png
US-2021259946-A1,Biodegradable polyesters for water-resistant anhydrous suncare formulations ,Nouryon Chemicals International B.V.,"Hanamanthsa Shankarsa Bevinakatti, Paul Michael Ferm, Allison M. Johnston, William F. Joyce, Karen L. White, Kristin Nicole Golas",2020-02-21,2021-02-16,2021-08-26,,https://patents.google.com/patent/US20210259946A1/en,https://patentimages.storage.googleapis.com/63/91/47/56eafab9ab41ba/US20210259946A1-20210826-D00000.png
US-2021257685-A1,Efficient recovery processes for the black mass from spent lithium-ion batteries ,"Ut-Battelle, Llc","Ilias Belharouak, Yaocai BAI, Jianlin Li",2020-02-14,2021-02-16,2021-08-19,,https://patents.google.com/patent/US20210257685A1/en,https://patentimages.storage.googleapis.com/e5/96/2f/c81e8abc3066fc/US20210257685A1-20210819-D00000.png
US-2021259930-A1,Biodegradable polyesters for water-resistant water-in-oil suncare formulations ,Nouryon Chemicals International B.V.,"Hanamanthsa Shankarsa Bevinakatti, Paul Michael Ferm, Allison M. Johnston, William F. Joyce, Karen L. White, Kristin Nicole Golas",2020-02-21,2021-02-16,2021-08-26,,https://patents.google.com/patent/US20210259930A1/en,https://patentimages.storage.googleapis.com/0d/fb/54/d4808e25ebc071/US20210259930A1-20210826-D00000.png
US-2021252507-A1,Apparatus for separating the cellular and liquid portions of a whole blood sample ,"University Of Maryland, Baltimore County","Mustafa AL-ADHAMI, Yordan Kostov, Govind Rao",2020-02-16,2021-02-16,2021-08-19,,https://patents.google.com/patent/US20210252507A1/en,https://patentimages.storage.googleapis.com/af/b9/42/01855a9b2305bb/US20210252507A1-20210819-D00000.png
US-2021251517-A1,Unobstrusive estimation of cardiovascular parameters with limb ballistocardiography ,"University Of Maryland, College Park","Jin-Oh Hahn, Yang Yao, Sungtae Shin, Azin Sadat Mousavi",2020-02-14,2021-02-15,2021-08-19,,https://patents.google.com/patent/US20210251517A1/en,https://patentimages.storage.googleapis.com/e0/65/b1/84e4cddec879e4/US20210251517A1-20210819-D00000.png
US-2021252280-A1,Human body enhanced training system ,Techfit Group LLC,Jim Stathis,2020-02-13,2021-02-15,2021-08-19,,https://patents.google.com/patent/US20210252280A1/en,https://patentimages.storage.googleapis.com/d6/04/ce/e5f9d8273afa94/US20210252280A1-20210819-D00000.png
US-2021252418-A1,Self-supporting inflatable kite system and method of use ,Thomas R. Pierce,Thomas R. Pierce,2020-02-14,2021-02-15,2021-08-19,,https://patents.google.com/patent/US20210252418A1/en,https://patentimages.storage.googleapis.com/43/e7/66/ba52528c899ccd/US20210252418A1-20210819-D00000.png
US-2021252773-A1,Three-dimensional freeze extrusion for the manufacture of homogeneous and graded rods and tubes ,Trustees Of Dartmouth College,"Ulrike G. K. Wegst, Kaiyang Yin, Claire Adner, Peyton Weber, Amalie Hildebrandt Brynjulfsson",2020-02-14,2021-02-15,2021-08-19,,https://patents.google.com/patent/US20210252773A1/en,https://patentimages.storage.googleapis.com/50/82/9c/741d186e9df201/US20210252773A1-20210819-D00000.png
US-2021272861-A1,Protector Cap for Package with Thermal Interface Material ,Infineon Technologies Austria Ag,"Christian Kasztelan, Nee Wan Khoo",2020-02-27,2021-02-15,2021-09-02,,https://patents.google.com/patent/US20210272861A1/en,https://patentimages.storage.googleapis.com/23/9c/08/09e9211f7effed/US20210272861A1-20210902-D00000.png
US-2021185722-A1,Physical uplink shared channel (pusch) transmission scheduling for new radio (nr) ,Intel Corporation,"Yingyang Li, Yongjun KWAK",2020-02-13,2021-02-12,2021-06-17,,https://patents.google.com/patent/US20210185722A1/en,https://patentimages.storage.googleapis.com/5b/1c/aa/88eedfcdefcf76/US20210185722A1-20210617-D00000.png
US-2021254863-A1,Geothermal heat containment barrier ,"Pdq Mazoo, Llc","Tony Abfall, Richard Mazursky, Marvin Barsky",2020-02-13,2021-02-12,2021-08-19,,https://patents.google.com/patent/US20210254863A1/en,https://patentimages.storage.googleapis.com/73/6b/10/fefd9112667d5f/US20210254863A1-20210819-D00000.png
US-2021168852-A1,Mode-1 downlink control information transmission-reception for configured sidelink scheduling in nr v2x ,Intel Corporation,"Sergey Panteleev, Alexey Khoryaev, Mikhail Shilov, Kilian Roth, Dmitry Belov",2020-02-13,2021-02-12,2021-06-03,,https://patents.google.com/patent/US20210168852A1/en,https://patentimages.storage.googleapis.com/a0/8a/4f/a695ab8dc8cf02/US20210168852A1-20210603-D00000.png
US-2021253303-A1,Bottle adapted for storing a liquid composition with an aesthetic design suspended therein ,The Procter & Gamble Company,"Stefano Bartolucci, Mark Anthony Brown, Emily Lao Hickey",2020-02-14,2021-02-12,2021-08-19,,https://patents.google.com/patent/US20210253303A1/en,https://patentimages.storage.googleapis.com/d8/31/6f/808234b3d52a3c/US20210253303A1-20210819-D00000.png
US-2021251983-A1,Methods of treatment with buprenorphine ,"Biodelivery Sciences International, Inc.","Thomas Smith, Mancia Ko, Todd Kunkel",2020-02-13,2021-02-12,2021-08-19,,https://patents.google.com/patent/US20210251983A1/en,https://patentimages.storage.googleapis.com/88/56/36/292ca30b7f3628/US20210251983A1-20210819-D00000.png
US-2021235645-A1,Lettuce Variety Buckskin ,Syngenta Crop Protection Ag,Hallie Gale Dodson-Swenson,2020-02-03,2020-02-03,2021-08-05,,https://patents.google.com/patent/US20210235645A1/en,
US-2021259111-A1,Laminated sheet ,Nitto Denko Corporation,"Keisuke OKUMURA, Yoshihiro Furukawa",2020-02-17,2021-02-12,2021-08-19,,https://patents.google.com/patent/US20210259111A1/en,https://patentimages.storage.googleapis.com/33/34/46/21603f4544cc0d/US20210259111A1-20210819-D00000.png
US-2021251140-A1,Lawn trimmer attachment for trimming sprinkler heads ,Edward Tybuszynski,Edward Tybuszynski,2020-02-13,2021-02-12,2021-08-19,,https://patents.google.com/patent/US20210251140A1/en,https://patentimages.storage.googleapis.com/3e/ab/48/bcf80486362bb7/US20210251140A1-20210819-D00000.png
US-2021251216-A1,System for automated permeation of a biological material and method of using same ,Cook Medical Technologies Llc,Jorge L. JIMENEZ-RIOS,2020-02-17,2021-02-12,2021-08-19,,https://patents.google.com/patent/US20210251216A1/en,https://patentimages.storage.googleapis.com/74/fa/b7/d3c93e35e8a6a1/US20210251216A1-20210819-D00000.png
US-2021285002-A1,Oligonucleotides targeting frataxin and related methods ,University Of Massachusetts,"Feng Wang, Jonathan Watts",2020-02-14,2021-02-12,2021-09-16,,https://patents.google.com/patent/US20210285002A1/en,https://patentimages.storage.googleapis.com/f7/f5/a3/a781f7c5d3f24e/US20210285002A1-20210916-D00000.png
US-2021246009-A1,"Apparatus for rupturing a sealed, frangible container ",Zachary Bradford Smith,Zachary Bradford Smith,2020-02-12,2021-02-12,2021-08-12,,https://patents.google.com/patent/US20210246009A1/en,https://patentimages.storage.googleapis.com/41/64/31/7e6b1e69039795/US20210246009A1-20210812-D00000.png
US-2021256394-A1,Methods and systems for the optimization of a biosynthetic pathway ,Zymergen Inc.,"Stepan Tymoshenko, Oliver Liu",2020-02-14,2021-02-12,2021-08-19,,https://patents.google.com/patent/US20210256394A1/en,https://patentimages.storage.googleapis.com/50/7a/30/626c02049afeaa/US20210256394A1-20210819-D00000.png
US-2021168755-A1,Positioning measurements in new radio positioning protocol a (nrppa) ,Alexander Sirotkin,Alexander Sirotkin,2020-02-14,2021-02-12,2021-06-03,,https://patents.google.com/patent/US20210168755A1/en,https://patentimages.storage.googleapis.com/f4/81/5d/55a326580c9a1f/US20210168755A1-20210603-D00000.png
US-2021252469-A1,Polyurea Capsules Cross-linked with Chitosan ,"Encapsys, Llc",Linsheng Feng,2020-02-14,2021-02-12,2021-08-19,,https://patents.google.com/patent/US20210252469A1/en,https://patentimages.storage.googleapis.com/c5/b7/5d/76fe2e8886b0b2/US20210252469A1-20210819-D00001.png
US-2021260180-A1,Coronavirus immunogenic compositions and uses thereof ,"Altimmune, Inc","Bertrand Victor Gilbert Georges, M. Scot Roberts",2020-02-14,2021-02-12,2021-08-26,,https://patents.google.com/patent/US20210260180A1/en,https://patentimages.storage.googleapis.com/f3/98/b3/243903be336c6d/US20210260180A1-20210826-D00000.png
US-2021257149-A1,Mark-including inductor and mark-including laminated sheet ,Nitto Denko Corporation,"Keisuke OKUMURA, Yoshihiro Furukawa",2020-02-17,2021-02-12,2021-08-19,,https://patents.google.com/patent/US20210257149A1/en,https://patentimages.storage.googleapis.com/39/24/9f/80117fc1a328eb/US20210257149A1-20210819-D00000.png
US-2021269783-A1,Haplotype-based treatment of rp1 associated retinal degenerations ,Massachusetts Eye And Ear Infirmary,"Qin Liu, Caitlin Collin",2020-02-12,2021-02-12,2021-09-02,,https://patents.google.com/patent/US20210269783A1/en,https://patentimages.storage.googleapis.com/79/2b/49/527f2d88a7f700/US20210269783A1-20210902-D00000.png
US-2021203397-A1,Systems and methods for multiple-beam uplink transmission ,Intel Corporation,"Gang Xiong, Bishwarup Mondal, Guotong Wang",2020-02-13,2021-02-12,2021-07-01,,https://patents.google.com/patent/US20210203397A1/en,https://patentimages.storage.googleapis.com/4b/d8/d0/d4d6acf821c888/US20210203397A1-20210701-D00000.png
US-2021252362-A1,Portable outdoor game ,Newport Innovations L.L.C.,"Craig Lee ALLEN, Denice ALLEN",2020-02-16,2021-02-11,2021-08-19,,https://patents.google.com/patent/US20210252362A1/en,https://patentimages.storage.googleapis.com/a5/63/b8/454e8e3d45d98e/US20210252362A1-20210819-D00000.png
US-2021246993-A1,Valve Actuator and Valve ,Buerkert Werke Gmbh & Co. Kg,Micah HODGINS,2020-02-11,2021-02-11,2021-08-12,,https://patents.google.com/patent/US20210246993A1/en,https://patentimages.storage.googleapis.com/7f/00/29/573a62ba0e2621/US20210246993A1-20210812-D00000.png
US-2021246396-A1,Water-soluble refill dose article enclosing a concentrated liquid cleanser composition and kits having same ,Hayden Products Llc,"Curan Mehra, Konstantinos LAHANAS",2020-02-12,2021-02-11,2021-08-12,,https://patents.google.com/patent/US20210246396A1/en,https://patentimages.storage.googleapis.com/9b/19/3e/bef9a9d5a3e1b4/US20210246396A1-20210812-D00000.png
US-2021268022-A1,Methods of activating regulatory t cells ,"HCW Biologics, Inc.","Hing C. Wong, Niraj Shresha, Varghese George, Michael Dee",2020-02-11,2021-02-11,2021-09-02,,https://patents.google.com/patent/US20210268022A1/en,https://patentimages.storage.googleapis.com/f1/e7/a9/cc9dcc03208956/US20210268022A1-20210902-D00000.png
US-2021248923-A1,"Systems, apparatuses, and methods for presenting an anatomical simulant ","Abbott Cardiovascular Systems, Inc.",Michael L. Green,2020-02-12,2021-02-11,2021-08-12,,https://patents.google.com/patent/US20210248923A1/en,https://patentimages.storage.googleapis.com/3a/86/b1/5569112e73a058/US20210248923A1-20210812-D00000.png
US-2021245531-A1,Printing device ,"Bixolon Co., Ltd.","Jin Gwan Kim, Jin Kook Kim",2020-02-11,2021-02-11,2021-08-12,,https://patents.google.com/patent/US20210245531A1/en,https://patentimages.storage.googleapis.com/f1/35/fa/44c6ba4d9c6a7b/US20210245531A1-20210812-D00000.png
US-2021275220-A1,Surgical cannula with removable pressure seal ,"Embody, Inc.","Christopher K. Jones, Douglas Snell, Isaac Running, R. Sean Churchill, Nathan Kemper",2020-02-11,2021-02-11,2021-09-09,,https://patents.google.com/patent/US20210275220A1/en,https://patentimages.storage.googleapis.com/21/ae/b1/cc77a0d0c6bbac/US20210275220A1-20210909-D00000.png
