US-2021036836-A1,Resource Mapping Based on Bandwidth Part ,Telefonaktiebolaget Lm Ericsson (Publ),"Erik Dahlman, Robert Baldemair, Daniel Chen Larsson, Sorour Falahati, Stefan Parkvall",2018-02-16,2018-02-16,2021-02-04,,https://patents.google.com/patent/US20210036836A1/en,https://patentimages.storage.googleapis.com/ba/44/cc/99a4c29b040ad8/US20210036836A1-20210204-D00000.png
US-2020392304-A1,Fluorine rubber composition and crosslinked fluorine rubber product ,"Daikin Industries, Ltd., Bridgestone Corporation","Masashi Arai, Daisuke Ohta, Akinori Ueda, Yasuhiro Oda, Junichi ORIDE",2018-02-23,2019-02-22,2020-12-17,,https://patents.google.com/patent/US20200392304A1/en,https://patentimages.storage.googleapis.com/c9/60/ad/a52fcd2f17cd84/US20200392304A1-20201217-D00000.png
US-2020337145-A1,Laser system ,"Gigaphoton Inc., The University Of Tokyo","Hironori IGARASHI, Kouji Kakizaki, Yohei Kobayashi, Shuntaro TANI",2018-02-21,2020-07-02,2020-10-22,,https://patents.google.com/patent/US20200337145A1/en,https://patentimages.storage.googleapis.com/9b/1a/70/56f93047f6a87c/US20200337145A1-20201022-D00000.png
US-2021361875-A1,Surface Texturization for Rolling Diaphragm Syringe ,Bayer Healthcare Llc,"Kevin Cowan, Michael Spohn, Michael Swantner, James MIERZWIAK, David Berry, Barry Tucker, Arthur Uber, Iii",2018-02-05,2019-02-05,2021-11-25,,https://patents.google.com/patent/US20210361875A1/en,https://patentimages.storage.googleapis.com/0e/e4/27/7762cbd92e2656/US20210361875A1-20211125-D00000.png
US-2021039338-A1,Method for manufacturing a prepreg made of a composite material ,Institut De Recherche Technologique Jules Verne,"Thierry Renault, Sébastien GUÉROULT",2018-02-09,2019-02-08,2021-02-11,,https://patents.google.com/patent/US20210039338A1/en,https://patentimages.storage.googleapis.com/0b/7f/1e/f6a51346a0c75e/US20210039338A1-20210211-D00000.png
US-2021096127-A1,Means and methods for monitoring scar development ,Helmholtz Zentrum München - Deutsches Forschungszentrum für Gesundheit und Umwelt (GmbH),"Yuval Rinkevich, Dongsheng Jiang, Donovan CORREA-GALLEGOS",2018-02-09,2019-08-02,2021-04-01,,https://patents.google.com/patent/US20210096127A1/en,https://patentimages.storage.googleapis.com/e1/ef/d3/5d2bcff14fe7b9/US20210096127A1-20210401-D00000.png
US-2019255581-A1,Equipment for and method of recycling window panel ,"Samsung Display Co., Ltd., C & S Engineering Co., Ltd.","Jinwook Yang, Heechang Kim, Chang-Mo Park, Jongman Bae, Soyeon Eom, Bongkee LEE, Hyoungyoul KIM",2018-02-19,2019-02-19,2019-08-22,,https://patents.google.com/patent/US20190255581A1/en,https://patentimages.storage.googleapis.com/50/96/9c/d20f89e12e4c6d/US20190255581A1-20190822-D00000.png
US-2021088451-A1,Unmanned vehicle based detection of chemical warfare agents ,"Intelligent Optical Systems, Inc.","Manal Beshay, Janet L Jensen, James M Cress",2018-02-22,2020-06-12,2021-03-25,,https://patents.google.com/patent/US20210088451A1/en,https://patentimages.storage.googleapis.com/0f/f5/09/1106d5c4e78449/US20210088451A1-20210325-D00001.png
US-10326261-B1,Architectural wall panels and adornments for concealing indoor wiring and cables ,"Unitoro, LLC",Edward J. Kim,2018-02-01,2018-02-01,2019-06-18,2019-06-18,https://patents.google.com/patent/US10326261B1/en,https://patentimages.storage.googleapis.com/e1/5e/a2/6501ddb68678aa/US10326261-20190618-D00000.png
US-2019231883-A1,Spider silk protein drug compositions and delivery ,Utah State University,"Randolph V. Lewis, Justin A. JONES, Thomas Harris, Deven Smuin",2018-02-01,2019-02-01,2019-08-01,,https://patents.google.com/patent/US20190231883A1/en,https://patentimages.storage.googleapis.com/99/cf/08/696328d0baaea9/US20190231883A1-20190801-D00001.png
US-2020376753-A1,Three-dimensional printing methods ,"Hewlett-Packard Develment Company, L.P.","Alexey S Kabalnov, Stephen G. Rudisill, Jesiska TANDY, Graciela Emma Negri Jimenez, Shannon Reuben Woodruff, Jason Butler",2018-02-06,2018-02-06,2020-12-03,,https://patents.google.com/patent/US20200376753A1/en,https://patentimages.storage.googleapis.com/9f/5a/ab/52574e1cbb10d7/US20200376753A1-20201203-D00000.png
US-2021108017-A1,(co)pol ymers of hydrophobic monomers and methods of making and use thereof ,Basf Se,"Michael Krayer, Kostas S. Avramidis",2018-02-16,2019-02-14,2021-04-15,,https://patents.google.com/patent/US20210108017A1/en,https://patentimages.storage.googleapis.com/bd/49/80/73fc87766a480e/US20210108017A1-20210415-D00000.png
US-11156963-B2,Movement and timepiece ,Seiko Epson Corporation,"Shuichi Tamura, Tsunenobu Endo, Ryo Sugimoto",2018-02-06,2019-02-05,2021-10-26,2021-10-26,https://patents.google.com/patent/US11156963B2/en,https://patentimages.storage.googleapis.com/12/73/b7/6b1396d4e87163/US11156963-20211026-D00000.png
US-2021079050-A1,Compositions and methods for delivery and expression of small inhibitory peptides and use thereof ,Carmel Haifa University Economic Corporation Ltd.,"Kobi ROSENBLUM, Efrat EDRY",2018-02-20,2019-02-20,2021-03-18,,https://patents.google.com/patent/US20210079050A1/en,https://patentimages.storage.googleapis.com/de/d3/aa/7d66490a455d48/US20210079050A1-20210318-D00000.png
US-2021271061-A1,Observation device and observation method ,Sony Corporation,"Takanori Fukazawa, Goro Fujita, Koichiro Kishima",2018-02-14,2019-01-16,2021-09-02,,https://patents.google.com/patent/US20210271061A1/en,https://patentimages.storage.googleapis.com/ed/e4/15/f929834f93ed3e/US20210271061A1-20210902-D00000.png
US-2019231182-A1,Endoscope with oscillation for spectrally-encoded endoscopy ,"Canon U.S.A., Inc.","Jacob Schieffelin Brauer, Zhuo Wang, Alex Altshuler, Anderson Thi Mach",2018-02-01,2018-02-01,2019-08-01,,https://patents.google.com/patent/US20190231182A1/en,https://patentimages.storage.googleapis.com/a8/9b/b5/43fd45e0f74d2b/US20190231182A1-20190801-D00000.png
US-2021364503-A1,Biochemical reaction substrate and analyzer ,"Nippon Chemiphar Co., Ltd., Ueda Japan Radio Co., Ltd.","Kenji Uemura, Norio Tanimoto, Mai Egami, Takahiro Mataki, Yumi KONISHI, Motoe SHIMIZU, Shigenori Takahashi, Koji Sakaguchi",2018-02-02,2019-02-01,2021-11-25,,https://patents.google.com/patent/US20210364503A1/en,https://patentimages.storage.googleapis.com/36/d3/41/acbaec6ed36d02/US20210364503A1-20211125-D00000.png
US-2019257853-A1,Optical accelerometers for use in navigation grade environments ,General Electric Company,"William Albert Challener, Mengli Wang",2018-02-20,2018-05-01,2019-08-22,,https://patents.google.com/patent/US20190257853A1/en,https://patentimages.storage.googleapis.com/b2/67/49/6827f8dbb525e7/US20190257853A1-20190822-D00000.png
US-10495829-B1,Positioning of an optical beam to mitigate hysteresis ,The Government Of The United States Of America As Represented By The Secretary Of The Air Force,Matthew Squires,2018-02-26,2018-02-26,2019-12-03,2019-12-03,https://patents.google.com/patent/US10495829B1/en,https://patentimages.storage.googleapis.com/b5/c3/25/00a18b90b36fd6/US10495829-20191203-D00000.png
US-2019257142-A1,System and method for a modular door structure ,"Russet Labs, Llc","Jean Bernard Koehl, Robert S. Freeman, Xavier Humel",2018-02-18,2019-02-13,2019-08-22,,https://patents.google.com/patent/US20190257142A1/en,https://patentimages.storage.googleapis.com/79/ae/be/5cb2baefc0559e/US20190257142A1-20190822-D00000.png
US-2021032436-A1,"Particulate nucleating agent, resin composition, molded product, and production method thereof ",Adeka Corporation,"Takahiro Horikoshi, Yuri YOKOTA",2018-02-15,2019-02-07,2021-02-04,,https://patents.google.com/patent/US20210032436A1/en,
US-2021045976-A1,"Powder-containing composition, powder for aqueous solvent, and production method of powder for aqueous solvent ","Shiseido Company, Ltd.",Yumi Ando,2018-02-08,2018-02-08,2021-02-18,,https://patents.google.com/patent/US20210045976A1/en,
US-2021022982-A1,"Powder-containing composition, powder for aqueous solvent, and production method of powder for aqueous solvent ","Shiseido Company, Ltd.",Yumi Ando,2018-02-08,2018-02-08,2021-01-28,,https://patents.google.com/patent/US20210022982A1/en,
US-2019247846-A1,Method and Apparatus for Pipette Tip Columns ,"Chris Suh, Douglas T. Gjerde, Lee Hoang, Mark Abel","Chris Suh, Douglas T. Gjerde, Lee Hoang, Mark Abel",2018-02-09,2018-02-09,2019-08-15,,https://patents.google.com/patent/US20190247846A1/en,
US-2019261941-A1,Radiation fluoroscopy imaging apparatus ,Shimadzu Corporation,Tanaka Masahiro,2018-02-23,2018-02-23,2019-08-29,,https://patents.google.com/patent/US20190261941A1/en,https://patentimages.storage.googleapis.com/fe/48/9b/a59fffc38066b5/US20190261941A1-20190829-D00000.png
US-2021122893-A1,Sponge-forming silicone rubber composition and silicone rubber sponge ,"Dow Toray Co., Ltd.",Masakazu Irie,2018-02-01,2019-01-18,2021-04-29,,https://patents.google.com/patent/US20210122893A1/en,
US-2021360913-A1,"Methods, systems and compositions for normothermic ex vivo preservation of intact organs ",Yale University,"Stefano Daniele, Nenad Sestan, John Silbereis, Zvonimir Vrselja",2018-02-09,2019-02-08,2021-11-25,,https://patents.google.com/patent/US20210360913A1/en,https://patentimages.storage.googleapis.com/f8/16/27/53c75d1d9ca10a/US20210360913A1-20211125-D00000.png
US-2021016501-A1,"Devices, systems and methods for printing three-dimensional objects ","3Deo, Inc.","Matthew Petros, Payman Torabi",2018-02-07,2020-08-03,2021-01-21,,https://patents.google.com/patent/US20210016501A1/en,https://patentimages.storage.googleapis.com/94/31/11/a1a0327375a9d5/US20210016501A1-20210121-D00000.png
US-2019257973-A1,3-dimensional scanner for downhole well integrity reconstruction in the hydrocarbon industry ,Saudi Arabian Oil Company,"Hussain AlBahrani, Mohammad Aljubran, Timothy E. Moellendick",2018-02-20,2018-02-20,2019-08-22,,https://patents.google.com/patent/US20190257973A1/en,https://patentimages.storage.googleapis.com/94/83/93/cf797030b7f09d/US20190257973A1-20190822-D00000.png
US-2019256399-A1,Additive layer process for manufacturing glass articles from soot ,Corning Incorporated,"Sezhian Annamalai, Thomas Richard Chapman, Kenneth Edward Hrdina, Douglas Hull Jennings, Nicolas LeBlond, Dale Robert Powers",2018-02-19,2019-02-18,2019-08-22,,https://patents.google.com/patent/US20190256399A1/en,https://patentimages.storage.googleapis.com/f5/20/40/d7244f96c1a95f/US20190256399A1-20190822-D00000.png
US-2021369506-A1,Absorbent member for a body cleft adapted product and product with such absorbent member ,John BLEVINS,John BLEVINS,2018-02-15,2019-02-15,2021-12-02,,https://patents.google.com/patent/US20210369506A1/en,https://patentimages.storage.googleapis.com/35/97/6a/eaa8155e5f42c2/US20210369506A1-20211202-D00000.png
US-2020285085-A1,Direct drive region-less polymer modulator methods of fabricating and materials therefor ,Lightwave Logic Inc.,"Michael Lebby, Yasufumi Enami",2018-02-19,2020-02-11,2020-09-10,,https://patents.google.com/patent/US20200285085A1/en,https://patentimages.storage.googleapis.com/a7/6c/fc/79520580c2d737/US20200285085A1-20200910-D00000.png
US-2021078309-A1,Composite structure ,Graphene Composites Limited,"Sandy Chen, Stephen Devine",2018-02-22,2019-02-22,2021-03-18,,https://patents.google.com/patent/US20210078309A1/en,https://patentimages.storage.googleapis.com/ba/04/e5/2f231f53476283/US20210078309A1-20210318-D00000.png
US-2021120750-A1,Fluidized bed extractors for capture of co2 from ambient air ,"Carbon Sink, Inc.","Alain L. Bourhis, David K. Steckler, Raffaella Sordella, Frank O'Keefe",2018-02-16,2020-08-12,2021-04-29,,https://patents.google.com/patent/US20210120750A1/en,https://patentimages.storage.googleapis.com/eb/be/fb/5103defbe1cc9e/US20210120750A1-20210429-D00000.png
US-2021076720-A1,Shelf stable powdered composition ,Firmenich Sa,"Jian Zhang, Rutger VAN SLEEUWEN, Amanda SCHOBER, Brian MACDOUGALL, Frank Fei Zhang, Pierre-Etienne Bouquerand",2018-02-23,2019-02-22,2021-03-18,,https://patents.google.com/patent/US20210076720A1/en,https://patentimages.storage.googleapis.com/26/4b/ae/9c3856deaf1bbd/US20210076720A1-20210318-D00001.png
US-2019245270-A1,Electronic Device With Antenna Feed Bolt ,Apple Inc.,"James M. Cuseo, David C. Parell, Jerzy S. Guterman, Joel D. Barrera",2018-02-07,2019-02-06,2019-08-08,,https://patents.google.com/patent/US20190245270A1/en,https://patentimages.storage.googleapis.com/1e/31/2d/f5dd8be5d2ead9/US20190245270A1-20190808-D00000.png
US-2021031131-A1,Fastening Module and Filter System ,Mann+Hummel Gmbh,"Juergen Rauschmaier, Herbert Pietrowski, Bernd Joos, Christoph Krautner, Daniel Ebnet",2018-02-21,2020-08-21,2021-02-04,,https://patents.google.com/patent/US20210031131A1/en,https://patentimages.storage.googleapis.com/14/87/58/0a83e8d862cc9c/US20210031131A1-20210204-D00000.png
US-2021091449-A1,Antenna housing and structure for antenna housing ,Telefonaktiebolaget Lm Ericsson (Publ),"Stefan Weber, Eckart STUIBLE",2018-02-23,2018-08-21,2021-03-25,,https://patents.google.com/patent/US20210091449A1/en,https://patentimages.storage.googleapis.com/ab/04/c3/540741bff13814/US20210091449A1-20210325-D00000.png
US-2020390823-A1,"Free-standing, transferrable vascular networks via guided self-assembly and use in cell replacement therapies ",Cornell University,"Minglin Ma, Wei Song, Alan Chiu",2018-02-07,2019-02-07,2020-12-17,,https://patents.google.com/patent/US20200390823A1/en,https://patentimages.storage.googleapis.com/5c/d3/cb/ca04cd84e5ea28/US20200390823A1-20201217-D00000.png
US-2021028002-A1,"Sample supporting body, method for ionizing sample, and mass spectrometry method ",Hamamatsu Photonics K.K.,"Miu TAKIMOTO, Takayuki Ohmura, Masahiro KOTANI",2018-02-09,2018-12-12,2021-01-28,,https://patents.google.com/patent/US20210028002A1/en,https://patentimages.storage.googleapis.com/b3/47/e7/635c89199ab042/US20210028002A1-20210128-D00000.png
US-2021102092-A1,Perhydropolysilazane compositions and methods for forming nitride films using same ,"American Air Liquide, Inc., L'Air Liquide, Société Anonyme pour l'Etude et l'Exploitation des Procédés Georges Claude","Antonio Sanchez, Gennadiy ITOV, Manish Khandelwal, Cole RITTER, Peng Zhang, Jean-Marc Girard, Zhiwen WAN, Glenn Kuchenbeiser, David Orban, Sean Kerrigan, Reno PESARESI, Matthew Damien Stephens, Yang Wang, Guillaume Husson, Grigory Nikiforov",2018-02-21,2019-02-21,2021-04-08,,https://patents.google.com/patent/US20210102092A1/en,https://patentimages.storage.googleapis.com/cf/38/e2/d32dc8c68c018e/US20210102092A1-20210408-D00000.png
US-2021029813-A1,Method of generation of planar plasma jets ,"Drexel University, Thomas Jefferson University","Danil V. Dobrynin, Alexander Fridman, Abraham Lin, Vandana MILLER, Adam Snook",2018-02-20,2019-02-20,2021-01-28,,https://patents.google.com/patent/US20210029813A1/en,https://patentimages.storage.googleapis.com/b0/11/47/01660ca09a6b00/US20210029813A1-20210128-D00000.png
US-2021071649-A1,Untwisted artificial muscle ,"Lintec Of America, Inc.",Marcio Dias Lima,2018-02-20,2019-02-15,2021-03-11,,https://patents.google.com/patent/US20210071649A1/en,https://patentimages.storage.googleapis.com/0e/9f/66/77d450a49590d6/US20210071649A1-20210311-D00000.png
US-2019247638-A1,Delivery system for delivering a drug depot to a target site under image guidance and methods and uses of same ,Kieran P. Murphy,Kieran P. Murphy,2018-02-13,2019-02-12,2019-08-15,,https://patents.google.com/patent/US20190247638A1/en,https://patentimages.storage.googleapis.com/48/6e/c8/a7269b2969db2a/US20190247638A1-20190815-D00000.png
US-2020198299-A1,Flame retardant metal-resin composite material ,Mitsubishi Chemical Corporation,"Kazuhiro Muraki, Eiji Yanai",2018-02-14,2020-03-05,2020-06-25,,https://patents.google.com/patent/US20200198299A1/en,
US-2020373729-A1,Optical module ,"Sumitomo Electric Industries, Ltd.","Yohei ENYA, Masato Furukawa",2018-02-16,2019-02-08,2020-11-26,,https://patents.google.com/patent/US20200373729A1/en,https://patentimages.storage.googleapis.com/60/01/f2/3733caa2dc0650/US20200373729A1-20201126-D00000.png
US-2019248440-A1,System and method for adjusting spring rate of a coil spring in a bike suspension ,"Carl Winefordner, Frank Hermansen","Carl Winefordner, Frank Hermansen",2018-02-12,2018-02-12,2019-08-15,,https://patents.google.com/patent/US20190248440A1/en,https://patentimages.storage.googleapis.com/eb/10/bb/8365746e0db26f/US20190248440A1-20190815-D00000.png
US-2020367734-A1,Imaging unit and endoscope ,Olympus Corporation,Toshiyuki Shimizu,2018-02-20,2020-08-14,2020-11-26,,https://patents.google.com/patent/US20200367734A1/en,https://patentimages.storage.googleapis.com/09/e5/8b/8c60945b4963c0/US20200367734A1-20201126-D00000.png
US-10933240-B2,Treatment of inflammation by selective DMV cholinergic neuron stimulation ,The Feinstein Institutes For Medical Research,"Adam M. Kressel, Valentin A. Pavlov, Sangeeta S. Chavan, Kevin J. Tracey",2018-02-12,2019-02-11,2021-03-02,2021-03-02,https://patents.google.com/patent/US10933240B2/en,https://patentimages.storage.googleapis.com/d2/cc/eb/2cff80ee5cd2bb/US10933240-20210302-D00000.png
US-2020368135-A1,Use of non-dissolved starch based particles ,Speximo Ab,"Malin Sjöö, Abdullah ALI, Jasmine BEDI SVENSSON",2018-02-02,2019-02-01,2020-11-26,,https://patents.google.com/patent/US20200368135A1/en,https://patentimages.storage.googleapis.com/7a/09/2a/3e9071e800347c/US20200368135A1-20201126-D00000.png
US-2021033547-A1,Apparatus and method for analysing and processing granular material ,Boomer Advanced Manufacturing Holdings Pty Ltd,"Jan Verboomen, Steven Verboomen",2018-02-07,2019-02-07,2021-02-04,,https://patents.google.com/patent/US20210033547A1/en,https://patentimages.storage.googleapis.com/b1/42/ee/cc337bf7f619c5/US20210033547A1-20210204-D00000.png
US-2021047216-A1,Methods and systems for treating liquids including contaminant molecules ,Bio Castle Water Technologies Ltd.,"Eyal KURZBAUM, Hadas Mamane, Ofir Menashe, Dror Avisar",2018-02-07,2019-02-07,2021-02-18,,https://patents.google.com/patent/US20210047216A1/en,https://patentimages.storage.googleapis.com/cd/01/88/6dacda8dffc05d/US20210047216A1-20210218-D00000.png
US-2021079272-A1,Method for producing articles coated with adhesive ,Basf Se,"Christoph Kiener, Lars HECKHOFF, Peter Preishuber-Pfluegl, Richard BOCIEK",2018-02-21,2019-02-15,2021-03-18,,https://patents.google.com/patent/US20210079272A1/en,
US-2021054428-A1,Transaminase mutant and application thereof ,"Asymchem Life Science (Tianjin) Co., Ltd","Hao Hong, Gage JAMES, Jiangping Lu, Xingfu XU, Yuxia CUI, Na Zhang, Xuewu DONG, Wenyan Yu, Xin Huang, Mingmin HAO, Yulei MA, Yibing CHENG, Jiadong ZHAO",2018-02-05,2018-02-05,2021-02-25,,https://patents.google.com/patent/US20210054428A1/en,
US-2021371710-A1,"Block Copolymer, Polymer Composition, Composition for Viscous Adhesive, Viscous Adhesive Composition, and Coupling Agent ",Asahi Kasei Kabushiki Kaisha,"Naoki Taniguchi, Ippei Kameda, Masato Yamada, Hitoshi Yamamoto",2018-02-09,2019-01-28,2021-12-02,,https://patents.google.com/patent/US20210371710A1/en,
US-2019250801-A1,Content size adjustment ,Lenovo (Singapore) Pte. Ltd.,"Russell Speight VanBlon, Ryan Charles Knudson, Roderick Echols",2018-02-13,2018-02-13,2019-08-15,,https://patents.google.com/patent/US20190250801A1/en,https://patentimages.storage.googleapis.com/d8/a7/c5/847228d9dfcc1c/US20190250801A1-20190815-D00000.png
US-2019252130-A1,Electrochemical device ,Tdk Corporation,"Hiroaki Hasegawa, Hidetake Itoh, Yoshihiko Ohashi, Yuji Yoshino, Kazunori Yoshikawa, Kiyonori Hinoki",2018-02-15,2019-02-01,2019-08-15,,https://patents.google.com/patent/US20190252130A1/en,https://patentimages.storage.googleapis.com/b6/a3/7d/7c65179c38548a/US20190252130A1-20190815-D00000.png
US-2019239846-A1,Deformable lung model apparatus ,"University Of Maryland, Baltimore","Amit Sawant, Maida Ranjbar, Pouya Sabouri, Carlo Repetto",2018-02-06,2019-02-06,2019-08-08,,https://patents.google.com/patent/US20190239846A1/en,https://patentimages.storage.googleapis.com/5f/32/0c/5e9dada7c31454/US20190239846A1-20190808-D00000.png
US-2021002603-A1,Processes for converting biomass into high-value products ,The Texas A&M University System,"Mark Holtzapple, Sagar Lonkar, Pratik Darvekar, Samarpita Roy, Cesar Granda, Trent Benefield, Jeremy Seidel, Victoria Ehlinger, Scott Wellington, Tyler Mann",2018-02-13,2019-02-13,2021-01-07,,https://patents.google.com/patent/US20210002603A1/en,https://patentimages.storage.googleapis.com/7c/5b/68/69a7b524b6ccce/US20210002603A1-20210107-D00000.png
US-2021052777-A1,Methods and compositions for treating and preventing diabetes ,"Technion Research & Development Foundation Limited, B. G. Negev Technologies And Applications Ltd., At Ben-Gurion University, Rambam Med-Tech Ltd.","Shulamit Levenberg, Eddy Karnieli, Eli Chaim LEWIS, Margarita BECKERMAN, Chava HAREL",2018-02-04,2019-02-04,2021-02-25,,https://patents.google.com/patent/US20210052777A1/en,https://patentimages.storage.googleapis.com/b8/54/33/ec7c6a8a2d5d35/US20210052777A1-20210225-D00000.png
US-2021054464-A1,Methods for subtyping of bladder cancer ,"Genecentric Therapeutics, Inc., The University Of North Carolina At Chapel Hill","Hawazin FARUKI, Greg MAYHEW, Myla LAI-GOLDMAN, Charles PEROU",2018-02-13,2019-02-13,2021-02-25,,https://patents.google.com/patent/US20210054464A1/en,https://patentimages.storage.googleapis.com/10/68/37/755b5145b3d9c0/US20210054464A1-20210225-D00000.png
US-11048827-B2,Protection systems for portable devices ,Valeo Cases Llc,Juan Fernandez,2018-02-15,2019-02-15,2021-06-29,2021-06-29,https://patents.google.com/patent/US11048827B2/en,https://patentimages.storage.googleapis.com/4c/f6/12/0aa700e2e14154/US11048827-20210629-D00000.png
US-10818086-B2,Augmented reality content characteristic adjustment ,Lenovo (Singapore) Pte. Ltd.,"Russell Speight VanBlon, Robert James Kapinos, Scott Wentao Li, Robert James Norton, JR.",2018-02-09,2018-02-09,2020-10-27,2020-10-27,https://patents.google.com/patent/US10818086B2/en,https://patentimages.storage.googleapis.com/1b/22/3a/d155ca82eb8933/US10818086-20201027-D00000.png
US-2019266742-A1,Entity location provision using an augmented reality system ,Lenovo (Singapore) Pte. Ltd.,"Nathan J. Peterson, Rod D. Waltermann, John Carl Mese, Russell Speight VanBlon",2018-02-26,2018-02-26,2019-08-29,,https://patents.google.com/patent/US20190266742A1/en,https://patentimages.storage.googleapis.com/85/a0/40/040d53976695ce/US20190266742A1-20190829-D00000.png
US-10930444-B2,Electrochemical device ,Tdk Corporation,"Hiroaki Hasegawa, Hidetake Itoh, Yoshihiko Ohashi, Yuji Yoshino, Kazunori Yoshikawa",2018-02-23,2019-02-12,2021-02-23,2021-02-23,https://patents.google.com/patent/US10930444B2/en,https://patentimages.storage.googleapis.com/78/7c/01/285025879378a8/US10930444-20210223-D00000.png
US-2019239808-A1,Electronic device ,"Samsung Display Co., Ltd.","Jae Ik Lim, Won Sang Park",2018-02-05,2018-10-05,2019-08-08,,https://patents.google.com/patent/US20190239808A1/en,https://patentimages.storage.googleapis.com/77/96/b3/b50e32077ec77c/US20190239808A1-20190808-D00000.png
US-10593102-B2,Three-dimensional display for smart home device ,"Disney Enterprises, Inc.","Eric C. Haseltine, Michael P. GOSLIN",2018-02-12,2018-02-12,2020-03-17,2020-03-17,https://patents.google.com/patent/US10593102B2/en,https://patentimages.storage.googleapis.com/78/e3/d5/90442e7cb10b1b/US10593102-20200317-D00000.png
US-2021087709-A1,Methods of screening antigen-binding molecules by normalizing for the concentration of antigen-binding molecule ,"Meso Scale Technologies, Llc.","Ka Y. KWONG, Ilia V. DAVYDOV",2018-02-23,2019-02-22,2021-03-25,,https://patents.google.com/patent/US20210087709A1/en,https://patentimages.storage.googleapis.com/8e/70/53/95ee94191301d3/US20210087709A1-20210325-D00001.png
US-2020399507-A1,Linerless Water-Activated Water-Based Emulsion ,Avery Dennison Corporation,"Dipak S. JADHAV, Parimal NAIK, Virendrasing J. PATIL, Dhananjay Patil",2018-02-13,2019-02-12,2020-12-24,,https://patents.google.com/patent/US20200399507A1/en,https://patentimages.storage.googleapis.com/a8/b0/c3/1c75aa0148cb73/US20200399507A1-20201224-D00000.png
US-2021040344-A1,"Conductive paste, cured product, conductive pattern, garment and stretchable paste ",Namics Corporation,Tomoyuki Takahashi,2018-02-08,2019-01-16,2021-02-11,,https://patents.google.com/patent/US20210040344A1/en,https://patentimages.storage.googleapis.com/67/ad/dc/0c872d04f43b69/US20210040344A1-20210211-D00000.png
US-2020385512-A1,"Epoxy resin, epoxy resin composition, epoxy resin cured product and method of producing epoxy resin cured product, composite material, insulating member, electronic appliance, structural material, and vehicle ","Hitachi Chemical Company, Ltd.","Kazumasa Fukuda, Yoshitaka Takezawa, Tomoko Higashiuchi, Naoki Maruyama, Shingo Tanaka",2018-02-22,2018-02-22,2020-12-10,,https://patents.google.com/patent/US20200385512A1/en,https://patentimages.storage.googleapis.com/ae/f8/0e/da58337f98e652/US20200385512A1-20201210-D00000.png
US-2020366056-A1,Semiconductor laser module ,"Furukawa Electric Co., Ltd.","Yusuke INABA, Maiko Ariga, Kazuki YAMAOKA",2018-02-14,2020-08-05,2020-11-19,,https://patents.google.com/patent/US20200366056A1/en,https://patentimages.storage.googleapis.com/67/1d/33/c2186d8acdd451/US20200366056A1-20201119-D00000.png
US-2019241706-A1,Polyphenylene sulfide polymers having improved melt-stability ,"Solvay Specialty Polymers Usa, Llc","Hong Chen, Peter Mushenheim, Lee CARVELL, Erik Nelson, Charles R. Hoppin",2018-02-06,2018-02-06,2019-08-08,,https://patents.google.com/patent/US20190241706A1/en,
US-2019248442-A1,System and method for adjusting spring rate of a coil spring in a bike suspension ,"Carl Winefordner, Frank Hermansen","Carl Winefordner, Frank Hermansen",2018-02-12,2019-01-24,2019-08-15,,https://patents.google.com/patent/US20190248442A1/en,https://patentimages.storage.googleapis.com/f5/f0/83/697417d3eeae65/US20190248442A1-20190815-D00000.png
