US-2020051734-A1,Coil module ,"Wits Co., Ltd.","Jae Sun Won, Hee Seung Kim, Soon Joung YIO, Dong Yeol Lee, Jae Hyuk Jang, Young Seung Roh",2018-08-10,2019-08-09,2020-02-13,,https://patents.google.com/patent/US20200051734A1/en,https://patentimages.storage.googleapis.com/40/f5/97/df3ec586f7491e/US20200051734A1-20200213-D00000.png
US-10801249-B2,Sealing tape roll of a sealing tape with interior barrier layers ,Iso-Chemie Gmbh,Martin Deiss,2018-08-07,2019-07-31,2020-10-13,2020-10-13,https://patents.google.com/patent/US10801249B2/en,https://patentimages.storage.googleapis.com/1c/49/fe/d24b534b20b14d/US10801249-20201013-D00000.png
US-2021198629-A1,Compositions and methods for increasing beiging of white adipose tissue ,"University Of Georgia Research Foundation, Inc.",Hang Yin,2018-08-20,2019-08-20,2021-07-01,,https://patents.google.com/patent/US20210198629A1/en,https://patentimages.storage.googleapis.com/a6/dc/a5/2087c52e1ce959/US20210198629A1-20210701-D00000.png
US-2020066354-A1,Error recovery of data in non-volatile memory during read ,International Business Machines Corporation,"Nikolas Ioannou, Charalampos Pozidis, Sasa Tomic, Nikolaos Papandreou, Roman A. Pletka, Aaron D. Fry, Timothy Fisher",2018-08-24,2018-08-24,2020-02-27,,https://patents.google.com/patent/US20200066354A1/en,https://patentimages.storage.googleapis.com/e4/c9/8f/d1199820cbaf8c/US20200066354A1-20200227-D00000.png
US-2021236657-A1,Nerve-specific fluorophore formulations for direct and systemic administration ,"Oregon Health & Science University, Oregon State University","Summer L. Gibbs, Connor W. Barth, Wathah G. Alani, Vidhiben Shah, Lei Wang",2018-08-06,2019-08-06,2021-08-05,,https://patents.google.com/patent/US20210236657A1/en,https://patentimages.storage.googleapis.com/f2/cc/83/0c2f15f05979fe/US20210236657A1-20210805-D00000.png
US-2020051309-A1,Graphics architecture including a neural network pipeline ,Intel Corporation,"Hugues Labbe, Darrel Palke, Sherine Abdelhak, Jill Boyce, Varghese George, Scott Janus, Adam Lake, Zhijun Lei, Zhengmin Li, Mike MacPherson, Carl Marshall, Selvakumar Panneer, Prasoonkumar Surti, Karthik Veeramani, Deepak Vembar, Vallabhajosyula Srinivasa Somayazulu",2018-08-10,2019-08-09,2020-02-13,,https://patents.google.com/patent/US20200051309A1/en,https://patentimages.storage.googleapis.com/4f/23/a6/f2d1a262127ed3/US20200051309A1-20200213-D00000.png
US-2020041710-A1,Electronic apparatus ,"K-Tronics (Suzhou) Technology Co., Ltd., Boe Technology Group Co., Ltd.","Qigui Rong, Liushuai Zhao",2018-08-02,2019-04-18,2020-02-06,,https://patents.google.com/patent/US20200041710A1/en,https://patentimages.storage.googleapis.com/85/cb/88/8efb5d9ee0dd20/US20200041710A1-20200206-D00000.png
US-2020068949-A1,Dual-tank electronic cigarette ,Fontem Holdings 1 B.V.,Dennis Rasmussen,2018-08-28,2018-08-28,2020-03-05,,https://patents.google.com/patent/US20200068949A1/en,https://patentimages.storage.googleapis.com/92/07/b1/dec3b0856cbb16/US20200068949A1-20200305-D00000.png
US-2020071056-A1,Repulpable container insulation products and methods of making and using same ,"Cellulose Material Solutions, LLC","Matthew Henderson, Kevin Chase",2018-08-28,2019-03-28,2020-03-05,,https://patents.google.com/patent/US20200071056A1/en,https://patentimages.storage.googleapis.com/e5/52/3f/f3d9529798f847/US20200071056A1-20200305-D00000.png
US-2020066264-A1,Intelligent hearing aid ,International Business Machines Corporation,"Shikhar KWATRA, Komminist Weldemariam, Sarbajit K. Rakshit, Paul Krystek",2018-08-21,2018-08-21,2020-02-27,,https://patents.google.com/patent/US20200066264A1/en,https://patentimages.storage.googleapis.com/5b/18/3a/c8689d85071071/US20200066264A1-20200227-D00000.png
US-2020046588-A1,Patient mobility garment for nurses ,Jeanne Margaret Arnold,Jeanne Margaret Arnold,2018-08-08,2019-08-06,2020-02-13,,https://patents.google.com/patent/US20200046588A1/en,https://patentimages.storage.googleapis.com/28/86/77/5f29845faa5ec0/US20200046588A1-20200213-D00000.png
US-2021297135-A1,"Method for transmitting or receiving channel state information for plurality of base stations in wireless communication system, and device therefor ",Lg Electronics Inc.,"Hyungtae Kim, Jiwon Kang, Jonghyun Park, Haewook Park",2018-08-08,2019-08-08,2021-09-23,,https://patents.google.com/patent/US20210297135A1/en,https://patentimages.storage.googleapis.com/29/22/70/89be29124a46cd/US20210297135A1-20210923-D00000.png
US-2020365868-A1,Device for charging and discharging secondary battery ,"Lg Chem, Ltd.","Jae-Hyoung SON, Chang-Bum Ahn, Ik-Soo CHAE",2018-08-09,2019-05-29,2020-11-19,,https://patents.google.com/patent/US20200365868A1/en,https://patentimages.storage.googleapis.com/f5/27/5d/afb6db9a603a72/US20200365868A1-20201119-D00000.png
US-2021319811-A1,Drive strength calibration for multi-level signaling ,"Micron Technology, Inc.","Peter Mayer, Wolfgang Anton Spirkl, Michael Dieter Richter, Martin Brox, Thomas Hein",2018-08-21,2021-04-27,2021-10-14,,https://patents.google.com/patent/US20210319811A1/en,https://patentimages.storage.googleapis.com/94/dc/33/428e07b83ee12e/US20210319811A1-20211014-D00000.png
US-2020059421-A1,Dynamic allocation of processing queues for control packets in software defined networks ,"Vmware, Inc.","Yong Wang, Eduard Serra Miralles, David James Leroy",2018-08-20,2018-08-20,2020-02-20,,https://patents.google.com/patent/US20200059421A1/en,https://patentimages.storage.googleapis.com/a9/87/28/34ec9f87864b57/US20200059421A1-20200220-D00000.png
US-2019043604-A1,Multi-level memory repurposing ,Intel Corporation,"Jim S. Baca, Joseph Tarango",2018-08-21,2018-08-21,2019-02-07,,https://patents.google.com/patent/US20190043604A1/en,https://patentimages.storage.googleapis.com/e4/b3/44/8180bc2e777eba/US20190043604A1-20190207-D00000.png
US-10742048-B2,"Wearable electronic device with a caseback having multiple, arc-shaped, ferrous, metal contacts ","Fossil Group, Inc.","Brad William Piercey, Ryan Griffin Geraghty, Sean E. Daley, Brad D. Brinson, Alexander J. Brown, Timothy Simeon Golnik",2018-08-02,2018-08-02,2020-08-11,2020-08-11,https://patents.google.com/patent/US10742048B2/en,https://patentimages.storage.googleapis.com/ad/5d/4f/97651a54951ebb/US10742048-20200811-D00000.png
US-11051200-B2,Method for performing channel estimation in wireless communication system and apparatus therefor ,Lg Electronics Inc.,"Hyunho Lee, Duckhyun BAE, Yunjung Yi, Inkwon Seo",2018-08-10,2020-06-17,2021-06-29,2021-06-29,https://patents.google.com/patent/US11051200B2/en,https://patentimages.storage.googleapis.com/69/b7/0d/eed8b453ea1a5b/US11051200-20210629-D00000.png
US-11172421-B2,Method and apparatus for cell reselection by ranking cells using PLMN offset in unlicensed frequency ,Lg Electronics Inc.,"Sangwon Kim, Youngdae Lee",2018-08-10,2019-08-09,2021-11-09,2021-11-09,https://patents.google.com/patent/US11172421B2/en,https://patentimages.storage.googleapis.com/6b/63/86/14b97550f85374/US11172421-20211109-D00000.png
US-2020042359-A1,Systems and methods for computing resources allocation for medical applications ,"Shanghai United Imaging Healthcare Co., Ltd.","Zhiguo Zhang, Chunshan YANG",2018-08-03,2018-12-30,2020-02-06,,https://patents.google.com/patent/US20200042359A1/en,https://patentimages.storage.googleapis.com/67/7e/08/f7c334ea69ca40/US20200042359A1-20200206-D00000.png
US-2021309057-A1,Tyre comprising a monitoring device ,Pirelli Tyre S.P.A.,"Cristiano Puppi, Ivan Gildo Boscaino, Andrea NATTA",2018-08-02,2019-07-25,2021-10-07,,https://patents.google.com/patent/US20210309057A1/en,https://patentimages.storage.googleapis.com/16/2f/7a/1526e7521b2526/US20210309057A1-20211007-D00000.png
US-2020039791-A1,Belt with layered load bearing elements ,Otis Elevator Company,Jun Ma,2018-08-06,2018-08-06,2020-02-06,,https://patents.google.com/patent/US20200039791A1/en,https://patentimages.storage.googleapis.com/a3/81/ab/43050c21da6f49/US20200039791A1-20200206-D00000.png
US-2021190234-A1,Coiled tubing system ,Paradigm Flow Services Limited,"Robert Bain, Hugh MacKenzie",2018-08-29,2019-08-28,2021-06-24,,https://patents.google.com/patent/US20210190234A1/en,https://patentimages.storage.googleapis.com/b0/be/8a/5c3d3f52327b18/US20210190234A1-20210624-D00000.png
US-2021316566-A1,Pen tip and writing tool equipped with the pen tip ,"Mitsubishi Pencil Company, Limited",Toshimi Kamitani,2018-08-07,2019-08-07,2021-10-14,,https://patents.google.com/patent/US20210316566A1/en,https://patentimages.storage.googleapis.com/c5/25/bb/a966443a4cc9e0/US20210316566A1-20211014-D00000.png
US-2020061606-A1,Microfluidic rotor device ,Zoetis Services Llc,"Greg Bennett, Warren Edward FARNAM, III",2018-08-24,2019-08-22,2020-02-27,,https://patents.google.com/patent/US20200061606A1/en,https://patentimages.storage.googleapis.com/28/3f/c7/5f11df9442a09a/US20200061606A1-20200227-D00000.png
US-2020048507-A1,All-Weather Pressure-Sensitive Adhesive ,Gcp Applied Technologies Inc.,"Md Nasim Hyder, Robert A. Wiercinski, Anandakumar Ranganathan, Jyoti Seth",2018-08-10,2019-08-09,2020-02-13,,https://patents.google.com/patent/US20200048507A1/en,https://patentimages.storage.googleapis.com/88/25/58/27a9dde8e09550/US20200048507A1-20200213-D00000.png
US-2020074785-A1,Triggering an event based on accumulating symbols over multiple reels in a gaming environment ,Igt,"Jeffrey Uss, Kimberly Rogers",2018-08-28,2018-08-28,2020-03-05,,https://patents.google.com/patent/US20200074785A1/en,https://patentimages.storage.googleapis.com/f5/32/29/57d3d6ba22fe2b/US20200074785A1-20200305-D00000.png
US-2020054869-A1,Microneedle array with active ingredient ,"Allergan, Inc.","Futian Liu, Xiaojie Yu, Lance E. Steward",2018-08-15,2019-08-15,2020-02-20,,https://patents.google.com/patent/US20200054869A1/en,https://patentimages.storage.googleapis.com/1d/08/34/9b20f5d349de69/US20200054869A1-20200220-D00000.png
US-2021310110-A1,Covetic materials ,"Lyten, Inc.","Michael W. Stowell, Bruce Lanning, Peter Todd Williams, Daniel Cook",2018-08-02,2021-04-27,2021-10-07,,https://patents.google.com/patent/US20210310110A1/en,https://patentimages.storage.googleapis.com/8b/fb/3a/7d512b24e311dc/US20210310110A1-20211007-D00000.png
US-2020062660-A1,Multi-step curing of green bodies ,"Solidia Technologies, Inc.",Ahmet Cuneyt Tas,2018-08-27,2019-08-27,2020-02-27,,https://patents.google.com/patent/US20200062660A1/en,https://patentimages.storage.googleapis.com/aa/14/d0/bcd583f36c13cb/US20200062660A1-20200227-D00000.png
US-2021299324-A1,"Implantable biomaterial, and method of manufacturing thereof ","National University Of Ireland, Galway","Elizabeth Sander, William Hickey, Robert Pendlebury, Faisal Sharif, Brendan Marrinan, Tony O'Halloran",2018-08-07,2019-08-07,2021-09-30,,https://patents.google.com/patent/US20210299324A1/en,https://patentimages.storage.googleapis.com/58/73/61/78b400b89f6175/US20210299324A1-20210930-D00001.png
US-2020047469-A1,"Weather-resistant composite floor and preparation method thereof, and artificial mineral board and preparation method thereof ","Zhejiang Tianzhen Bamboo & Wood Development Co., Ltd",Qinghua FANG,2018-08-13,2019-01-11,2020-02-13,,https://patents.google.com/patent/US20200047469A1/en,https://patentimages.storage.googleapis.com/4a/b5/72/8423243a7ad1c2/US20200047469A1-20200213-D00000.png
US-2020050122-A1,"Image recording composition, electrostatic image developing toner, and image forming method ","Konica Minolta, Inc.","Toyoko Shibata, Seijiro TAKAHASHI, Haruo Horiguchi",2018-08-10,2019-06-03,2020-02-13,,https://patents.google.com/patent/US20200050122A1/en,https://patentimages.storage.googleapis.com/51/32/eb/89c849580b1591/US20200050122A1-20200213-D00000.png
US-2021002524-A1,Substrate-Free Adhesive Tape ,"Lg Chem, Ltd.","Ki Seung Seo, Ji Hye Kim, Sang Hwan Kim, Jun Hyoung Park, Kyung Jun Yoon",2018-08-08,2019-08-06,2021-01-07,,https://patents.google.com/patent/US20210002524A1/en,https://patentimages.storage.googleapis.com/26/3d/15/72d977d737eb81/US20210002524A1-20210107-D00000.png
US-2021254085-A1,Methods and compositions for the modification of plants ,"Flagship Pioneering Innovations Vi, Llc","Maria Helena Christine VAN ROOIJEN, Hok Hei TAM, Maier Steve Avendaño AMADO, Barry Andrew Martin, Ignacio Martinez, Piotr Stanislaw KOWALSKI, Nataliya Vladimirovna Nukolova, Yajie Niu",2018-08-24,2019-08-24,2021-08-19,,https://patents.google.com/patent/US20210254085A1/en,https://patentimages.storage.googleapis.com/ae/b2/c7/a2a582afa24c70/US20210254085A1-20210819-D00000.png
US-10828513-B2,Ionizing-radiation beam monitoring system ,"Integrated Sensors, Llc",Peter S. Friedman,2018-08-06,2020-03-06,2020-11-10,2020-11-10,https://patents.google.com/patent/US10828513B2/en,https://patentimages.storage.googleapis.com/ed/99/cd/4d08a48018a7a9/US10828513-20201110-D00000.png
US-2020059062-A1,Systems and methods for end pumped laser mirror stack assemblies ,Honeywell International Inc.,"Teresa Marta, Lance Vrieze, Alan Bruce Touchberry",2018-08-17,2018-08-17,2020-02-20,,https://patents.google.com/patent/US20200059062A1/en,https://patentimages.storage.googleapis.com/77/7f/12/e85825ff36b459/US20200059062A1-20200220-D00000.png
US-2020062645-A1,High strength class c fly ash cementitious compositions with controllable setting ,The Catholic University Of America,"Weiliang Gong, Hui Xu, Werner Lutze, Ian L. Pegg",2018-08-22,2019-08-20,2020-02-27,,https://patents.google.com/patent/US20200062645A1/en,
US-10836952-B2,Oil recovery methods using carboxylated pyrolyzed date leaves ,King Fahd University Of Petroleum And Minerals,"Bashirul Haq, Abdul Aziz, Abbas Saeed Hakeem, Dhafer A. Al Shehri",2018-08-14,2019-08-14,2020-11-17,2020-11-17,https://patents.google.com/patent/US10836952B2/en,https://patentimages.storage.googleapis.com/8d/b5/68/9cb380010a6a01/US10836952-20201117-D00000.png
US-11003244-B2,System and method for real-time high-resolution eye-tracking ,University Of Rochester,"Michele Rucci, Ruei-Jr Wu, Zhetuo Zhao",2018-08-27,2019-08-26,2021-05-11,2021-05-11,https://patents.google.com/patent/US11003244B2/en,https://patentimages.storage.googleapis.com/90/2e/5c/6de3f264e877d9/US11003244-20210511-D00000.png
US-2021331994-A1,"Compound, composition containing the same, method for forming resist pattern and method for forming insulating film ","Mitsubishi Gas Chemical Company, Inc.","Takashi Sato, Masatoshi Echigo, Takashi Makinoshima",2018-08-24,2019-08-21,2021-10-28,,https://patents.google.com/patent/US20210331994A1/en,
US-2021175318-A1,Display device ,"Samsung Display Co., Ltd.","Soon Dong Kim, Jin Wook Yang",2018-08-08,2019-02-08,2021-06-10,,https://patents.google.com/patent/US20210175318A1/en,https://patentimages.storage.googleapis.com/e9/d2/5a/fcd6acf869e7a5/US20210175318A1-20210610-D00000.png
US-2021179507-A1,Process for biological ammonia production by nitrogen fixing cyanobacteria ,Grouponics Greenhouse Technology Ltd.,"Lior Hessel, Assaf SHEMESH",2018-08-29,2019-08-29,2021-06-17,,https://patents.google.com/patent/US20210179507A1/en,https://patentimages.storage.googleapis.com/16/9a/ab/198e4c5fef9aa3/US20210179507A1-20210617-D00000.png
US-2020241148-A1,Signal acquisition method and device ,Beijing University Of Posts And Telecommunications,"Zhongliang Deng, Buyun Jia, Jun Mo, Xinmei Bian, Haijun Jiang, Shiwei Fan",2018-08-20,2019-03-08,2020-07-30,,https://patents.google.com/patent/US20200241148A1/en,https://patentimages.storage.googleapis.com/5e/62/68/413ebaded910bb/US20200241148A1-20200730-D00000.png
US-2020071191-A1,Systems and methods for water reclamation ,Morningside Venture Investments Limited,Frank Schubert,2018-08-28,2018-08-28,2020-03-05,,https://patents.google.com/patent/US20200071191A1/en,https://patentimages.storage.googleapis.com/ea/76/db/e7eeb4d255a191/US20200071191A1-20200305-D00000.png
US-2020046265-A1,Real-time spike detection and identification ,Ctrl-Labs Corporation,"Patrick Kaifosh, Alexandre Barachant, Michael Isaac Mandel, Daniel Wetmore",2018-08-13,2019-08-13,2020-02-13,,https://patents.google.com/patent/US20200046265A1/en,https://patentimages.storage.googleapis.com/66/05/01/a26162f61cc615/US20200046265A1-20200213-D00000.png
US-10791607-B1,Configuring and controlling light emitters ,"Amazon Technologies, Inc.","John Modestine, Ryan David Hruska, Elliott Lemberger, Sang Min Park, Michael V. Recker",2018-08-17,2018-08-17,2020-09-29,2020-09-29,https://patents.google.com/patent/US10791607B1/en,https://patentimages.storage.googleapis.com/f7/b2/1e/8ea5d8b5f6aa87/US10791607-20200929-D00000.png
US-10536816-B1,Mobile device that creates a communication group based on the mobile device identifying people currently located at a particular location ,International Business Machines Corporation,"Jeremy R. Fox, Gregory J. Boss, Liam S. Harpur, Sarbajit K. Rakshit",2018-08-17,2018-08-17,2020-01-14,2020-01-14,https://patents.google.com/patent/US10536816B1/en,https://patentimages.storage.googleapis.com/6b/4a/2e/fff19b568e49ab/US10536816-20200114-D00000.png
US-10556615-B1,Center load steering rack support ,Justin Smith,Justin Smith,2018-08-24,2019-08-23,2020-02-11,2020-02-11,https://patents.google.com/patent/US10556615B1/en,https://patentimages.storage.googleapis.com/8b/89/f1/323859a5f080ba/US10556615-20200211-D00000.png
US-2020059049-A1,Connection Interface For A Panel And Support Structure ,David Lynn,David Lynn,2018-08-17,2018-08-17,2020-02-20,,https://patents.google.com/patent/US20200059049A1/en,https://patentimages.storage.googleapis.com/54/77/65/38fa30f8060f6c/US20200059049A1-20200220-D00000.png
US-2020061784-A1,Selectively adjustable torque indicating tool ,"Frank Hermansen, Carl Winefordner","Frank Hermansen, Carl Winefordner",2018-08-22,2018-08-22,2020-02-27,,https://patents.google.com/patent/US20200061784A1/en,https://patentimages.storage.googleapis.com/61/8d/71/c54ce0106d7f52/US20200061784A1-20200227-D00000.png
US-2020064797-A1,System and method for distributed device configuration and authorization ,Johnson Controls Technology Company,"Jeremy P. Hannon, Nicholas J. Schaf, Leyla Mousavi, Scott G. Ambelang, Xin Zhang",2018-08-23,2019-08-16,2020-02-27,,https://patents.google.com/patent/US20200064797A1/en,https://patentimages.storage.googleapis.com/4d/96/33/433e9a628eff44/US20200064797A1-20200227-D00000.png
US-2020075056-A1,"Method to log audio in a distributed, immutable transaction log for end-to-end verification and auditing ","Motorola Solutions, Inc","Yunhai Yang, Thomas J. Senese, George R. Economy",2018-08-28,2018-08-28,2020-03-05,,https://patents.google.com/patent/US20200075056A1/en,https://patentimages.storage.googleapis.com/db/65/b9/e893f3ab921462/US20200075056A1-20200305-D00000.png
US-2021314046-A1,Method for transmitting and receiving channel state information in wireless communication system and device therefor ,Lg Electronics Inc.,"Hyungtae Kim, Haewook Park, Jiwon Kang",2018-08-08,2019-08-08,2021-10-07,,https://patents.google.com/patent/US20210314046A1/en,https://patentimages.storage.googleapis.com/b0/7e/68/eaeab7fab7abea/US20210314046A1-20211007-D00000.png
US-2021341264-A1,Optical systems and devices for ballistic parameter measurements ,Sensormetrix,Anthony F. Starr,2018-08-06,2021-02-05,2021-11-04,,https://patents.google.com/patent/US20210341264A1/en,https://patentimages.storage.googleapis.com/00/d1/70/23ee3aff0c3b61/US20210341264A1-20211104-D00000.png
US-2021320774-A1,Method for performing uplink transmission in wireless communication system and apparatus therefor ,Lg Electronics Inc.,"Jonghyun Park, Jiwon Kang",2018-08-09,2019-08-09,2021-10-14,,https://patents.google.com/patent/US20210320774A1/en,https://patentimages.storage.googleapis.com/4e/60/fc/c8a226ca0c5f4c/US20210320774A1-20211014-D00000.png
US-2020061500-A1,Portable lubricant filtration tool and methods of use ,"Rocky Mountain Filtration Solutions, Inc.",Scott Lee Hohnstein,2018-08-21,2019-08-21,2020-02-27,,https://patents.google.com/patent/US20200061500A1/en,https://patentimages.storage.googleapis.com/69/de/42/fab9e73da52aa6/US20200061500A1-20200227-D00000.png
US-11099647-B2,User interface control of responsive devices ,"Pison Technology, Inc.","Dexter W. Ang, David O Cipoletta, Michael P. Kowalczyk",2018-08-05,2019-01-14,2021-08-24,2021-08-24,https://patents.google.com/patent/US11099647B2/en,https://patentimages.storage.googleapis.com/3b/38/79/ffcbb30979d79c/US11099647-20210824-D00000.png
US-2021348114-A1,Extracellular vesicles as biomarkers and therapeutics for neuromuscular disorders ,"University Of Delaware, Iowa State University Research Foundation, Inc.","Matthew B. Hudson, Joshua T. Selsby",2018-08-24,2019-08-23,2021-11-11,,https://patents.google.com/patent/US20210348114A1/en,https://patentimages.storage.googleapis.com/3a/9f/eb/79c606a2e8b168/US20210348114A1-20211111-D00000.png
US-2020046021-A1,Charge circuitry for an aerosol delivery device ,"Rai Strategic Holdings, Inc.",Rajesh Sur,2018-08-10,2018-08-10,2020-02-13,,https://patents.google.com/patent/US20200046021A1/en,https://patentimages.storage.googleapis.com/3c/ad/0d/be9310c6f8e527/US20200046021A1-20200213-D00000.png
US-2021324380-A1,Stem cell derived lineage barcoding ,"Cairn Biosciences, Inc.","M. Susana G. DE ABREU RIBEIRO, Catherine I. LACAYO, Mary J. C. LUDLAM, Salome Calado BOTELHO",2018-08-18,2019-08-16,2021-10-21,,https://patents.google.com/patent/US20210324380A1/en,https://patentimages.storage.googleapis.com/9b/aa/50/a55218c86bbc9a/US20210324380A1-20211021-D00000.png
US-11011016-B2,Systems and methods for providing gaming content synchronized with streaming video content ,Igt,Dwayne Nelson,2018-08-23,2018-08-23,2021-05-18,2021-05-18,https://patents.google.com/patent/US11011016B2/en,https://patentimages.storage.googleapis.com/3b/af/f7/de529be84430a5/US11011016-20210518-D00000.png
US-2020053464-A1,User interface for controlling audio zones ,Qualcomm Incorporated,Nils Gunther Peters,2018-08-08,2018-08-08,2020-02-13,,https://patents.google.com/patent/US20200053464A1/en,https://patentimages.storage.googleapis.com/a8/0c/f3/cf9a69d39a77e1/US20200053464A1-20200213-D00000.png
US-2020065545-A1,Biometric sensor and display device having same ,"Point Engineering Co., Ltd.","Bum Mo Ahn, Seung Ho Park, Sung Hyun BYUN",2018-08-22,2019-08-20,2020-02-27,,https://patents.google.com/patent/US20200065545A1/en,https://patentimages.storage.googleapis.com/22/21/2a/b71a304a3da9de/US20200065545A1-20200227-D00000.png
US-2021354992-A1,Production of fine grain magnesium oxide and fibrous amorphous silica from serpentinite mine tailings ,Mag One Operations Inc.,"Gillian HOLCROFT, Gervais Soucy, YuMei HAN, Denys Pinard, Jean-Marc Lalancette",2018-08-06,2019-08-06,2021-11-18,,https://patents.google.com/patent/US20210354992A1/en,https://patentimages.storage.googleapis.com/24/6b/5e/4a4427196c228e/US20210354992A1-20211118-D00000.png
US-2021317232-A1,Methods and compositions relating to anti-biotin antibodies ,Wayne State University,Jian-Ping Jin,2018-08-02,2019-08-02,2021-10-14,,https://patents.google.com/patent/US20210317232A1/en,https://patentimages.storage.googleapis.com/7b/7a/8c/e8f09ca85ed5b0/US20210317232A1-20211014-D00001.png
US-2020065056-A1,Intelligent exercise music synchronization ,International Business Machines Corporation,"Paul R. Bastide, Matthew E. Broomhall, Robert E. Loredo, Fang Lu",2018-08-22,2018-08-22,2020-02-27,,https://patents.google.com/patent/US20200065056A1/en,https://patentimages.storage.googleapis.com/85/6d/35/be42e4ec9db197/US20200065056A1-20200227-D00000.png
US-2020061714-A1,Bonding structure and method of manufacturing bonding structure ,Fujitsu Limited,"Shinichi Hirose, Daiyu Kondo",2018-08-21,2019-07-29,2020-02-27,,https://patents.google.com/patent/US20200061714A1/en,https://patentimages.storage.googleapis.com/7a/be/09/8cd7750ca6027a/US20200061714A1-20200227-D00000.png
US-2019042385-A1,Dynamic device-determined storage performance ,Intel Corporation,"Jason Casmira, Jawad Khan, David Minturn",2018-08-14,2018-08-14,2019-02-07,,https://patents.google.com/patent/US20190042385A1/en,https://patentimages.storage.googleapis.com/54/f6/35/b885490d459ff3/US20190042385A1-20190207-D00000.png
US-2021321953-A1,"System, method, and smartwatch for fall detection, prediction, and risk assessment ","Vitaltech Properties, Llc","Anjan PANNEER SELVAM, Peter Ianace",2018-08-24,2019-08-23,2021-10-21,,https://patents.google.com/patent/US20210321953A1/en,https://patentimages.storage.googleapis.com/4e/40/d9/59a14e9e725f9f/US20210321953A1-20211021-D00000.png
US-2020074318-A1,Inference engine acceleration for video analytics in computing environments ,Intel Corporation,Fan CHEN,2018-08-28,2018-08-28,2020-03-05,,https://patents.google.com/patent/US20200074318A1/en,https://patentimages.storage.googleapis.com/ab/1d/e0/12c5912ea3be62/US20200074318A1-20200305-D00000.png
US-2020159955-A1,Data Privacy Opt In/Out Solution ,"Cox Communications, Inc.","Len Barlik, William Bayless Bracker, Matthew Edwin Carothers, Donald W. Johnson, Michael J. Pacifico, Jemin Thakkar, Christian Ulf Welin",2018-08-03,2019-08-02,2020-05-21,,https://patents.google.com/patent/US20200159955A1/en,https://patentimages.storage.googleapis.com/90/e9/a6/4b9d098be0f4e7/US20200159955A1-20200521-D00000.png
US-2020052813-A1,Zero power (zp) channel state information reference signal (csi-rs) rate matching with slot aggregation ,Qualcomm Incorporated,"Seyedkianoush HOSSEINI, Alexandros Manolakos",2018-08-13,2019-08-05,2020-02-13,,https://patents.google.com/patent/US20200052813A1/en,https://patentimages.storage.googleapis.com/3d/98/3c/a0718f90ae6b07/US20200052813A1-20200213-D00000.png
US-2020396101-A1,Extensible mapping for vehicle system buses ,Google Llc,"Tomasz Pawel Wasilczyk, Yevgeniy Ruvinovich Karshenboym, Steve Paik, Scott Randolph",2018-08-21,2019-06-17,2020-12-17,,https://patents.google.com/patent/US20200396101A1/en,https://patentimages.storage.googleapis.com/db/4b/7d/c2754b045656b0/US20200396101A1-20201217-D00000.png
