US-2020255597-A1,"Poly(imide-amide) copolymer or its precursor, composition including same, composition for preparing same, article, method for preparing article, and display device including article ","Samsung Electronics Co., Ltd.","Ha Na Kim, Yoon Seok KO, Hyun Seok Choi, Ju Hyun Kim, Byunghee SOHN, Sungwon Choi",2019-02-11,2020-02-06,2020-08-13,,https://patents.google.com/patent/US20200255597A1/en,
US-10886562-B2,Acrylate polymers with dicarbonyl pendant groups as electrolytes for lithium ion batteries ,Robert Bosch Gmbh,"Malar Azagarsamy, Hany Basam Eitouni, Kulandaivelu Sivanandan, Scott Allen Mullin",2019-02-15,2019-02-15,2021-01-05,2021-01-05,https://patents.google.com/patent/US10886562B2/en,https://patentimages.storage.googleapis.com/6c/0a/02/a26e7a8639bd97/US10886562-20210105-D00000.png
US-2021380743-A1,"Ultraviolet-ray absorbing polymer, formation resin composition, and formed body ","Toyo Ink Sc Holdings Co., Ltd., Toyocolor Co., Ltd.","Akio HIMIZU, Keisuke Masuko, Joji Mikami, Takeshi NISHINAKA, Tomoyuki AOTANI, Kazunori Shigemori, Motoki Tanaka, Hiroyuki Hayashi",2019-02-20,2021-08-18,2021-12-09,,https://patents.google.com/patent/US20210380743A1/en,
US-2020262230-A1,Electrohydrodynamic printing of nanomaterials for flexible and stretchable electronics ,North Carolina State University,"Yong Zhu, Jingyan DONG, Zheng Cui, Yiwei Han",2019-02-18,2020-02-18,2020-08-20,,https://patents.google.com/patent/US20200262230A1/en,https://patentimages.storage.googleapis.com/69/79/ef/880467198720ad/US20200262230A1-20200820-D00000.png
US-2020266539-A1,Electronic Device Having Dual-Frequency Ultra-Wideband Antennas ,Apple Inc.,"Aaron J. Cooper, Amin Tayebi, Carlo Di Nallo, Zheyu Wang",2019-02-15,2019-02-15,2020-08-20,,https://patents.google.com/patent/US20200266539A1/en,https://patentimages.storage.googleapis.com/16/b1/9f/926a09ea51e52f/US20200266539A1-20200820-D00000.png
US-2020263032-A1,Thermoplastic urethane resin molded product ,"Nissin Chemical Industry Co., Ltd.",Kentaro Watanabe,2019-02-15,2020-02-14,2020-08-20,,https://patents.google.com/patent/US20200263032A1/en,
US-2020260840-A1,Method and apparatus for custom blend compositions ,Elc Management Llc,"Daniel Onategogo DEDEWO, David Edward Wilson",2019-02-15,2020-02-14,2020-08-20,,https://patents.google.com/patent/US20200260840A1/en,https://patentimages.storage.googleapis.com/de/2d/17/8b81040c917870/US20200260840A1-20200820-D00000.png
US-2020258492-A1,Noise suppression device ,"Pattison Sand Company, Llc",Howard W. Wood,2019-02-08,2019-02-08,2020-08-13,,https://patents.google.com/patent/US20200258492A1/en,https://patentimages.storage.googleapis.com/48/fe/45/7d753f925b598b/US20200258492A1-20200813-D00000.png
US-2020278059-A1,Convex male fitting and systems ,"Controls Southeast, Inc.","Brandon W. Forbes, Andrew Steven Pustay",2019-02-04,2020-02-03,2020-09-03,,https://patents.google.com/patent/US20200278059A1/en,https://patentimages.storage.googleapis.com/55/73/3b/5f455cd35b1558/US20200278059A1-20200903-D00001.png
US-2020255695-A1,"Moisture-curable adhesive tape and method for jacketing elongated items, especially leads ",Tesa Se,"Kerstin Klingeberg, Heike SIMONIS, Lars GULBRANDSEN, Marco Kupsky, Patrick Kerep",2019-02-08,2020-02-07,2020-08-13,,https://patents.google.com/patent/US20200255695A1/en,https://patentimages.storage.googleapis.com/d6/dd/b7/20402f1abaf0c3/US20200255695A1-20200813-D00000.png
US-2021361631-A1,N-methyl-D-aspartic Acid Receptor Modulators ,Emory University,"Dennis Liotta, Stephen F. Traynelis, David MENALDINO, Matthew EPPLIN",,2019-02-09,2021-11-25,,https://patents.google.com/patent/US20210361631A1/en,
US-10761344-B1,Systems and methods for generating a volumetric image and interacting with the volumetric image using a planar display ,"Toyota Motor Engineering & Manufacturing North America, Inc.","Paul Schmalenberg, Ercan M. Dede",2019-02-07,2019-02-07,2020-09-01,2020-09-01,https://patents.google.com/patent/US10761344B1/en,https://patentimages.storage.googleapis.com/4a/9b/d1/e969ecff636006/US10761344-20200901-D00000.png
US-2020252618-A1,Methods and systems for providing variable bitrate content ,"Comcast Cable Communications, Llc","Adam Eng, David Eng",2019-02-01,2019-02-01,2020-08-06,,https://patents.google.com/patent/US20200252618A1/en,https://patentimages.storage.googleapis.com/b0/4c/47/10bcd5790bb7f9/US20200252618A1-20200806-D00000.png
US-2021346241-A1,"Resin composition, film, multilayer body, and packaging bag for medical use ",Mcpp Innovation Llc,Yuji Kadowaki,2019-02-18,2021-07-21,2021-11-11,,https://patents.google.com/patent/US20210346241A1/en,
US-2020252229-A1,Systems and methods to facilitate downstream bandwidth utilization ,"Nathan Goichberg, Shaul Shulman","Nathan Goichberg, Shaul Shulman",2019-02-04,2019-02-04,2020-08-06,,https://patents.google.com/patent/US20200252229A1/en,https://patentimages.storage.googleapis.com/cc/37/ed/46b0a957f95bc8/US20200252229A1-20200806-D00000.png
US-2020247910-A1,Cellulose ester compositions derived from recycled plastic content syngas ,Eastman Chemical Company,"Ronald Buford Sheppard, William Lewis Trapp",2019-02-04,2020-02-03,2020-08-06,,https://patents.google.com/patent/US20200247910A1/en,https://patentimages.storage.googleapis.com/dc/f8/e6/5cd1d1262a9ad9/US20200247910A1-20200806-D00000.png
US-2020254472-A1,Liquid discharging device and wiping method ,"Ayaka TANAKA, Akira Izutani, Takumi ATAKE","Ayaka TANAKA, Akira Izutani, Takumi ATAKE",2019-02-08,2020-01-31,2020-08-13,,https://patents.google.com/patent/US20200254472A1/en,https://patentimages.storage.googleapis.com/c5/51/60/44479c357b03e3/US20200254472A1-20200813-D00000.png
US-2020256778-A1,Molecule detecting apparatus ,Kabushiki Kaisha Toshiba,"Honam Kwon, Ikuo Fujiwara, Kazuhiro Suzuki, Keita Sasaki, Yuki NOBUSA, Yasushi Shinjo",2019-02-07,2019-08-30,2020-08-13,,https://patents.google.com/patent/US20200256778A1/en,https://patentimages.storage.googleapis.com/06/c1/c1/713eba160c77e9/US20200256778A1-20200813-D00000.png
US-2020248988-A1,"Methods, systems, and apparatus for multi-use multi-vision modular invisible covers ",Alejandro Evaristo Perez,Alejandro Evaristo Perez,2019-02-05,2019-02-05,2020-08-06,,https://patents.google.com/patent/US20200248988A1/en,https://patentimages.storage.googleapis.com/db/51/07/ea457d4d26f16e/US20200248988A1-20200806-D00000.png
US-2020275547-A1,Magneto-optical trap method and apparatus ,"Nippon Telegraph And Telephone Corporation, Riken","Hiromitsu IMAI, Tomoyo AKATSUKA, Katsuya OGURI, Atsushi Ishizawa, Hideki Gotoh, Hidetoshi Katori, Masao TAKAMOTO",2019-02-26,2020-02-24,2020-08-27,,https://patents.google.com/patent/US20200275547A1/en,https://patentimages.storage.googleapis.com/c4/9d/8c/5fe598ca4058f9/US20200275547A1-20200827-D00000.png
US-2021161645-A1,"Composite scaffold for the repair, reconstruction, and regeneration of soft tissues ","Biorez, Inc.","Kevin A. Rocco, Bhavana Mohanraj, Jeffrey Ott, Justin Bendigo, Jacob Edward Komenda, Mark Theodore Aronson, Andrew James Carter",2019-02-07,2020-08-06,2021-06-03,,https://patents.google.com/patent/US20210161645A1/en,https://patentimages.storage.googleapis.com/7e/90/11/f8b262b22feabc/US20210161645A1-20210603-D00000.png
US-11008708-B2,Water resistant paper and solution for producing same and building structure employing same ,"Agriboard International, Llc","Eddie Caruthers, Frank Laster, Larry Ryan",2019-02-14,2019-02-14,2021-05-18,2021-05-18,https://patents.google.com/patent/US11008708B2/en,https://patentimages.storage.googleapis.com/fe/20/18/28e4d04d5281a1/US11008708-20210518-D00000.png
US-2020258208-A1,Machine learning assisted image analysis ,"Toyota Motor North America, Inc.","Charan Lota, Hazem Ahmed",2019-02-12,2019-02-12,2020-08-13,,https://patents.google.com/patent/US20200258208A1/en,https://patentimages.storage.googleapis.com/fd/77/68/d06123c7cb8568/US20200258208A1-20200813-D00000.png
US-2020259206-A1,Reduced llto particles with electronically insulating coatings ,"Seeo, Inc.","Katherine Joann Harry, Hany Basam Eitouni",2019-02-13,2019-02-13,2020-08-13,,https://patents.google.com/patent/US20200259206A1/en,https://patentimages.storage.googleapis.com/0b/80/5a/18db3ef704d137/US20200259206A1-20200813-D00000.png
US-2020266323-A1,Display device and method for fabricating the same ,"Samsung Display Co., Ltd.","Shogo Nishizaki, Jaehyun Kim, Seokhoon SEO, Soyoung LEE, Seungjae Lee",2019-02-15,2020-02-04,2020-08-20,,https://patents.google.com/patent/US20200266323A1/en,https://patentimages.storage.googleapis.com/de/5e/0f/92f4d9e5e699db/US20200266323A1-20200820-D00000.png
US-2020249157-A1,System and Method for Secondary Amplification of Refractive Detection Signals ,"Uchicago Argonne, Llc","Benjamin DIROLL, Xufeng Zhang, Supratik Guha",2019-02-01,2019-02-01,2020-08-06,,https://patents.google.com/patent/US20200249157A1/en,https://patentimages.storage.googleapis.com/c6/8b/5e/49c6a5e046afa1/US20200249157A1-20200806-D00000.png
US-2021214616-A1,"Liquid crystal alignment agent composition, method of preparing liquid crystal alignment film, and liquid crystal alignment film, liquid crystal display using the same ","Lg Chem, Ltd.","Soonho KWON, Hyeongseuk YUN, Jung Ho Jo, Sungjoon Min",2019-02-21,2020-01-22,2021-07-15,,https://patents.google.com/patent/US20210214616A1/en,
US-11013831-B2,Methods of synthesis for a thioketal diol ,"Warsaw Orthopedic, Inc.","Roger E. Harrington, Jerbrena C. Jacobs, Robert Doyle",2019-02-20,2019-02-20,2021-05-25,2021-05-25,https://patents.google.com/patent/US11013831B2/en,https://patentimages.storage.googleapis.com/cb/0c/20/c9543db6a526f0/US11013831-20210525-D00001.png
US-2020261805-A1,"System, method, and device for playing a drinking game ",Boris MERTENS,Boris MERTENS,2019-02-18,2020-02-18,2020-08-20,,https://patents.google.com/patent/US20200261805A1/en,https://patentimages.storage.googleapis.com/d5/23/70/3d394aacebddd5/US20200261805A1-20200820-D00000.png
US-10716208-B1,Wiring board ,"Shinko Electric Industries Co., Ltd.",Shuhei Momose,2019-02-06,2020-02-04,2020-07-14,2020-07-14,https://patents.google.com/patent/US10716208B1/en,https://patentimages.storage.googleapis.com/02/02/37/fc4bbfb44dac82/US10716208-20200714-D00000.png
US-2020253350-A1,Hair iron having a ceramic heater ,"Lexmark International, Inc.","Peter Alden Bayerle, Russell Edward Lucas, Jerry Wayne Smith",2019-02-08,2020-02-05,2020-08-13,,https://patents.google.com/patent/US20200253350A1/en,https://patentimages.storage.googleapis.com/3a/b9/8a/54e4a4cbc1480f/US20200253350A1-20200813-D00000.png
US-2021284590-A1,"Anthracene Compound for Host Material, Light-Emitting Device, Light-Emitting Apparatus, Electronic Apparatus, and Lighting Apparatus ","Semiconductor Energy Laboratory Co., Ltd.","Hiroki Suzuki, Satoshi Seo, Hiroshi Kadoma, Tsunenori Suzuki, Naoaki HASHIMOTO",2019-02-14,2020-02-05,2021-09-16,,https://patents.google.com/patent/US20210284590A1/en,https://patentimages.storage.googleapis.com/f8/c7/b0/b8558375ac5ff8/US20210284590A1-20210916-D00000.png
US-2020251717-A1,Anode layer and all sold state battery ,Toyota Jidosha Kabushiki Kaisha,"Hajime Hasegawa, Hideaki Nishimura, Shigenori Hama, Satoshi Mizutani, Masataka TOMITA",2019-02-05,2020-01-28,2020-08-06,,https://patents.google.com/patent/US20200251717A1/en,https://patentimages.storage.googleapis.com/16/96/50/7741aed1706f9e/US20200251717A1-20200806-D00000.png
US-11127976-B2,Sulfur-based polyester electrolytes for high voltage lithium ion batteries ,Robert Bosch Gmbh,"Malar Azagarsamy, Kulandaivelu Sivanandan, Hany Basam Eitouni, Jonathan P. Mailoa, Georgy Samsonidze, Boris Kozinsky, Mordechai Kornbluth",2019-02-26,2019-02-26,2021-09-21,2021-09-21,https://patents.google.com/patent/US11127976B2/en,https://patentimages.storage.googleapis.com/9b/b3/40/c2f12543f048e5/US11127976-20210921-D00001.png
US-2020255637-A1,Method and product of modifying vulcanized rubber ,"Georg Bohm, Xuesong YAN, Yu Sun, Li Jia","Georg Bohm, Xuesong YAN, Yu Sun, Li Jia",2019-02-12,2020-02-11,2020-08-13,,https://patents.google.com/patent/US20200255637A1/en,https://patentimages.storage.googleapis.com/d5/b0/48/6190ff5291f5ef/US20200255637A1-20200813-D00000.png
US-2020328357-A1,Organic solar cell and photodetector materials and devices ,The Regents Of The University Of California,"Jaewon Lee, Soe-Jin Ko, Jianfei Huang, Martin Seifrid, Hengbin Wang, Thuc-Quyen Nguyen, Guillermo C. Bazan",2019-02-15,2020-02-14,2020-10-15,,https://patents.google.com/patent/US20200328357A1/en,https://patentimages.storage.googleapis.com/a5/c1/f1/0c0d8b00491150/US20200328357A1-20201015-D00000.png
US-2020262341-A1,Vehicle interior lighting system ,Volvo Car Corporation,"Johan Anders Persson, Markus Lars Edvin Andersson",2019-02-14,2019-02-14,2020-08-20,,https://patents.google.com/patent/US20200262341A1/en,https://patentimages.storage.googleapis.com/f8/5b/5b/6bff8599886c81/US20200262341A1-20200820-D00000.png
US-2020262506-A1,Foldable Bicycle Frame ,Grzegorz Olech,Grzegorz Olech,2019-02-20,2020-02-18,2020-08-20,,https://patents.google.com/patent/US20200262506A1/en,https://patentimages.storage.googleapis.com/22/66/b6/abf0c8df859fa1/US20200262506A1-20200820-D00000.png
US-2021198810-A1,"Handheld/portable apparatus for the production of microfibers, submicron fibers and nanofibers ",The Board Of Regents Of The University Of Texas System,"Karen Lozano, Gregory Potter, Javier Alonzo Ortega",2019-02-20,2020-02-19,2021-07-01,,https://patents.google.com/patent/US20210198810A1/en,https://patentimages.storage.googleapis.com/80/96/f9/cffb2ae4d46860/US20210198810A1-20210701-D00000.png
US-2020270861-A1,Framed Acoustic Panel and Method of Manufacture ,"Certainteed Canada, Inc.","Luigi Bartella, Donald Deyoe",2019-02-22,2020-02-24,2020-08-27,,https://patents.google.com/patent/US20200270861A1/en,https://patentimages.storage.googleapis.com/3b/bc/db/f136c49e63fb87/US20200270861A1-20200827-D00000.png
US-2020264724-A1,Touchscreen stylus and display module interface ,Dell Products L.P.,"Aik Keong Ong, Hsu Feng Lee, Wei Wei Wilson Chua",2019-02-15,2019-02-15,2020-08-20,,https://patents.google.com/patent/US20200264724A1/en,https://patentimages.storage.googleapis.com/ff/8e/61/53e834dda6fa5e/US20200264724A1-20200820-D00000.png
US-2021356407-A1,Micro scale image capture system ,"Seddi, Inc.","Carlos ALIAGA, Raúl ALCAIN, Carlos HERAS, Iñigo SALINAS, Sergio SUJA, Elena GARCÉS, Jorge LÓPEZ",2019-02-22,2021-07-30,2021-11-18,,https://patents.google.com/patent/US20210356407A1/en,https://patentimages.storage.googleapis.com/72/9c/65/0f50d119df537c/US20210356407A1-20211118-D00000.png
US-2020271331-A1,Removable fin heat exchanger systems and methods ,Johnson Controls Technology Company,Zhiwei Huang,2019-02-21,2019-03-01,2020-08-27,,https://patents.google.com/patent/US20200271331A1/en,https://patentimages.storage.googleapis.com/bb/7d/d6/12b3d2b1dabc0b/US20200271331A1-20200827-D00000.png
US-2020265643-A1,Selective Presentation of Augmented Reality Objects ,"At&T Intellectual Property I, L.P.","Robert Koch, Ari Craine",2019-02-18,2019-02-18,2020-08-20,,https://patents.google.com/patent/US20200265643A1/en,https://patentimages.storage.googleapis.com/ba/17/43/1e1114f9e888ca/US20200265643A1-20200820-D00000.png
US-2020254133-A1,System and Method for Air Purification and Sterilization ,Nathan Carr,Nathan Carr,2019-02-11,2020-02-11,2020-08-13,,https://patents.google.com/patent/US20200254133A1/en,https://patentimages.storage.googleapis.com/54/65/ed/f8c7d6c7409133/US20200254133A1-20200813-D00000.png
US-2020253312-A1,Cranial protection apparatus ,John Malheiro,John Malheiro,2019-02-13,2020-02-10,2020-08-13,,https://patents.google.com/patent/US20200253312A1/en,https://patentimages.storage.googleapis.com/79/14/d0/82a444e65468b0/US20200253312A1-20200813-D00000.png
US-2020250989-A1,Vehicles as traffic control devices ,"Toyota Research Institute, Inc.",Matthew Amacker,2019-02-04,2019-02-04,2020-08-06,,https://patents.google.com/patent/US20200250989A1/en,https://patentimages.storage.googleapis.com/f9/b4/6c/3de804a9ffba48/US20200250989A1-20200806-D00000.png
US-2020245717-A1,Footwear article for walking ,"Fuerst Group, Inc.","Ciro Fusco, Dewayne Dale, Michael Leoniak",2019-02-06,2020-02-06,2020-08-06,,https://patents.google.com/patent/US20200245717A1/en,https://patentimages.storage.googleapis.com/4b/75/31/65ea154ee05d87/US20200245717A1-20200806-D00000.png
US-10961829-B2,Fallback bearing protection system ,"Halliburton Energy Services, Inc.","Wesley John Nowitzki, Jason Eugene Hill, Thomas Gottschalk",2019-02-14,2019-05-29,2021-03-30,2021-03-30,https://patents.google.com/patent/US10961829B2/en,https://patentimages.storage.googleapis.com/2d/4c/17/9d486a783d1ebd/US10961829-20210330-D00000.png
US-11188027-B2,"Systems, devices, and methods for side lobe control in holograms ",Google Llc,Robin W. Tsen,,2019-02-14,2021-11-30,2021-11-30,https://patents.google.com/patent/US11188027B2/en,https://patentimages.storage.googleapis.com/ea/0e/2e/66b4939500ca2b/US11188027-20211130-D00000.png
US-2020274483-A1,Magnetic Coupling Frame PV Module with Battery and Method of Using the Same ,"Impower Energy, Inc.","Roland T. Sanglap, Matthew C. Noonan",2019-02-21,2020-02-21,2020-08-27,,https://patents.google.com/patent/US20200274483A1/en,https://patentimages.storage.googleapis.com/f8/ac/f4/471208b815146d/US20200274483A1-20200827-D00000.png
US-2020265335-A1,Method and a system for context based clustering of object ,Wipro Limited,"Manjunath Ramachandra Iyer, Rameshwar Pratap, Boby Chaitanya Villari",2019-02-15,2019-03-30,2020-08-20,,https://patents.google.com/patent/US20200265335A1/en,https://patentimages.storage.googleapis.com/b1/0e/c5/d0074fdbcc6930/US20200265335A1-20200820-D00000.png
US-2020406068-A1,Landar emergency evacuation system for high-rise abodes ,Valentine Egbejimba,Valentine Egbejimba,2019-02-20,2019-02-20,2020-12-31,,https://patents.google.com/patent/US20200406068A1/en,https://patentimages.storage.googleapis.com/d7/24/32/cc18a0e6956ad1/US20200406068A1-20201231-D00000.png
US-2020245615-A1,Shelf-stable antimicrobial compositions ,Randall Andrew PILON,Faraz AHMADPOUR,2019-02-06,2019-02-06,2020-08-06,,https://patents.google.com/patent/US20200245615A1/en,https://patentimages.storage.googleapis.com/bd/f0/0f/859e918c0ce69b/US20200245615A1-20200806-D00001.png
US-2020247877-A1,Recombinant Hemoglobins and Methods of Preparation and Use Thereof ,Cheer Global Limited,"Sui Yi Kwok, Norman Fung Man WAI, Shan Yu, Terence Shau Yin WAI",2019-02-01,2020-01-31,2020-08-06,,https://patents.google.com/patent/US20200247877A1/en,https://patentimages.storage.googleapis.com/27/0e/10/8f6823ce73375e/US20200247877A1-20200806-D00000.png
US-2020266554-A1,Electrical connection bails and stirrup systems and methods including same ,Tyco Electronics Canada Ulc,"Barry James Johnson, Jonathan Guppy",2019-02-20,2020-02-11,2020-08-20,,https://patents.google.com/patent/US20200266554A1/en,https://patentimages.storage.googleapis.com/8a/1e/bb/b7f4cc4cab2e28/US20200266554A1-20200820-D00000.png
US-2020247941-A1,Thermosetting foams having improved insulating value ,Honeywell International Inc.,"Bin Yu, Ryan Hulse",2019-02-01,2020-01-31,2020-08-06,,https://patents.google.com/patent/US20200247941A1/en,https://patentimages.storage.googleapis.com/b9/96/09/7cf572d9af3be9/US20200247941A1-20200806-D00001.png
US-2021218018-A1,"Cathode active material, method of preparing the same, and lithium secondary battery including cathode including the same ","Sm Lab Co.,Ltd.","Min Ho Seo, Ji Young Kim",2019-02-18,2019-12-26,2021-07-15,,https://patents.google.com/patent/US20210218018A1/en,https://patentimages.storage.googleapis.com/7b/f8/9b/fcfaba7668259f/US20210218018A1-20210715-D00000.png
US-2021076785-A1,Lock fastener ,"Nitta Mold Corporation, Kasai Kogyo Co., Ltd.",Takumi Moro,2019-02-25,2020-02-18,2021-03-18,,https://patents.google.com/patent/US20210076785A1/en,https://patentimages.storage.googleapis.com/3f/a1/a0/eb62be3dc94daf/US20210076785A1-20210318-D00000.png
US-2021242459-A1,"Cathode active material, method of preparing the same, and lithium secondary battery including cathode including the same ","Sm Lab Co.,Ltd.","Min Ho Seo, Ji Young Kim",2019-02-18,2019-12-26,2021-08-05,,https://patents.google.com/patent/US20210242459A1/en,https://patentimages.storage.googleapis.com/9f/9e/0f/9137d70aeec0b1/US20210242459A1-20210805-D00000.png
US-2021344041-A1,Battery ,"Panasonic Intellectual Property Management Co., Ltd.","Akira Kawase, Kouji Nishida, Yasutaka Tsutsui",2019-02-15,2021-07-14,2021-11-04,,https://patents.google.com/patent/US20210344041A1/en,https://patentimages.storage.googleapis.com/01/81/70/f7ef2739168c45/US20210344041A1-20211104-D00000.png
US-2021379603-A1,Open cell or reticulated foam having 3-dimensional open-network structure made of a hydrophobic material for selective separation of mineral particles ,Cidra Corporate Services Llc,"Paul J. Rothman, Mark R. Fernald, Francis DIDDEN, Christian V. O'Keefe, Douglas H. Adamson, Paul DOLAN, Timothy J. Bailey, Michael Stephen Ryan, Weiguo Huang, Kevin Rodney Lassila, Michael D. Coppola, Allison K. Greene",,2019-02-07,2021-12-09,,https://patents.google.com/patent/US20210379603A1/en,https://patentimages.storage.googleapis.com/22/86/95/2fb0dc21fe2e45/US20210379603A1-20211209-D00000.png
US-2020249963-A1,Hybrid interactivity in javascript webpage user interfaces ,"Walmart Apollo, Llc",Roger Yeh,2019-02-01,2019-02-01,2020-08-06,,https://patents.google.com/patent/US20200249963A1/en,https://patentimages.storage.googleapis.com/b3/97/2b/ed4468b2a5073e/US20200249963A1-20200806-D00000.png
US-10656343-B1,Fiber optic visual fault locator ,"Cotsworks, Llc",Ken Applebaum,2019-02-04,2019-02-04,2020-05-19,2020-05-19,https://patents.google.com/patent/US10656343B1/en,https://patentimages.storage.googleapis.com/00/3c/48/b3afc7ad5d5fa8/US10656343-20200519-D00000.png
US-2020247604-A1,Mixture Cartridge For Use In A Shaving Lather Generating And Dispensing System ,Carl F. Cwiok,Carl F. Cwiok,2019-02-06,2019-02-06,2020-08-06,,https://patents.google.com/patent/US20200247604A1/en,https://patentimages.storage.googleapis.com/df/91/1a/0a0c67548ddedc/US20200247604A1-20200806-D00000.png
US-11055491-B2,Geographic location specific models for information extraction and knowledge discovery ,International Business Machines Corporation,"Md Faisal Mahbub Chowdhury, Michael Robert Glass",2019-02-05,2019-02-05,2021-07-06,2021-07-06,https://patents.google.com/patent/US11055491B2/en,https://patentimages.storage.googleapis.com/a4/d4/82/5b5ec8d404093b/US11055491-20210706-D00000.png
US-2020268622-A1,Ultra-stable water-in-oil high internal phase emulsions featuring interfacial and biphasic network stabilization ,Cornell University,"Alireza Abbaspourrad, Michelle Lee",2019-02-26,2020-02-25,2020-08-27,,https://patents.google.com/patent/US20200268622A1/en,https://patentimages.storage.googleapis.com/e8/77/d8/44d43ec683031b/US20200268622A1-20200827-D00000.png
US-2020263429-A1,Continuous nonwoven polyester fiber and fiberglass thread hybrid mat ,"Tamko Building Products, Inc.","James Gregory Powell, Chris Freeborg, Jonathan Marta, Kyle Davis",2019-02-20,2020-02-20,2020-08-20,,https://patents.google.com/patent/US20200263429A1/en,https://patentimages.storage.googleapis.com/90/2b/75/47010362105971/US20200263429A1-20200820-D00000.png
US-10879754-B2,Axial flux motor having an insulated rotor ,GM Global Technology Operations LLC,"Jian Yao, Chengwu Duan",2019-02-02,2019-05-30,2020-12-29,2020-12-29,https://patents.google.com/patent/US10879754B2/en,https://patentimages.storage.googleapis.com/f8/d7/98/1f14633604b3bf/US10879754-20201229-D00000.png
US-2020272260-A1,Touch panel ,Tpk Advanced Solutions Inc.,"Yu Zhang, Ho-Chien Wu, Ho-Hsun Chi, Liang-Zhen Xu",2019-02-25,2020-02-25,2020-08-27,,https://patents.google.com/patent/US20200272260A1/en,https://patentimages.storage.googleapis.com/28/d6/16/1ae22ab5ac8b72/US20200272260A1-20200827-D00000.png
US-2020261099-A1,Side loading ratchet to stop arterial bleeding during combat truma and the like ,Armr Systems Llc,"Yegor Podgorsky, Chibueze Joseph Ihenacho, Andrew Stephens",2019-02-14,2020-02-14,2020-08-20,,https://patents.google.com/patent/US20200261099A1/en,https://patentimages.storage.googleapis.com/be/3d/92/d4c35d0ca50fa4/US20200261099A1-20200820-D00000.png
US-2020247640-A1,Devices for cable management ,Commscope Technologies Llc,"Marcus J. Ash, Syed B. Abbas, Jose A.T. Babello, Brian Spinks, Michael R. Schaefer, Bhavin Kadakia",2019-02-01,2020-01-30,2020-08-06,,https://patents.google.com/patent/US20200247640A1/en,https://patentimages.storage.googleapis.com/11/e1/2d/77f1b30cb1b39a/US20200247640A1-20200806-D00000.png
US-2020248007-A1,Erosion and Corrosion Resistant Overlay Coating Systems for Protection of Metal Components ,"Mark W Perpall, Irina Belov","Mark W Perpall, Irina Belov",2019-02-01,2020-01-30,2020-08-06,,https://patents.google.com/patent/US20200248007A1/en,https://patentimages.storage.googleapis.com/84/c5/16/eb3094a4a69457/US20200248007A1-20200806-D00000.png
US-10961955-B2,Air intake apparatus for internal combustion engine ,Aisin Seiki Kabushiki Kaisha,"Masato Ishii, Tomohiro Yamaguchi, Hideto Yano",2019-02-01,2019-11-25,2021-03-30,2021-03-30,https://patents.google.com/patent/US10961955B2/en,https://patentimages.storage.googleapis.com/9f/7c/eb/1cf01d1d35c611/US10961955-20210330-D00000.png
US-2019165503-A1,Connector with relaxation mechanism for latch ,Intel Corporation,"Phil Geng, Xiang Li, George Vergis, Mani Prakash",2019-02-01,2019-02-01,2019-05-30,,https://patents.google.com/patent/US20190165503A1/en,https://patentimages.storage.googleapis.com/f6/ed/17/5ef4eb58e49057/US20190165503A1-20190530-D00000.png
US-2020245828-A1,Toilet Seal ,Aristo Crapital LLC,William Bahn,2019-02-01,2019-02-01,2020-08-06,,https://patents.google.com/patent/US20200245828A1/en,https://patentimages.storage.googleapis.com/3f/81/10/9d4232b667c430/US20200245828A1-20200806-D00000.png
