US-2020215801-A1,Multi-laminate plastic carrier plate and method for the production thereof ,Akzenta Paneele + Profile Gmbh,"Hans-Jürgen Hannig, Felix HÜLLENKREMER",2018-08-14,2019-08-13,2020-07-09,,https://patents.google.com/patent/US20200215801A1/en,https://patentimages.storage.googleapis.com/d0/d8/96/256cc33e9607bd/US20200215801A1-20200709-D00000.png
US-2021381690-A1,Industrial chimney for wet stack operation provided with an internal lining system ,Hadek Protective Systems B.V.,"Bastiaan VAN DER WOUDE, Albert DE KREIJ",2018-08-08,2019-08-06,2021-12-09,,https://patents.google.com/patent/US20210381690A1/en,https://patentimages.storage.googleapis.com/64/11/42/a5d8aa8eac9b9a/US20210381690A1-20211209-D00000.png
US-2020290323-A1,Decorative panel having a multi-laminate plastic carrier plate and method for the production thereof ,Akzenta Paneele + Profile Gmbh,"Hans-Jürgen Hannig, Felix HÜLLENKREMER",2018-08-14,2019-08-13,2020-09-17,,https://patents.google.com/patent/US20200290323A1/en,https://patentimages.storage.googleapis.com/cc/2f/56/74b9e1d7388447/US20200290323A1-20200917-D00000.png
US-2021161707-A1,Dispenser for precise extraction of a semi-solid product ,Azura Ophthalmics Ltd.,"Yair Alster, Omer Rafaeli, Hadas Sarig RAPAPORT, Eitan SHARIFF",2018-08-10,2021-02-09,2021-06-03,,https://patents.google.com/patent/US20210161707A1/en,https://patentimages.storage.googleapis.com/f7/b9/58/1efc03ad322f93/US20210161707A1-20210603-D00000.png
US-2021317320-A1,Methods of making polymers and metal-polymer composites ,Cirrus Materials Science Limited,"Margaret Mary Hyland, Fengqian Zhang, Chuong Luu Nguyen",2018-08-16,2019-08-16,2021-10-14,,https://patents.google.com/patent/US20210317320A1/en,https://patentimages.storage.googleapis.com/ee/e2/8e/5c436b9e766056/US20210317320A1-20211014-D00001.png
US-2020280090-A1,Secondary battery charging/discharging device ,"Lg Chem, Ltd.","Jae-Hyoung SON, Chang-Bum Ahn",2018-08-09,2019-05-24,2020-09-03,,https://patents.google.com/patent/US20200280090A1/en,https://patentimages.storage.googleapis.com/c8/09/7b/97bd09af45fbe2/US20200280090A1-20200903-D00000.png
US-2021320821-A1,Method for performing channel estimation in wireless communication system and apparatus therefor ,Lg Electronics Inc.,"Hyunho Lee, Duckhyun BAE, Yunjung Yi, Inkwon Seo",2018-08-10,2019-08-12,2021-10-14,,https://patents.google.com/patent/US20210320821A1/en,https://patentimages.storage.googleapis.com/38/b2/52/8cb7adc79ca0e5/US20210320821A1-20211014-D00000.png
US-2021344883-A1,Color conversion element ,"Panasonic Intellectual Property Management Co., Ltd.","Takanori Aketa, Yosuke Honda, Takashi Kishida, Toru Hirano",2018-08-28,2019-07-23,2021-11-04,,https://patents.google.com/patent/US20210344883A1/en,https://patentimages.storage.googleapis.com/39/08/1d/7893da0eee1bd3/US20210344883A1-20211104-D00000.png
US-2020062571-A1,Alcohol concentrate filling systems and methods of use thereof ,Bedford Systems Llc,"Jure Lukac, Stanko Zver, Justin Robbins, Peter Edwards, Peter Gosselin",2018-08-24,2019-08-23,2020-02-27,,https://patents.google.com/patent/US20200062571A1/en,https://patentimages.storage.googleapis.com/eb/16/83/b5962967a826af/US20200062571A1-20200227-D00000.png
US-2021314997-A1,"Method for monitoring scheduling information in wireless communication system, and device using method ",Lg Electronics Inc.,"Inkwon Seo, Daesung Hwang, Yunjung Yi",2018-08-10,2019-08-09,2021-10-07,,https://patents.google.com/patent/US20210314997A1/en,https://patentimages.storage.googleapis.com/0f/b8/e8/8b6a98927456c2/US20210314997A1-20211007-D00000.png
US-10371832-B1,Theranostic imaging with CZT gamma cameras ,"Kromek Group, PLC","James William Hugg, Ian Radley",2018-08-29,2018-08-29,2019-08-06,2019-08-06,https://patents.google.com/patent/US10371832B1/en,https://patentimages.storage.googleapis.com/4b/7c/06/d984b2887aea81/US10371832-20190806-D00000.png
US-2020059844-A1,Method and apparatus for triggering transmission carrier reselection procedure due to high congestion level in wireless communication system ,Lg Electronics Inc.,"Youngdae Lee, Taehun Kim, Jongwoo Hong",2018-08-16,2019-08-14,2020-02-20,,https://patents.google.com/patent/US20200059844A1/en,https://patentimages.storage.googleapis.com/6b/c3/77/c006d9a1182f65/US20200059844A1-20200220-D00000.png
US-2020060529-A1,Tip part for a vision device ,Ambu A/S,"Morten Sørensen, Thomas Bachgaard Jensen, Morten Jacobsen",2018-08-24,2019-08-23,2020-02-27,,https://patents.google.com/patent/US20200060529A1/en,https://patentimages.storage.googleapis.com/9d/03/73/15d92cc01ea351/US20200060529A1-20200227-D00000.png
US-2021308102-A1,Compositions and methods for treatment of presbyopia ,Seinda Pharmaceutical Guangzhou Corporation,"Hui Ouyang, Min Xia",2018-08-08,2019-08-08,2021-10-07,,https://patents.google.com/patent/US20210308102A1/en,https://patentimages.storage.googleapis.com/83/66/87/a91fb67166830c/US20210308102A1-20211007-D00000.png
US-2020063691-A1,Multi-degree of freedom acoustic panel ,"Rohr, Inc.",Teresa Kruckenberg,2018-08-22,2018-08-22,2020-02-27,,https://patents.google.com/patent/US20200063691A1/en,https://patentimages.storage.googleapis.com/23/a4/68/c8ad964bc05ef8/US20200063691A1-20200227-D00000.png
US-2020061957-A1,Microtextured substrates and laminates comprising printing and packages made from the same ,The Procter & Gamble Company,"John Daniel Algers, John Andrew Strasemeier, Sarah Beth Gross",2018-08-24,2019-08-23,2020-02-27,,https://patents.google.com/patent/US20200061957A1/en,https://patentimages.storage.googleapis.com/6b/ad/d1/bc260b82dfdc9b/US20200061957A1-20200227-D00000.png
US-10383225-B1,Interposer with offset-stacked traces ,Seagate Technology Llc,"Michael J. Peterson, Michael R. Fabry, Sean M. Horgan",2018-08-10,2018-08-10,2019-08-13,2019-08-13,https://patents.google.com/patent/US10383225B1/en,https://patentimages.storage.googleapis.com/29/04/f9/98dbf15000a522/US10383225-20190813-D00000.png
US-2021238644-A1,Cell culture strategies for modulating protein glycosylation ,"Genentech, Inc.","Inn Huam Yuk, Patrick Daniel AHYOW, Anh Thuy NGUYEN DANG, Melissa Siu-Lan MUN, Kristen Leigh DOUGLAS, Robert David KISS",2018-08-10,2021-02-10,2021-08-05,,https://patents.google.com/patent/US20210238644A1/en,https://patentimages.storage.googleapis.com/6a/51/d6/06fbb696c5fc8f/US20210238644A1-20210805-D00001.png
US-2020067064-A1,Transferable electrode tip for resistance welding an anode tab to the casing of an electrochemical cell ,Greatbatch Ltd.,"Xiangyang Dai, Kenneth L. Grubb",2018-08-24,2019-08-26,2020-02-27,,https://patents.google.com/patent/US20200067064A1/en,https://patentimages.storage.googleapis.com/da/86/97/e02b69806a1652/US20200067064A1-20200227-D00000.png
US-2021028122-A1,EMI Shielding for Flip Chip Package with Exposed Die Backside ,STATS ChipPAC Pte. Ltd.,"Dong Won Son, ByeongHoon Kim, Sung Ho Choi, Sung Jae Lim, Jong Ho Shin, SungWon Cho, Changoh Kim, KyoungHee Park",2018-08-10,2020-10-12,2021-01-28,,https://patents.google.com/patent/US20210028122A1/en,https://patentimages.storage.googleapis.com/c4/04/3d/09446f46a1c3d2/US20210028122A1-20210128-D00000.png
US-2020062895-A1,Aromatic polyesters from biosuccinic acid ,"University Of Florida Research Foundation, Incorporated","Stephen Albert MILLER, Ha Thi Hoang NGUYEN, Gabriel Nicholas SHORT",2018-08-21,2019-08-21,2020-02-27,,https://patents.google.com/patent/US20200062895A1/en,https://patentimages.storage.googleapis.com/dc/41/26/4ed4a029228381/US20200062895A1-20200227-D00000.png
US-2021324286-A1,"Sliding material composition, sliding molded article, and sliding member ",Riken Technos Corporation,Yoshiyuki Sekine,2018-08-07,2019-08-06,2021-10-21,,https://patents.google.com/patent/US20210324286A1/en,
US-2021313865-A1,Electrical machine having a plastic layer as a phase separator ,Siemens Aktiengeselischaft,"Klaus Büttner, Tobias Katzenberger, Bastian Plochmann, Matthias Warmuth",2018-08-03,2019-07-24,2021-10-07,,https://patents.google.com/patent/US20210313865A1/en,https://patentimages.storage.googleapis.com/a2/0e/5d/29e50abb3f1242/US20210313865A1-20211007-D00000.png
US-2021353721-A1,Methods and compositions relating to inhibiting cardiovascular calcification via annexin a1 ,"The Brigham And Women's Hospital, Inc.","Elena Aikawa, Maximillian ROGERS, Masanori Aikawa",2018-08-07,2019-08-07,2021-11-18,,https://patents.google.com/patent/US20210353721A1/en,https://patentimages.storage.googleapis.com/2a/53/99/0f498382f8ab9f/US20210353721A1-20211118-D00000.png
US-2021299985-A1,"Preform, composite structure and panel, and methods of forming same ",Fast Build Systems Pty Ltd,"Paul George DeOliveira, Alan Stephen Jones",2018-08-08,2019-08-01,2021-09-30,,https://patents.google.com/patent/US20210299985A1/en,https://patentimages.storage.googleapis.com/fa/c9/5e/2bbb7ca1eb3bac/US20210299985A1-20210930-D00000.png
US-2020061709-A1,Porous Tools and Methods of Making the Same ,General Electric Company,"Nolan Leander Cousineau, Nathan Carl Sizemore",2018-08-22,2018-08-22,2020-02-27,,https://patents.google.com/patent/US20200061709A1/en,https://patentimages.storage.googleapis.com/99/ff/d3/70f5f65baceb63/US20200061709A1-20200227-D00000.png
US-2021282725-A1,NEAR 2Pi COMPTON CAMERA FOR MEDICAL IMAGING ,"Siemens Medical Solutions Usa, Inc.","Miesher Rodrigues, Ronald E. Malmin",2018-08-07,2018-08-07,2021-09-16,,https://patents.google.com/patent/US20210282725A1/en,https://patentimages.storage.googleapis.com/6c/45/bd/2a313db94c5793/US20210282725A1-20210916-D00000.png
US-10891925-B2,Stringed instrument enhanced with sympathetic strings ,David Cody Warner,David Cody Warner,2018-08-25,2020-08-03,2021-01-12,2021-01-12,https://patents.google.com/patent/US10891925B2/en,https://patentimages.storage.googleapis.com/8c/94/91/be1bddcac161bf/US10891925-20210112-D00000.png
US-2021290189-A1,Compton camera with segmented detection modules ,"Siemens Medical Solutions Usa, Inc.","Alexander Hans Vija, Miesher Rodrigues, James Frank Caruba",2018-08-07,2018-08-07,2021-09-23,,https://patents.google.com/patent/US20210290189A1/en,https://patentimages.storage.googleapis.com/31/ca/6d/f1ff96e323a8c8/US20210290189A1-20210923-D00000.png
US-2021140444-A1,Screw systems ,"Percheron Power, LLC","Jerry L. Straalsund, Sharon D. Atkin, Nicholas Z. Hertelendy",2018-08-02,2020-11-25,2021-05-13,,https://patents.google.com/patent/US20210140444A1/en,https://patentimages.storage.googleapis.com/b9/eb/54/af404e5d76816b/US20210140444A1-20210513-D00000.png
US-2021262440-A1,Wind turbine propeller regulator to produce uninterrupted electricity and longer bearing life ,"Samuel Messinger, Hisham A. Abdel-aal","Samuel Messinger, Hisham A. Abdel-aal",2018-08-25,2021-04-10,2021-08-26,,https://patents.google.com/patent/US20210262440A1/en,https://patentimages.storage.googleapis.com/4c/32/c0/b69809d52fadeb/US20210262440A1-20210826-D00000.png
US-2021290196-A1,Adaptive compton camera for medical imaging ,"Siemens Medical Solutions Usa, Inc.",Miesher Rodrigues,2018-08-07,2018-08-07,2021-09-23,,https://patents.google.com/patent/US20210290196A1/en,https://patentimages.storage.googleapis.com/1f/4c/a5/9b0d9e12a7064c/US20210290196A1-20210923-D00000.png
US-2020054189-A1,Status indicator and lighting assembly for an appliance door ,"Haier Us Appliance Solutions, Inc.","Bradley Duane Ford, Jr., Justin Tyler Brown",2018-08-20,2018-08-20,2020-02-20,,https://patents.google.com/patent/US20200054189A1/en,https://patentimages.storage.googleapis.com/f8/1e/00/6d5a522b11e057/US20200054189A1-20200220-D00000.png
US-2020054188-A1,Status indicator and lighting assembly for an appliance door ,"Haier Us Appliance Solutions, Inc.","Bradley Duane Ford, Jr.",2018-08-20,2018-08-20,2020-02-20,,https://patents.google.com/patent/US20200054188A1/en,https://patentimages.storage.googleapis.com/a5/ea/ff/db0ff2f52ad6f1/US20200054188A1-20200220-D00000.png
US-2021301800-A1,Device and method for relocating water ,"Ocean-Based Climate Solutions, Inc.",Philip Kithil,2018-08-17,2019-08-13,2021-09-30,,https://patents.google.com/patent/US20210301800A1/en,https://patentimages.storage.googleapis.com/bb/47/af/034c0f2c87b35a/US20210301800A1-20210930-D00000.png
US-2020044304-A1,Connect rv mount ,"Wilson Electronics, Llc","Aaron Jay Hamilton, Brooks Stephen Ruhman",2018-08-01,2019-08-01,2020-02-06,,https://patents.google.com/patent/US20200044304A1/en,https://patentimages.storage.googleapis.com/d7/d8/b1/257f7bec8046e2/US20200044304A1-20200206-D00000.png
US-2021311324-A1,Device and method for creating an aperture diaphragm in an intraocular lens ,Rowiak Gmbh,"Holger Lubatschowski, Georg Gerten",2018-08-01,2019-07-30,2021-10-07,,https://patents.google.com/patent/US20210311324A1/en,https://patentimages.storage.googleapis.com/e0/e7/b6/d418d35db51c48/US20210311324A1-20211007-D00000.png
US-2020052461-A1,Light emitting assembly and method thereof ,Bae Systems Information And Electronic Systems Integration Inc.,"David B. Belley, Erik J. Spahr",2018-08-13,2018-08-13,2020-02-13,,https://patents.google.com/patent/US20200052461A1/en,https://patentimages.storage.googleapis.com/12/de/d3/fea793860aaa07/US20200052461A1-20200213-D00000.png
US-2020037515-A1,"Expandable, configurable, disassemblable structure for creating barriers or enclosures for landscaping.... ",Amy Ziffer,Amy Ziffer,2018-08-03,2019-06-29,2020-02-06,,https://patents.google.com/patent/US20200037515A1/en,https://patentimages.storage.googleapis.com/03/00/a9/46f00e4e2b3900/US20200037515A1-20200206-D00000.png
US-2021322912-A1,Use of clean and dry gas for particle removal and assembly therefor ,"Rapid Micro Biosystems, Inc.","Rich Higgins, Ken FLATON",2018-08-29,2019-08-29,2021-10-21,,https://patents.google.com/patent/US20210322912A1/en,https://patentimages.storage.googleapis.com/06/ed/d2/5320cf45f81a76/US20210322912A1-20211021-D00000.png
US-2021315774-A1,Disposable port device for connecting a functional unit to a flexible wall of a disposable container and method of manufacturing a disposable port device ,Sartorius Stedim Biotech Gmbh,"Isabelle Gay, Thomas Regen, Marek Hoehse",2018-08-22,2019-08-14,2021-10-14,,https://patents.google.com/patent/US20210315774A1/en,https://patentimages.storage.googleapis.com/36/b6/c4/f12aeeaa1921d7/US20210315774A1-20211014-D00000.png
US-10444385-B1,Shieldless detector with one-dimensional directionality ,David Edward Newman,David Edward Newman,2018-08-01,2019-06-04,2019-10-15,2019-10-15,https://patents.google.com/patent/US10444385B1/en,https://patentimages.storage.googleapis.com/71/5c/b0/d83b930e75493e/US10444385-20191015-D00000.png
US-2020060662-A1,Methods and devices for gaseous sample collection and storage ,"Ghassan S. Kassab, Klaus Ley","Ghassan S. Kassab, Klaus Ley",2018-08-25,2019-08-26,2020-02-27,,https://patents.google.com/patent/US20200060662A1/en,https://patentimages.storage.googleapis.com/7e/47/5a/3f4f98ab11b9fe/US20200060662A1-20200227-D00000.png
US-2020055264-A1,Tooling Device And Method For Producing A Planar Structural Component For An Aircraft ,Airbus Operations Gmbh,Dimitri Orlov,2018-08-16,2019-08-07,2020-02-20,,https://patents.google.com/patent/US20200055264A1/en,https://patentimages.storage.googleapis.com/69/32/6b/4063977071192a/US20200055264A1-20200220-D00000.png
US-2020053865-A1,"Use of metal-core printed circuit board (pcb) for generation of ultra-narrow, high-current pulse driver ","Lasertel, Inc.","Eric Paul RUBEN, Jean Michel Maillard, Prabhu Thiagarajan",2018-08-13,2019-08-13,2020-02-13,,https://patents.google.com/patent/US20200053865A1/en,https://patentimages.storage.googleapis.com/bc/bf/d8/7dd0861de32355/US20200053865A1-20200213-D00000.png
US-2020058988-A1,High frequency antenna carrier in vehicle roof cross member ,Ficosa North America Corporation,Bassel ELSHAAR,2018-08-16,2019-08-14,2020-02-20,,https://patents.google.com/patent/US20200058988A1/en,https://patentimages.storage.googleapis.com/07/39/26/e94d66b3faa451/US20200058988A1-20200220-D00000.png
US-2020070630-A1,Frameless window regulator rail with over-molded functional edge ,Magna Closures Inc.,"Raymond Edward Fortin, Michael Bayley",2018-08-28,2019-08-27,2020-03-05,,https://patents.google.com/patent/US20200070630A1/en,https://patentimages.storage.googleapis.com/f8/b2/31/1c03a3ac5ff08e/US20200070630A1-20200305-D00000.png
US-2021287864-A1,Switching Device ,Tdk Electronics Ag,"Frank Werner, Torsten Klinger",2018-08-28,2019-08-16,2021-09-16,,https://patents.google.com/patent/US20210287864A1/en,https://patentimages.storage.googleapis.com/7e/4c/4b/94daed7cc05561/US20210287864A1-20210916-D00000.png
US-11078155-B2,Crystalline tranilast salts and their pharmaceutical use ,Nuformix Technologies Limited,"Joanne Holland, Christopher Frampton",2018-08-14,2019-08-14,2021-08-03,2021-08-03,https://patents.google.com/patent/US11078155B2/en,https://patentimages.storage.googleapis.com/58/77/ad/f5320218872aa3/US11078155-20210803-D00001.png
US-2020061939-A1,Flexible Mandrel for Forming Composite Structures ,The Boeing Company,"Michael A. Lee, Jennifer Sue Noel, John Dempsey Morris",2018-08-22,2018-08-22,2020-02-27,,https://patents.google.com/patent/US20200061939A1/en,https://patentimages.storage.googleapis.com/e6/f6/5c/65c41a63783f9f/US20200061939A1-20200227-D00000.png
US-2021323866-A1,Heat generating compositions ,Axis Innovation Pty Ltd,"Philip Anthony Scardigno, Stylianos Steven Pehlivanides",2018-08-02,2019-08-01,2021-10-21,,https://patents.google.com/patent/US20210323866A1/en,https://patentimages.storage.googleapis.com/ad/6a/bc/31037a26a52580/US20210323866A1-20211021-D00000.png
US-10599575-B2,Media manager cache with integrated drift buffer ,"Micron Technology, Inc.","Ashay Narsale, Robert M. Walker",2018-08-09,2018-08-09,2020-03-24,2020-03-24,https://patents.google.com/patent/US10599575B2/en,https://patentimages.storage.googleapis.com/9c/99/53/8c50713e452d4d/US10599575-20200324-D00000.png
US-11094182-B2,Using sensors to detect movement of light fixtures ,Signify Holding B.V.,"Jonathan Andrew Whitten, Satinderjeet Kaur, Stephen Paul Kotz, Christopher J. Harris",2018-08-02,2019-08-01,2021-08-17,2021-08-17,https://patents.google.com/patent/US11094182B2/en,https://patentimages.storage.googleapis.com/1e/10/0a/f77b26bbafc6ad/US11094182-20210817-D00000.png
US-2020063757-A1,Compact compressor intake system and method ,General Electric Company,"Alan Eskandar, Valery Ivanovich Ponyavin, Hua Zhang, Christopher Conrad Frese",2018-08-24,2018-08-24,2020-02-27,,https://patents.google.com/patent/US20200063757A1/en,https://patentimages.storage.googleapis.com/dc/2a/0a/4ea9a3f773250c/US20200063757A1-20200227-D00000.png
US-2021176699-A1,Information transmission method and apparatus ,"Huawei Technologies Co., Ltd.","Zhenni Feng, Wenqi SUN, Wei Tan",2018-08-22,2021-02-19,2021-06-10,,https://patents.google.com/patent/US20210176699A1/en,https://patentimages.storage.googleapis.com/8a/af/49/273dbe9a5d10a5/US20210176699A1-20210610-D00000.png
US-2021168809-A1,"Communication method, device, and apparatus ","Huawei Technologies Co., Ltd.","Hao Sun, Lixia Xue",2018-08-10,2021-02-09,2021-06-03,,https://patents.google.com/patent/US20210168809A1/en,https://patentimages.storage.googleapis.com/5d/dc/6c/3a74bf0719f0d0/US20210168809A1-20210603-D00000.png
US-2021244796-A1,"Compositions in the form of an injectable aqueous solution comprising amylin an amylin receptor agonist or an amylin analog, at least one ionic species and an amphoiphilic compounds containing hydriphobic radicals ",Adocia,Emmanuel DAUTY,2018-08-03,2019-08-03,2021-08-12,,https://patents.google.com/patent/US20210244796A1/en,https://patentimages.storage.googleapis.com/3a/25/1f/bf8996dc5d2a7b/US20210244796A1-20210812-D00000.png
US-2021190477-A1,Method and apparatus for plain bearing crush height measurement ,Wärtsilä Finland Oy,"Janne LEPPÄKANGAS, Pasi Halla-aho, Jaakko ISTOLAHTI, Jukka-Pekka VESALA",2018-08-21,2018-08-21,2021-06-24,,https://patents.google.com/patent/US20210190477A1/en,https://patentimages.storage.googleapis.com/a8/d4/d6/d83aaeea3a49ce/US20210190477A1-20210624-D00000.png
US-2020260842-A1,Portable pouch with detachable harness for carrying and storing of bags and goods. ,Yuriy Prytchak,Yuriy Prytchak,2018-08-07,2018-08-07,2020-08-20,,https://patents.google.com/patent/US20200260842A1/en,https://patentimages.storage.googleapis.com/b0/91/70/acd3dd7bfc89f4/US20200260842A1-20200820-D00000.png
US-10627182-B2,Shooting sticks device ,Outdoor Gear Solutions Inc.,"Steven C. Holmberg, Randal P. Stuart, Stephen W. Cass",2018-08-14,2019-08-14,2020-04-21,2020-04-21,https://patents.google.com/patent/US10627182B2/en,https://patentimages.storage.googleapis.com/aa/2e/5a/eceb9eb379882b/US10627182-20200421-D00000.png
US-2020347962-A1,Structural Fastener ,"Mag Daddy, LLC","Michael Walter Smith, Daniel James Dickinson",2018-08-20,2020-05-16,2020-11-05,,https://patents.google.com/patent/US20200347962A1/en,https://patentimages.storage.googleapis.com/15/f5/42/145c56dfe345c1/US20200347962A1-20201105-D00000.png
US-2020063494-A1,Ladder leveler ,Derryll Mark Brudzinski,Derryll Mark Brudzinski,2018-08-21,2019-03-13,2020-02-27,,https://patents.google.com/patent/US20200063494A1/en,https://patentimages.storage.googleapis.com/d7/fb/45/29721aa6b646f3/US20200063494A1-20200227-D00000.png
US-2021266025-A1,Data communication transceiver assembly and method for integration into entrance ports for underground enclosures ,3M Innovative Properties Company,"Ernesto M. Rodriguez, Steven E. Turch",2018-08-22,2019-08-06,2021-08-26,,https://patents.google.com/patent/US20210266025A1/en,https://patentimages.storage.googleapis.com/f3/6f/68/bae9c358436446/US20210266025A1-20210826-D00000.png
US-10660326-B2,Universal steady rest system ,Steven D. LeBire,Steven D. LeBire,2018-08-14,2019-08-14,2020-05-26,2020-05-26,https://patents.google.com/patent/US10660326B2/en,https://patentimages.storage.googleapis.com/df/7f/2d/0266b8d3bd4729/US10660326-20200526-D00000.png
US-11195274-B2,Systems and methods for analysis of tissue images ,Nucleai Ltd,"Avi VEIDMAN, Lotan CHOREV",,2018-08-02,2021-12-07,2021-12-07,https://patents.google.com/patent/US11195274B2/en,https://patentimages.storage.googleapis.com/41/a2/69/901bd0f46e4fea/US11195274-20211207-D00000.png
US-2020067183-A1,Broadband dual-polarized microstrip antenna using a fr4-based element having low cross-polarization and flat broadside gain and method therefor ,"Benchmark Electronics, Inc.",Arkajyoti Chang,2018-08-22,2019-09-19,2020-02-27,,https://patents.google.com/patent/US20200067183A1/en,https://patentimages.storage.googleapis.com/cf/2a/83/82556d250a4187/US20200067183A1-20200227-D00000.png
US-10919784-B2,Iron-based desalination ,Badwater Alchemy Holdings LLC,William J. Walker,2018-08-17,2019-08-09,2021-02-16,2021-02-16,https://patents.google.com/patent/US10919784B2/en,https://patentimages.storage.googleapis.com/d4/5f/da/70596fb27d24e3/US10919784-20210216-D00000.png
US-2020066626-A1,"Pocket structures, materials, and methods for integrated circuit package supports ",Intel Corporation,"Jason M. Gamba, David Unruh, Adrian Kemal Bayraktaroglu, Thomas S. Heaton",2018-08-21,2018-08-21,2020-02-27,,https://patents.google.com/patent/US20200066626A1/en,https://patentimages.storage.googleapis.com/57/96/d8/a976be8167f6b8/US20200066626A1-20200227-D00000.png
US-2021310473-A1,Heat-Driven Pumping System ,Economad Solutions Ltd,Peter MCKAY,2018-08-10,2019-08-09,2021-10-07,,https://patents.google.com/patent/US20210310473A1/en,https://patentimages.storage.googleapis.com/f7/ef/e3/476027c75f3c01/US20210310473A1-20211007-D00000.png
US-2020063439-A1,Prefabricated Tile Strip ,"New Age Surfaces, LLC",Mark Domanico,2018-08-23,2019-08-23,2020-02-27,,https://patents.google.com/patent/US20200063439A1/en,https://patentimages.storage.googleapis.com/cb/c3/91/b3cb3d845d77df/US20200063439A1-20200227-D00000.png
US-2020066659-A1,Wirebond and leadframe magnetic inductors ,Intel Corporation,"William J. Lambert, Omkar Karhade, Martin Rodriguez, Gregorio R. Murtagian",2018-08-21,2018-08-21,2020-02-27,,https://patents.google.com/patent/US20200066659A1/en,https://patentimages.storage.googleapis.com/1f/f7/7b/a3a18bed62a1a4/US20200066659A1-20200227-D00000.png
US-2021315537-A1,Calibration object for an x-ray system ,3Shape A/S,Bo ESBECH,2018-08-23,2019-08-23,2021-10-14,,https://patents.google.com/patent/US20210315537A1/en,https://patentimages.storage.googleapis.com/28/ad/b3/a9c05e20a96680/US20210315537A1-20211014-D00000.png
US-10917314-B1,Distributed health management using peer leases ,"Amazon Technologies, Inc.",Rakesh Narayan Iyer,2018-08-08,2018-08-08,2021-02-09,2021-02-09,https://patents.google.com/patent/US10917314B1/en,https://patentimages.storage.googleapis.com/2f/49/68/8e278ba3d3802c/US10917314-20210209-D00000.png
US-2020062408-A1,De-icing systems ,"De-Ice Technologies, Inc.","Alexandru Bratianu-Badea, Ruben Toubiana, Christopher Buenrostro, Sean David Kropp",2018-08-27,2019-08-27,2020-02-27,,https://patents.google.com/patent/US20200062408A1/en,https://patentimages.storage.googleapis.com/5b/07/2e/8acaa3750321e4/US20200062408A1-20200227-D00000.png
US-10597881-B1,Wall system ,"Rafael Huguet, Sr., Rafael Huguet, Jr.","Rafael Huguet, Sr., Rafael Huguet, Jr.",2018-08-02,2019-07-09,2020-03-24,2020-03-24,https://patents.google.com/patent/US10597881B1/en,https://patentimages.storage.googleapis.com/75/31/fb/6c418fa24035c2/US10597881-20200324-D00000.png
US-2021302508-A1,Magnetic sensor module ,Metrasens Limited,Mark Nicholas Keene,2018-08-01,2019-08-01,2021-09-30,,https://patents.google.com/patent/US20210302508A1/en,https://patentimages.storage.googleapis.com/6e/28/52/093af0c7b48b91/US20210302508A1-20210930-D00000.png
US-2021313673-A1,Structure at least partially transparent to radio frequency signals ,Bae Systems Plc,Ashley Lloyd Wade,2018-08-16,2019-08-14,2021-10-07,,https://patents.google.com/patent/US20210313673A1/en,https://patentimages.storage.googleapis.com/52/e3/08/28b519f564bf21/US20210313673A1-20211007-D00000.png
