US-2020139322-A1,Storage Drum Assembly ,Stephen CAIN,Stephen CAIN,2018-08-03,2020-01-08,2020-05-07,,https://patents.google.com/patent/US20200139322A1/en,https://patentimages.storage.googleapis.com/a6/7f/72/c7f3a661c3744f/US20200139322A1-20200507-D00000.png
US-2021252456-A1,Nitrogen oxide storage catalyst ,Umicore Ag & Co. Kg,"Anke Woerz, Ruediger Hoyer, Benjamin Betz",2018-08-28,2019-08-22,2021-08-19,,https://patents.google.com/patent/US20210252456A1/en,https://patentimages.storage.googleapis.com/23/40/03/840be65743d238/US20210252456A1-20210819-D00001.png
US-2021172908-A1,Eddy current flaw detection device and eddy current flaw detection method ,Toshiba Energy Systems & Solutions Corporation,"Noriyasu KOBAYASHI, Jun Semboshi, Megumi AKIMOTO, Masaru Ukai",2018-08-06,2021-01-25,2021-06-10,,https://patents.google.com/patent/US20210172908A1/en,https://patentimages.storage.googleapis.com/96/b7/0f/90417a680fb73b/US20210172908A1-20210610-D00000.png
US-11046848-B2,Heat-curable resin composition for semiconductor encapsulation and semiconductor device ,"Shin-Etsu Chemical Co., Ltd.","Yoshihiro Tsutsumi, Naoyuki KUSHIHARA, Yuki Kudo, Norifumi Kawamura, Yoshihira Hamamoto",2018-08-10,2019-07-26,2021-06-29,2021-06-29,https://patents.google.com/patent/US11046848B2/en,
US-2020075930-A1,Cathode and lithium battery including the same ,"Samsung Electronics Co., Ltd., Samsung Sdi Co., Ltd.","Youngsoo Kim, Younggyoon RYU, Jaegu Yoon, Seungyeon Lee",2018-08-28,2019-08-07,2020-03-05,,https://patents.google.com/patent/US20200075930A1/en,https://patentimages.storage.googleapis.com/64/91/2d/3212a3ae6523a2/US20200075930A1-20200305-D00000.png
US-2020056139-A1,Detection of nuclease edited sequences in automated modules and instruments ,"Inscripta, Inc.","Andrew Garst, Michael Graige, Richard Fox, Eileen Spindler, Amy Hiddessen, Phillip Belgrader, Don Masquelier, Bruce Chabansky",2018-08-14,2019-08-08,2020-02-20,,https://patents.google.com/patent/US20200056139A1/en,https://patentimages.storage.googleapis.com/88/34/cb/f347aed1babb32/US20200056139A1-20200220-D00000.png
US-2020040229-A1,Adhesive composition comprising metal nanoparticles ,Xerox Corporation,"Sarah J. VELLA, Guiqin Song, Chad Steven SMITHSON, Kurt Halfyard",2018-08-02,2019-02-15,2020-02-06,,https://patents.google.com/patent/US20200040229A1/en,https://patentimages.storage.googleapis.com/4a/f8/4e/ab2e04affe8b29/US20200040229A1-20200206-D00000.png
US-11069838-B2,Light-emitting device with light-emitting element mounted on supporting member and display apparatus ,"Rohm Co, Ltd.",Sosuke Murata,2018-08-09,2019-07-31,2021-07-20,2021-07-20,https://patents.google.com/patent/US11069838B2/en,https://patentimages.storage.googleapis.com/f3/c4/05/6d84274225c9d7/US11069838-20210720-D00000.png
US-2021277342-A1,"Modular Biogas Facility, Method For Operating A Modular Biogas Facility And System For Monitoring And Control ",Goffin Energy GmbH,"Gregor Urban, Thomas Schmidt, Martin Schmidt, Thomas BRUESE, Walter Danner",2018-08-29,2021-02-26,2021-09-09,,https://patents.google.com/patent/US20210277342A1/en,https://patentimages.storage.googleapis.com/30/95/38/a1bac8a6daa7c9/US20210277342A1-20210909-D00000.png
US-2020058579-A1,Semiconductor device package and method of manufacturing the same ,"Advanced Semiconductor Engineering, Inc.",Wen-Long Lu,2018-08-15,2018-08-15,2020-02-20,,https://patents.google.com/patent/US20200058579A1/en,https://patentimages.storage.googleapis.com/9a/81/39/d3e50a92f336d5/US20200058579A1-20200220-D00000.png
US-2020062028-A1,Marked wheel rim and method for manufacturing the same ,Marshal Industrial Corp.,Ming-Jen Tsai,2018-08-22,2018-08-22,2020-02-27,,https://patents.google.com/patent/US20200062028A1/en,https://patentimages.storage.googleapis.com/16/8b/39/5b53029b750a11/US20200062028A1-20200227-D00000.png
US-2021328219-A1,"Negative electrode active material, method for producing same, and lithium secondary battery having negative electrode including same ","Sj Advanced Materials Co., Ltd.","Jae Phil Cho, Jae Kyung SUNG, Ji Young Ma",2018-08-14,2019-08-13,2021-10-21,,https://patents.google.com/patent/US20210328219A1/en,https://patentimages.storage.googleapis.com/4a/ae/68/90ff69f7e8ee98/US20210328219A1-20211021-D00000.png
US-2021253861-A1,Lignocellulosic composite articles ,Basf Se,"Donald Charles Mente, Gustavo E. Leon, Gene Michael Scheffler, Christian Mueller, Stephan Weinkoetz",2018-08-28,2019-08-27,2021-08-19,,https://patents.google.com/patent/US20210253861A1/en,https://patentimages.storage.googleapis.com/78/e5/20/5596d9505ffc6f/US20210253861A1-20210819-D00001.png
US-2020290297-A1,Composite shaping apparatus and composite shaping method ,Subaru Corporation,Atsushi RIHEI,2018-08-24,2019-05-10,2020-09-17,,https://patents.google.com/patent/US20200290297A1/en,https://patentimages.storage.googleapis.com/08/0a/d8/1c992ff1aaf4c2/US20200290297A1-20200917-D00000.png
US-2021234174-A1,"Conductive material dispersion liquid, electrode and lithium secondary battery prepared by using the same ","Lg Chem, Ltd.","Houng Sik YOO, Hyeon Choi, Dong Hyun Kim, Hyun Sik Chae, Sang Hoon Choy, Hyung Suk Cho",2018-08-21,2019-08-21,2021-07-29,,https://patents.google.com/patent/US20210234174A1/en,
US-2021291484-A1,Laminated structure ,Asahi Kasei Kabushiki Kaisha,"Naoki Azuma, Tetsuo Nakamoto",2018-08-09,2019-08-01,2021-09-23,,https://patents.google.com/patent/US20210291484A1/en,https://patentimages.storage.googleapis.com/73/c2/9c/cb09c1090ecc8d/US20210291484A1-20210923-D00000.png
US-2021273138-A1,Light-emitting device and the method of manufacturing the same ,Epistar Corporation,"Chien-Liang Liu, Ming-Chi Hsu, Shih-An LIAO, Jen-Chieh Yu, Min-Hsun Hsieh, Jia-Tay KUO, Yu-His SUNG, Po-Chang Chen",2018-08-01,2021-05-17,2021-09-02,,https://patents.google.com/patent/US20210273138A1/en,https://patentimages.storage.googleapis.com/3f/ea/07/f369e96b1d14fb/US20210273138A1-20210902-D00000.png
US-2020048464-A1,Heat-curable resin composition and semiconductor device ,"Shin-Etsu Chemical Co., Ltd.","Yoshihiro Tsutsumi, Naoyuki KUSHIHARA, Norifumi Kawamura, Yoshihira Hamamoto, Yuki Kudo",2018-08-10,2019-07-26,2020-02-13,,https://patents.google.com/patent/US20200048464A1/en,
US-2020048454-A1,Heat-curable resin composition for semiconductor encapsulation and semiconductor device ,"Shin-Etsu Chemical Co., Ltd.","Yoshihiro Tsutsumi, Naoyuki KUSHIHARA, Norifumi Kawamura, Yuki Kudo",2018-08-09,2019-07-03,2020-02-13,,https://patents.google.com/patent/US20200048454A1/en,
US-2020071599-A1,Particulate polyvinyl alcohol compositions having reduced dust content ,"Kuraray Co., Ltd.","Ghebrehiwet GHEBREMESKEL, Masaki Kato, Keisuke Morikawa, Erik BATEHAM",2018-08-28,2019-08-28,2020-03-05,,https://patents.google.com/patent/US20200071599A1/en,
US-2021249210-A1,Switching Device ,Tdk Electronics Ag,"Armin Grunack, Torsten Klinger",2018-08-28,2019-08-16,2021-08-12,,https://patents.google.com/patent/US20210249210A1/en,https://patentimages.storage.googleapis.com/72/33/5f/c35e056f8c3f04/US20210249210A1-20210812-D00000.png
US-2021057735-A1,"Sulfur-carbon composite, preparation method therefor, and positive electrode and lithium secondary battery comprising same ","Lg Chem, Ltd.","Bong Soo Kim, Soohyun KIM, Sun Mi JIN",2018-08-08,2019-07-29,2021-02-25,,https://patents.google.com/patent/US20210057735A1/en,https://patentimages.storage.googleapis.com/16/6d/07/4be4b392cd6ad8/US20210057735A1-20210225-D00000.png
US-2020064027-A1,Geothermal heat exchange reservoirs and related methods and systems ,Gary Scott Peele,Gary Scott Peele,2018-08-23,2019-08-21,2020-02-27,,https://patents.google.com/patent/US20200064027A1/en,https://patentimages.storage.googleapis.com/04/32/9b/183d0dc059a895/US20200064027A1-20200227-D00000.png
US-2021308902-A1,Wear detector for glass furnace ,Saint-Gobain Centre De Recherches Et D'etudes Europeen,"Isabelle Cabodi, Olivier Citti, Jean-Gaël Vuillermet",2018-08-01,2019-07-26,2021-10-07,,https://patents.google.com/patent/US20210308902A1/en,https://patentimages.storage.googleapis.com/04/e4/87/5bf7dd04da03d3/US20210308902A1-20211007-D00000.png
US-10967245-B2,Tracked skate runner ,Steven Dickinson Potter,Steven Dickinson Potter,2018-08-05,2018-08-05,2021-04-06,2021-04-06,https://patents.google.com/patent/US10967245B2/en,https://patentimages.storage.googleapis.com/3f/ff/e7/5e5c1da5bb90dc/US10967245-20210406-D00000.png
US-2021337488-A1,Cell identification for radio access networks ,Telefonaktiebolaget Lm Ericsson (Publ),"Robert Baldemair, Stefan Parkvall, Erik Dahlman, Sorour Falahati",2018-08-05,2018-08-06,2021-10-28,,https://patents.google.com/patent/US20210337488A1/en,https://patentimages.storage.googleapis.com/88/b4/8b/1b04cee38ac313/US20210337488A1-20211028-D00000.png
US-2021307024-A1,Handling bs-to-bs interference in radio access networks ,Telefonaktiebolaget Lm Ericsson (Publ),"Robert Baldemair, Stefan Parkvall, Erik Dahlman, Sorour Falahati",2018-08-05,2018-08-05,2021-09-30,,https://patents.google.com/patent/US20210307024A1/en,https://patentimages.storage.googleapis.com/a5/e7/4d/3eae5026f4464a/US20210307024A1-20210930-D00000.png
US-2021307020-A1,Atmospheric channel-driven interference handling ,Telefonaktiebolaget Lm Ericsson (Publ),"Robert Baldemair, Stefan Parkvall, Erik Dahlman, Sorour Falahati",2018-08-05,2018-08-05,2021-09-30,,https://patents.google.com/patent/US20210307020A1/en,https://patentimages.storage.googleapis.com/96/d2/1e/937a8a2b16e4f3/US20210307020A1-20210930-D00000.png
US-2021297871-A1,Handling of BS-to-BS Interference in Radio Access Networks ,Telefonaktiebolaget Lm Ericsson (Publ),"Axel GUTHMANN, Robert Baldemair, Erik Dahlman, Sorour Falahati, Stefan Parkvall",2018-08-07,2019-06-25,2021-09-23,,https://patents.google.com/patent/US20210297871A1/en,https://patentimages.storage.googleapis.com/bb/8c/87/ca4dfef1f1da66/US20210297871A1-20210923-D00000.png
US-2021273769-A1,Atmosheric channel-driven interference handling ,Telefonaktiebolaget Lm Ericsson (Publ),"Robert Baldemair, Stefan Parkvall, Erik Dahlman, Sorour Falahati",2018-08-05,2018-08-05,2021-09-02,,https://patents.google.com/patent/US20210273769A1/en,https://patentimages.storage.googleapis.com/30/d9/a5/cee2124e84dfcc/US20210273769A1-20210902-D00000.png
US-2021345261-A1,Signaling of identity for radio access networks ,Telefonaktiebolaget Lm Ericsson (Publ),"Robert Baldemair, Stefan Parkvall, Erik Dahlman, Sorour Falahati",2018-08-05,2018-08-05,2021-11-04,,https://patents.google.com/patent/US20210345261A1/en,https://patentimages.storage.googleapis.com/98/28/a4/fee0a6d8977d1f/US20210345261A1-20211104-D00000.png
US-2020055431-A1,Vehicle seat belt system ,"Ford Global Technologies, Llc","Dean M. Jaradi, Mohammad Omar Faruque, S.M. Iskander FAROOQ, Zhenyan Gao",2018-08-20,2018-08-20,2020-02-20,,https://patents.google.com/patent/US20200055431A1/en,https://patentimages.storage.googleapis.com/5a/6a/67/1fd5bd792f1dbc/US20200055431A1-20200220-D00000.png
US-2021194615-A1,Reference signaling for radio access networks ,Telefonaktiebolaget Lm Ericsson (Publ),"Robert Baldemair, Stefan Parkvall, Erik Dahlman, Sorour Falahati",2018-08-05,2018-08-05,2021-06-24,,https://patents.google.com/patent/US20210194615A1/en,https://patentimages.storage.googleapis.com/8d/a9/27/aeb53cd54c1f3b/US20210194615A1-20210624-D00000.png
US-2021348163-A1,The Microbiome as a Target of MicroRNAs for the Treatment of Disease ,"The Brigham And Women's Hospital, Inc.","Shirong Liu, Howard Weiner",2018-08-23,2019-08-23,2021-11-11,,https://patents.google.com/patent/US20210348163A1/en,https://patentimages.storage.googleapis.com/34/a9/e0/aaae07e05980d1/US20210348163A1-20211111-D00000.png
US-2020062574-A1,Manifold and Fluid Dispensing Systems ,"Rooftop Research, Llc",Robert S. Burns,2018-08-24,2019-04-11,2020-02-27,,https://patents.google.com/patent/US20200062574A1/en,https://patentimages.storage.googleapis.com/cc/18/33/fa90ddafbc4b47/US20200062574A1-20200227-D00000.png
US-2020054259-A1,High density analog multipexing ,"EnLiSense, LLC","Devangsingh Gajendarsingh Sankhala, Sriram Muthukumar",2018-08-17,2019-08-16,2020-02-20,,https://patents.google.com/patent/US20200054259A1/en,https://patentimages.storage.googleapis.com/ff/0e/e8/9b1c52d2b6f059/US20200054259A1-20200220-D00000.png
US-2020358211-A1,Semiconductor module ,"Fuji Electric Co., Ltd.",Mayumi Shiohara,2018-08-02,2020-07-28,2020-11-12,,https://patents.google.com/patent/US20200358211A1/en,https://patentimages.storage.googleapis.com/f2/bd/90/d0d2889bce1694/US20200358211A1-20201112-D00000.png
US-2021318496-A1,Optical fiber alignment devices and systems ,Commscope Technologies Llc,"Danny Willy August Verheyden, Debora DOCKX",2018-08-29,2019-08-29,2021-10-14,,https://patents.google.com/patent/US20210318496A1/en,https://patentimages.storage.googleapis.com/58/7a/5f/77e268973c6762/US20210318496A1-20211014-D00000.png
US-2020059063-A1,Anti-Stokes-Fluorescence-Cooled Fiber-Based Gain Element ,The Board Of Trustees Of The Leland Stanford Junior University,"Michael J. DIGONNET, Jennifer KNALL",2018-08-15,2019-08-14,2020-02-20,,https://patents.google.com/patent/US20200059063A1/en,https://patentimages.storage.googleapis.com/da/12/9d/fe9027461b0779/US20200059063A1-20200220-D00000.png
US-2020040746-A1,Fiber-reinforced self-healing bond coat ,United Technologies Corporation,"Richard Wesley Jackson, John E. Holowczak, Xia Tang, James T. Beals",2018-08-03,2018-08-03,2020-02-06,,https://patents.google.com/patent/US20200040746A1/en,https://patentimages.storage.googleapis.com/6f/d9/d4/883df2c3576f9c/US20200040746A1-20200206-D00000.png
US-2021324142-A1,Cross-linked polyimide membranes and carbon molecular sieve hollow fiber membranes made therefrom ,"Dow Global Technologies Llc, Georgia Tech Research Corporation","Justin T. Vaughn, Wulin Qiu, William J. Koros, Liren Xu, Mark K. Brayden",2018-08-23,2019-08-20,2021-10-21,,https://patents.google.com/patent/US20210324142A1/en,
US-2020054101-A1,Closure Device for Releasably Connecting Two Parts ,Fidlock Gmbh,"Joachim Fiedler, Philip Klein",2018-08-16,2019-08-14,2020-02-20,,https://patents.google.com/patent/US20200054101A1/en,https://patentimages.storage.googleapis.com/39/30/f6/f31813dc36b9ec/US20200054101A1-20200220-D00000.png
US-2021164892-A1,"Device for conducting radiation, a photodetector arrangement, and a method for spatially resolved spectral analysis ",Universität Leipzig,Marius Grundmann,2018-08-14,2019-08-14,2021-06-03,,https://patents.google.com/patent/US20210164892A1/en,https://patentimages.storage.googleapis.com/52/9b/07/c035977ecd6eb9/US20210164892A1-20210603-D00000.png
US-2021300829-A1,"Crystalline silicon carbide fiber and method for manufacturing same, and ceramic composite substrate ","Ube Industries, Ltd.","Yuusuke TOMINAGA, Hiroyuki Yamaoka, Kouichirou Suyama, Hideki Ozawa, Mao Sumino",2018-08-06,2019-08-06,2021-09-30,,https://patents.google.com/patent/US20210300829A1/en,https://patentimages.storage.googleapis.com/3c/38/7c/47527bcb8eed55/US20210300829A1-20210930-D00000.png
US-2020062643-A1,Methods and apparatuses for curing optical fiber coatings ,Corning Incorporated,"Dana Craig Bookbinder, Darren Andrew Stainer, Pushkar Tandon, Ruchi Tandon",2018-08-24,2019-08-12,2020-02-27,,https://patents.google.com/patent/US20200062643A1/en,https://patentimages.storage.googleapis.com/0d/6c/a7/a2a04313e0b378/US20200062643A1-20200227-D00000.png
US-2020044412-A1,Submount for semiconductor laser and optical fibers ,"Cisco Technology, Inc.","Jock T. Bovington, Ashley J. MAKER, Kumar Satya Harinadh Potluri",2018-08-01,2018-08-01,2020-02-06,,https://patents.google.com/patent/US20200044412A1/en,https://patentimages.storage.googleapis.com/b5/02/2e/1a4cbd9c542d92/US20200044412A1-20200206-D00000.png
US-2020057057-A1,Methods and reagents for Toxoplasma infection diagnosis ,"Denis LIMONNE, Rima McLeod, Francois Peyron, Kamal EL-BISSATI, Joe LYKINS","Denis LIMONNE, Rima McLeod, Francois Peyron, Kamal EL-BISSATI, Joe LYKINS",2018-08-16,2019-08-16,2020-02-20,,https://patents.google.com/patent/US20200057057A1/en,https://patentimages.storage.googleapis.com/08/e2/c2/6e161c5fb2aea8/US20200057057A1-20200220-D00000.png
US-10804195-B2,High density embedded interconnects in substrate ,Qualcomm Incorporated,"Kuiwon Kang, Marcus HSU, Brigham NAVAJA, Houssam Jomaa",2018-08-08,2018-12-21,2020-10-13,2020-10-13,https://patents.google.com/patent/US10804195B2/en,https://patentimages.storage.googleapis.com/2f/63/fa/28faeafd04cfd7/US10804195-20201013-D00000.png
US-2020053887-A1,Mechanically Robust Component Carrier With Rigid and Flexible Portions ,At&S Austria Technologie & Systemtechnik Aktiengesellschaft,Roland Bund,2018-08-09,2018-08-09,2020-02-13,,https://patents.google.com/patent/US20200053887A1/en,https://patentimages.storage.googleapis.com/96/16/fb/9ab5b524994c0e/US20200053887A1-20200213-D00000.png
US-2020067353-A1,Test object holder ,Apple Inc.,"Daman Kapoor, Fei Zhao, Matthew A. Tamashiro, Jiahui J. Dong, Jeffrey Douglas Louis, Michael Victor Paauwe, Ryllian Zhang",2018-08-22,2019-08-20,2020-02-27,,https://patents.google.com/patent/US20200067353A1/en,https://patentimages.storage.googleapis.com/4f/41/17/9c33a859a3c5e7/US20200067353A1-20200227-D00000.png
US-11160169-B2,Component carrier with component embedded in cavity and with double dielectric layer on front side ,AT&S (Chongqing) Company Limited,"Yu-Hui Wu, Christopher Katzko",2018-08-03,2019-08-01,2021-10-26,2021-10-26,https://patents.google.com/patent/US11160169B2/en,https://patentimages.storage.googleapis.com/17/ab/39/808929325b6d9a/US11160169-20211026-D00000.png
US-11131665-B1,Method for evaluating urine of a subject to estimate the fertile window ,"MFB Fertility, Inc.",Amy Beckley,2018-08-22,2021-05-05,2021-09-28,2021-09-28,https://patents.google.com/patent/US11131665B1/en,https://patentimages.storage.googleapis.com/59/9c/15/0d59e9c2c1beb1/US11131665-20210928-D00001.png
US-2021308544-A1,Practice sword ,Norio NABETA,Norio NABETA,2018-08-16,2019-05-29,2021-10-07,,https://patents.google.com/patent/US20210308544A1/en,https://patentimages.storage.googleapis.com/aa/39/c4/ee11a5667569f9/US20210308544A1-20211007-D00000.png
US-2021161211-A1,"Flavor generation system, method, and program ",Japan Tobacco Inc.,"Takeshi Akao, Takashi Oda, Takuma Nakano, Hajime Fujita",2018-08-13,2021-02-10,2021-06-03,,https://patents.google.com/patent/US20210161211A1/en,https://patentimages.storage.googleapis.com/13/20/aa/0d777e5602b8be/US20210161211A1-20210603-D00000.png
US-2021329797-A1,"Housing Frame for a Control Unit, which Housing Frame is Suitable for Externally Electrically Contacting a Circuit Carrier of the Control Unit ",Robert Bosch Gmbh,"Reinhold Jocham, Ulrich Trescher, Sascha Bader, Oliver Schilli",2018-08-21,2019-07-22,2021-10-21,,https://patents.google.com/patent/US20210329797A1/en,https://patentimages.storage.googleapis.com/bd/91/c5/f5ff3a5503f7c8/US20210329797A1-20211021-D00000.png
US-2021319984-A1,Method and aparatus for low particle plasma etching ,Evatec Ag,"Jürgen Weichart, Ben CURTIS, Frantisek Balon",2018-08-15,2019-08-13,2021-10-14,,https://patents.google.com/patent/US20210319984A1/en,https://patentimages.storage.googleapis.com/e1/db/3b/dfa59db5cfb4ed/US20210319984A1-20211014-D00000.png
US-2020055151-A1,Method of manufacturing a welding stud ,Newfrey Llc,"Johannes Rhiel, Martin Schneider, Ralf Pimper, Andreas Schmitt, Timo Pieh",2018-08-16,2019-08-15,2020-02-20,,https://patents.google.com/patent/US20200055151A1/en,https://patentimages.storage.googleapis.com/f9/10/61/1aaabfaf05ba49/US20200055151A1-20200220-D00000.png
US-2020056050-A1,"Compositions containing conductive additives, related electrodes and related batteries ",Cabot Corporation,"Paolina Atanassova, Aurelien DuPasquier, Deanna Lanigan, Miodrag Oljaca",2018-08-20,2019-08-01,2020-02-20,,https://patents.google.com/patent/US20200056050A1/en,https://patentimages.storage.googleapis.com/d9/55/61/9d46a35e3814db/US20200056050A1-20200220-D00000.png
US-2021164486-A1,Air blower ,Nidec Copal Electronics Corporation,"Yusuke Saito, Masatoshi OBAYASHI, Kyosuke SASO, Tadashi Okabe, Toshiya Uchida",2018-08-24,2021-02-09,2021-06-03,,https://patents.google.com/patent/US20210164486A1/en,https://patentimages.storage.googleapis.com/c1/28/8c/38c77366975246/US20210164486A1-20210603-D00000.png
US-2021308921-A1,Injection device ,"Nissei Plastic Industrial Co., Ltd.","Yuichi Sakurada, Nanae NAITO, Keita Arai, Hozumi Yoda, Hirofumi Murata",2018-08-29,2019-03-28,2021-10-07,,https://patents.google.com/patent/US20210308921A1/en,https://patentimages.storage.googleapis.com/dd/aa/ed/7a52abbfab481b/US20210308921A1-20211007-D00000.png
US-2020055190-A1,Simulating process forces during robot testing ,The Boeing Company,Phillip J. Crothers,2018-08-20,2018-08-20,2020-02-20,,https://patents.google.com/patent/US20200055190A1/en,https://patentimages.storage.googleapis.com/17/8d/d0/d6f0540caf23f7/US20200055190A1-20200220-D00000.png
US-2020216458-A1,Non-peptide opioid receptor modulators ,Virginia Commonwealth University,Yan Zhang,2018-08-21,2019-12-24,2020-07-09,,https://patents.google.com/patent/US20200216458A1/en,https://patentimages.storage.googleapis.com/26/dd/79/316219c5f7f723/US20200216458A1-20200709-D00000.png
US-2020064881-A1,Display device ,"Samsung Display Co., Ltd.","Youngji KIM, Minsu JUNG",2018-08-27,2019-05-24,2020-02-27,,https://patents.google.com/patent/US20200064881A1/en,https://patentimages.storage.googleapis.com/d5/b1/5c/f416a1b1f042da/US20200064881A1-20200227-D00000.png
US-2021159009-A1,Reactor ,"Autonetworks Technologies, Ltd., Sumitomo Wiring Systems, Ltd., Sumitomo Electric Industries, Ltd.",Kohei Yoshikawa,2018-08-09,2019-08-01,2021-05-27,,https://patents.google.com/patent/US20210159009A1/en,https://patentimages.storage.googleapis.com/00/a1/c9/68f9de86f4c150/US20210159009A1-20210527-D00000.png
US-2021221959-A1,Polysiloxane-polyalkylene glycol block copolymer and method of producing same ,"Toray Industries, Inc.","Yuka Isago, Kenshi Miyaura, Itaru Asano",2018-08-10,2019-08-06,2021-07-22,,https://patents.google.com/patent/US20210221959A1/en,https://patentimages.storage.googleapis.com/8c/5b/54/d661a8f7a91308/US20210221959A1-20210722-D00000.png
US-2020052341-A1,Horizontal composite electricity supply element group ,"Prologium Technology Co., Ltd., Prologium Holding Inc.",Szu-Nan Yang,2018-08-08,2019-08-08,2020-02-13,,https://patents.google.com/patent/US20200052341A1/en,https://patentimages.storage.googleapis.com/87/c3/ab/845e2a1525f8bf/US20200052341A1-20200213-D00000.png
US-2021304948-A1,Reactor ,"Autonetworks Technologies, Ltd., Sumitomo Electric Industries, Ltd., Sumitomo Wiring Systems, Ltd.","Kohei Yoshikawa, Akinori OOISHI",2018-08-09,2019-08-01,2021-09-30,,https://patents.google.com/patent/US20210304948A1/en,https://patentimages.storage.googleapis.com/f7/e5/31/6474a0ff5c94be/US20210304948A1-20210930-D00000.png
US-2020071690-A1,Amplifying oligonucleotides and producing libraries of dual guide constructs ,"Agilent Technologies, Inc.","Jeffrey Carl Braman, Peter James Sheffield, Holly Hogrefe",2018-08-29,2018-08-29,2020-03-05,,https://patents.google.com/patent/US20200071690A1/en,https://patentimages.storage.googleapis.com/f0/50/f7/787a1157f2059f/US20200071690A1-20200305-D00000.png
US-2020341074-A1,"Secondary battery for testing internal short, method and apparatus for testing internal short of secondary battery using the same ","Lg Chem, Ltd.","Sol-Nip LEE, Ju-Hyun Kang",2018-08-01,2019-06-26,2020-10-29,,https://patents.google.com/patent/US20200341074A1/en,https://patentimages.storage.googleapis.com/1e/59/1d/d4367af27aa91a/US20200341074A1-20201029-D00000.png
US-2019242286-A1,Inorganic Fibre Mats ,Thermal Ceramics Uk Limited,"Gary Jubb, Farid Modarresifar",2018-08-17,2019-04-18,2019-08-08,,https://patents.google.com/patent/US20190242286A1/en,https://patentimages.storage.googleapis.com/b0/90/ba/ee2d1d17884f27/US20190242286A1-20190808-D00000.png
US-2021163737-A1,"Poly(arylene ether ketone) and poly(phenylene ether) compositions, methods, and articles ",Shpp Global Technologies B.V.,"Fen Zhang, Mian DAI, Liang Shen",2018-08-22,2019-07-22,2021-06-03,,https://patents.google.com/patent/US20210163737A1/en,
US-2021317950-A1,"Corner structure for a sealed, thermally insulated tank ",Gaztransport Et i echnigaz,"Mohamed SASSI, Ronan Le Bihan",2018-08-06,2019-08-02,2021-10-14,,https://patents.google.com/patent/US20210317950A1/en,https://patentimages.storage.googleapis.com/d2/a9/0a/7b3e519aa6b0a1/US20210317950A1-20211014-D00000.png
US-2020075873-A1,Flexible fiber substrate and flexible display device including the same ,"Hefei Xinsheng Optoelectronics Technology Co., Ltd., Boe Technology Group Co., Ltd.",Yangkun Jing,2018-08-29,2019-05-08,2020-03-05,,https://patents.google.com/patent/US20200075873A1/en,https://patentimages.storage.googleapis.com/99/4d/c8/959e01594b021f/US20200075873A1-20200305-D00000.png
US-2021325172-A1,Integrated fiber for optical shape sensing and spectral tissue sensing ,Koninklijke Philips N.V.,"Bernardus Hendrikus Wilhelmus Hendriks, Gert Wim 'T Hooft, Martinus Bernardus Van Der Mark, Johan Lub, Torre Michelle Bydlon, Molly Lara Flexman",2018-08-28,2019-08-19,2021-10-21,,https://patents.google.com/patent/US20210325172A1/en,https://patentimages.storage.googleapis.com/0a/50/76/a6abb28a623777/US20210325172A1-20211021-D00000.png
US-2020061872-A1,Method of manufacturing a carbon fiber wheel rim ,Marshal Industrial Corp.,Ming-Jen Tsai,2018-08-23,2018-08-23,2020-02-27,,https://patents.google.com/patent/US20200061872A1/en,https://patentimages.storage.googleapis.com/30/61/bf/788616d21a06ba/US20200061872A1-20200227-D00000.png
US-2021165164-A1,Fiber orbital angular momentum mode sorter ,"Soreq Nuclear Research Center, Ramot At Tel Aviv University","Shlomi Lightman, Gilad Hurvitz, Razi Gvishi, Ady Arie",2018-08-14,2019-08-07,2021-06-03,,https://patents.google.com/patent/US20210165164A1/en,https://patentimages.storage.googleapis.com/64/cd/8f/881e48b01135a1/US20210165164A1-20210603-D00000.png
