US-2021376182-A1,Display devices with image sensor ,Innolux Corporation,"Chin-Lung Ting, Li-Wei Mao, Shun-Yuan HU",2019-05-17,2021-08-05,2021-12-02,,https://patents.google.com/patent/US20210376182A1/en,https://patentimages.storage.googleapis.com/d9/65/1f/6dd4dbdbc4c2d4/US20210376182A1-20211202-D00000.png
US-2021309863-A1,"Anti-reflective film, polarizing plate, and display apparatus ","Lg Chem, Ltd.","Jinseok Byun, So Young Kim, Kyung Moon KO, Sang Heon Lee, Intaek SONG, Yeongrae Chang",2019-05-28,2020-05-28,2021-10-07,,https://patents.google.com/patent/US20210309863A1/en,https://patentimages.storage.googleapis.com/85/9d/a5/cb4369de9e1ee4/US20210309863A1-20211007-D00001.png
US-2021311152-A1,Systems and methods for magnetic resonance imaging ,"Shanghai United Imaging Healthcare Co., Ltd.","Lingzhi HU, Yiran Li, Xinyuan Xia",2019-05-08,2021-06-15,2021-10-07,,https://patents.google.com/patent/US20210311152A1/en,https://patentimages.storage.googleapis.com/6c/79/d3/affb629d3c0552/US20210311152A1-20211007-D00000.png
US-2020371101-A1,"Compositions and methods relating to detection, inhibition, and imaging of indoleamine 2,3-dioxygenase 1 (ido1) ","Indi Molecular, Inc.","Heather Dawn Agnew, Bert Tsunyin Lai, Anders Eliasen",2019-05-20,2020-05-20,2020-11-26,,https://patents.google.com/patent/US20200371101A1/en,https://patentimages.storage.googleapis.com/55/9b/19/f8c8b6aec2dab2/US20200371101A1-20201126-D00000.png
US-2020373036-A1,Bending-resistant communication cable and wire harness ,Yazaki Corporation,"Toshiharu Shimizu, Hiroki Kondo",2019-05-20,2020-05-19,2020-11-26,,https://patents.google.com/patent/US20200373036A1/en,https://patentimages.storage.googleapis.com/27/fa/e7/1e8b4ddd57523c/US20200373036A1-20201126-D00000.png
US-2020367465-A1,Absorbent sheet for pets ,Unicharm Corporation,"Hiroki Yamamoto, Ayano Okawa, Yasuhiro Sasano, Shinya Kaneko",2019-05-20,2020-05-20,2020-11-26,,https://patents.google.com/patent/US20200367465A1/en,https://patentimages.storage.googleapis.com/57/4e/99/7db5a839c8066e/US20200367465A1-20201126-D00000.png
US-2021308490-A1,Systems and methods for motion tracking in radiation therapy ,"Shanghai United Imaging Healthcare Co., Ltd.","Lingzhi HU, Hongdi Li",2019-05-08,2021-06-15,2021-10-07,,https://patents.google.com/patent/US20210308490A1/en,https://patentimages.storage.googleapis.com/89/9b/f0/2e66900d624cee/US20210308490A1-20211007-D00000.png
US-10897444-B2,Automatic electronic message filtering method and apparatus ,Verizon Media Inc.,"Ariel Raviv, Dan Pelleg, Ran Wolff, Gal LALOUCHE, Noa Avigdor-Elgrabli",2019-05-07,2019-05-07,2021-01-19,2021-01-19,https://patents.google.com/patent/US10897444B2/en,https://patentimages.storage.googleapis.com/cb/f8/32/1c91661acfb4b4/US10897444-20210119-D00000.png
US-10832484-B1,Virtual reality risk detection ,International Business Machines Corporation,"Zachary A. Silverstein, Trudy L. Hewitt, Jeremy R. Fox, Robert Huntington Grant",2019-05-09,2019-05-09,2020-11-10,2020-11-10,https://patents.google.com/patent/US10832484B1/en,https://patentimages.storage.googleapis.com/3c/ea/ac/ae5edda4d2f5b3/US10832484-20201110-D00000.png
US-11147243-B2,Dog collar and leash assembly ,Isaac SOTO,Isaac SOTO,2019-05-13,2019-05-13,2021-10-19,2021-10-19,https://patents.google.com/patent/US11147243B2/en,https://patentimages.storage.googleapis.com/72/fc/55/2e6760b779e2b6/US11147243-20211019-D00000.png
US-2020359872-A1,Rack detection system for child safety and a method of controlling a dishwasher ,"Bsh Home Appliances Corporation, BSH Hausgeräte GmbH","Shane Blackmon, Deborah Harr, Shaun Jones",2019-05-17,2019-05-17,2020-11-19,,https://patents.google.com/patent/US20200359872A1/en,https://patentimages.storage.googleapis.com/18/7d/7a/d33271fe4405c7/US20200359872A1-20201119-D00000.png
US-10875010-B2,PGM nanoparticles TWC catalysts for gasoline exhaust gas applications ,Johnson Matthey Public Limited Company,Shuhei NAGAOKA,2019-05-06,2020-05-01,2020-12-29,2020-12-29,https://patents.google.com/patent/US10875010B2/en,https://patentimages.storage.googleapis.com/24/9d/de/0706902942200c/US10875010-20201229-D00001.png
US-2020407531-A1,Stretchable polymer thick film carbon black composition for wearable heaters ,"Dupont Electronics, Inc.","H David ROSENFELD, Ivan Chen, William George Kampert, Ping Tzeng, Fred E Nagle, Michael Stephen Wolfe",2019-05-13,2020-05-11,2020-12-31,,https://patents.google.com/patent/US20200407531A1/en,https://patentimages.storage.googleapis.com/24/cb/22/ca5c2cdd3d15f8/US20200407531A1-20201231-D00000.png
US-11043040-B2,Extended reality based positive affect implementation for product development ,Accenture Global Solutions Limited,"Rohit Mehra, Vibhu Saujanya Sharma, Vikrant Kaulgud, Sanjay Podder, Adam Patten BURDEN",2019-05-21,2020-05-19,2021-06-22,2021-06-22,https://patents.google.com/patent/US11043040B2/en,https://patentimages.storage.googleapis.com/d5/2a/7f/c62248dd3c7bea/US11043040-20210622-D00000.png
US-2020352905-A1,"6-(2,4-dichlorophenyl)-5-[4-[(3s)-1-(3-fluoropropyl)pyrrolidin-3-yl]oxyphenyl]-8,9-dihydro-7h-benzo[7]annulene-2-carboxylic acid for use in metastatic or advanced breast cancer patients ",Sanofi,"Sylvaine CARTOT-COTTON, Marina CELANOVIC, Patrick Cohen, Gautier PAUX",2019-05-09,2020-05-08,2020-11-12,,https://patents.google.com/patent/US20200352905A1/en,https://patentimages.storage.googleapis.com/3f/4c/cd/f526ee0f95bf86/US20200352905A1-20201112-D00000.png
US-2020356408-A1,System and method for inreasing robustness of heterogeneous computing systems ,University Of Louisiana At Lafayette,"James Gentry, Mohsen Amini Salehi, Chavit Denninnart",2019-05-07,2020-04-28,2020-11-12,,https://patents.google.com/patent/US20200356408A1/en,https://patentimages.storage.googleapis.com/ce/e8/9d/a946521e38e711/US20200356408A1-20201112-D00000.png
US-2020345426-A1,"Systems, methods, and devices for registering and tracking organs during interventional procedures ",Neil Glossop,Neil Glossop,2019-05-03,2019-11-27,2020-11-05,,https://patents.google.com/patent/US20200345426A1/en,https://patentimages.storage.googleapis.com/c4/4e/5b/73857d3be344e0/US20200345426A1-20201105-D00000.png
US-2020018005-A1,Apparatus and method for treating laundry ,Lg Electronics Inc.,Seung Jun Lee,2019-05-09,2019-09-23,2020-01-16,,https://patents.google.com/patent/US20200018005A1/en,https://patentimages.storage.googleapis.com/f2/aa/61/aff7ca7e6bb5b5/US20200018005A1-20200116-D00000.png
US-2020364542-A1,Private deep learning ,"Salesforce.Com, Inc.",Lichao Sun,2019-05-16,2019-08-21,2020-11-19,,https://patents.google.com/patent/US20200364542A1/en,https://patentimages.storage.googleapis.com/60/84/5c/e688b59f6239d1/US20200364542A1-20201119-D00000.png
US-2020376147-A1,"Sodium saccharin having conjugated ligand, derivatives thereof and process for the preparation thereof ",Kyung-In Synthetic Corporation,"Donggil Kim, Eui Jae Lee",2019-05-28,2019-05-28,2020-12-03,,https://patents.google.com/patent/US20200376147A1/en,https://patentimages.storage.googleapis.com/76/02/04/077b4430b0131d/US20200376147A1-20201203-D00000.png
US-2020375849-A1,Devices and methods for providing medication ,"Cmpd Licensing, Llc",II Jay Richard Ray,2019-05-28,2019-05-28,2020-12-03,,https://patents.google.com/patent/US20200375849A1/en,https://patentimages.storage.googleapis.com/fd/27/60/8bbaa533947b02/US20200375849A1-20201203-D00000.png
US-2020372596-A1,Integrated object-centric service delivery system (osds) containers ,Alfred Cheung,Alfred Cheung,2019-05-23,2019-05-23,2020-11-26,,https://patents.google.com/patent/US20200372596A1/en,https://patentimages.storage.googleapis.com/43/86/c1/26774a9f88709a/US20200372596A1-20201126-D00000.png
US-2020363768-A1,"Process cartridge, image forming apparatus and cleaning apparatus ",Canon Kabushiki Kaisha,"Kazunori Hashimoto, Katsuhiro Kojima, Toshiaki Takeuchi, Yasukazu Ikami, Kosuke Ikada, Yoshihiro Mitsui, Yuichiro Hirata, Go Shindo, Akinobu Saito, Yuhei Terui, Noriyoshi Umeda, Tomonori Matsunaga, Shohei Kototani, Masamichi Sato",2019-05-17,2020-05-15,2020-11-19,,https://patents.google.com/patent/US20200363768A1/en,https://patentimages.storage.googleapis.com/1d/1e/b8/097b12596836c2/US20200363768A1-20201119-D00000.png
US-11123658-B2,Demulsification methods using palm oil fuel ash ,King Fahd University Of Petroleum And Minerals,"Ahmad A. ADEWUNMI, Muhammad Shahzad KAMAL, Theis Ivan SOLLING, Babatunde Abiodun SALAMI",2019-05-20,2019-05-20,2021-09-21,2021-09-21,https://patents.google.com/patent/US11123658B2/en,https://patentimages.storage.googleapis.com/26/f0/09/63ad0ddc1143ff/US11123658-20210921-D00000.png
US-2020369685-A1,Boronic ester prodrugs and uses thereof ,"Massachusetts Institute Of Technology, Dana-Farber Cancer Institute, Inc.","Jeremiah A. Johnson, Paiman Ghoroghchian, Yivan Jiang, Hung Vanthanh Nguyen, Irene Ghobrial, Alexandre Detappe",2019-05-20,2020-03-20,2020-11-26,,https://patents.google.com/patent/US20200369685A1/en,https://patentimages.storage.googleapis.com/c5/1c/a4/28f1a35bdc6481/US20200369685A1-20201126-D00000.png
US-2020372501-A1,Blockchain enabled service request system ,Visa International Service Association,"Ashwini Kadarmandalgi, Sowmya Saiprasad, Srinivas Vadhri",2019-05-24,2019-05-24,2020-11-26,,https://patents.google.com/patent/US20200372501A1/en,https://patentimages.storage.googleapis.com/ef/f6/75/a6bb74b85b8c41/US20200372501A1-20201126-D00000.png
US-2020369951-A1,Methods of inhibiting corrosion with acidic treatment fluids ,King Fahd University Of Petroleum And Minerals,"Mumtaz Ahmad QURAISHI, Kashif Rahmani ANSARI, Dheeraj Singh CHAUHAN",2019-05-21,2019-05-21,2020-11-26,,https://patents.google.com/patent/US20200369951A1/en,https://patentimages.storage.googleapis.com/75/32/a7/217686567c4b97/US20200369951A1-20201126-D00000.png
US-2020369117-A1,Method and apparatus for controlling heat transfer to a transparent sheet ,GM Global Technology Operations LLC,"David G. Meller, Todd J. Gordon",2019-05-21,2019-05-21,2020-11-26,,https://patents.google.com/patent/US20200369117A1/en,https://patentimages.storage.googleapis.com/9b/fa/89/1869276bbe907c/US20200369117A1-20201126-D00000.png
US-2021046106-A1,Methods of treating cancer with androgen deprivation therapy in combination with an inhibitor of the sp1 transcription factor ,The Board Of Trustees Of The Leland Stanford Junior University,"Susan J. Knox, Donna M. Peehl, Junqiang Tian",2019-05-28,2020-05-26,2021-02-18,,https://patents.google.com/patent/US20210046106A1/en,https://patentimages.storage.googleapis.com/04/5e/c3/e17428a537ec79/US20210046106A1-20210218-D00001.png
US-2021369463-A1,Systems and methods for manufacturing bioscaffold extracellular structures for tissue regeneration ,Mentor Worldwide Llc,"Hector Javier Toro Estrella, Orquidea Helen Garcia",,2019-05-06,2021-12-02,,https://patents.google.com/patent/US20210369463A1/en,https://patentimages.storage.googleapis.com/82/48/97/f5b192cdeae0ee/US20210369463A1-20211202-D00000.png
US-2020361184-A1,Lightweight polyethylene film for packaging applications and the product resulting therefrom and the method of making the same ,"Mucell Extrusion, Llc","Mehdi Saniei, Mark E. Lindenfelzer, Eric V. Fredrickson",2019-05-17,2019-05-17,2020-11-19,,https://patents.google.com/patent/US20200361184A1/en,
US-2020372597-A1,Method for object-centric service delivery ,Alfred Cheung,Alfred Cheung,2019-05-24,2019-05-24,2020-11-26,,https://patents.google.com/patent/US20200372597A1/en,https://patentimages.storage.googleapis.com/d3/a9/54/d7d599b5ea946c/US20200372597A1-20201126-D00000.png
US-2020372384-A1,Dual Flow Generative Computer Architecture ,Wisconsin Alumni Research Foundation,"Haoliang Sun, Ronak R. Mehta, Hao Zhou, Vikas Singh, Vivek Prabhakaran, Stirling C. Johnson",2019-05-20,2019-05-20,2020-11-26,,https://patents.google.com/patent/US20200372384A1/en,https://patentimages.storage.googleapis.com/a3/b6/c3/1ec9725ccc8809/US20200372384A1-20201126-D00000.png
US-2021212807-A1,Poly (ester urea) adhesion barriers for use in the treatment of hernia-mesh repair ,"University Of Akron, Cook Medical Technologies Llc","Matthew Becker, Nathan Z. DREGER, Zachary K. ZANDER, Trenton Parsell, Michael Hiles",2019-05-07,2019-05-07,2021-07-15,,https://patents.google.com/patent/US20210212807A1/en,https://patentimages.storage.googleapis.com/f9/6e/07/cb79aac98f3ce3/US20210212807A1-20210715-D00000.png
US-2020369439-A1,Container system with locking tabs ,"Jason S. SCHULER, Stephen RICCI","Jason S. SCHULER, Stephen RICCI",2019-05-23,2020-05-21,2020-11-26,,https://patents.google.com/patent/US20200369439A1/en,https://patentimages.storage.googleapis.com/d5/e5/e5/269bdef3a29241/US20200369439A1-20201126-D00000.png
US-11141609-B2,Dose guided real-time adaptive radiotherapy ,Elekta Ab (Publ),"David Andreas Tilly, Stella Lucie Riad, Peter Kimstrand, Nina Terese Tilly, Klas Mareks von Würtemberg",2019-05-15,2019-05-15,2021-10-12,2021-10-12,https://patents.google.com/patent/US11141609B2/en,https://patentimages.storage.googleapis.com/93/58/a2/1622bfcd5264af/US11141609-20211012-D00000.png
US-10777070-B1,Occupancy alarm system ,"Diane Holder, Ainsworth Carter","Diane Holder, Ainsworth Carter",2019-05-16,2019-05-16,2020-09-15,2020-09-15,https://patents.google.com/patent/US10777070B1/en,https://patentimages.storage.googleapis.com/ea/a1/7c/9ecc0c5a6e4630/US10777070-20200915-D00000.png
US-2020364852-A1,Method for aiding visualization of lesions in medical imagery and apparatus using the same ,"Vuno, Inc.",Gwangbeen PARK,2019-05-14,2020-05-14,2020-11-19,,https://patents.google.com/patent/US20200364852A1/en,https://patentimages.storage.googleapis.com/30/19/b6/43102cac04d931/US20200364852A1-20201119-D00000.png
US-2020345112-A1,Custom accessory making kit ,Joan Lynn Lawler,Joan Lynn Lawler,2019-05-02,2020-01-16,2020-11-05,,https://patents.google.com/patent/US20200345112A1/en,https://patentimages.storage.googleapis.com/d5/e7/6f/7261d613111382/US20200345112A1-20201105-D00000.png
US-2020372918-A1,Plush toy audio controller ,Wicked Cool Toys Holdings Llc,"Jeremy Padawer, Justin Randall Padawer, Michael Rinzler",2019-05-21,2020-01-14,2020-11-26,,https://patents.google.com/patent/US20200372918A1/en,https://patentimages.storage.googleapis.com/b9/73/2c/3df66b677fb9c5/US20200372918A1-20201126-D00000.png
US-2021335344-A1,Artificial intelligence device capable of controlling other devices based on device information ,Lg Electronics Inc.,Jisoo PARK,2019-05-29,2019-05-29,2021-10-28,,https://patents.google.com/patent/US20210335344A1/en,https://patentimages.storage.googleapis.com/66/f3/d1/0d265c7c2c32ba/US20210335344A1-20211028-D00000.png
US-2020360728-A1,Machine learning based dose guided real-time adaptive radiotherapy ,Elekta Ab (Publ),"David Andreas Tilly, Stella Lucie Riad, Peter Kimstrand, Nina Terese Tilly, Klas Marcks von Würtemberg",2019-05-15,2019-05-15,2020-11-19,,https://patents.google.com/patent/US20200360728A1/en,https://patentimages.storage.googleapis.com/f8/88/f4/767ac65708e0ee/US20200360728A1-20201119-D00000.png
US-2020349241-A1,Machine learning-based anomaly detection for human presence verification ,EMC IP Holding Company LLC,"Dany Shapiro, Shiri Gaber, Ohad Arnon",2019-05-02,2019-05-02,2020-11-05,,https://patents.google.com/patent/US20200349241A1/en,https://patentimages.storage.googleapis.com/0e/43/d8/bb68144af3d4d6/US20200349241A1-20201105-D00000.png
US-2020361185-A1,Lightweight polyethylene film for aseptic packaging applications and the product resulting therefrom and the process of making the same ,"Mucell Extrusion, Llc","Mehdi Saniei, Mark E. Lindenfelzer, Eric V. Fredrickson",2019-05-17,2020-05-15,2020-11-19,,https://patents.google.com/patent/US20200361185A1/en,
US-10805925-B1,Measuring a signal from a neighboring device ,Lg Electronics Inc.,"Jinyup Hwang, Yoonoh Yang, Sangwook Lee, Suhwan Lim, Manyoung Jung, Jongkeun Park",2019-05-01,2020-04-23,2020-10-13,2020-10-13,https://patents.google.com/patent/US10805925B1/en,https://patentimages.storage.googleapis.com/83/0a/ff/84cc0ba46db491/US10805925-20201013-D00000.png
US-2020361645-A1,Method and apparatus for producing a multipack with several beverage containers ,Krones Aktiengesellschaft,"Herbert Spindler, Markus Gabler, Thomas Stadler, Johann LUBER, Tobias Gut",2019-05-17,2020-05-15,2020-11-19,,https://patents.google.com/patent/US20200361645A1/en,https://patentimages.storage.googleapis.com/fa/ab/d1/6dfc2ab3304755/US20200361645A1-20201119-D00000.png
US-2021316038-A1,"Antibiotic eluting poly(ester urea) films, meshes and pouches for infection control of implantable medical devices ","The University Of Akron, 21St Century Medical Technologies, Llc","Matthew Becker, Shantanu Pratap NIKAM, Arthur Alfaro",2019-05-09,2021-03-23,2021-10-14,,https://patents.google.com/patent/US20210316038A1/en,https://patentimages.storage.googleapis.com/2e/d1/74/f71c21f51f54fa/US20210316038A1-20211014-D00000.png
US-2020373957-A1,Glass breaker and security alert apparatus and method of application thereof ,Tonka Asset Management Llc,"Marc Sharinn, Debrah Sharinn",2019-05-20,2020-05-20,2020-11-26,,https://patents.google.com/patent/US20200373957A1/en,https://patentimages.storage.googleapis.com/d9/c9/56/994753fe4df50a/US20200373957A1-20201126-D00000.png
US-2020358891-A1,Display module including sensor and electronic device including the display module ,"Samsung Electronics Co., Ltd.","Jihun HEO, Jihoon Park, Seungho HWANG, Bongjae RHEE, Dongchurl KIM, Hyunwoo Kim, Sanggeun HAN",2019-05-09,2020-05-07,2020-11-12,,https://patents.google.com/patent/US20200358891A1/en,https://patentimages.storage.googleapis.com/18/d7/85/c2941b877fea57/US20200358891A1-20201112-D00000.png
US-2020355946-A1,Colored electrophoretic displays ,E Ink Corporation,"Stephen J. Telfer, Eugene BZOWEJ, Kenneth R. Crounse, John L. Marshall, Brandon MacDonald, Ziyan Wu, Lee Yezek",2019-05-10,2020-05-06,2020-11-12,,https://patents.google.com/patent/US20200355946A1/en,https://patentimages.storage.googleapis.com/23/d7/be/5e0cb2cc0f9ff1/US20200355946A1-20201112-D00000.png
US-2020357779-A1,Micro led transfer method and display module manufactured by the same ,"Samsung Electronics Co., Ltd.","Doyoung KWAG, Byungchul Kim, EunHye Kim, Sangmoo Park, Minsub OH, Dongyeob Lee, Yoonsuk LEE",2019-05-07,2020-05-04,2020-11-12,,https://patents.google.com/patent/US20200357779A1/en,https://patentimages.storage.googleapis.com/72/54/a7/8f3a8ace15f859/US20200357779A1-20201112-D00000.png
US-2020381749-A1,Fuel cell and manufacturing method of fuel cell ,Toyota Jidosha Kabushiki Kaisha,"Kenji Sato, Yuto Tamura, Tomoo YOSHIZUMI",2019-05-27,2020-05-04,2020-12-03,,https://patents.google.com/patent/US20200381749A1/en,https://patentimages.storage.googleapis.com/d8/31/d9/96591c7329cf6a/US20200381749A1-20201203-D00000.png
US-2020347524-A1,High-brightness luminescent yarn and manufacturing method thereof ,"Chance Line Industrial Co., Ltd.",Ming-Hsien YAO,2019-05-03,2020-04-29,2020-11-05,,https://patents.google.com/patent/US20200347524A1/en,https://patentimages.storage.googleapis.com/f5/09/2f/6157eba62455e4/US20200347524A1-20201105-D00000.png
US-2020350295-A1,Light-emitting device ,Innolux Corporation,"Shun-Yuan HU, Chin-Lung Ting, Ker-Yih Kao, Li-Wei Mao",2019-05-02,2020-04-29,2020-11-05,,https://patents.google.com/patent/US20200350295A1/en,https://patentimages.storage.googleapis.com/e6/b6/42/663e36908d6411/US20200350295A1-20201105-D00000.png
US-2020357326-A1,Gate driver circuit and driving method of touch display panel ,Hannstar Display Corporation,Ya-Wen Lee,2019-05-06,2020-04-29,2020-11-12,,https://patents.google.com/patent/US20200357326A1/en,https://patentimages.storage.googleapis.com/86/2b/39/073aa3c82cc6e3/US20200357326A1-20201112-D00000.png
US-2020381461-A1,Active array substrate and fabricating method thereof ,E Ink Holdings Inc.,"Chien-Hung Lin, Ian French, Sheng-Long Lin, Xian-Teng CHUNG",2019-05-28,2020-04-29,2020-12-03,,https://patents.google.com/patent/US20200381461A1/en,https://patentimages.storage.googleapis.com/f2/fb/b4/848bc43c6f08c4/US20200381461A1-20201203-D00000.png
US-2020353675-A1,Apparatus and method for generating a 3d structure ,Xeikon Prepress Nv,Bart Marc Luc Wattyn,2019-05-06,2020-04-29,2020-11-12,,https://patents.google.com/patent/US20200353675A1/en,https://patentimages.storage.googleapis.com/fe/6d/96/8f09c54ad7c657/US20200353675A1-20201112-D00000.png
US-2020349336-A1,Electronic device ,Innolux Corporation,"Chandra LIUS, Kuan-Feng LEE",2019-05-03,2020-04-28,2020-11-05,,https://patents.google.com/patent/US20200349336A1/en,https://patentimages.storage.googleapis.com/96/40/25/29cf52d0179c6d/US20200349336A1-20201105-D00000.png
US-2020357971-A1,Electronic device ,Innolux Corporation,"Ming-Chang Lin, Tzu-Min Yan",2019-05-09,2020-04-27,2020-11-12,,https://patents.google.com/patent/US20200357971A1/en,https://patentimages.storage.googleapis.com/e3/1f/42/35af4672d2d2b2/US20200357971A1-20201112-D00000.png
US-2020375461-A1,Flexible brain probe over guidewire ,Biosense Webster (Israel) Ltd.,Assaf Govari,2019-05-28,2020-04-24,2020-12-03,,https://patents.google.com/patent/US20200375461A1/en,https://patentimages.storage.googleapis.com/88/c0/86/11005c51b4c29f/US20200375461A1-20201203-D00000.png
US-2020375492-A1,Brain signal tracking ,Biosense Webster (Israel) Ltd.,Assaf Govari,2019-05-28,2020-04-24,2020-12-03,,https://patents.google.com/patent/US20200375492A1/en,https://patentimages.storage.googleapis.com/51/62/f5/f6915a25d3c189/US20200375492A1-20201203-D00000.png
US-2020363882-A1,"Input sensing unit, display device including same, and method for manufacturing same ","Samsung Display Co., Ltd.","Youngeun NAM, JongWon Moon, Hyeaweon SHIN, Cheolhwan EOM",2019-05-13,2020-04-14,2020-11-19,,https://patents.google.com/patent/US20200363882A1/en,https://patentimages.storage.googleapis.com/ef/e1/58/d66c89101388c3/US20200363882A1-20201119-D00000.png
US-2020365823-A1,"Display module, display apparatus including the same, and method of manufacturing the display apparatus ","Samsung Display Co., Ltd.",Geunwoo YUG,2019-05-17,2020-04-09,2020-11-19,,https://patents.google.com/patent/US20200365823A1/en,https://patentimages.storage.googleapis.com/79/05/79/8bd2d23abc6283/US20200365823A1-20201119-D00000.png
US-2020373858-A1,Acoustic device ,Tdk Corporation,"Akira Satoh, Yoshikazu SHIMURA, Kaoru Kijima",2019-05-20,2020-05-11,2020-11-26,,https://patents.google.com/patent/US20200373858A1/en,https://patentimages.storage.googleapis.com/de/83/09/b39e6c34eb5711/US20200373858A1-20201126-D00000.png
US-2020363699-A1,Optical element driving mechanism ,Tdk Taiwan Corp.,"Chao-Hsi Wang, Chao-Chang Hu, Kuen-Wang TSAI, Chih-Wei Weng, Sin-Jhong SONG",2019-05-17,2020-04-08,2020-11-19,,https://patents.google.com/patent/US20200363699A1/en,https://patentimages.storage.googleapis.com/48/83/30/5454be2292cf68/US20200363699A1-20201119-D00000.png
US-2020363671-A1,Display Panel With Integrated Force-Touch Sensor And Display Device Including Same ,"Iljin Display Co., Ltd.","Kyun AHN, Yunhee CHUNG, Jun Sik KANG, Han Ju Yu, Yong Hee Shin",2019-05-14,2020-04-03,2020-11-19,,https://patents.google.com/patent/US20200363671A1/en,https://patentimages.storage.googleapis.com/06/00/09/309705bef1afa3/US20200363671A1-20201119-D00000.png
US-2020352642-A1,Using Pulmonary Vein Isolation for Patients with Atrial Fibrillation ,Biosense Webster (Israel) Ltd.,"Anthony Hong, Lee Ming BOO",2019-05-06,2020-03-30,2020-11-12,,https://patents.google.com/patent/US20200352642A1/en,https://patentimages.storage.googleapis.com/cf/bd/ca/95519f66476bc3/US20200352642A1-20201112-D00000.png
US-2020380918-A1,Display device ,"Samsung Display Co., Ltd.","Seung Hwan Cho, Ki Nyeng KANG, Sang Hoon Lee, Sun Ho Kim, Tae Woo Kim, Tae Hoon YANG, Jong Hyun Choi",2019-05-27,2020-03-27,2020-12-03,,https://patents.google.com/patent/US20200380918A1/en,https://patentimages.storage.googleapis.com/14/e3/96/7a497e10ede5a1/US20200380918A1-20201203-D00000.png
US-2020348560-A1,Display device ,Lg Electronics Inc.,"Changhwan YI, Dongho HAM, Sangyeol KIM",2019-05-03,2020-03-24,2020-11-05,,https://patents.google.com/patent/US20200348560A1/en,https://patentimages.storage.googleapis.com/4f/3a/99/522c84573636bb/US20200348560A1-20201105-D00000.png
US-2020356217-A1,Display device ,"Samsung Display Co., Ltd.","Sang Won Jeong, Tae Young Koo, Min Chul Song, In Young YOON",2019-05-07,2020-03-20,2020-11-12,,https://patents.google.com/patent/US20200356217A1/en,https://patentimages.storage.googleapis.com/41/4f/be/232865d5e898ca/US20200356217A1-20201112-D00000.png
US-2020381505-A1,Display device ,"Samsung Display Co., Ltd.","Seunghwan CHO, Minsoo Kim",2019-05-27,2020-03-18,2020-12-03,,https://patents.google.com/patent/US20200381505A1/en,https://patentimages.storage.googleapis.com/6a/32/f3/162669364c5b35/US20200381505A1-20201203-D00000.png
US-2020348452-A1,Method for manufacturing window and method for manufacturing display device ,"Samsung Display Co., Ltd.","Byoungyul Shim, Seungyo Yang, Jaeseung Jeon, Hyun Chul Jung",2019-05-03,2020-03-18,2020-11-05,,https://patents.google.com/patent/US20200348452A1/en,https://patentimages.storage.googleapis.com/d9/89/cb/4d5ab83c6972cb/US20200348452A1-20201105-D00000.png
US-2020358014-A1,"Display component, display device, and method for manufacturing same ","Samsung Display Co., Ltd.","Sungjune Park, ByeongKyu PARK",2019-05-07,2020-03-04,2020-11-12,,https://patents.google.com/patent/US20200358014A1/en,https://patentimages.storage.googleapis.com/4d/0f/8e/ba12aedf8ff169/US20200358014A1-20201112-D00000.png
US-2020356143-A1,Flexible display device including heat dissipation structure ,"Samsung Electronics Co., Ltd.","Hyunchul Oh, Minsoo Kim, Hokyung KANG, Yundong KIM, Bowoong SEO, Seokwoo Lee, Hyunsuk CHOI",2019-05-10,2020-05-08,2020-11-12,,https://patents.google.com/patent/US20200356143A1/en,https://patentimages.storage.googleapis.com/55/6c/05/503183a611cddc/US20200356143A1-20201112-D00000.png
