US-2021004868-A1,Systems and methods for targeting bid and position for a keyword ,"Capital One Services, Llc","James O. H. MONTGOMERY, Athanassios KINTSAKIS, Keegan Hines",2019-07-02,2019-07-02,2021-01-07,,https://patents.google.com/patent/US20210004868A1/en,https://patentimages.storage.googleapis.com/97/4d/8b/04e7da0714c3c3/US20210004868A1-20210107-D00000.png
US-2021025679-A1,Operating light sources to project patterns for disorienting visual detection systems ,Nec Corporation Of America,"Yaacov HOCH, Tsvi Lev",2019-07-23,2019-07-23,2021-01-28,,https://patents.google.com/patent/US20210025679A1/en,https://patentimages.storage.googleapis.com/e6/2b/bf/bae5f3d2e3cfa5/US20210025679A1-20210128-D00000.png
US-2021023533-A1,Magnetic composite containing polyethylenimine functionalized actived carbon and methods thereof ,King Fahd University Of Petroleum And Minerals,"Tawfik Abdo Saleh Awadh, Akram Abdulhakeem Al-Absi",2019-07-23,2019-07-23,2021-01-28,,https://patents.google.com/patent/US20210023533A1/en,https://patentimages.storage.googleapis.com/0c/ac/84/fa1a6abc37e71f/US20210023533A1-20210128-D00000.png
US-2021025064-A1,Transition metal phosphide supported on carbon nanosheets ,King Fahd University Of Petroleum And Minerals,"Mohammad Nahid Siddiqui, Mohammad Qamar, Alaaldin Mohamed Abdalla ADAM, Munzir H. SULIMAN",2019-07-22,2019-07-22,2021-01-28,,https://patents.google.com/patent/US20210025064A1/en,https://patentimages.storage.googleapis.com/d6/92/5d/74168838b89ef7/US20210025064A1-20210128-D00001.png
US-2021017083-A1,Cement compositions containing phyllosilicate and methods of use ,King Fahd University Of Petroleum And Minerals,"Salaheldin ELKATATNY, Ahmed Abdulhamid MAHMOUD, Abdulmalek AHMED",2019-07-19,2019-07-19,2021-01-21,,https://patents.google.com/patent/US20210017083A1/en,https://patentimages.storage.googleapis.com/8b/52/18/ad03ca4881d9cf/US20210017083A1-20210121-D00000.png
US-2021016029-A1,Portable ventilator and methods for providing oscillatory flow ,"Mackay Memorial Hospital, National Chiao Tung University","Hsu-Tah KUO, Chien-Liang Wu, Wen-Jui Wu, Yu-Te Liao, Shao-Yung Lu",2019-07-19,2019-07-19,2021-01-21,,https://patents.google.com/patent/US20210016029A1/en,https://patentimages.storage.googleapis.com/d5/01/35/85c80d4078f3ad/US20210016029A1-20210121-D00000.png
US-11048796-B2,Securely performing parameter data updates ,Siemens Healthcare Gmbh,"Martin Kraus, Andre Aichert",2019-07-19,2020-07-09,2021-06-29,2021-06-29,https://patents.google.com/patent/US11048796B2/en,https://patentimages.storage.googleapis.com/94/e8/87/38df2a0a7cdbed/US11048796-20210629-D00000.png
US-10932002-B2,Cross-media measurement device and method ,"Hyphametrics, Inc.","Gerardo Lopez Zamudio, Joanna Drews",2019-07-09,2020-07-09,2021-02-23,2021-02-23,https://patents.google.com/patent/US10932002B2/en,https://patentimages.storage.googleapis.com/a2/f2/f5/57e3a40baf1883/US10932002-20210223-D00000.png
US-11169458-B2,Toner ,Canon Kabushiki Kaisha,"Noritaka Toyoizumi, Takashi Kenmoku, Yuzo Seino, Kenta Kamikura, Yu Yoshida, Akane Masumoto",2019-07-25,2020-07-22,2021-11-09,2021-11-09,https://patents.google.com/patent/US11169458B2/en,https://patentimages.storage.googleapis.com/b7/14/84/81a7fa18dbc7cf/US11169458-20211109-D00000.png
US-11178337-B2,"Image capturing apparatus, method of controlling the same, and non-transitory computer readable storage medium for calculating a depth width for an object area based on depth information ",Canon Kabushiki Kaisha,Kensei Ikeda,2019-07-29,2020-07-23,2021-11-16,2021-11-16,https://patents.google.com/patent/US11178337B2/en,https://patentimages.storage.googleapis.com/de/7f/b0/c8391933a235f4/US11178337-20211116-D00000.png
US-2021024378-A1,Graphene reinforced polystyrene composite for separation of nonpolar compounds from water ,King Fahd University Of Petroleum And Minerals,"Tawfik Abdo Saleh Awadh, Nadeem BAIG",2019-07-24,2019-07-24,2021-01-28,,https://patents.google.com/patent/US20210024378A1/en,https://patentimages.storage.googleapis.com/81/5c/df/171715bad74167/US20210024378A1-20210128-D00000.png
US-2021023367-A1,Av synchronous septal pacing ,"Medtronic, Inc.",Subham Ghosh,2019-07-24,2019-07-24,2021-01-28,,https://patents.google.com/patent/US20210023367A1/en,https://patentimages.storage.googleapis.com/da/99/21/9cd8ad43bb0373/US20210023367A1-20210128-D00000.png
US-2021025158-A1,Concrete wall panels with flexible insulation material ,King Fahd University Of Petroleum And Minerals,"Luai M. ALHEMS, Mohammed IBRAHIM, Aftab Ahmad, Mohammed Salihu Barry",2019-07-26,2019-07-26,2021-01-28,,https://patents.google.com/patent/US20210025158A1/en,https://patentimages.storage.googleapis.com/a8/a5/06/f61c0fa8ed9a0f/US20210025158A1-20210128-D00000.png
US-2021010806-A1,Rotatable optical module for projecting structured light and electronic device using the same ,Triple Win Technology(Shenzhen) Co.Ltd.,"Shin-Wen Chen, Long-Fei Zhang, Kun Li, Ye-Quang Chen, Xiao-Mei Ma",2019-07-08,2019-08-06,2021-01-14,,https://patents.google.com/patent/US20210010806A1/en,https://patentimages.storage.googleapis.com/65/e1/d3/3f61b838dfc9d9/US20210010806A1-20210114-D00000.png
US-2021015392-A1,"Deep intracranial electrode, electroencephalograph and manufacturing method thereof ","Neuroechos Medical (Shenzhen) Co., Ltd","Xijun GUAN, Xiaolong MO",2019-07-17,2019-08-23,2021-01-21,,https://patents.google.com/patent/US20210015392A1/en,https://patentimages.storage.googleapis.com/54/d9/87/002c688641d88a/US20210015392A1-20210121-D00000.png
US-2021026521-A1,Multimedia device and method for controlling the same ,Lg Electronics Inc.,Sukmin LEE,2019-07-25,2019-08-28,2021-01-28,,https://patents.google.com/patent/US20210026521A1/en,https://patentimages.storage.googleapis.com/cb/1f/9f/482cea07bd9452/US20210026521A1-20210128-D00000.png
US-2021015931-A1,IMMUNOREGULATORY PROTEIN-siRNA COMPLEX HAVING ANTICANCER ACTIVITY ,Korea Institute Of Science And Technology,"Sun Hwa Kim, Ick Chan Kwon, In-San Kim, Kwangmeyung KIM, Yoosoo YANG, Young-ji KO",2019-07-16,2019-09-17,2021-01-21,,https://patents.google.com/patent/US20210015931A1/en,https://patentimages.storage.googleapis.com/cc/7e/f2/572d6c89d73c4a/US20210015931A1-20210121-D00000.png
US-2021008729-A1,Robot for making coffee and method for controlling the same ,Lg Electronics Inc.,Taeyoung Choi,2019-07-12,2019-10-01,2021-01-14,,https://patents.google.com/patent/US20210008729A1/en,https://patentimages.storage.googleapis.com/46/b3/b3/13ae80274b2660/US20210008729A1-20210114-D00000.png
US-2021023825-A1,"Decorative film, packaging material using same, and label sticker using same ",Hsing-Lieh Chuang,Hsing-Lieh Chuang,2019-07-24,2019-10-16,2021-01-28,,https://patents.google.com/patent/US20210023825A1/en,https://patentimages.storage.googleapis.com/c0/3a/62/24f8fa7baa881f/US20210023825A1-20210128-D00000.png
US-2021024363-A1,"Dumbbell-shaped calcium hydroxide nanoparticles, an enhanced fuel comprising the nanoparticles, and a method for making ",King Fahd University Of Petroleum And Minerals,"Mohammad Ramzan Saeed Ashraf Janjua, Saba JAMIL, Shanza Rauf KHAN",2019-07-22,2019-10-17,2021-01-28,,https://patents.google.com/patent/US20210024363A1/en,https://patentimages.storage.googleapis.com/01/a2/eb/5849f44e2fde52/US20210024363A1-20210128-D00000.png
US-2021004595-A1,"Image processing method and apparatus, electronic device, readable storage medium ","Beijing Xiaomi Mobile Software Co., Ltd.","Xirui DU, Junzeng Du",2019-07-01,2019-11-29,2021-01-07,,https://patents.google.com/patent/US20210004595A1/en,https://patentimages.storage.googleapis.com/38/e4/e1/29ceb580905df7/US20210004595A1-20210107-D00000.png
US-2021023440-A1,Terminal connected to action robot and operating method thereof ,Lg Electronics Inc.,"Yongkyoung SHIN, Sanghun Kim",2019-07-23,2020-01-28,2021-01-28,,https://patents.google.com/patent/US20210023440A1/en,https://patentimages.storage.googleapis.com/eb/1d/35/a49a44e7afb06b/US20210023440A1-20210128-D00000.png
US-2021261624-A1,Rubella virus spike construct ,"Institut Virion \ Serion GmbH, Judith STUERMER","Thomas Schumacher, Hugo ARENDS",2019-07-10,2020-02-14,2021-08-26,,https://patents.google.com/patent/US20210261624A1/en,https://patentimages.storage.googleapis.com/05/30/6f/caf2cbce1089b6/US20210261624A1-20210826-D00000.png
US-2021026497-A1,Display device ,"Samsung Display Co., Ltd.","Soo Jung Lee, Suk Kim, Ki Seo KIM, Yu Na Kim, Keum Dong JUNG, Go Eun CHA",2019-07-23,2020-03-25,2021-01-28,,https://patents.google.com/patent/US20210026497A1/en,https://patentimages.storage.googleapis.com/f7/58/fa/1d699ffa005a79/US20210026497A1-20210128-D00000.png
US-2021005317-A1,Methods and systems for achieving vibrant constitution based on user inputs ,Kenneth Neumann,Kenneth Neumann,2019-07-03,2019-07-03,2021-01-07,,https://patents.google.com/patent/US20210005317A1/en,https://patentimages.storage.googleapis.com/2e/b2/da/46cfb0f19de4d7/US20210005317A1-20210107-D00000.png
US-2021005304-A1,Methods and systems for generating a supplement instruction set using artificial intelligence ,"Kpn Innovations, Llc",Kenneth Neumann,2019-07-03,2020-04-01,2021-01-07,,https://patents.google.com/patent/US20210005304A1/en,https://patentimages.storage.googleapis.com/be/1a/9e/8a41a44d88d54f/US20210005304A1-20210107-D00000.png
US-2021013280-A1,Semiconductor device and method for fabricating the same ,"Samsung Display Co., Ltd.","Ji Eun CHOI, Deok Hoi Kim, Jeong Hwan Kim, Jong Baek Seon, Jun Cheol SHIN, Jae hak Lee",2019-07-09,2020-04-03,2021-01-14,,https://patents.google.com/patent/US20210013280A1/en,https://patentimages.storage.googleapis.com/b2/d1/67/9269f774bc2aea/US20210013280A1-20210114-D00000.png
US-2021017582-A1,Detection of genomic sequences and probe molecules therefor ,Safeguard Biosystems Holdings Ltd.,"Holger Klapproth, Sonja Bednar",2019-07-19,2020-04-03,2021-01-21,,https://patents.google.com/patent/US20210017582A1/en,https://patentimages.storage.googleapis.com/39/cd/7f/db902265d6b314/US20210017582A1-20210121-D00001.png
US-2021001081-A1,Tubular element for medical use ,Fiab S.P.A.,"Alberto Calabro', Antonio Fasano, Paolo Vettori",2019-07-04,2020-04-30,2021-01-07,,https://patents.google.com/patent/US20210001081A1/en,https://patentimages.storage.googleapis.com/05/b3/26/f68f4e9c09c077/US20210001081A1-20210107-D00000.png
US-2021016431-A1,Robot and method for recognizing wake-up word thereof ,Lg Electronics Inc.,Namgeon KIM,2019-07-19,2020-05-01,2021-01-21,,https://patents.google.com/patent/US20210016431A1/en,https://patentimages.storage.googleapis.com/9a/1b/6c/ae28da4c6f4430/US20210016431A1-20210121-D00000.png
US-2021011100-A1,Systems and methods for pulse sequence configuration in magnetic resonance imaging ,"Shanghai United Imaging Healthcare Co., Ltd.",Xiaomao GONG,2019-07-08,2020-05-07,2021-01-14,,https://patents.google.com/patent/US20210011100A1/en,https://patentimages.storage.googleapis.com/f9/9d/28/3d46c6498253a5/US20210011100A1-20210114-D00000.png
US-2021027667-A1,Display module ,"Samsung Display Co., Ltd.","Chansong Lee, Jihwa Lee, Minju Oh",2019-07-22,2020-05-19,2021-01-28,,https://patents.google.com/patent/US20210027667A1/en,https://patentimages.storage.googleapis.com/67/dd/50/5d4788e3da171c/US20210027667A1-20210128-D00000.png
US-2021005135-A1,Display device capable of determining a bonding state of a driver integrated circuit therein ,"Samsung Display Co., Ltd.",Youngbin Kim,2019-07-05,2020-05-19,2021-01-07,,https://patents.google.com/patent/US20210005135A1/en,https://patentimages.storage.googleapis.com/8f/32/88/3d9cf0f399f000/US20210005135A1-20210107-D00000.png
US-2021024548-A1,Boron-containing pharmacophore ,Massachusetts Institute Of Technology,"Ronald T. Raines, Ian William Windsor, Brian James Graham",2019-07-25,2020-05-22,2021-01-28,,https://patents.google.com/patent/US20210024548A1/en,https://patentimages.storage.googleapis.com/8f/31/78/da48c0cc27f07c/US20210024548A1-20210128-D00000.png
US-2021022248-A1,Flexble circuit board and display device includinging the same ,"Samsung Display Co., Ltd.","Seungjin Lim, Chung-Seok Lee",2019-07-17,2020-06-08,2021-01-21,,https://patents.google.com/patent/US20210022248A1/en,https://patentimages.storage.googleapis.com/4e/60/b4/910b51ced4735f/US20210022248A1-20210121-D00000.png
US-2021288267-A1,Asymmetric Non-Fullerene Acceptor and Organic Photovoltaic Device Comprising the Same ,The Regents Of The University Of Michigan,"Stephen R. Forrest, Yongxi LI",2019-07-17,2020-06-17,2021-09-16,,https://patents.google.com/patent/US20210288267A1/en,https://patentimages.storage.googleapis.com/b4/8c/a1/aefb5657d728d9/US20210288267A1-20210916-D00000.png
US-2021020075-A1,Secure grip sign holder ,"K-International, Inc.",Ryan Masek,2019-07-18,2019-07-18,2021-01-21,,https://patents.google.com/patent/US20210020075A1/en,https://patentimages.storage.googleapis.com/fc/26/3e/2cfc4ccb43f3e2/US20210020075A1-20210121-D00000.png
US-2021005690-A1,Electronic panel and electronic device having the same ,"Samsung Display Co.,Ltd.","Minji Lee, Hyungjun AN, Jeongoh Jin",2019-07-05,2020-06-18,2021-01-07,,https://patents.google.com/patent/US20210005690A1/en,https://patentimages.storage.googleapis.com/35/c5/e4/e438ba2ee769d3/US20210005690A1-20210107-D00000.png
US-2021004135-A1,Detection sensor and display device ,"Samsung Display Co., Ltd.","Do Ik Kim, Kang Won LEE, Choon Hyop LEE",2019-07-02,2020-06-19,2021-01-07,,https://patents.google.com/patent/US20210004135A1/en,https://patentimages.storage.googleapis.com/3e/64/34/4d7802e763e127/US20210004135A1-20210107-D00000.png
US-2021017499-A1,Siloxane polymer-based cancer stem cell preparation method ,Korea Advanced Institute Of Science And Technology,"Sang Yong Jon, Jun Hyuk Song, Daeyoup Lee, Yoomi Lee",2019-07-18,2020-06-26,2021-01-21,,https://patents.google.com/patent/US20210017499A1/en,https://patentimages.storage.googleapis.com/e8/7b/b6/c9bb1a94454efa/US20210017499A1-20210121-D00000.png
US-2021024985-A1,Devices and Methods Useful for Imaging Transient and Rare Mechanical Events in Cells ,Emory University,"Khalid Salaita, Rong Ma",2019-07-26,2020-06-26,2021-01-28,,https://patents.google.com/patent/US20210024985A1/en,https://patentimages.storage.googleapis.com/c1/0c/b8/943488dbec306a/US20210024985A1-20210128-D00000.png
US-2021001627-A1,Liquid ejecting apparatus ,Seiko Epson Corporation,"Kazuaki UCHIDA, Shunya Fukuda",2019-07-01,2020-06-29,2021-01-07,,https://patents.google.com/patent/US20210001627A1/en,https://patentimages.storage.googleapis.com/ef/dc/70/111cb14ba4c284/US20210001627A1-20210107-D00000.png
US-2021002947-A1,Flexible cover window ,Uti Inc.,"Deok Young Park, Jae Young HWANG, Hak Chul Kim, Kukhyun Sunwoo, Tea Joo Ha",2019-07-03,2020-06-29,2021-01-07,,https://patents.google.com/patent/US20210002947A1/en,https://patentimages.storage.googleapis.com/22/4e/c6/735e60b0472bfe/US20210002947A1-20210107-D00000.png
US-2021001068-A1,Medical ventilator with internal casing including a motorized mirco-blower and gas circuits ,Air Liquide Medical Systems,Romain Davoine,2019-07-05,2020-06-30,2021-01-07,,https://patents.google.com/patent/US20210001068A1/en,https://patentimages.storage.googleapis.com/89/71/3e/62416efcbaf0e5/US20210001068A1-20210107-D00000.png
US-2021008461-A1,Virtual Puppeteering Using a Portable Device ,"Disney Enterprises Inc., Eth Zurich","Raphael Anderegg, Loic Ciccone, Robert W. Sumner",2019-07-11,2020-06-30,2021-01-14,,https://patents.google.com/patent/US20210008461A1/en,https://patentimages.storage.googleapis.com/1a/f1/d2/7ff5206cffc692/US20210008461A1-20210114-D00000.png
US-2021102089-A1,"Biobased, non-isocyanate, 2k polyurethane coatings produced from polycarbamate and dialdehyde crosslinking ",Ndsu Research Foundation,"Dean C. Webster, Mukund P. Sibi, Samantha D. SILBERT, Eric M. SERUM",2019-07-01,2020-06-30,2021-04-08,,https://patents.google.com/patent/US20210102089A1/en,https://patentimages.storage.googleapis.com/f7/e5/2c/8a703205b022f8/US20210102089A1-20210408-D00000.png
US-2021002536-A1,Solution-processable superatomic thin-films ,"The Trustees Of Columbia University In The City Of New York, Carnegie Mellon University","Colin Nuckolls, JingJing Yang, Alexander D. Christodoulides, Boyuan Zhang, Qizhi Xu, Amirali Zangiabadi, Christine McGinn, Samuel Peurifoy, Lingyun Dai, Elena Meirzadeh, Michael Steigerwald, Xavier Roy, Ioannis Kymissis, Jonathan A. Malen",2019-07-01,2020-06-30,2021-01-07,,https://patents.google.com/patent/US20210002536A1/en,https://patentimages.storage.googleapis.com/a4/e8/5b/b0c5f8fb2e522a/US20210002536A1-20210107-D00000.png
US-2021027801-A1,Systems and methods for remote multi-directional bark deterrence ,Radio Systems Corporation,"Richard Seltzer, Jonathan William Huber, Paul Case, John Hatcher",2019-07-25,2019-07-25,2021-01-28,,https://patents.google.com/patent/US20210027801A1/en,https://patentimages.storage.googleapis.com/5f/2a/d8/25020f2a9baeea/US20210027801A1-20210128-D00000.png
US-11190866-B2,Display device ,"Samsung Display Co., Ltd.","Jeong Heon Lee, Jong Tae Kim, Young Sik Kim",2019-07-09,2020-06-30,2021-11-30,2021-11-30,https://patents.google.com/patent/US11190866B2/en,https://patentimages.storage.googleapis.com/46/c5/76/faea66445b0582/US11190866-20211130-D00000.png
US-2021015438-A1,Deep learning for perfusion in medical imaging ,Siemens Healthcare Gmbh,"Pooyan Sahbaee Bagherzadeh, Puneet Sharma",2019-07-16,2019-07-16,2021-01-21,,https://patents.google.com/patent/US20210015438A1/en,https://patentimages.storage.googleapis.com/3d/0b/f5/d7c4bde744e63b/US20210015438A1-20210121-D00000.png
US-2021015449-A1,Methods and systems for processing and displaying fetal images from ultrasound imaging data ,GE Precision Healthcare LLC,"Helmut Brandl, Erwin Fosodeder",2019-07-16,2019-07-16,2021-01-21,,https://patents.google.com/patent/US20210015449A1/en,https://patentimages.storage.googleapis.com/5e/4d/c3/22ec2e0284ebd6/US20210015449A1-20210121-D00000.png
US-2021024447-A1,Functionalized long-chain hydrocarbon mono- and di-carboxylic acids and their use for the prevention or treatment of disease ,"Espervita Therapeutics, Inc.",Daniela Carmen Oniciu,2019-07-26,2020-07-23,2021-01-28,,https://patents.google.com/patent/US20210024447A1/en,https://patentimages.storage.googleapis.com/65/1b/d8/4466e6b0a104ca/US20210024447A1-20210128-D00000.png
US-2021015448-A1,Methods and systems for imaging a needle from ultrasound imaging data ,GE Precision Healthcare LLC,"Alexander Sokulin, Cynthia Owen, Menachem Halmann, Dani Pinkovich",2019-07-15,2019-07-15,2021-01-21,,https://patents.google.com/patent/US20210015448A1/en,https://patentimages.storage.googleapis.com/82/79/13/72c40e99fbc81f/US20210015448A1-20210121-D00000.png
US-2021014589-A1,Display device ,"Samsung Display Co., Ltd.","Jeong Heon Lee, Jong Tae Kim, Young Sik Kim",2019-07-09,2020-06-30,2021-01-14,,https://patents.google.com/patent/US20210014589A1/en,https://patentimages.storage.googleapis.com/36/b1/85/77bcbc4cbc2037/US20210014589A1-20210114-D00000.png
US-2021027460-A1,Medical image processing method and apparatus ,Canon Medical Systems Corporation,"Erin Beveridge, Paul Thomson, Brian MOHR, Georgios DIAKIDIS, Naotaka SAKASHITA",2019-07-25,2020-06-30,2021-01-28,,https://patents.google.com/patent/US20210027460A1/en,https://patentimages.storage.googleapis.com/d6/a0/81/9ef30235bb1ce3/US20210027460A1-20210128-D00000.png
US-2021000691-A1,Syringe holder assembly ,Eric Bekemeyer,Eric Bekemeyer,2019-07-01,2020-06-30,2021-01-07,,https://patents.google.com/patent/US20210000691A1/en,https://patentimages.storage.googleapis.com/75/b8/78/7b0cc12ab7e3ab/US20210000691A1-20210107-D00000.png
US-2021047342-A1,Prodrugs of modulators of the nmda receptor ,H. Lundbeck A/S,"John Paul Kilburn, Erhad Ascic, Mauro Marigo, Laurent David",2019-07-03,2020-06-30,2021-02-18,,https://patents.google.com/patent/US20210047342A1/en,https://patentimages.storage.googleapis.com/f9/18/44/d8d94e3ecf4cdb/US20210047342A1-20210218-D00000.png
US-2021032296-A1,Alkali-Tolerant Affinity Chromatography Ligands ,Bioprocessia Technologies Llc,Yinong Zong,2019-07-03,2020-07-02,2021-02-04,,https://patents.google.com/patent/US20210032296A1/en,https://patentimages.storage.googleapis.com/8c/46/d2/8bb5a5fb7728c0/US20210032296A1-20210204-D00000.png
US-2021023083-A1,Diagnosis and regulation of epidermal differentiation and cancer cell activity ,The Board Of Trustees Of The Leland Stanford Junior University,Carolyn Lee,2019-07-11,2020-07-02,2021-01-28,,https://patents.google.com/patent/US20210023083A1/en,https://patentimages.storage.googleapis.com/22/86/f6/dee60f586650e3/US20210023083A1-20210128-D00001.png
US-2021001305-A1,Monolithic trace-contaminant sorbents fabricated from 3d-printed polymer precursors ,"Advanced Fuel Research, Inc.","Joseph E. Cosgrove, Marek A. Wójtowicz, Michael A. Serio, Andrew E. Carlson",2019-07-04,2020-07-03,2021-01-07,,https://patents.google.com/patent/US20210001305A1/en,https://patentimages.storage.googleapis.com/f2/f2/5d/31aac178a36b4a/US20210001305A1-20210107-D00000.png
US-2021002508-A1,"Slurry Floor Treatment Technology, Such As Curable Epoxy Resin-Based Systems, Other Resin Systems, and Related Resin Coat Methods ","Tennant Coatings, Inc.","Thomas M. Lux, Kevin K. Hobbie, Christopher B. Adams",2019-07-05,2020-07-03,2021-01-07,,https://patents.google.com/patent/US20210002508A1/en,https://patentimages.storage.googleapis.com/5d/c4/ca/38f8aa540265d6/US20210002508A1-20210107-D00000.png
US-2021009176-A1,Collapsible support structure ,"Sunny Fold, Llc",Joseph E. Panigot,2019-07-09,2020-07-06,2021-01-14,,https://patents.google.com/patent/US20210009176A1/en,https://patentimages.storage.googleapis.com/7a/d8/cb/ae69182883f74c/US20210009176A1-20210114-D00000.png
US-2021009939-A1,Compositions and methods for maximizing malonyl-coa in e. coli ,Board Of Supervisors Of Louisiana State University And Agricultural And Mechan,"Grover L. Waldrop, Tatiana Thompson Silveira Mello, Marcio de Queiroz",2019-07-08,2020-07-07,2021-01-14,,https://patents.google.com/patent/US20210009939A1/en,https://patentimages.storage.googleapis.com/66/21/ab/be99c3415407a5/US20210009939A1-20210114-D00000.png
US-2021012947-A1,Electronic component ,Tdk Corporation,"Yuya ISHIMA, Shinichi Kondo, Kosuke Ito, Shingo Hattori, Kazuya TOBITA, Noriaki HAMACHI, Atsushi Moriya",2019-07-09,2020-07-07,2021-01-14,,https://patents.google.com/patent/US20210012947A1/en,https://patentimages.storage.googleapis.com/7b/f1/96/49054052083417/US20210012947A1-20210114-D00000.png
US-2021002990-A1,Compositions and Methods for Pressure Protection ,Chevron U.S.A. Inc.,"Samiha Said Elsayed MORSY, Nabijan Nizamidin, Taimur Malik, Mohsen S. TAGAVIFAR",2019-07-07,2020-07-07,2021-01-07,,https://patents.google.com/patent/US20210002990A1/en,https://patentimages.storage.googleapis.com/f6/ca/0c/ccf24e64a1c3c6/US20210002990A1-20210107-D00000.png
US-2021011614-A1,Method and apparatus for mood based computing experience ,Ambience LLC,"Samuel Gustman, Valerie Karno",2019-07-10,2020-07-08,2021-01-14,,https://patents.google.com/patent/US20210011614A1/en,https://patentimages.storage.googleapis.com/20/5b/7f/7734e330b60236/US20210011614A1-20210114-D00000.png
US-2021012036-A1,"Systems, devices, and methods for prevention of recording content ",Peanut Butter and Jelly TV L.L.C.,Robert Franzo,2019-07-12,2020-07-09,2021-01-14,,https://patents.google.com/patent/US20210012036A1/en,https://patentimages.storage.googleapis.com/96/42/5a/d1babfac176edb/US20210012036A1-20210114-D00000.png
US-2021012505-A1,System and method for multi-scale coarse-to-fine segmentation of images to detect pancreatic ductal adenocarcinoma ,The Johns Hopkins University,"Alan Yuille, Elliott Fishman, Zhuoton Zhu, Yingda Xia, Lingxi Xie",2019-07-09,2020-07-09,2021-01-14,,https://patents.google.com/patent/US20210012505A1/en,https://patentimages.storage.googleapis.com/df/ce/a2/860eaac8ec71a6/US20210012505A1-20210114-D00000.png
US-2021074403-A1,Methods and systems for optimizing dietary levels utilizing artificial intelligence ,Kenneth Neumann,Kenneth Neumann,2019-07-03,2019-07-03,2021-03-11,,https://patents.google.com/patent/US20210074403A1/en,https://patentimages.storage.googleapis.com/67/0f/c1/af55fd823c98c8/US20210074403A1-20210311-D00000.png
US-2021012456-A1,"Information processing method, image processing apparatus, and storage medium ",Canon Kabushiki Kaisha,Yoshinori Hashimoto,2019-07-10,2020-07-10,2021-01-14,,https://patents.google.com/patent/US20210012456A1/en,https://patentimages.storage.googleapis.com/93/a4/f4/04afb3c67dee24/US20210012456A1-20210114-D00000.png
US-2021017780-A1,Convertible pool cover system and apparatus ,Texas Tiny Pools,Amy Dunnem Hageman,2019-07-15,2020-07-15,2021-01-21,,https://patents.google.com/patent/US20210017780A1/en,https://patentimages.storage.googleapis.com/5a/70/76/058466ab0065fa/US20210017780A1-20210121-D00000.png
US-2021015614-A1,Independent proximal element actuation methods ,"Evalve, Inc.","Koji Kizuka, Richard Childs, Gabriel GONZALES, Dylan Van Hoven, Chad Abunassar, Travis Marsot, Rob Mosley, Nisu PATEL, Francisco Valencia",2019-07-15,2020-07-15,2021-01-21,,https://patents.google.com/patent/US20210015614A1/en,https://patentimages.storage.googleapis.com/d6/d8/ff/00b34dedb9c14a/US20210015614A1-20210121-D00000.png
US-2021032354-A1,Methods for treating or preventing asthma by administering an il-4r antagonist ,"Sanofi Biotechnology, Regeneron Pharmaceuticals, Inc.","Heribert Staudinger, Ariel Teper, Nikhil Amin, Sivan Harel, Neil Graham",2019-07-16,2020-07-15,2021-02-04,,https://patents.google.com/patent/US20210032354A1/en,https://patentimages.storage.googleapis.com/04/ff/a2/7dbf880d678246/US20210032354A1-20210204-D00000.png
US-2021023140-A1,Platelet formulations and medical uses thereof ,"Prp Scientific, Inc.",II Jamesette Hays,2019-07-26,2020-07-16,2021-01-28,,https://patents.google.com/patent/US20210023140A1/en,https://patentimages.storage.googleapis.com/01/94/a4/40f5f57a58ebda/US20210023140A1-20210128-D00001.png
