US-2021378891-A1,Wheelchair systems and methods enabling fine manual motion control ,"Toyota Motor North America, Inc.","Dario Jose Villarreal Suarez, Sarah Darrow",,2020-06-05,2021-12-09,,https://patents.google.com/patent/US20210378891A1/en,https://patentimages.storage.googleapis.com/bd/6a/b7/dd54f8a0fbf9c9/US20210378891A1-20211209-D00000.png
US-2021380324-A1,Disposable cup lid film system and method ,Brian Garbutt,Brian Garbutt,,2020-06-04,2021-12-09,,https://patents.google.com/patent/US20210380324A1/en,https://patentimages.storage.googleapis.com/4e/28/6c/f6c50f7d1ffe19/US20210380324A1-20211209-D00000.png
US-2021384060-A1,Structure for automatic in-situ replacement of a part of an electrostatic chuck ,Tokyo Electron Limited,"Daisuke Hayashi, Atsushi Kawabata",,2020-06-04,2021-12-09,,https://patents.google.com/patent/US20210384060A1/en,https://patentimages.storage.googleapis.com/92/20/a9/aae8138afb8eb1/US20210384060A1-20211209-D00000.png
US-2021379500-A1,Tubular Transport System With Motorized Vehicle ,Anthony-Joseph DiMatteo,Anthony-Joseph DiMatteo,,2020-06-04,2021-12-09,,https://patents.google.com/patent/US20210379500A1/en,https://patentimages.storage.googleapis.com/f0/db/bf/faf7c2f7f92ef3/US20210379500A1-20211209-D00000.png
US-2021381396-A1,Composite liners for turbofan engines ,Rolls-Royce Corporation,"Matthew J. Kappes, Robert Heeter, Jonathan Michael Rivers, Benedict N. Hodgson",,2020-06-03,2021-12-09,,https://patents.google.com/patent/US20210381396A1/en,https://patentimages.storage.googleapis.com/ca/ee/c1/6ff61b8fdc936b/US20210381396A1-20211209-D00000.png
US-2021374502-A1,Technique to perform neural network architecture search with federated learning ,Nvidia Corporation,"Holger Reinhard Roth, Dong Yang, Wenqi Li, Andriy Myronenko, Wentao Zhu, Ziyue Xu, Xiaosong Wang, Daguang Xu",,2020-06-01,2021-12-02,,https://patents.google.com/patent/US20210374502A1/en,https://patentimages.storage.googleapis.com/c9/6f/d8/bde6a4f647272a/US20210374502A1-20211202-D00000.png
US-2021374999-A1,System and method for detecting and correcting defective image output from radiation-damaged video cameras ,"Varian Medical Systems, Inc.","Paul Pu SUN, Eric Michael STIMMANN",,2020-06-01,2021-12-02,,https://patents.google.com/patent/US20210374999A1/en,https://patentimages.storage.googleapis.com/94/a8/41/9c2895a0e974a5/US20210374999A1-20211202-D00000.png
US-2021378925-A1,Water-Free/Anhydrous Cream Shampoo ,"Zotos International, Inc.","Schavel Morrison, Marina Azizova, Lisa Argus",,2020-06-03,2021-12-09,,https://patents.google.com/patent/US20210378925A1/en,
US-2021368723-A1,Soybean cultivar 99310382 ,"M.S. Technologies, L.L.C.",Justin T. Mason,,2020-06-02,2021-12-02,,https://patents.google.com/patent/US20210368723A1/en,
US-2021368722-A1,Soybean cultivar 97320638 ,"M.S. Technologies, L.L.C.",Justin T. Mason,,2020-06-02,2021-12-02,,https://patents.google.com/patent/US20210368722A1/en,
US-2021368720-A1,Soybean cultivar 93120753 ,"M.S. Technologies, L.L.C.",Justin T. Mason,,2020-06-02,2021-12-02,,https://patents.google.com/patent/US20210368720A1/en,
US-2021368718-A1,Soybean cultivar 96350326 ,"M.S. Technologies, L.L.C.",Justin T. Mason,,2020-06-02,2021-12-02,,https://patents.google.com/patent/US20210368718A1/en,
US-2021368719-A1,Soybean cultivar 91410746 ,"M.S. Technologies, L.L.C.",Justin T. Mason,,2020-06-02,2021-12-02,,https://patents.google.com/patent/US20210368719A1/en,
US-2021368717-A1,Soybean cultivar 98320614 ,"M.S. Technologies, L.L.C.",Justin T. Mason,,2020-06-02,2021-12-02,,https://patents.google.com/patent/US20210368717A1/en,
US-2021368724-A1,Soybean cultivar 91230357 ,"M.S. Technologies, L.L.C.",Justin T. Mason,,2020-06-02,2021-12-02,,https://patents.google.com/patent/US20210368724A1/en,
US-2021368872-A1,Wearable temperature control device ,Make Great Sales Limited,Kin Choi Lee,,2020-06-17,2021-12-02,,https://patents.google.com/patent/US20210368872A1/en,https://patentimages.storage.googleapis.com/ef/97/ee/67fbd441801863/US20210368872A1-20211202-D00000.png
US-10969085-B1,Decorative cover enclosure for moving yoke intelligent lighting fixtures ,Matthew Saltzer,Matthew Saltzer,2020-06-15,2020-06-15,2021-04-06,2021-04-06,https://patents.google.com/patent/US10969085B1/en,https://patentimages.storage.googleapis.com/c0/3e/c8/71f09e00860afb/US10969085-20210406-D00000.png
US-11102908-B1,Storage apparatus ,"Hitachi, Ltd.","Shunsuke Komori, Masanori Hori, Toshihisa TABUCHI, Naoki Wada, Yosuke Ishida",2020-06-16,2021-03-12,2021-08-24,2021-08-24,https://patents.google.com/patent/US11102908B1/en,https://patentimages.storage.googleapis.com/fa/c1/f8/313bb0d38ce87d/US11102908-20210824-D00000.png
US-10988479-B1,Morphic forms of trilaciclib and methods of manufacture thereof ,"G1 Therapeutics, Inc.","Stephen Schneider, Alexander Smith, Hannah S. White, Jay Copeland Strum, Jaroslaw Mazurek",2020-06-15,2020-11-13,2021-04-27,2021-04-27,https://patents.google.com/patent/US10988479B1/en,https://patentimages.storage.googleapis.com/6c/76/d5/ae3d21f74500c9/US10988479-20210427-D00001.png
