US-2021015630-A1,Spinal implant system and method ,"Warsaw Orthopedic, Inc.",Daniel Paxton Wall,2019-07-16,2019-07-16,2021-01-21,,https://patents.google.com/patent/US20210015630A1/en,https://patentimages.storage.googleapis.com/1c/e9/6d/1785d722ef39fe/US20210015630A1-20210121-D00000.png
US-2021028391-A1,Display device and method for manufacturing the same ,"Samsung Display Co., Ltd.","Geunwoo YUG, Taehyun JUNG, Seoin Han",2019-07-25,2020-07-23,2021-01-28,,https://patents.google.com/patent/US20210028391A1/en,https://patentimages.storage.googleapis.com/a0/35/64/bf552f189d6636/US20210028391A1-20210128-D00000.png
US-2021325748-A1,"Array substrate, display panel, display device and manufacturing method for array substrate ","Fuzhou Boe Optoelectronics Technology Co., Ltd., Boe Technology Group Co., Ltd.","Zongxiang LI, Wenchao Wang, Jinglong Yan, Hongjiang Wu, Baoqiang Wang, Wenrui LIU, Xi Chen, Yao Liu, Hongtao LIN, Wenchang TAO",2019-07-16,2019-07-16,2021-10-21,,https://patents.google.com/patent/US20210325748A1/en,https://patentimages.storage.googleapis.com/6e/53/3b/c852b68f50655b/US20210325748A1-20211021-D00000.png
US-2021020560-A1,Package structure and method of manufacturing the same ,"Taiwan Semiconductor Manufacturing Co., Ltd.","Chuei-Tang Wang, Chun-Lin Lu, Kai-Chiang Wu",2019-07-17,2019-07-17,2021-01-21,,https://patents.google.com/patent/US20210020560A1/en,https://patentimages.storage.googleapis.com/cc/71/29/7eb29c25fdf331/US20210020560A1-20210121-D00000.png
US-2021025772-A1,Flexible printed pressure transducer with sensor diffusion stack materials and methods incorporating the same ,"Toyota Motor Engineering & Manufacturing North America, Inc.","Caleb M. Rogers, Benjamin D. Atkinson, Tyler Flood",2019-07-23,2019-07-23,2021-01-28,,https://patents.google.com/patent/US20210025772A1/en,https://patentimages.storage.googleapis.com/fa/17/3e/b02df359817317/US20210025772A1-20210128-D00000.png
US-2021023742-A1,Method for manufacturing recyclable environment-friendly organic paper ,"Chun Ming Huang, Ho Asia Huang International Co., Ltd.",Chun Ming Huang,2019-07-25,2019-07-25,2021-01-28,,https://patents.google.com/patent/US20210023742A1/en,https://patentimages.storage.googleapis.com/c6/c0/aa/78ae7c7ad19922/US20210023742A1-20210128-D00000.png
US-2021016551-A1,Plastic laminate and process for manufacturing the same ,"Shin-Etsu Chemical Co., Ltd.",Tatsuro KANEKO,2019-07-19,2020-07-20,2021-01-21,,https://patents.google.com/patent/US20210016551A1/en,https://patentimages.storage.googleapis.com/d5/5a/1b/68a7599cc2bc9a/US20210016551A1-20210121-D00000.png
US-2021151222-A1,High frequency signal transmission cable and producing method therefor ,"Hitachi Metals, Ltd.","Detian Huang, Takanobu Watanabe, Kimika Kudo",2019-07-11,2019-11-04,2021-05-20,,https://patents.google.com/patent/US20210151222A1/en,https://patentimages.storage.googleapis.com/f8/c8/a4/b02f5865fa7e8d/US20210151222A1-20210520-D00000.png
US-2021033561-A1,Electrochemical sensor ,"Rosemount Inc., Regents Of The University Of Minnesota","Xin Chen, Jinbo Hu, Philippe Buhlmann",2019-07-29,2019-11-14,2021-02-04,,https://patents.google.com/patent/US20210033561A1/en,https://patentimages.storage.googleapis.com/71/39/33/19f7d1d9995679/US20210033561A1-20210204-D00000.png
US-2021024672-A1,"Polymer, ion-exchange membrane, and structure-enhanced membrane employing the same ",Industrial Technology Research Institute,"Hsuan-Wei LEE, Cheng-Hsiu TSAI, Chiu-Tung WANG, Li-Duan Tsai, Tzu-Ying Chen",2019-07-22,2019-11-21,2021-01-28,,https://patents.google.com/patent/US20210024672A1/en,https://patentimages.storage.googleapis.com/a8/19/a7/dd81c6337a1352/US20210024672A1-20210128-D00000.png
US-2021005790-A1,Micro-led and method for forming the same ,Acer Incorporated,"Jui-Chieh HSIANG, Chih-Chiang Chen",2019-07-04,2020-01-20,2021-01-07,,https://patents.google.com/patent/US20210005790A1/en,https://patentimages.storage.googleapis.com/00/5a/16/0189e82a07227f/US20210005790A1-20210107-D00000.png
US-2021020723-A1,Display device ,"Samsung Display Co., Ltd.","Ju Chan Park, Sun Hee Lee, Sun Ho Kim, Hyun Kim",2019-07-17,2020-02-12,2021-01-21,,https://patents.google.com/patent/US20210020723A1/en,https://patentimages.storage.googleapis.com/79/de/b5/747137f42b6ddb/US20210020723A1-20210121-D00000.png
US-2021011510-A1,Display device ,"Samsung Display Co., Ltd.","Jeong Heon Lee, Young Sik Kim, Jong Tae Kim, Sang Wook Yoo, Si Young Choi",2019-07-10,2020-03-06,2021-01-14,,https://patents.google.com/patent/US20210011510A1/en,https://patentimages.storage.googleapis.com/88/7f/d6/53c35b2709a877/US20210011510A1-20210114-D00000.png
US-2021007754-A1,Filamentary devices for treatment of vascular defects ,"Sequent Medical, Inc.","Parker Milhous, Karishma Desai",2019-07-12,2020-03-11,2021-01-14,,https://patents.google.com/patent/US20210007754A1/en,https://patentimages.storage.googleapis.com/69/32/21/fb15b28c7298d8/US20210007754A1-20210114-D00000.png
US-2021005696-A1,Display device ,"Samsung Display Co., Ltd.","Ki Ho BANG, Eun Hye Kim, Eun Ae JUNG, Won Suk CHOI",2019-07-02,2020-04-02,2021-01-07,,https://patents.google.com/patent/US20210005696A1/en,https://patentimages.storage.googleapis.com/da/27/a9/76f238c0c8fe99/US20210005696A1-20210107-D00000.png
US-11125932-B2,"Light guide plate and manufacturing method thereof, backlight module and display device ","Beijing Boe Display Technology Co., Ltd., Boe Technology Group Co., Ltd.","Honghao Yu, Hao Zhou, Lili Jia, Donglei LI, Hui Liu, Ying Chen, Shanshan Liu",2019-07-19,2020-06-23,2021-09-21,2021-09-21,https://patents.google.com/patent/US11125932B2/en,https://patentimages.storage.googleapis.com/e6/82/c6/f1eade8b36a825/US11125932-20210921-D00000.png
US-2021031556-A1,Refill for a writing felt pen ,Societe Bic,Arnaud Bez,2019-07-29,2020-07-24,2021-02-04,,https://patents.google.com/patent/US20210031556A1/en,https://patentimages.storage.googleapis.com/e9/25/6a/270018c64497cd/US20210031556A1-20210204-D00000.png
US-2021013455-A1,Display device including a light control pattern ,"Samsung Display Co., Ltd.","Kwangsoo Bae, Beomsoo Park, Minjeong Oh, YoungJe CHO",2019-07-12,2020-04-02,2021-01-14,,https://patents.google.com/patent/US20210013455A1/en,https://patentimages.storage.googleapis.com/58/62/64/32ef78a176aabb/US20210013455A1-20210114-D00000.png
US-2021005844-A1,Organic light-emitting diode and light-emitting display apparatus comprising the same ,"Samsung Display Co., Ltd.","Sungwook Kim, KyungSik KIM, Seulong KIM, Tsuyoshi Naijo, Sungsoo BAE, Dongchan LEE, Hyein Jeong, Hyewon CHOI, Seungjin Chu, Jaeweon Hur",2019-07-03,2020-04-17,2021-01-07,,https://patents.google.com/patent/US20210005844A1/en,https://patentimages.storage.googleapis.com/dd/6b/30/627c5b6a3f6a86/US20210005844A1-20210107-D00000.png
US-2021005689-A1,Display device ,"Samsung Display Co., Ltd.","Mi Jang, Do Hyun Kwon, Min Jung Lee",2019-07-02,2020-04-22,2021-01-07,,https://patents.google.com/patent/US20210005689A1/en,https://patentimages.storage.googleapis.com/88/84/4a/e51024ba9f7b63/US20210005689A1-20210107-D00000.png
US-2021010151-A1,Titanium part having an etched surface ,Apple Inc.,"James A. Curran, Todd S. Mintz, Isabel YANG",2019-07-08,2020-05-05,2021-01-14,,https://patents.google.com/patent/US20210010151A1/en,https://patentimages.storage.googleapis.com/aa/1c/a8/bda2cc6af34e61/US20210010151A1-20210114-D00000.png
US-2021028212-A1,Image sensing device and image-sensing system ,"Silicon Optronics, Inc.","Yen-Chen Chang, Bo-Ray LEE",2019-07-24,2020-05-14,2021-01-28,,https://patents.google.com/patent/US20210028212A1/en,https://patentimages.storage.googleapis.com/3e/36/5e/ab9c86ed716498/US20210028212A1-20210128-D00000.png
US-2021018812-A1,Display device ,E Ink Holdings Inc.,"Yi-Sheng Lin, Chia-Chun Yeh, Kuan-Yi Lin, Po-Yu HSIAO",2019-07-19,2020-05-17,2021-01-21,,https://patents.google.com/patent/US20210018812A1/en,https://patentimages.storage.googleapis.com/d9/87/67/2f825f4da93cfa/US20210018812A1-20210121-D00000.png
US-2021028156-A1,Display module having led packages and manufacturing method thereof ,"Samsung Electronics Co., Ltd.","Jinhee KANG, Taesoon PARK, Youngki Jung, Chulgyu Jung",2019-07-25,2020-05-28,2021-01-28,,https://patents.google.com/patent/US20210028156A1/en,https://patentimages.storage.googleapis.com/28/e9/41/873ba367850281/US20210028156A1-20210128-D00000.png
US-2021028272-A1,Display device ,"Samsung Display Co., Ltd.","Sunghwan Won, Jongmoo Huh, Kyumin Kim, Doohyun Kim, Songhee Kim, Jeehoon Kim, Shinhyuk Yang",2019-07-23,2020-05-29,2021-01-28,,https://patents.google.com/patent/US20210028272A1/en,https://patentimages.storage.googleapis.com/1a/fb/aa/d06374148ab360/US20210028272A1-20210128-D00000.png
US-2021020726-A1,Display device and method of manufacturing the same ,"Samsung Display Co., Ltd.","Min Woo Woo, Moo-Soon Ko, Wangwoo Lee",2019-07-15,2020-06-01,2021-01-21,,https://patents.google.com/patent/US20210020726A1/en,https://patentimages.storage.googleapis.com/16/a1/50/feacd0c60299c9/US20210020726A1-20210121-D00000.png
US-2021013184-A1,Led transfer method and display module manufactured thereby ,"Samsung Electronics Co., Ltd.","Ohjae Kwon, Jinmo Kang, Donghwan Kim, Yong Namkung, Seondeok HWANG",2019-07-12,2020-06-03,2021-01-14,,https://patents.google.com/patent/US20210013184A1/en,https://patentimages.storage.googleapis.com/a8/e9/a8/4c3022ec2e019e/US20210013184A1-20210114-D00000.png
US-2021005677-A1,Touch detecting unit and display device including the same ,"Samsung Display Co., Ltd.","Kang Won LEE, Do Ik Kim, Choon Hyop LEE, Jang Hui KIM, Sang Chul Lee",2019-07-02,2020-06-08,2021-01-07,,https://patents.google.com/patent/US20210005677A1/en,https://patentimages.storage.googleapis.com/e0/f6/eb/24f58c8eab0a24/US20210005677A1-20210107-D00000.png
US-2021011206-A1,Diffractive optical element and device ,"Samsung Electronics Co., Ltd.","Hyun Seok Choi, Beom Seok Kim, Ju Hyun Kim, Hoon Song, Jung Kwuen An, Sung Dug Kim, Hong-seok Lee, Sunghyun HAN",2019-07-08,2020-06-08,2021-01-14,,https://patents.google.com/patent/US20210011206A1/en,https://patentimages.storage.googleapis.com/38/4a/7e/31e8a2826d7ed5/US20210011206A1-20210114-D00000.png
US-2021028222-A1,Wafer-level process for curving a set of electronic chips ,Commissariat A L'energie Atomique Et Aux Energies Alternatives,"Bertrand Chambion, Jean-Philippe Colonna",2019-07-26,2020-07-24,2021-01-28,,https://patents.google.com/patent/US20210028222A1/en,https://patentimages.storage.googleapis.com/34/d1/30/c366565233cbf0/US20210028222A1-20210128-D00000.png
US-2021028258-A1,Display apparatus ,"Samsung Display Co., Ltd.","Jieun Lee, Minchae KWAK, Byungsun KIM, Ilgoo Youn, Seunghan Jo, JunYoung Jo, Minhee Choi",2019-07-25,2020-07-24,2021-01-28,,https://patents.google.com/patent/US20210028258A1/en,https://patentimages.storage.googleapis.com/a1/74/50/178c3c209f27d0/US20210028258A1-20210128-D00000.png
US-2021022477-A1,Cosmetic applicator ,HCT Group Holdings Limited,"Jeremy Wilson, Adrian Charles Apodaca, Lewis On Hang Lee",2019-07-26,2020-07-24,2021-01-28,,https://patents.google.com/patent/US20210022477A1/en,https://patentimages.storage.googleapis.com/ca/2f/ee/de78648bfded6e/US20210022477A1-20210128-D00000.png
US-2021025114-A1,"Heat Sealable Paper-Baed Substrate Coated with Water-Based Coatings, Its Process of Manufacturing and Uses Thereof ",Cascades Sonoco Inc.,"Yvon MONGRAIN, Etienne Levert, Simon Provencher",2019-07-26,2020-07-27,2021-01-28,,https://patents.google.com/patent/US20210025114A1/en,https://patentimages.storage.googleapis.com/c4/a2/c0/4ec7f1fb355801/US20210025114A1-20210128-D00001.png
US-2021013288-A1,Display device ,"Samsung Display Co., Ltd.","Sang Gab Kim, Tae Sung Kim, Joon Geol Lee, Hyun Min Cho, Dae Won CHOI, Yun Jong YEO",2019-07-09,2020-06-12,2021-01-14,,https://patents.google.com/patent/US20210013288A1/en,https://patentimages.storage.googleapis.com/26/18/cf/6dd1a384fecb19/US20210013288A1-20210114-D00000.png
US-2021011325-A1,Display panel ,Hannstar Display Corporation,"Cheng-Yen Yeh, I-Hsuan Chen, Guang-Shiung Chao, Mu-Kai KANG",2019-07-08,2020-06-14,2021-01-14,,https://patents.google.com/patent/US20210011325A1/en,https://patentimages.storage.googleapis.com/06/52/95/31f051a06a494b/US20210011325A1-20210114-D00000.png
US-2021012078-A1,Electronic device ,Innolux Corporation,"Kuei-Sheng CHANG, Kuo-Jung Wu, Po-Yang Chen, I-An Yao",2019-07-12,2020-06-15,2021-01-14,,https://patents.google.com/patent/US20210012078A1/en,https://patentimages.storage.googleapis.com/91/85/4d/004c062aaee9ac/US20210012078A1-20210114-D00000.png
US-2021021023-A1,Radiation device ,Innolux Corporation,"Hang-Lang LEE, I-Yin Li, Tang-Chin HUNG, Pei-Chi Chen",2019-07-15,2020-06-18,2021-01-21,,https://patents.google.com/patent/US20210021023A1/en,https://patentimages.storage.googleapis.com/bd/4a/53/d2897abc50d01a/US20210021023A1-20210121-D00000.png
US-2021004145-A1,Ablation system with graphical user interface ,Biosense Webster (Israel) Ltd.,"Amit Agarwal, Ahmed Abdelaal",2019-07-01,2020-06-18,2021-01-07,,https://patents.google.com/patent/US20210004145A1/en,https://patentimages.storage.googleapis.com/df/00/d8/99007111f65917/US20210004145A1-20210107-D00000.png
US-2021036088-A1,Display device ,"Samsung Display Co., Ltd.","JunYoung Jo, Byungsun KIM, Minhee Choi, Minchae KWAK, Ilgoo Youn, Jieun Lee, Seunghan Jo",2019-07-29,2020-06-18,2021-02-04,,https://patents.google.com/patent/US20210036088A1/en,https://patentimages.storage.googleapis.com/33/6b/e5/eb7f9a6b37d182/US20210036088A1-20210204-D00000.png
US-2021020077-A1,Display device ,Innolux Corporation,"Yu-Chia Huang, Yuan-Lin WU, Kuan-Feng LEE",2019-07-19,2020-06-19,2021-01-21,,https://patents.google.com/patent/US20210020077A1/en,https://patentimages.storage.googleapis.com/51/47/b2/80ee61548eb065/US20210020077A1-20210121-D00000.png
US-2021010959-A1,Inspection apparatus and inspection method ,"Nuflare Technology, Inc.","Masataka Shiratsuchi, Riki Ogawa, Hiromu Inoue",2019-07-08,2020-06-22,2021-01-14,,https://patents.google.com/patent/US20210010959A1/en,https://patentimages.storage.googleapis.com/9a/4c/48/4db280907d31e7/US20210010959A1-20210114-D00000.png
US-2021020618-A1,Display device ,Innolux Corporation,Chia-Hsiu Hsu,2019-07-18,2020-06-23,2021-01-21,,https://patents.google.com/patent/US20210020618A1/en,https://patentimages.storage.googleapis.com/f2/52/85/58966a7f70b133/US20210020618A1-20210121-D00000.png
US-2021003755-A1,Light Control Film Having Nano Light Absorbing Layer and Display Using the Same ,"Lg Display Co., Ltd.","Jaejung Han, Jaejin Kim, JinRyun KIM, Semin Lee, Daeyong Kim, Eunhee Choi",2019-07-02,2020-06-26,2021-01-07,,https://patents.google.com/patent/US20210003755A1/en,https://patentimages.storage.googleapis.com/a6/26/75/3285e4b5e640d9/US20210003755A1-20210107-D00000.png
US-2021013465-A1,Power storage module ,"Honda Motor Co., Ltd.",Atsushi Sakurai,2019-07-10,2020-06-26,2021-01-14,,https://patents.google.com/patent/US20210013465A1/en,https://patentimages.storage.googleapis.com/16/8c/db/1dc9a7e8ac5456/US20210013465A1-20210114-D00000.png
US-2021013186-A1,Lighting device and method of manufacturing the same ,Innolux Corporation,"Jia-Yuan CHEN, Tsung-Han Tsai, Kuan-Feng LEE",2019-07-09,2020-06-28,2021-01-14,,https://patents.google.com/patent/US20210013186A1/en,https://patentimages.storage.googleapis.com/72/26/fc/88dd0655a264b3/US20210013186A1-20210114-D00000.png
US-2021004095-A1,Touchscreen panel module ,Sharp Kabushiki Kaisha,"Ryo Matsuda, Kohji Yabuta",2019-07-03,2020-06-29,2021-01-07,,https://patents.google.com/patent/US20210004095A1/en,https://patentimages.storage.googleapis.com/76/f6/31/627b977efa8a6d/US20210004095A1-20210107-D00000.png
US-2021028386-A1,"Display panel, packaging cover plate and manufacturing method of the same ","Boe Technology Group Co., Ltd.","Xinwei GAO, Donghui YU",2019-07-22,2020-06-29,2021-01-28,,https://patents.google.com/patent/US20210028386A1/en,https://patentimages.storage.googleapis.com/7f/0b/15/18f2e9ddb65dce/US20210028386A1-20210128-D00000.png
US-2021005669-A1,"Display unit, display module, and electronic device ","Semiconductor Energy Laboratory Co., Ltd.","Taisuke Kamada, Ryo HATSUMI, Daisuke Kubota, Naoaki HASHIMOTO, Tsunenori Suzuki, Harue Osaka, Satoshi Seo",2019-07-05,2020-06-29,2021-01-07,,https://patents.google.com/patent/US20210005669A1/en,https://patentimages.storage.googleapis.com/eb/a3/71/497ae021845518/US20210005669A1-20210107-D00000.png
US-2021000656-A1,Absorbent article with ear portion ,The Procter & Gamble Company,"II Nelson Edward Greening, Erica Lynne Locke, Urmish Popatlal Dalal, Marcus Schönbeck, Maria OUDE-LANSINK, Jan Michael Trinkaus, Marius Janas, Marcel Grossmann",2019-07-01,2020-06-30,2021-01-07,,https://patents.google.com/patent/US20210000656A1/en,https://patentimages.storage.googleapis.com/ff/a5/fd/1406522c12bafa/US20210000656A1-20210107-D00000.png
US-2021000493-A1,Torque accessory for support catheter ,Boston Scientific Limited,"Sharath Badadamath, Aditya DHANOTIYA",2019-07-01,2020-06-30,2021-01-07,,https://patents.google.com/patent/US20210000493A1/en,https://patentimages.storage.googleapis.com/9f/11/a2/a1e855cbf7b5fb/US20210000493A1-20210107-D00000.png
US-2021028337-A1,Light emitting device ,Innolux Corporation,"Tzu-Min Yan, Tsau-Hua Hsieh",2019-07-22,2020-06-30,2021-01-28,,https://patents.google.com/patent/US20210028337A1/en,https://patentimages.storage.googleapis.com/14/de/8c/92b6b86a7b06b7/US20210028337A1-20210128-D00000.png
US-2021028327-A1,Light emitting device and method of manufacturing the same ,Innolux Corporation,"Hsiao-Lang Lin, Tsung-Han Tsai",2019-07-23,2020-06-30,2021-01-28,,https://patents.google.com/patent/US20210028327A1/en,https://patentimages.storage.googleapis.com/48/4b/a4/a202157f999104/US20210028327A1-20210128-D00000.png
US-2021002037-A1,Storage container systems including containers and corresponding lids ,"S.C. Johnson & Son, Inc.","Samuel J. Marino, Kasey A. Fuller, Amy P. Goldsmith, Brian T. Davis, Pierce J. Peterson, Michael T. Robl, Donald E. McCumber",2019-07-05,2020-07-01,2021-01-07,,https://patents.google.com/patent/US20210002037A1/en,https://patentimages.storage.googleapis.com/3d/0c/55/676971ca7c1059/US20210002037A1-20210107-D00000.png
US-2021029838-A1,Display ,Au Optronics Corporation,"Chih-Tsung Lee, Chih-Chieh Lin, Yi-Wei Tsai, Ko-Chin Chung",2019-07-24,2020-07-01,2021-01-28,,https://patents.google.com/patent/US20210029838A1/en,https://patentimages.storage.googleapis.com/63/42/96/2ceccfbfb53530/US20210029838A1-20210128-D00000.png
US-2021009899-A1,"Quantum dots, a composition or composite including the same, and an electronic device including the same ","Samsung Display Co., Ltd.","Nayoun Won, Garam Park, Shin Ae Jun, Tae Gon Kim, Taekhoon KIM, Shang Hyeun PARK, Mi Hye LIM",2019-07-10,2020-07-01,2021-01-14,,https://patents.google.com/patent/US20210009899A1/en,https://patentimages.storage.googleapis.com/2f/8c/a4/f1c028447e8935/US20210009899A1-20210114-D00000.png
US-2021069978-A1,Vat for three-dimensional manufacturing apparatus and three-dimensional manufacturing apparatus ,"Kantatsu Co., Ltd.","Eiji Oshima, Kazutaka Noborimoto",2019-07-03,2020-07-02,2021-03-11,,https://patents.google.com/patent/US20210069978A1/en,https://patentimages.storage.googleapis.com/5c/f6/71/b2d070f600a1c0/US20210069978A1-20210311-D00000.png
US-2021001624-A1,Real time drop information measurement unit and real time discharging droplet compensating apparatus and method using the same ,Semes Co. Ltd.,"Donghwa LEE, Daigeon YOON, Jaeyong Choi, Sanguk Son, Daesung Kim",2019-07-05,2020-07-02,2021-01-07,,https://patents.google.com/patent/US20210001624A1/en,https://patentimages.storage.googleapis.com/00/13/98/3d6a055a3e0d0e/US20210001624A1-20210107-D00000.png
US-2021000471-A1,Tailored venous anastomosis for arteriovenous grafts ,"Washington University, St. Louis, MO","Mohamed Zayed, Dillon Williams, Guy Genin, Eric Leuthardt",2019-07-02,2020-07-02,2021-01-07,,https://patents.google.com/patent/US20210000471A1/en,https://patentimages.storage.googleapis.com/fa/ac/cd/c234b6d8608a65/US20210000471A1-20210107-D00000.png
US-2021284789-A1,High dielectric breakdown polymers; compositions; methods of making; and use thereof ,University Of Connecticut,Gregory A. Sotzing,2019-07-03,2020-07-02,2021-09-16,,https://patents.google.com/patent/US20210284789A1/en,https://patentimages.storage.googleapis.com/70/99/32/e0569c8359e787/US20210284789A1-20210916-D00000.png
US-11195893-B2,Display apparatus having shield electrode overlapping connection line ,"Samsung Display Co., Ltd.","Jieun Lee, Minchae KWAK, Byungsun KIM, Ilgoo Youn, Seunghan Jo, JunYoung Jo, Minhee Choi",2019-07-25,2020-07-24,2021-12-07,2021-12-07,https://patents.google.com/patent/US11195893B2/en,https://patentimages.storage.googleapis.com/97/f6/5e/7bf63cd5abd6ab/US11195893-20211207-D00000.png
US-11072099-B2,Method and apparatus for composite rib and sheet molding II ,Arris Composites Inc.,"Riley Reese, Erick Davidson, Ethan Escowitz, J. Scott PERKINS",2019-07-24,2020-07-24,2021-07-27,2021-07-27,https://patents.google.com/patent/US11072099B2/en,https://patentimages.storage.googleapis.com/d8/d1/0e/2a245134fb8988/US11072099-20210727-D00000.png
US-2021002586-A1,Hard surface cleaning compositions with reduced surface tension ,Ecolab Usa Inc.,"Derrick Anderson, Erik C. Olson, Melissa Martinez-Crowley",2019-07-03,2020-07-06,2021-01-07,,https://patents.google.com/patent/US20210002586A1/en,https://patentimages.storage.googleapis.com/f8/99/11/68278165244460/US20210002586A1-20210107-D00000.png
US-11175776-B2,Electronic device including an optical sensor mounted on back surface of a display ,"Samsung Electronics Co., Ltd","Heewoong YOON, Jeongho Cho, Sangjin Kim, Jongah KIM, Donghan Lee",2019-07-18,2020-07-17,2021-11-16,2021-11-16,https://patents.google.com/patent/US11175776B2/en,https://patentimages.storage.googleapis.com/6b/9a/30/1f4cbd75c9e0e7/US11175776-20211116-D00000.png
US-2021013494-A1,Anode coating in lithium ion batteries ,StoreDot Ltd.,"Eran SELLA, Nitzam Shadmi, Ohad Goldfarb, Daniel Aronov",2019-07-08,2020-07-06,2021-01-14,,https://patents.google.com/patent/US20210013494A1/en,https://patentimages.storage.googleapis.com/7f/23/b3/4c214083fa8c83/US20210013494A1-20210114-D00000.png
US-2021020379-A1,Multilayer ceramic electronic device and method for manufacuting same ,"Taiyo Yuden Co., Ltd.","Ryo Ono, Tetsuhiko FUKUOKA, Shoji Kusumoto, Akihiko Kono",2019-07-16,2020-07-14,2021-01-21,,https://patents.google.com/patent/US20210020379A1/en,https://patentimages.storage.googleapis.com/e8/d6/ca/422521a4307b72/US20210020379A1-20210121-D00000.png
US-2021018370-A1,Sensor and double integration method for capturing thermal patterns ,"Commissariat A L'energie Atomique Et Aux Energies Alternatives, Idemia Identity & Security France","Jean-Francois Mainguet, Joel Yann FOURRE",2019-07-18,2020-07-08,2021-01-21,,https://patents.google.com/patent/US20210018370A1/en,https://patentimages.storage.googleapis.com/60/d8/0a/9703a3c0881d4c/US20210018370A1-20210121-D00000.png
US-2021013419-A1,"Organic Compound, Light-Emitting Device, Light-Emitting Apparatus, Electronic Device, and Lighting Device ","Semiconductor Energy Laboratory Co., Ltd.","Kaori Ogita, Anna Tada, Sachiko Kawakami, Nobuharu Ohsawa, Satoshi Seo",2019-07-12,2020-07-08,2021-01-14,,https://patents.google.com/patent/US20210013419A1/en,https://patentimages.storage.googleapis.com/79/bb/ae/146fec5f24f5d7/US20210013419A1-20210114-D00000.png
US-11194080-B2,Diffractive optical element and device ,"Samsung Electronics Co., Ltd.","Hyun Seok Choi, Beom Seok Kim, Ju Hyun Kim, Hoon Song, Jung Kwuen An, Sung Dug Kim, Hong-seok Lee, Sunghyun HAN",2019-07-08,2020-06-08,2021-12-07,2021-12-07,https://patents.google.com/patent/US11194080B2/en,https://patentimages.storage.googleapis.com/18/eb/4e/384b7541b90567/US11194080-20211207-D00000.png
US-2021014378-A1,Image reading apparatus ,Seiko Epson Corporation,"Koji Migita, Yutaro KAJITANI, Masato Ogawa",2019-07-12,2020-07-09,2021-01-14,,https://patents.google.com/patent/US20210014378A1/en,https://patentimages.storage.googleapis.com/87/8b/aa/17e9ce82a3bc26/US20210014378A1-20210114-D00000.png
US-2021009518-A1,"Organic Compound, Light-Emitting Device, Light-Receiving Device, Light-Emitting Apparatus, Light-Emitting Module, Electronic Device, and Lighting Device ","Semiconductor Energy Laboratory Co., Ltd.","Anna Tada, Sachiko Kawakami, Takumu Okuyama, Tsunenori Suzuki, Satoshi Seo",2019-07-12,2020-07-09,2021-01-14,,https://patents.google.com/patent/US20210009518A1/en,https://patentimages.storage.googleapis.com/53/1c/33/cb7bcd3b7ab27c/US20210009518A1-20210114-D00000.png
US-2021010776-A1,Malfunction simulation insert ,"James Matthew Underwood, Larry Cullen Underwood","James Matthew Underwood, Larry Cullen Underwood",2019-07-10,2020-07-09,2021-01-14,,https://patents.google.com/patent/US20210010776A1/en,https://patentimages.storage.googleapis.com/65/55/09/986df0785d830b/US20210010776A1-20210114-D00000.png
US-2021020351-A1,Magnetic coupling reactor apparatus ,Sumida Corporation,Akira Takeuchi,2019-07-19,2020-07-09,2021-01-21,,https://patents.google.com/patent/US20210020351A1/en,https://patentimages.storage.googleapis.com/6c/55/d1/4d1f36325aecb0/US20210020351A1-20210121-D00000.png
US-11143910-B2,Lighting device and display device ,"Funai Electric Co., Ltd.",Tomohiro Kobayashi,2019-07-19,2020-07-15,2021-10-12,2021-10-12,https://patents.google.com/patent/US11143910B2/en,https://patentimages.storage.googleapis.com/27/1a/af/c82c5ac311ed48/US11143910-20211012-D00000.png
US-2021028027-A1,Processing method and resin applying machine ,Disco Corporation,"Yoshikuni MIGIYAMA, Kazuki Sugiura, Yoshinori KAKINUMA, Mitsuru IKUSHIMA",2019-07-23,2020-07-10,2021-01-28,,https://patents.google.com/patent/US20210028027A1/en,https://patentimages.storage.googleapis.com/4c/0a/35/3d7b8abec2dba5/US20210028027A1-20210128-D00000.png
