US-2019309036-A1,A cancer-treating recombinant protein that improves the activity of cytotoxic killer cells targeting cancer cells and use thereof ,Gwangju Institute Of Science And Technology,"Chang-Duk JUN, Bu Nam JEON, hey-ran KIM",2018-04-10,2018-08-27,2019-10-10,,https://patents.google.com/patent/US20190309036A1/en,https://patentimages.storage.googleapis.com/8a/df/1d/2094d3cf9322ce/US20190309036A1-20191010-D00000.png
US-2021047526-A1,Alcohol soluble printing ink compositions ,"Eastman Chemical (China) Co., Ltd.",Jian Qui Jerry Shi,2018-04-24,2018-04-24,2021-02-18,,https://patents.google.com/patent/US20210047526A1/en,https://patentimages.storage.googleapis.com/dc/b2/a4/3ac2b605effed1/US20210047526A1-20210218-D00000.png
US-2021090719-A1,Digital image transfer system ,Jaap Teeuwen,Jaap Teeuwen,2018-04-05,2020-10-05,2021-03-25,,https://patents.google.com/patent/US20210090719A1/en,https://patentimages.storage.googleapis.com/ea/61/1d/424cceebcf23f6/US20210090719A1-20210325-D00000.png
US-10396897-B1,Systems and methods for predicting defects in optical transceiver devices ,General Electric Company,"Peter Malave, Partha Natampalli, Aniruddha Banke Tiwari, Jonathan Clarence West, Steven James Huff",2018-04-17,2018-04-17,2019-08-27,2019-08-27,https://patents.google.com/patent/US10396897B1/en,https://patentimages.storage.googleapis.com/09/59/96/0193fb1e88789e/US10396897-20190827-D00000.png
US-2021039829-A1,"Tab, can lid, and method for manufacturing can lid ",Daiwa Can Company,"Toshiyuki Ohkoshi, Masahiko Yasaka, Shinji Shimazu, Tadayosi Iwamaru, Hirohumi Fujiwara",2018-04-27,2020-10-23,2021-02-11,,https://patents.google.com/patent/US20210039829A1/en,https://patentimages.storage.googleapis.com/78/1e/e9/292ddee144a803/US20210039829A1-20210211-D00000.png
US-2021095862-A1,Heating cooking device ,"Panasonic Intellectual Property Management Co., Ltd.","Takeshi Nakashima, Hiroki Hayashi, Takuzo Shimizu",2018-04-27,2019-04-22,2021-04-01,,https://patents.google.com/patent/US20210095862A1/en,https://patentimages.storage.googleapis.com/ea/ae/75/41c569b4aa2f49/US20210095862A1-20210401-D00000.png
US-2021166836-A1,Shielded flat cable ,"Sumitomo Electric Industries, Ltd.","Manabu Nagano, Go HIRAKAWA, Shin Sato, Tatsuo Matsuda",2018-04-23,2019-04-11,2021-06-03,,https://patents.google.com/patent/US20210166836A1/en,https://patentimages.storage.googleapis.com/02/93/06/1586fafe08913f/US20210166836A1-20210603-D00000.png
US-2021238454-A1,"Surface-modifying sheet, surface-modified member, coated article, printed article, joined body, and method for producing surface-modified member ",Nitto Denko Corporation,"Yosuke MAKIHATA, Asuka Endo, Eriko Nakao, Kenichi Okada, Fumika KAWATAKE, Naoyuki Nishiyama, Kayo Shimokawa",2018-04-26,2019-04-24,2021-08-05,,https://patents.google.com/patent/US20210238454A1/en,https://patentimages.storage.googleapis.com/10/d7/c6/c20db64cf5ae96/US20210238454A1-20210805-D00000.png
US-2021033596-A1,Methods for High-Content Drug Screening ,The Regents Of The University Of California,"Alan S. Verkman, Byung-Ju Jin, Sujin Lee",2018-04-27,2019-04-25,2021-02-04,,https://patents.google.com/patent/US20210033596A1/en,https://patentimages.storage.googleapis.com/e4/48/d0/84c86b3934750b/US20210033596A1-20210204-D00000.png
US-11177532-B2,Pouch-type secondary battery having gas discharge means ,"Lg Chem, Ltd.","Sang Hun Kim, Myung Hwan Kim, Yong Su Choi, Na Yoon Kim, Hyung Kyun YU",2018-04-23,2019-01-24,2021-11-16,2021-11-16,https://patents.google.com/patent/US11177532B2/en,https://patentimages.storage.googleapis.com/44/3d/ea/f3a616519aac25/US11177532-20211116-D00000.png
US-2021228717-A1,Multianalyte immunoassay and uses thereof ,Emergent Biosolutions Canada Inc.,"Russell PRONYK, Samantha ERICHSEN",2018-04-27,2019-04-26,2021-07-29,,https://patents.google.com/patent/US20210228717A1/en,https://patentimages.storage.googleapis.com/2b/c5/f3/1b94b3081e1a05/US20210228717A1-20210729-D00000.png
US-2021289934-A1,Interdental cleaning tool ,"Kobayashi Pharmaceutical Co., Ltd.",Tasuku Kikkawa,2018-04-27,2019-04-26,2021-09-23,,https://patents.google.com/patent/US20210289934A1/en,https://patentimages.storage.googleapis.com/16/ea/e1/0fe69dbbae8cff/US20210289934A1-20210923-D00000.png
US-2021251375-A1,Interdental cleaning tool ,"Kobayashi Pharmaceutical Co., Ltd.",Tasuku Kikkawa,2018-04-27,2019-04-26,2021-08-19,,https://patents.google.com/patent/US20210251375A1/en,https://patentimages.storage.googleapis.com/b5/21/7f/ea1333b1840dc4/US20210251375A1-20210819-D00000.png
US-2021290353-A1,Interdental cleaning tool ,"Kobayashi Pharmaceutical Co., Ltd.",Tasuku Kikkawa,2018-04-27,2019-04-26,2021-09-23,,https://patents.google.com/patent/US20210290353A1/en,https://patentimages.storage.googleapis.com/c4/ee/46/d1423ef7d86c83/US20210290353A1-20210923-D00000.png
US-2020338872-A1,Laminate and method for its production ,AGC Inc.,"Norio Ozawa, Tomoya Hosoda, Takashi Sato",2018-04-16,2020-07-09,2020-10-29,,https://patents.google.com/patent/US20200338872A1/en,https://patentimages.storage.googleapis.com/e0/5a/3c/d23023eff6e08a/US20200338872A1-20201029-D00000.png
US-2021018809-A1,Light control unit ,"Toppan Printing Co., Ltd.","Masayuki Takahashi, Kazuki Takahashi, Yasunori Hashida",2018-04-05,2020-10-05,2021-01-21,,https://patents.google.com/patent/US20210018809A1/en,https://patentimages.storage.googleapis.com/12/f8/0b/66e34c89d41060/US20210018809A1-20210121-D00000.png
US-2021043886-A1,Secondary battery ,"Murata Manufacturing Co., Ltd.","Kenji Oshima, Koji Hattori, Shuichi Nagaoka",2018-04-19,2020-10-15,2021-02-11,,https://patents.google.com/patent/US20210043886A1/en,https://patentimages.storage.googleapis.com/6a/9d/a3/80611272f6c04b/US20210043886A1-20210211-D00000.png
US-2021022893-A1,Stent ,"Takao ITOI, Kawasumi Laboratories, Inc.","Takao ITOI, Noriaki Shirahama",2018-04-27,2019-04-22,2021-01-28,,https://patents.google.com/patent/US20210022893A1/en,https://patentimages.storage.googleapis.com/9a/2c/f3/0700118959db6a/US20210022893A1-20210128-D00000.png
US-2021052139-A1,Endoscope ,"Panasonic I-Pro Sensing Solutions Co., Ltd.","Yuichi HATASE, Naoyuki Haraguchi",2018-04-25,2019-04-19,2021-02-25,,https://patents.google.com/patent/US20210052139A1/en,https://patentimages.storage.googleapis.com/a6/64/8b/226b0f6481c9f2/US20210052139A1-20210225-D00000.png
US-2019323149-A1,Electrospinning head and electrospinning apparatus ,Kabushiki Kaisha Toshiba,"Shizuo Kinoshita, Kenya UCHIDA, Satomi Sakai",2018-04-20,2019-04-18,2019-10-24,,https://patents.google.com/patent/US20190323149A1/en,https://patentimages.storage.googleapis.com/31/41/77/b05e1d08a7aaf0/US20190323149A1-20191024-D00000.png
US-2019321241-A1,Absorbent article comprising an adhesive composition ,The Procter & Gamble Company,"Robert Haines Turner, Torsten Lindner, Matthias Morand, Benjamin John Kutay, Holger Beruda, Ekaterina Ponomarenko, William L. Bunnelle, Jon FAGERNESS, Nick Fowler, Bill TURNER, Andres Sustic, Enrico Buenacosa, Steve OETTING, Steve McHaney, J.J. DeCAIR",2018-04-20,2019-04-18,2019-10-24,,https://patents.google.com/patent/US20190321241A1/en,https://patentimages.storage.googleapis.com/e9/8b/fe/9ec99e515bb20a/US20190321241A1-20191024-D00000.png
US-2019322017-A1,Production Method of Insert-Molded Product and Insert-Molded Product ,"Yamaha Fine Technologies Co., Ltd.","Shuji Tanaka, Tadashi Imaizumi, Fuminori Nagase, Katsuya Suzuki, Yuichi UCHIBORI",2018-04-18,2019-04-17,2019-10-24,,https://patents.google.com/patent/US20190322017A1/en,https://patentimages.storage.googleapis.com/cf/ef/74/1aa0bdffcc8f41/US20190322017A1-20191024-D00000.png
US-2021175580-A1,Electrochemical devices and methods of making and use thereof ,"Board Of Regents, The University Of Texas System","Charles AMOS, Nicholas GRUNDISH",2018-04-16,2019-04-16,2021-06-10,,https://patents.google.com/patent/US20210175580A1/en,https://patentimages.storage.googleapis.com/56/a0/a2/6f57cda387eda6/US20210175580A1-20210610-D00000.png
US-2021152911-A1,Earpiece ,"Sekisui Polymatech Co., Ltd.",Shinya Mizoe,2018-04-25,2019-04-15,2021-05-20,,https://patents.google.com/patent/US20210152911A1/en,https://patentimages.storage.googleapis.com/37/7e/50/60026b694ae3b4/US20210152911A1-20210520-D00000.png
US-2021137691-A1,Artificial meniscus including circumferential and non-circumferential fiber bundles ,Georgia Tech Research Corporation,"Trent Gardner CALLCOTT, Jonathan William SCHWARTZ, David Nelson Ku",2018-04-12,2019-04-12,2021-05-13,,https://patents.google.com/patent/US20210137691A1/en,https://patentimages.storage.googleapis.com/d1/01/9b/5f9d091fb5c329/US20210137691A1-20210513-D00000.png
US-2021161403-A1,"Devices, systems, and methods for training pelvic floor muscles ",Renovia Inc.,"Marc D. Beer, Jose Bohorquez, Samantha J. Pulliam, Jessica L. McKinney",2018-04-13,2019-04-12,2021-06-03,,https://patents.google.com/patent/US20210161403A1/en,https://patentimages.storage.googleapis.com/9a/93/7c/c7d8752e687eec/US20210161403A1-20210603-D00000.png
US-2019321005-A1,"Subject information acquisition apparatus, subject information processing method, and storage medium using probe to receive acoustic wave ",Canon Kabushiki Kaisha,"Shoya Sasaki, Kenichi Nagae",2018-04-18,2019-04-12,2019-10-24,,https://patents.google.com/patent/US20190321005A1/en,https://patentimages.storage.googleapis.com/a4/ec/d9/e3085db5be3b58/US20190321005A1-20191024-D00000.png
US-2021165545-A1,Pressure sensitive display device ,Mttech Interactive Multimedia Systems Ltd,"Gal Benjamin HAMBURGER, Gabriel GELERENTER",2018-04-12,2019-04-11,2021-06-03,,https://patents.google.com/patent/US20210165545A1/en,https://patentimages.storage.googleapis.com/ce/80/3d/6ddf6913acf4ad/US20210165545A1-20210603-D00000.png
US-2019314619-A1,Multi-stage balloon catheter systems and methods ,"Merit Medical Systems, Inc.","Aaron Hopkinson, Jason Wiersdorf",2018-04-13,2019-04-11,2019-10-17,,https://patents.google.com/patent/US20190314619A1/en,https://patentimages.storage.googleapis.com/63/67/10/8d3d04fcc997aa/US20190314619A1-20191017-D00000.png
US-2021146577-A1,Composite Material Pallet Assembly Formed from Recycled Material ,Regen-Composites International Corp.,Prakash Gowdar,2018-04-11,2019-04-11,2021-05-20,,https://patents.google.com/patent/US20210146577A1/en,https://patentimages.storage.googleapis.com/68/40/ae/0257a38e9ec159/US20210146577A1-20210520-D00000.png
US-2021030250-A1,Cleaning Sheet ,Kikuo Yamada,Kikuo Yamada,2018-04-10,2019-04-10,2021-02-04,,https://patents.google.com/patent/US20210030250A1/en,https://patentimages.storage.googleapis.com/33/86/a6/2e9b3c558cf858/US20210030250A1-20210204-D00000.png
US-2020365946-A1,Non-Aqueous Electrolyte Solution for Lithium Secondary Battery and Lithium Secondary Battery Including the Same ,"Lg Chem, Ltd.","Hyun Seung Kim, Chul Haeng Lee, Jeong Woo Oh",2018-04-11,2019-04-10,2020-11-19,,https://patents.google.com/patent/US20200365946A1/en,https://patentimages.storage.googleapis.com/f6/5e/08/1fc7badb42f34f/US20200365946A1-20201119-D00000.png
US-2019307372-A1,Battery-less sweat patch to measure biochemical composition ,"Cesar A. Ocampo, Hong Anh TRUONG, Cihan YILMAZ","Cesar A. Ocampo, Hong Anh TRUONG, Cihan YILMAZ",2018-04-10,2019-04-09,2019-10-10,,https://patents.google.com/patent/US20190307372A1/en,https://patentimages.storage.googleapis.com/9c/06/f6/4de732e98dc1c2/US20190307372A1-20191010-D00000.png
US-2021146096-A1,Movable catheter ,"National University Corporation Shiga University Of Medical Science, Zeon Corporation","Atsushi Yamada, Tohru Tani, Wataru Yonemichi",2018-04-16,2019-04-09,2021-05-20,,https://patents.google.com/patent/US20210146096A1/en,https://patentimages.storage.googleapis.com/ac/87/8d/4bc25acb5c292a/US20210146096A1-20210520-D00000.png
US-2021128840-A1,Stretchable plunger assemblies ,"Sio2 Medical Products, Inc.","Brian Russell Lilly, Timothy M. Miller, Shankara Narayanappa",2018-04-09,2019-04-09,2021-05-06,,https://patents.google.com/patent/US20210128840A1/en,https://patentimages.storage.googleapis.com/5e/81/c2/9d00ae586cd8ff/US20210128840A1-20210506-D00000.png
US-2019315979-A1,Curable resin composition and manufacturing method of three-dimensional object using the same ,Canon Kabushiki Kaisha,"Takayuki Hiratani, Kyohei Wada",2018-04-16,2019-04-08,2019-10-17,,https://patents.google.com/patent/US20190315979A1/en,https://patentimages.storage.googleapis.com/da/b9/0c/e72f1e3c4d9068/US20190315979A1-20191017-D00001.png
US-2021030299-A1,Apparatus and methods for detection of the onset and monitoring the progression of cerebral ischemia to enable optimal stroke treatment ,The Board Of Trustees Of The Leland Stanford Junior University,"Urs Hendrik NABER, Orestis Vardoulis, Patrick Clyne THOMPSON, Lily Ayodele Roberts",2018-04-06,2019-04-08,2021-02-04,,https://patents.google.com/patent/US20210030299A1/en,https://patentimages.storage.googleapis.com/9a/65/bc/41546e03a2c775/US20210030299A1-20210204-D00000.png
US-2021013511-A1,"Positive Electrode Active Material, Method of Preparing the Same, Positive Electrode Including the Positive Electrode Active Material, and Secondary Battery Including the Positive Electrode ","Lg Chem, Ltd.","Seul Ki Kim, Hye Lim Jeon, Tae Gon Kim, Wang Mo JUNG, Sang Wook Lee",2018-04-06,2019-04-05,2021-01-14,,https://patents.google.com/patent/US20210013511A1/en,https://patentimages.storage.googleapis.com/50/ff/88/11a9a5b9c4e5cb/US20210013511A1-20210114-D00000.png
US-2021093883-A1,Light irradiation device and light irradiation method ,"Public University Corporation Nagoya City University, Ushio Denki Kabushiki Kaisha","Jun Mori, Katsuji Iguchi, Hitoshi Aoki, Akimichi Morita, Hideyuki Masuda, Makoto Kimura",2018-04-27,2019-04-05,2021-04-01,,https://patents.google.com/patent/US20210093883A1/en,https://patentimages.storage.googleapis.com/ca/16/b7/e0e22002fa57a4/US20210093883A1-20210401-D00000.png
US-2021021050-A1,Gradient permittivity film ,3M Innovative Properties Company,"Jaewon Kim, Stephen J. Etzkorn, Ronald D. Jesme, Dipankar Ghosh, Mohsen Salehi, Guanglei Du, John A. Wheatley",2018-04-06,2019-04-04,2021-01-21,,https://patents.google.com/patent/US20210021050A1/en,https://patentimages.storage.googleapis.com/d6/7e/9f/47488caacb9ce1/US20210021050A1-20210121-D00000.png
US-2021050673-A1,Radar standing wave dampnening components and systems ,3M Innovative Properties Company,"Dipankar Ghosh, Jaewon Kim, Stephen J. Etzkorn, Ronald D. Jesme, Mohsen Salehi, Guanglei Du, John A. Wheatley",2018-04-06,2019-04-04,2021-02-18,,https://patents.google.com/patent/US20210050673A1/en,https://patentimages.storage.googleapis.com/a7/da/a6/e8743db540e8a2/US20210050673A1-20210218-D00000.png
US-2019308765-A1,Condiment container ,"Thomas Solomon, Kyle Kruger","Thomas Solomon, Kyle Kruger",2018-04-04,2019-04-04,2019-10-10,,https://patents.google.com/patent/US20190308765A1/en,https://patentimages.storage.googleapis.com/25/01/f5/e9610bfc09c38b/US20190308765A1-20191010-D00000.png
US-2021238381-A1,"Thermosetting composition, prepreg, metal foil-clad laminate, resin sheet, and printed wiring board ","Mitsubishi Gas Chemical Company, Inc.","Yoshihiro NAKAZUMI, Kentaro Takano",2018-04-27,2019-04-02,2021-08-05,,https://patents.google.com/patent/US20210238381A1/en,
US-2021154978-A1,Metal-carbon fiber reinforced plastic composite and method for manufacturing metal-carbon fiber reinforced plastic composite ,Nippon Steel Corporation,"Masumi KOORI, Yasuaki KAWAMURA, Kohei Ueda",2018-04-03,2019-04-02,2021-05-27,,https://patents.google.com/patent/US20210154978A1/en,https://patentimages.storage.googleapis.com/1d/89/36/59bb6c3a21b845/US20210154978A1-20210527-D00000.png
US-2021038479-A1,Diverting jejunostomy tube ,Georgetown University,Emil COHEN,2018-04-02,2019-03-29,2021-02-11,,https://patents.google.com/patent/US20210038479A1/en,https://patentimages.storage.googleapis.com/2d/01/d0/e2fa75965bb83e/US20210038479A1-20210211-D00000.png
US-2021025908-A1,Temperature Adjustment System and Temperature Adjustment Method ,"Konica Minolta, Inc.","Kou Osawa, Takanori Murayama, Yuuya SHOUJI, Youichi Aoki, Hiroshi Hirayama",2018-04-05,2019-03-29,2021-01-28,,https://patents.google.com/patent/US20210025908A1/en,https://patentimages.storage.googleapis.com/09/63/cb/ebce985a163ede/US20210025908A1-20210128-D00000.png
US-2021008233-A1,Controlled release of radionuclides ,Alpha Tau Medical Ltd.,"Itzhak Kelson, Yona Keisari, Michael Schmidt, Amnon Gat, Ofer Magen, Guy Keret, Amitai Sosnovitch, Avia Berkowitz",2018-04-02,2019-03-28,2021-01-14,,https://patents.google.com/patent/US20210008233A1/en,https://patentimages.storage.googleapis.com/bf/d1/16/0111ece15196c3/US20210008233A1-20210114-D00000.png
US-2021014978-A1,Base material for printed circuit board and method of manufacturing base material for printed circuit board ,"Sumitomo Electric Industries, Ltd.","Kayo HASHIZUME, Masamichi Yamamoto",2018-04-26,2019-03-27,2021-01-14,,https://patents.google.com/patent/US20210014978A1/en,https://patentimages.storage.googleapis.com/c4/12/fc/123cadace078dc/US20210014978A1-20210114-D00000.png
US-2021036308-A1,Negative electrode plate for lead-acid battery and lead-acid battery ,Gs Yuasa International Ltd.,Akihito Tsujinaka,2018-04-12,2019-03-26,2021-02-04,,https://patents.google.com/patent/US20210036308A1/en,https://patentimages.storage.googleapis.com/f6/35/3b/aa7b7f0c835ec3/US20210036308A1-20210204-D00000.png
US-2021020928-A1,"Negative electrode active material, secondary battery, and electronic device ","Semiconductor Energy Laboratory Co., Ltd.","Mayumi MIKAMI, Jun Ishikawa, Miku FUJITA, Kazuhei NARITA",2018-04-05,2019-03-26,2021-01-21,,https://patents.google.com/patent/US20210020928A1/en,https://patentimages.storage.googleapis.com/d4/d0/4c/cc67a3813cd7ba/US20210020928A1-20210121-D00000.png
US-2019305195-A1,Wavelength conversion member and light emitting device ,Sharp Kabushiki Kaisha,"Hiroshi Fukunaga, Tatsuya RYOHWA, Kanako Nakata, Kenichi Yoshimura, Masatsugu Masuda",2018-04-02,2019-03-25,2019-10-03,,https://patents.google.com/patent/US20190305195A1/en,https://patentimages.storage.googleapis.com/25/b0/fb/da42824bbd2114/US20190305195A1-20191003-D00000.png
US-2020119331-A1,"Method of producing iron phosphide, positive electrode for lithium secondary battery comprising iron phosphide, and lithium secondary battery comprising same ","Lg Chem, Ltd.","Suenghoon HAN, Jungmi MOON, Kwonnam Sohn, Doo Kyung YANG",2018-04-10,2019-03-25,2020-04-16,,https://patents.google.com/patent/US20200119331A1/en,https://patentimages.storage.googleapis.com/fc/61/d1/b7488bfa74a1e0/US20200119331A1-20200416-D00000.png
US-2019307424-A1,Ultrasonic probe and ultrasonic diagnostic apparatus ,"Konica Minolta, Inc.",Ikuhiro KITAGAKI,2018-04-09,2019-03-07,2019-10-10,,https://patents.google.com/patent/US20190307424A1/en,https://patentimages.storage.googleapis.com/b6/5c/71/601a40f1ff4d86/US20190307424A1-20191010-D00000.png
US-2021210704-A1,"Conformal organic field-effect transistor, transistor array, and preparation method thereof ",Northeast Normal University,"Qing xin TANG, Xiaoli Zhao, Yan hong TONG, Yi Chun Liu",2018-04-11,2018-11-28,2021-07-08,,https://patents.google.com/patent/US20210210704A1/en,https://patentimages.storage.googleapis.com/5d/ba/1a/71d9baf445e1af/US20210210704A1-20210708-D00000.png
US-2021017355-A1,Method for degrading resin molded body and degradable resin product ,P-Life Japan Inc.,"Isao TOYAMA, Claudio Augusto FERNANDEZ PRECIADO",2018-04-27,2018-04-27,2021-01-21,,https://patents.google.com/patent/US20210017355A1/en,https://patentimages.storage.googleapis.com/90/cc/13/dbe4663341a10d/US20210017355A1-20210121-D00001.png
US-2019329471-A1,Die pin having ceramic tip for molten plastic extrusion ,"Graham Packaging Company, L.P.","Jason E. Burns, Larry M. Taylor",2018-04-27,2018-04-27,2019-10-31,,https://patents.google.com/patent/US20190329471A1/en,https://patentimages.storage.googleapis.com/5a/bd/ec/acda316984ec73/US20190329471A1-20191031-D00000.png
US-2021164158-A1,Textile printing ,"Hewlett-Packard Development Company, L.P.","Jie Zheng, Dennis Z. Guo",2018-04-16,2018-04-16,2021-06-03,,https://patents.google.com/patent/US20210164158A1/en,https://patentimages.storage.googleapis.com/6c/05/5e/060b4c44ee7ac8/US20210164158A1-20210603-D00000.png
US-2020308437-A1,Fluid sets ,"Hewlett-Packard Development Company, L,P.","Dennis Z. Guo, Jie Zheng, David Michael Ingle, Ronald A. Askeland",2018-04-16,2018-04-16,2020-10-01,,https://patents.google.com/patent/US20200308437A1/en,https://patentimages.storage.googleapis.com/a3/08/49/d9316140f018e0/US20200308437A1-20201001-D00000.png
US-2021047777-A1,Textile printing with inkjet inks ,"Hewlett-Packard Development Company, L.P.","Hector Lebron, Raffaella Fior, Stephen G. Rudisill, Jesiska TANDY, Alexey S. Kabalnov",2018-04-16,2018-04-16,2021-02-18,,https://patents.google.com/patent/US20210047777A1/en,https://patentimages.storage.googleapis.com/bd/ec/31/7dae90a3bd499d/US20210047777A1-20210218-D00000.png
US-2021069646-A1,Electrodialysis device for the desalination of water for oil and gas applications ,"Total Se, Mega A.S., Membrain S.R.O.","Alexandre Goldszal, Matthieu JACOB, David TVRZNÍK, Lubos NOVÁK",2018-04-13,2018-04-13,2021-03-11,,https://patents.google.com/patent/US20210069646A1/en,https://patentimages.storage.googleapis.com/da/c7/b8/e2e4949c79e237/US20210069646A1-20210311-D00000.png
US-2021146599-A1,Biaxially oriented tubular blown film stretching machine by isostatic pressurized water ,Enzpire Industry Company Limited,Arthorn WICHITAMORNLOET,2018-04-10,2018-04-10,2021-05-20,,https://patents.google.com/patent/US20210146599A1/en,https://patentimages.storage.googleapis.com/60/61/49/6e4b4b8ea7a7d6/US20210146599A1-20210520-D00000.png
US-2020369878-A1,"Resin composition, molded product and its use ",AGC Inc.,"Norio Ozawa, Tomoya Hosoda, Takashi Sato",2018-04-13,2020-08-13,2020-11-26,,https://patents.google.com/patent/US20200369878A1/en,
US-2019322900-A1,Adhesive composition for absorbent articles ,The Procter & Gamble Company,"Robert Haines Turner, Torsten Lindner, Matthias Morand, Benjamin John Kutay, Holger Beruda, Ekaterina Ponomarenko, William L. Bunnelle, Jon FAGERNESS, Nick Fowler, Bill TURNER, Andres Sustic, Enrico Buenacosa, Steve OETTING, Steve McHaney, J.J. DeCAIR",2018-04-20,2019-04-18,2019-10-24,,https://patents.google.com/patent/US20190322900A1/en,
US-2021032437-A1,Flame-retardant thermoplastic molding composition ,Basf Se,"Michael Roth, Klaus Uske, Michaela Heussler, Christoph Minges",2018-04-13,2019-04-11,2021-02-04,,https://patents.google.com/patent/US20210032437A1/en,
US-2021005874-A1,"Method of Preparing Positive Electrode Active Material For Lithium Secondary Battery, Positive Electrode Active Material For Lithium Secondary Battery, And Positive Electrode For Lithium Secondary Battery and Lithium Secondary Battery Including The Same ","Lg Chem, Ltd.","Sang Min Park, Hwa Seok Chae, Sin young PARK, Hong Kyu Park, Seong Hoon Kang",2018-04-04,2019-04-04,2021-01-07,,https://patents.google.com/patent/US20210005874A1/en,
US-2021155813-A1,Photocurable inkjet printing ink composition ,Sakata Inx Corporation,"Okinori NAKASHIMA, Takuya Myose, Kazuhiro FUKE, Yuki Yoshida",2018-04-11,2019-04-01,2021-05-27,,https://patents.google.com/patent/US20210155813A1/en,
US-2021115218-A1,Rubber composition comprising a reinforcing filler with a small specific surface area ,Compagnie Generale Des Etablissements Michelin,"Katia Baran, Nathalie Salgues",2018-04-09,2019-04-01,2021-04-22,,https://patents.google.com/patent/US20210115218A1/en,
US-2021040315-A1,Resin composition and synthetic leather ,Dic Corporation,"Tomohiro Tetsui, Atsushi Ninomiya",2018-04-20,2019-03-28,2021-02-11,,https://patents.google.com/patent/US20210040315A1/en,
US-2021363668-A1,Fabric and textile product ,Teijin Limited,"Hiroki Shimada, Kenji Iwashita, Kiho Nabetani",2018-04-03,2019-03-25,2021-11-25,,https://patents.google.com/patent/US20210363668A1/en,
US-2019324328-A1,"Optical plate with protrusions, optical structure, backlight module and display device ",Chi Mei Corporation,"Hsin-Hung Chen, Wei-Chan Tseng, Chung-Hao WANG",2018-04-20,2019-04-18,2019-10-24,,https://patents.google.com/patent/US20190324328A1/en,https://patentimages.storage.googleapis.com/f5/94/07/b170f71afebf85/US20190324328A1-20191024-D00000.png
US-2019317429-A1,"Developing device, image forming apparatus and cartridge ",Canon Kabushiki Kaisha,"Hiroki Tanaka, Motonari Ito, Hideo Kihara, Akihisa Matsukawa",2018-04-11,2019-04-11,2019-10-17,,https://patents.google.com/patent/US20190317429A1/en,https://patentimages.storage.googleapis.com/44/2c/ff/fcd3c7f482bfc4/US20190317429A1-20191017-D00000.png
US-2019324587-A1,Electronic device and input element thereof ,Asustek Computer Inc.,"Bin-Yi Lin, Chung-Wei LIANG",2018-04-19,2019-04-10,2019-10-24,,https://patents.google.com/patent/US20190324587A1/en,https://patentimages.storage.googleapis.com/f3/50/a8/11caea00a22ecb/US20190324587A1-20191024-D00000.png
US-2019307138-A1,System for measuring smoke absorption into food products and method of making the system ,Sugar Creek Packing Co.,"Robert E. Hanson, David Martin Phinney, Joelle Hemmelgarn, Jacquelyn Blanchard, Matthew Wesley, Matthew Tripp, Alex Gutkoski, Mitch Wiles",2018-04-09,2019-04-08,2019-10-10,,https://patents.google.com/patent/US20190307138A1/en,https://patentimages.storage.googleapis.com/60/78/96/38857d6537c49e/US20190307138A1-20191010-D00000.png
US-2019311671-A1,"Display device, method of manufacturing the same, and glass stack ","Samsung Display Co., Ltd.","Jong Hoon YEUM, Go Woon Kang, Yun Ho Kim, Jeung Soo Kim, Youn Bum Lee",2018-04-04,2019-04-03,2019-10-10,,https://patents.google.com/patent/US20190311671A1/en,https://patentimages.storage.googleapis.com/06/43/5f/b8efdf23e090ec/US20190311671A1-20191010-D00000.png
