US-2020365672-A1,Display panel and a display apparatus including the same ,"Samsung Display Co., Ltd.","WonSuk Choi, Hyunchul Kim, Seongryong Lee, Eunae JUNG, Yoonsun CHOI",2019-05-13,2020-05-12,2020-11-19,,https://patents.google.com/patent/US20200365672A1/en,https://patentimages.storage.googleapis.com/8f/91/25/c5609af74e035b/US20200365672A1-20201119-D00000.png
US-2020370171-A1,Stain Hiding Fabric With Metallic Coating ,Milliken & Company,"Rajib Mondal, Matthew I. Foote, II Gregory A. Satterfield, Cristina M. Acevedo, Geoffrey R. Haas",2019-05-23,2020-04-19,2020-11-26,,https://patents.google.com/patent/US20200370171A1/en,https://patentimages.storage.googleapis.com/cc/2b/d8/38c118b1b59367/US20200370171A1-20201126-D00000.png
US-2020381367-A1,Element chip manufacturing method ,"Panasonic Intellectual Property Management Co., Ltd.","Kiyoshi Arita, Shogo Okita, Hidehiko Karasaki",2019-05-29,2020-05-12,2020-12-03,,https://patents.google.com/patent/US20200381367A1/en,https://patentimages.storage.googleapis.com/70/f9/19/95539e325a6fd5/US20200381367A1-20201203-D00000.png
US-2020365676-A1,Display device ,"Samsung Display Co., Ltd.","Sang Hoon Lim, Young Kwan Kim, Bo Hyuk LEE, Jin Hyeong KIM, Young Jin Oh, Ku Hyun KANG, Sung Jin Jang",2019-05-14,2020-05-05,2020-11-19,,https://patents.google.com/patent/US20200365676A1/en,https://patentimages.storage.googleapis.com/4a/8b/ce/9b63596b406a3e/US20200365676A1-20201119-D00000.png
US-2020379371-A1,Image forming apparatus ,Kyocera Document Solutions Inc.,Kotaro Ogawa,2019-05-28,2020-05-26,2020-12-03,,https://patents.google.com/patent/US20200379371A1/en,https://patentimages.storage.googleapis.com/0c/13/43/3d77da98b078cb/US20200379371A1-20201203-D00000.png
US-2020358040-A1,"Method of manufacturing thin film transistor, method of manufacturing display apparatus and thin film transistor substrate ","Samsung Display Co., Ltd.","Keum Hee LEE, Joongeol KIM, Kap Soo Yoon, Woo Geun Lee, Seung-Ha Choi, Jiyun HONG",2019-05-10,2020-03-27,2020-11-12,,https://patents.google.com/patent/US20200358040A1/en,https://patentimages.storage.googleapis.com/d0/f6/79/04b8304b0e009b/US20200358040A1-20201112-D00000.png
US-10995272-B2,Pellet mixture and injection molded product ,"Sumitomo Chemical Company, Limited","Tomoyuki Hara, Takayuki Sugiyama",2019-05-17,2020-01-15,2021-05-04,2021-05-04,https://patents.google.com/patent/US10995272B2/en,
US-2020352570-A1,Surgical stapling device ,Covidien Lp,"Sulaiman Hussaini, Gerald N. Hodgkinson, Daniel A. Schulz-Jander, Dwight G. Bronson",2019-05-08,2020-04-03,2020-11-12,,https://patents.google.com/patent/US20200352570A1/en,https://patentimages.storage.googleapis.com/f5/33/cb/a17e830bcbcfba/US20200352570A1-20201112-D00000.png
US-2020363139-A1,Multi-function thermal absorber and isolator using liquid-to-gas phase change material ,Raytheon Company,"Leonel A. Olivarez, Adam C. Wood",2019-05-13,2019-05-13,2020-11-19,,https://patents.google.com/patent/US20200363139A1/en,https://patentimages.storage.googleapis.com/5f/60/6e/e9881c79878496/US20200363139A1-20201119-D00000.png
US-2020352565-A1,Surgical stapling device ,Covidien Lp,Daniel A. Schulz-Jander,2019-05-08,2020-04-03,2020-11-12,,https://patents.google.com/patent/US20200352565A1/en,https://patentimages.storage.googleapis.com/5e/15/87/39cb13b87476b5/US20200352565A1-20201112-D00000.png
US-11174342-B2,Pellet of liquid crystal polyester resin composition and method of producing pellet of liquid crystal polyester resin composition ,"Sumitomo Chemical Company, Limited","Tomoyuki Hara, Masanobu UONAMI, Yoshio Shoda",2019-05-17,2020-03-13,2021-11-16,2021-11-16,https://patents.google.com/patent/US11174342B2/en,https://patentimages.storage.googleapis.com/4e/fe/dd/acbcfe98e28a56/US11174342-20211116-D00000.png
US-2021119302-A1,Separator for secondary battery comprising dispersant and method of manufacturing the same ,"Lg Chem, Ltd.","Myeong Soo Kim, Su Jin YOON",2019-05-09,2020-04-17,2021-04-22,,https://patents.google.com/patent/US20210119302A1/en,https://patentimages.storage.googleapis.com/c6/90/9f/fe792961fd74b6/US20210119302A1-20210422-D00000.png
US-10933539-B2,Gripping devices and methods for making the same ,Trustees Of Boston University,"Douglas P. Holmes, Yi Yang, Peter Zink",2019-05-21,2020-05-21,2021-03-02,2021-03-02,https://patents.google.com/patent/US10933539B2/en,https://patentimages.storage.googleapis.com/3f/fd/49/5b9fa25b0a8a12/US10933539-20210302-D00000.png
US-2020370312-A1,Tile spacer and methods of use thereof ,Joseph Lawrence PETERSON,Joseph Lawrence PETERSON,2019-05-23,2019-07-31,2020-11-26,,https://patents.google.com/patent/US20200370312A1/en,https://patentimages.storage.googleapis.com/5f/21/73/d5e4484972977d/US20200370312A1-20201126-D00000.png
US-2020354293-A1,Process and apparatus for dual feed para-xylene separation ,Uop Llc,"Robert E. Tsai, Joseph Montalbano, Ellen Arnold, Raymond Shih, Anton N. Mlinar",2019-05-10,2019-05-10,2020-11-12,,https://patents.google.com/patent/US20200354293A1/en,https://patentimages.storage.googleapis.com/6c/55/44/ea12370d27717a/US20200354293A1-20201112-D00000.png
US-2020353218-A1,Stabilization Device for Invasive Hemodynamic Monitoring Transducer ,Benjamin-Fausto S. Thielman,Benjamin-Fausto S. Thielman,2019-05-08,2019-05-08,2020-11-12,,https://patents.google.com/patent/US20200353218A1/en,https://patentimages.storage.googleapis.com/81/a3/69/9fed3553a26c66/US20200353218A1-20201112-D00000.png
US-2020353656-A1,Molding process for joining prefabricated workpiece substrates into a workpiece assembly ,GM Global Technology Operations LLC,"David A. Okonski, Ryan Gergely, Blair E. Carlson, William R. Rodgers",2019-05-06,2019-05-06,2020-11-12,,https://patents.google.com/patent/US20200353656A1/en,https://patentimages.storage.googleapis.com/0b/af/b1/b408bcb072ae20/US20200353656A1-20201112-D00000.png
US-2020354569-A1,Polycarbonate composition which exhibits a flecked appearance when molded ,Trinseo Europe Gmbh,"Claude T. Van Nuffel, Yao-Chu Chung, Kai-Leung Cheng, Hung Chang Wu, Jih-Chiang Hsieh",2019-05-07,2020-04-22,2020-11-12,,https://patents.google.com/patent/US20200354569A1/en,https://patentimages.storage.googleapis.com/b0/95/df/08ac7e3293fed6/US20200354569A1-20201112-D00000.png
US-2020352571-A1,Surgical stapling device ,Covidien Lp,"Gerald N. Hodgkinson, Michael A. Soltz, Sulaiman Hussaini, Souad Sedlik",2019-05-08,2020-04-03,2020-11-12,,https://patents.google.com/patent/US20200352571A1/en,https://patentimages.storage.googleapis.com/d7/85/b1/cd777c53592ac6/US20200352571A1-20201112-D00000.png
US-2020345624-A1,Nanopore Delivery Device ,Lee Edward Hudson,Lee Edward Hudson,2019-05-03,2020-04-22,2020-11-05,,https://patents.google.com/patent/US20200345624A1/en,https://patentimages.storage.googleapis.com/de/01/74/f87e2caaa6f081/US20200345624A1-20201105-D00000.png
US-2020345652-A1,Nanopore Delivery Device ,Lee Edward Hudson,Lee Edward Hudson,2019-05-03,2020-04-30,2020-11-05,,https://patents.google.com/patent/US20200345652A1/en,https://patentimages.storage.googleapis.com/8a/78/51/664ace508cd5d9/US20200345652A1-20201105-D00000.png
US-2020363743-A1,"Toner, toner stored container, developer, developing device, process cartridge, and image forming apparatus ","Hisashi Nakajima, Akihiro Kaneko, Yoshitaka Yamauchi, Katsunori Kurose, Hyo Shu","Hisashi Nakajima, Akihiro Kaneko, Yoshitaka Yamauchi, Katsunori Kurose, Hyo Shu",2019-05-14,2020-04-22,2020-11-19,,https://patents.google.com/patent/US20200363743A1/en,https://patentimages.storage.googleapis.com/63/f8/34/74f458b579c0b9/US20200363743A1-20201119-D00000.png
US-2021273296-A1,"Functional separator, method for manufacturing the same, and lithium secondary battery comprising the same ","Lg Chem, Ltd.","Kihyun Kim, Seungbo YANG",2019-05-03,2020-04-28,2021-09-02,,https://patents.google.com/patent/US20210273296A1/en,https://patentimages.storage.googleapis.com/47/0d/35/916878ac774f4d/US20210273296A1-20210902-D00001.png
US-2021288380-A1,"Functional separator, method for manufacturing the same, and lithium secondary battery comprising the same ","Lg Chem, Ltd.","Kihyun Kim, Jangsoo LEE, Seungbo YANG, Soohyun KIM, Minsu Kim",2019-05-09,2020-04-28,2021-09-16,,https://patents.google.com/patent/US20210288380A1/en,https://patentimages.storage.googleapis.com/31/7c/a9/ecc998b99dab94/US20210288380A1-20210916-D00000.png
US-2020354028-A1,Drag-inducing mat for amusement park rides ,Universal City Studios Llc,"Byron Thomas Osborn, Eric Alan Vance, Pedro Lopez, Ryan Dale Walton, David Gerard Majdali",2019-05-09,2020-04-30,2020-11-12,,https://patents.google.com/patent/US20200354028A1/en,https://patentimages.storage.googleapis.com/1a/e7/0f/741fc5bc4dccd6/US20200354028A1-20201112-D00000.png
US-2020347694-A1,Dissolvable bridge plugs ,NexGen Oil Tools Inc.,"Travis Jack Power, Mark Wayne McLelland, Tuan A. Nguyen",2019-05-03,2020-04-29,2020-11-05,,https://patents.google.com/patent/US20200347694A1/en,https://patentimages.storage.googleapis.com/74/1f/ee/2164f384eea815/US20200347694A1-20201105-D00000.png
US-2020348254-A1,Low frequency apparatus and method for insect infestation detection ,King Fahd University Of Petroleum And Minerals,"Sharif lqbal Mitu SHEIKH, Forhad Hossain",2019-05-01,2019-06-25,2020-11-05,,https://patents.google.com/patent/US20200348254A1/en,https://patentimages.storage.googleapis.com/d6/f2/59/880b105263f151/US20200348254A1-20201105-D00000.png
US-2020370899-A1,Passenger Ride Extension for Special Services Using Remote Operation ,"Nissan North America, Inc., Renault S.A.S.","Aude Laurent, Armelle GUERIN, Erik VINKHUYZEN, Simon Tien, Kevin Poulet",2019-05-23,2019-05-23,2020-11-26,,https://patents.google.com/patent/US20200370899A1/en,https://patentimages.storage.googleapis.com/62/db/1f/59259f89b7b9da/US20200370899A1-20201126-D00000.png
US-2020377820-A1,Efficient biomass carbon-based solid acid esterification catalyst for producing biodiesel ,King Fahd University Of Petroleum And Minerals,"Chanbasha Basheer, Abdulaziz Al-Saadi, Muhammad Azeem AKBAR, Rashed Saed BAKDASH",2019-05-29,2019-05-29,2020-12-03,,https://patents.google.com/patent/US20200377820A1/en,https://patentimages.storage.googleapis.com/cd/5f/4e/37295bb144e21b/US20200377820A1-20201203-D00000.png
US-2020381186-A1,Platinum compounds and methods useful for making dye-sensitized solar cells ,King Fahd University Of Petroleum And Minerals,"Muhammad Ali Ehsan, Abdul Rehman, Abbas Saeed Hakeem",2019-05-29,2019-05-29,2020-12-03,,https://patents.google.com/patent/US20200381186A1/en,https://patentimages.storage.googleapis.com/89/fe/03/562752e2310254/US20200381186A1-20201203-D00001.png
US-2020372307-A1,Model insights framework for providing insight based on model evaluations to optimize machine learning models ,Adobe Inc.,"Sathya Arun, Nirmal Mani, Ashok Pancily Poothiyot",2019-05-22,2019-05-22,2020-11-26,,https://patents.google.com/patent/US20200372307A1/en,https://patentimages.storage.googleapis.com/58/14/11/3e7495287c8ce0/US20200372307A1-20201126-D00000.png
US-2020363449-A1,Pitot heater health monitoring system ,Rosemount Aerospace Inc.,Shoyeb Khan,2019-05-17,2019-07-16,2020-11-19,,https://patents.google.com/patent/US20200363449A1/en,https://patentimages.storage.googleapis.com/1e/a6/f1/3e26de71c97ad2/US20200363449A1-20201119-D00000.png
US-2019382735-A1,Multicopper Oxidase Mutant with Improved Salt Tolerance ,Jiangnan University,"Fang Fang, Tao Yang, Jingwen Zhou, Jian Chen, Guocheng Du, Jie Xu",2019-05-24,2019-07-29,2019-12-19,,https://patents.google.com/patent/US20190382735A1/en,https://patentimages.storage.googleapis.com/cc/b2/9d/3ac8701bd8039f/US20190382735A1-20191219-D00000.png
US-2020380842-A1,Dependent monitoring and caregiving system ,Ants Technology (Hk) Limited,"Ron Fridental, Ori Tal, Masha Zeldin-Melamed, Oranit Dror, Idit Diamant",2019-05-28,2020-01-29,2020-12-03,,https://patents.google.com/patent/US20200380842A1/en,https://patentimages.storage.googleapis.com/5d/4e/62/39e7d3da466ae5/US20200380842A1-20201203-D00000.png
US-2020359492-A1,Method And Apparatus For Production Of Radiometals And Other Radioisotopes Using A Particle Accelerator ,Strangis Radiopharmacy Consulting and Technology LLC,Saverio Roberto Strangis,2019-05-09,2020-01-30,2020-11-12,,https://patents.google.com/patent/US20200359492A1/en,https://patentimages.storage.googleapis.com/37/e5/de/e15c1fc0026ebe/US20200359492A1-20201112-D00000.png
US-2020360727-A1,Multi-leaf collimator and radiation therapy device ,"Shanghai United Imaging Healthcare Co., Ltd.","Jian Liu, Kun Yang, Jian Zhang, Yanfang Liu, Cheng Ni",2019-05-15,2020-02-25,2020-11-19,,https://patents.google.com/patent/US20200360727A1/en,https://patentimages.storage.googleapis.com/65/66/0f/4d0ba4ff228fc1/US20200360727A1-20201119-D00000.png
US-2020373784-A1,Electronic device including wireless charging structure ,"Samsung Electronics Co., Ltd.","Chanhun YUN, Minsoo Kim, Donghyeon YEO, Junghui PARK, Jiwoo Lee",2019-05-20,2020-04-20,2020-11-26,,https://patents.google.com/patent/US20200373784A1/en,https://patentimages.storage.googleapis.com/09/e7/da/85ac0f291f5646/US20200373784A1-20201126-D00000.png
US-2020357557-A1,Multilayer coil component ,Tdk Corporation,"Yuto SHIGA, Yoji Tozawa, Masaki Takahashi, Takashi Endo, Hajime Kato",2019-05-07,2020-04-21,2020-11-12,,https://patents.google.com/patent/US20200357557A1/en,https://patentimages.storage.googleapis.com/b3/33/df/7242edf1c62dd3/US20200357557A1-20201112-D00000.png
US-2020377105-A1,Methods and systems for computer-based determining of presence of dynamic objects ,Yandex Self Driving Group Llc,"Vyacheslav Vladimirovich MURASHKIN, Andrey Olegovich RYKOV, Artem Andreevich FILATOV",2019-05-27,2020-04-21,2020-12-03,,https://patents.google.com/patent/US20200377105A1/en,https://patentimages.storage.googleapis.com/30/a5/fb/458eda35dc7df6/US20200377105A1-20201203-D00000.png
US-2020348547-A1,Display device ,Coretronic Corporation,"Wen-Chin Tsai, Yin-Jen Lin",2019-05-05,2020-04-22,2020-11-05,,https://patents.google.com/patent/US20200348547A1/en,https://patentimages.storage.googleapis.com/91/cb/02/72323cf62ad02d/US20200348547A1-20201105-D00000.png
US-2020372831-A1,Ultrasound guided training simulators for cryoneurolysis pain blocks ,Black Cat Medical Llc,Michael F. Guzman,2019-05-23,2020-04-27,2020-11-26,,https://patents.google.com/patent/US20200372831A1/en,https://patentimages.storage.googleapis.com/e1/36/67/f30b1c5b5d9836/US20200372831A1-20201126-D00000.png
US-2020345791-A1,Probiotic Bacterial Strains That Produce Short Chain Fatty Acids And Compositions Comprising Same ,The Procter & Gamble Company,"Michael John Janusz, Anna Malgorzata Plechaty",2019-05-01,2020-04-28,2020-11-05,,https://patents.google.com/patent/US20200345791A1/en,https://patentimages.storage.googleapis.com/a4/ba/95/54c28a7e2c63de/US20200345791A1-20201105-D00001.png
US-2020365937-A1,"All solid battery, manufacturing method of all solid battery and solid electrolyte powder ","Taiyo Yuden Co., Ltd.","Chie Kawamura, Daigo Ito, Sachie TOMIZAWA",2019-05-13,2020-04-29,2020-11-19,,https://patents.google.com/patent/US20200365937A1/en,https://patentimages.storage.googleapis.com/ce/22/c9/a69cd20635e164/US20200365937A1-20201119-D00000.png
US-2020381802-A1,Antenna device and ic card having the same ,Tdk Corporation,"Masaki Matsushima, Noritaka CHIYO, Tomohiro MORIKI",2019-05-28,2020-04-30,2020-12-03,,https://patents.google.com/patent/US20200381802A1/en,https://patentimages.storage.googleapis.com/90/ee/d8/9656fbff7aa9e4/US20200381802A1-20201203-D00000.png
US-2020380332-A1,Antenna device and ic card having the same ,Tdk Corporation,"Masaki Matsushima, Noritaka CHIYO, Tomohiro MORIKI",2019-05-28,2020-04-30,2020-12-03,,https://patents.google.com/patent/US20200380332A1/en,https://patentimages.storage.googleapis.com/ef/d9/1a/337a0da147d44e/US20200380332A1-20201203-D00000.png
US-2021008117-A1,"Adiponectin-expressing regulatory t-cell precursors, composition and methods thereof ",The University Of Hong Kong,"Yu Wang, Aimin Xu, Yiwei Zhang, Handi CAO",2019-05-03,2020-05-01,2021-01-14,,https://patents.google.com/patent/US20210008117A1/en,https://patentimages.storage.googleapis.com/b3/9b/93/278c303868702a/US20210008117A1-20210114-D00000.png
US-2020360451-A1,Fermented milk for improving autonomic function ,"Meiji Co., Ltd., University Public Corporation Osaka","Yasuyoshi Watanabe, Kei Mizuno, Jun Henmi, Seiya Makino, Hiroshi Kano",2019-05-13,2020-05-01,2020-11-19,,https://patents.google.com/patent/US20200360451A1/en,https://patentimages.storage.googleapis.com/fd/92/ea/6792ba9dcea92c/US20200360451A1-20201119-D00000.png
US-2020355978-A1,Charge control agents and particle dispersions including the same ,E Ink Corporation,"Eugene BZOWEJ, John L. Marshall, Stephen J. Telfer, Brandon MacDonald",2019-05-10,2020-05-01,2020-11-12,,https://patents.google.com/patent/US20200355978A1/en,https://patentimages.storage.googleapis.com/73/35/e8/27b8a4c5e269a3/US20200355978A1-20201112-D00000.png
US-2020357151-A1,Imaging method and device ,GE Precision Healthcare LLC,"Xueli Wang, Ximiao CAO, Bingjie ZHAO, Weiwei Xing",2019-05-08,2020-05-04,2020-11-12,,https://patents.google.com/patent/US20200357151A1/en,https://patentimages.storage.googleapis.com/ff/c3/8b/dab855f01cb9c4/US20200357151A1-20201112-D00000.png
US-2020367851-A1,Medical diagnostic-imaging apparatus ,Canon Medical Systems Corporation,Katsumi Gotanda,2019-05-22,2020-05-04,2020-11-26,,https://patents.google.com/patent/US20200367851A1/en,https://patentimages.storage.googleapis.com/ee/d2/58/83e2f3b8fee233/US20200367851A1-20201126-D00000.png
US-2020353215-A1,System and Methods for Left Atrial Access ,Baylis Medical Company Inc.,"Gareth Davies, Eduardo Moriyama",2019-05-06,2020-05-05,2020-11-12,,https://patents.google.com/patent/US20200353215A1/en,https://patentimages.storage.googleapis.com/6c/11/28/f74fa98e0f4aa3/US20200353215A1-20201112-D00000.png
US-2020357150-A1,Method and device for obtaining predicted image of truncated portion ,GE Precision Healthcare LLC,"Xueli Wang, Bingjie ZHAO, Shiyu Li, Dan Liu",2019-05-08,2020-05-05,2020-11-12,,https://patents.google.com/patent/US20200357150A1/en,https://patentimages.storage.googleapis.com/3c/9d/1d/212e4f6d3c39f4/US20200357150A1-20201112-D00000.png
US-2020353222-A1,Conductance Based Digital Blood Flash Indicator Device ,"Bard Access Systems, Inc.","Arthur E. Jaquez, William Eccles",2019-05-08,2020-05-06,2020-11-12,,https://patents.google.com/patent/US20200353222A1/en,https://patentimages.storage.googleapis.com/e8/19/7a/81d9ea5614f2fd/US20200353222A1-20201112-D00000.png
US-2020362286-A1,Fermentation and aging apparatus ,"Lg Electronics, Inc.","Kyeongbo KIM, Junki YEO",2019-05-13,2020-05-07,2020-11-19,,https://patents.google.com/patent/US20200362286A1/en,https://patentimages.storage.googleapis.com/82/12/5a/e05a13c501d8ff/US20200362286A1-20201119-D00000.png
US-2020354651-A1,Hard surface cleaning compositions comprising alkoxylated phenols and perfumes and cleaning pads and methods for using such cleaning compositions ,The Procter & Gamble Company,"Fernando Ray Tollens, Pauline Cuc Vu, Brian Christopher Groendyke, William Alexander CYNECKI, Daniel Ross MAYFIELD, Afua Sarpong KARIKARI",2019-05-10,2020-05-07,2020-11-12,,https://patents.google.com/patent/US20200354651A1/en,https://patentimages.storage.googleapis.com/0f/af/ae/8cf1be0010fc50/US20200354651A1-20201112-D00000.png
US-2021027238-A1,Product identification systems and methods including a shelf ,"Touchcode Holdings, Llc","Wayne L. Nemeth, Lev M. Barsky, Oryan Inbar, Benjamin Kim, Fredy Giovanni Uruchima, Vadakkedathu Thomas Rajan",2019-05-08,2020-05-08,2021-01-28,,https://patents.google.com/patent/US20210027238A1/en,https://patentimages.storage.googleapis.com/04/7f/70/632b3ec200eee9/US20210027238A1-20210128-D00000.png
US-2020385446-A1,Anti-sema3a antibodies and their uses for treating eye or ocular diseases ,Boehringer Ingelheim International Gmbh,"Leo Thomas, Rachel Rebecca BARRETT, Kristin Laura BOVAT, Rajkumar Ganesan, Priyanka Gupta, Fei Han, Dongmei Liu, Juergen Prestle, Sanjaya Singh, Sathyadevi Venkataramani, Helen HAIXIA WU, Nina ZIPPEL",2019-05-09,2020-05-08,2020-12-10,,https://patents.google.com/patent/US20200385446A1/en,https://patentimages.storage.googleapis.com/29/f9/48/bcf69c1f18b0f2/US20200385446A1-20201210-D00000.png
US-2020354406-A1,Bicyclic peptide ligands specific for ox40 ,Bicycle TX Limited,"Tom Li STEPHEN, Kevin McDonnell, Nicholas Keen, Liuhong Chen, Helen Harrison, Peter U. Park, Michael Skynner, Harvey CHE",2019-05-09,2020-05-11,2020-11-12,,https://patents.google.com/patent/US20200354406A1/en,https://patentimages.storage.googleapis.com/65/6e/1b/75d020168dbdf4/US20200354406A1-20201112-D00000.png
US-2020359652-A1,Bacterial strain compositions and methods of using same ,"Agri-King, Inc.","Gbenga AYANGBILE, Mary GRZEMSKI, David Spangler, Lucas KRUEGER",2019-05-17,2020-05-11,2020-11-19,,https://patents.google.com/patent/US20200359652A1/en,https://patentimages.storage.googleapis.com/b2/91/5b/72a662cb89c9b1/US20200359652A1-20201119-D00001.png
US-2020362279-A1,Fermentation and aging apparatus and method for controlling fermentation and aging apparatus ,Lg Electronics Inc.,"Daewoong Lee, Yongbum Kim, Jinpyo Hong",2019-05-15,2020-05-12,2020-11-19,,https://patents.google.com/patent/US20200362279A1/en,https://patentimages.storage.googleapis.com/09/b9/49/3d030b74791620/US20200362279A1-20201119-D00000.png
US-2020370189-A1,Pd-comprising electrocatalysts suitable for water splitting ,King Fahd University Of Petroleum And Minerals,"Muhammad Ali Ehsan, Khurram Saleem Joya",2019-05-21,2019-05-21,2020-11-26,,https://patents.google.com/patent/US20200370189A1/en,https://patentimages.storage.googleapis.com/ac/1d/03/6106d9d37eb87d/US20200370189A1-20201126-D00001.png
US-2021171650-A1,Methods of administering anti-cd38 antibody ,Sanofi,"Heloise AUDAT, Sylvia MARION, Frank CAMPANA ZAMBRANO",2019-05-14,2020-05-13,2021-06-10,,https://patents.google.com/patent/US20210171650A1/en,https://patentimages.storage.googleapis.com/5e/7f/2f/d3e8d4824a92fd/US20210171650A1-20210610-D00000.png
US-2020362281-A1,Fermentation and aging apparatus ,Lg Electronics Inc.,"Daewoong Lee, Min JO, Kyungbin Lee",2019-05-14,2020-05-13,2020-11-19,,https://patents.google.com/patent/US20200362281A1/en,https://patentimages.storage.googleapis.com/18/ca/02/b92fafd400010e/US20200362281A1-20201119-D00000.png
US-2020391004-A1,Novel Method and Device for Urinary Catheter Placement ,"Mila International, Inc.","Jeff Vitullo, Anita J. Parkin",2019-05-18,2020-05-14,2020-12-17,,https://patents.google.com/patent/US20200391004A1/en,https://patentimages.storage.googleapis.com/84/9b/f4/9644be8da9bc61/US20200391004A1-20201217-D00000.png
US-2020371638-A1,Touch sensor ,"Dongwoo Fine-Chem Co., Ltd.","Seungkook KIM, Yumi AHN",2019-05-21,2020-05-14,2020-11-26,,https://patents.google.com/patent/US20200371638A1/en,https://patentimages.storage.googleapis.com/64/ec/03/2a552cdc8a425f/US20200371638A1-20201126-D00000.png
US-2020371155-A1,Thermal switch for rapid thermal coupling and decoupling of devices under test ,Intel Corporation,"Joe F. Walczyk, James Hastings, Morten Jensen, Todd Coons",2019-05-20,2019-05-20,2020-11-26,,https://patents.google.com/patent/US20200371155A1/en,https://patentimages.storage.googleapis.com/0d/77/e9/9c0682cf13543e/US20200371155A1-20201126-D00000.png
US-2020392584-A1,Methods and systems for detecting residual disease ,"Ultima Genomics, Inc.","Gilad Almogy, Mark Pratt, Omer BARAD, Simchon Faigler, Florian Oberstrass",2019-05-17,2020-05-15,2020-12-17,,https://patents.google.com/patent/US20200392584A1/en,https://patentimages.storage.googleapis.com/42/d5/98/cf52e64b0af277/US20200392584A1-20201217-D00000.png
US-2020370161-A1,Tetrahedral amorphous hydrogenated carbon and amorphous siloxane diamond-like nanocomposite ,"Thin Flim Service, Inc.",Ollivier Lefevre,2019-05-22,2020-05-15,2020-11-26,,https://patents.google.com/patent/US20200370161A1/en,https://patentimages.storage.googleapis.com/8c/d5/7f/95bab5f73e75e1/US20200370161A1-20201126-D00000.png
US-2020364915-A1,Techniques for managing multi-user content in augmented reality applications ,University Of Washington,"Kimberly C. Ruth, Tadayoshi Kohno, Franziska Roesner",2019-05-17,2020-05-15,2020-11-19,,https://patents.google.com/patent/US20200364915A1/en,https://patentimages.storage.googleapis.com/2d/90/c3/20bf42b1ec38a7/US20200364915A1-20201119-D00000.png
US-2020368952-A1,Injection molding apparatus with hot runners ,Sacmi Imola S.C.,"Gabriele SANGIORGI, Marco Fini, Davide Penazzi",2019-05-20,2020-05-18,2020-11-26,,https://patents.google.com/patent/US20200368952A1/en,https://patentimages.storage.googleapis.com/99/bd/c9/a74d2b69e57a0b/US20200368952A1-20201126-D00000.png
US-2020369008-A1,"Multiple-layer composite board of discrete materials and plastic, and production method thereof ",Minh Tam DO,Minh Tam DO,2019-05-21,2020-05-19,2020-11-26,,https://patents.google.com/patent/US20200369008A1/en,https://patentimages.storage.googleapis.com/bb/27/36/dd75ecf1518a97/US20200369008A1-20201126-D00000.png
US-2020373013-A1,Method And System For Analysis Of Spine Anatomy And Spine Disease ,"Theseus AI, Inc.","Billy Cao, Dave Harrison, Luke Macyszyn, Sam Elhag",2019-05-22,2020-05-19,2020-11-26,,https://patents.google.com/patent/US20200373013A1/en,https://patentimages.storage.googleapis.com/73/60/7c/be250142c23375/US20200373013A1-20201126-D00000.png
US-2020368253-A1,Use of csa compounds to stimulate stem cells and hair growth ,Brigham Young University,"Paul B. Savage, Michael C. Moore, Chad S. Beus",2019-05-23,2020-05-21,2020-11-26,,https://patents.google.com/patent/US20200368253A1/en,https://patentimages.storage.googleapis.com/22/0f/04/b0c7d82788f72d/US20200368253A1-20201126-D00000.png
