US-2019318690-A1,Display device ,"Samsung Display Co., Ltd.","Ju Hee Lee, Dae Youn CHO, Jong Woo Park, Young Tae Choi",2018-04-16,2019-04-03,2019-10-17,,https://patents.google.com/patent/US20190318690A1/en,https://patentimages.storage.googleapis.com/41/fc/13/1a6e5cb30bd6b4/US20190318690A1-20191017-D00000.png
US-2021069942-A1,A method for producing a cellulose product ,Pulpac AB,"Linus Larsson, Ove Larsson",2018-04-25,2019-04-17,2021-03-11,,https://patents.google.com/patent/US20210069942A1/en,https://patentimages.storage.googleapis.com/63/cc/2b/fa91e9676a1d11/US20210069942A1-20210311-D00000.png
US-2019335620-A1,Heat dissipation device ,Cambricon Technologies Corporation Limited,"Kun Li, Dejing WANG, Shuo Xing",2018-04-28,2019-04-16,2019-10-31,,https://patents.google.com/patent/US20190335620A1/en,https://patentimages.storage.googleapis.com/e2/aa/7c/4416ba06494ab5/US20190335620A1-20191031-D00000.png
US-2021008043-A1,"Substituted Chromenones, IRE1 Inhibitors, and Methods of Using Same ","The Wistar Institute, University Of South Florida","Chih-Chi Hu, Juan R. Del Valle",2018-04-01,2019-04-01,2021-01-14,,https://patents.google.com/patent/US20210008043A1/en,https://patentimages.storage.googleapis.com/79/ee/89/365d18d6fc49c7/US20210008043A1-20210114-D00000.png
US-2021351240-A1,Organic light-emitting display device having touch sensor ,"Lg Display Co., Ltd.","Hyang-Myoung GWON, Ji-Hyun Jung, Deuk-Su Lee, Su-Chang An, Jae-Gyun Lee, Ru-Da RHE, Yang-Sik LEE",2018-04-18,2021-07-26,2021-11-11,,https://patents.google.com/patent/US20210351240A1/en,https://patentimages.storage.googleapis.com/8d/21/4a/3d21eca6d4649d/US20210351240A1-20211111-D00000.png
US-2021017271-A1,Neutralization of Human Cytokines with Membrane-Bound Anti-Cytokine Non-Signaling Binders Expressed in Immune Cells ,National University Of Singapore,"Hong Ji Adrian Tan, Dario Campana",2018-04-02,2019-03-29,2021-01-21,,https://patents.google.com/patent/US20210017271A1/en,https://patentimages.storage.googleapis.com/2d/f0/9c/201b56e4f475f9/US20210017271A1-20210121-D00000.png
US-2019309238-A1,Polymeric Materials and Articles Manufactured There From ,"The Procter & Gamble Company, Virginia Tech Intellectual Properties, Inc.","Travis Kyle Hodgdon, Douglas Michael GRAHAM, Freddy Arthur Barnabas, Corey James Kenneally, Christopher Bryant Williams, Callie Elizabeth Zawaski, Timothy E Long, Allison M Pekkanen, Benjamin Tyler White",2018-04-10,2019-03-26,2019-10-10,,https://patents.google.com/patent/US20190309238A1/en,
US-10773944-B2,Smart vessel containment and dispensing unit ,Donald Christian Maier,Donald Christian Maier,2018-04-03,2019-04-02,2020-09-15,2020-09-15,https://patents.google.com/patent/US10773944B2/en,https://patentimages.storage.googleapis.com/88/a7/9b/5e4d22fac9e742/US10773944-20200915-D00000.png
US-2021335115-A1,"Sensing peripheral heuristic evidence, reinforcement, and engagement system ",State Farm Mutual Automobile Insurance Company,"Aaron Williams, Joseph Robert Brannan, Christopher N. Kawakita, Dana C. Hunt",2018-04-09,2021-07-06,2021-10-28,,https://patents.google.com/patent/US20210335115A1/en,https://patentimages.storage.googleapis.com/ae/fc/dc/1ae2be11361c90/US20210335115A1-20211028-D00000.png
US-2021359280-A1,"Organic light emiting transistor and manufacturing method thereof, display panel and electronic device ","Boe Technology Group Co., Ltd.","Liang Chen, Lei Wang, Xiaochuan Chen, Minghua XUAN, Dongni LIU, Li Xiao, Ming Yang, Detato ZHAO",2018-04-26,2019-01-07,2021-11-18,,https://patents.google.com/patent/US20210359280A1/en,https://patentimages.storage.googleapis.com/e1/c9/5a/930b9afa7ccc1f/US20210359280A1-20211118-D00000.png
US-2021238453-A1,Release film for pressure-sensitive silicone adhesive and production method therefor ,"Shin-Etsu Chemical Co., Ltd.","Koichi Yamaguchi, Yuji Yamane",2018-04-24,2019-04-04,2021-08-05,,https://patents.google.com/patent/US20210238453A1/en,
US-2019324289-A1,Spectacle lens comprising at least one ultrathin lens and process for production thereof ,CarI Zeiss Vision International GmbH,"Thomas Glöge, Jeremias Gromotka",2018-04-24,2019-04-24,2019-10-24,,https://patents.google.com/patent/US20190324289A1/en,https://patentimages.storage.googleapis.com/ca/7c/17/e94b7ac23dfbac/US20190324289A1-20191024-D00000.png
US-2019333971-A1,Display device ,"Samsung Display Co., Ltd",Hirotsugu Kishimoto,2018-04-27,2019-03-19,2019-10-31,,https://patents.google.com/patent/US20190333971A1/en,https://patentimages.storage.googleapis.com/d1/06/01/0d8aa9b1914510/US20190333971A1-20191031-D00000.png
US-2021242449-A1,"Improved flooded lead acid batteries utilizing an improved separator with a fibrous mat, and methods and systems using the same ","Daramic, Llc","Jorg Deiters, Matthew Stainer, Anna L. Verderame, J. Kevin Whear",2018-04-20,2019-04-18,2021-08-05,,https://patents.google.com/patent/US20210242449A1/en,https://patentimages.storage.googleapis.com/70/1b/f4/a4694739d070d2/US20210242449A1-20210805-D00000.png
US-10951133-B2,Repulsive-attractive-force electrostatic actuator ,The Regents Of The University Of California,"Ethan Weber Schaler, Ronald S. Fearing",2018-04-06,2019-04-08,2021-03-16,2021-03-16,https://patents.google.com/patent/US10951133B2/en,https://patentimages.storage.googleapis.com/00/5c/9b/64d77ceebc69b6/US10951133-20210316-D00000.png
US-2021189523-A1,Electrodes for biosensors ,Materion Corporation,"Ethan Fontaine, Jerome Farquharson",2018-04-18,2019-04-18,2021-06-24,,https://patents.google.com/patent/US20210189523A1/en,https://patentimages.storage.googleapis.com/1e/d5/f3/49136804fa2547/US20210189523A1-20210624-D00000.png
US-10485305-B2,Passenger safety belt buckles ,"Rockwell Collins, Inc.","Charles Martin Hansson, Jaan Lin, Brian P. Wenger, Michael Princip, Alex L. Velet, Thomas Martz, Glenn A. Johnson",2018-04-09,2018-04-09,2019-11-26,2019-11-26,https://patents.google.com/patent/US10485305B2/en,https://patentimages.storage.googleapis.com/2b/0c/93/b35aa2725f6f5a/US10485305-20191126-D00000.png
US-2019318767-A1,Electronic device having an interior that includes a saturated salt solution and a desiccant ,Seagate Technology Llc,John L Brand,2018-04-16,2018-04-16,2019-10-17,,https://patents.google.com/patent/US20190318767A1/en,https://patentimages.storage.googleapis.com/b3/af/d2/d61827d60977d0/US20190318767A1-20191017-D00000.png
US-2021023827-A1,Hardcoat film and article and image display device having hardcoat film ,Fujifilm Corporation,"Yuta FUKUSHIMA, Ayako Matsumoto, Tetsu Kitamura, Akio Tamura, Keigo UEKI",2018-04-26,2020-09-30,2021-01-28,,https://patents.google.com/patent/US20210023827A1/en,
US-2021106475-A1,Disposable cleaning auxiliary tool ,"Wanocare Co., Ltd.","Yukie Nagai, Akie Kawabata",2018-04-19,2018-11-19,2021-04-15,,https://patents.google.com/patent/US20210106475A1/en,https://patentimages.storage.googleapis.com/97/29/9f/c08c99f422f7d3/US20210106475A1-20210415-D00000.png
US-2019307584-A1,Intelligent prosthetic socket ,Case Western Reserve University,"Ming-Chun Huang, Hongping Zhao",2018-04-09,2019-04-09,2019-10-10,,https://patents.google.com/patent/US20190307584A1/en,https://patentimages.storage.googleapis.com/08/cb/21/400fa4fbcb05d9/US20190307584A1-20191010-D00000.png
US-10625122-B2,Enclosure for a bowling ball ,Magnum Shielding Corporation,"Cameron F. Hurwitz, Scott L. Hurwitz",2018-04-13,2019-02-08,2020-04-21,2020-04-21,https://patents.google.com/patent/US10625122B2/en,https://patentimages.storage.googleapis.com/a2/02/5c/27e0fb78c0819e/US10625122-20200421-D00000.png
US-2019330574-A1,"Water-soluble films, detergent single dose packs employing water-soluble films, and methods of producing the same ",Henkel IP & Holding GmbH,"Daniel Thomas Piorkowski, Casey Elphege Camire",2018-04-25,2018-04-25,2019-10-31,,https://patents.google.com/patent/US20190330574A1/en,
US-2021229531-A1,Composite pane with electrically switchable functional element in thermoplastic intermediate layer ,Saint-Gobain Glass France,"Patrick Weber, Ali-Osman KIZMAZ, Sara BORHANI HAGHIGHI, Alexandra YATIM",2018-04-25,2019-04-17,2021-07-29,,https://patents.google.com/patent/US20210229531A1/en,https://patentimages.storage.googleapis.com/ce/d2/2d/8f666352db2a9d/US20210229531A1-20210729-D00000.png
US-2019315090-A1,"Stitchbonded, washable nonwoven towels and method for making ",Amtex Innovations Llc,"Maxwell James LEE, Robert Charles BUSCH",2018-04-13,2019-04-12,2019-10-17,,https://patents.google.com/patent/US20190315090A1/en,https://patentimages.storage.googleapis.com/ed/f1/2d/a48b83bef12d0d/US20190315090A1-20191017-D00000.png
US-2021246238-A1,"Polymer, and oxygen absorbent and resin composition using same ","Kuraray Co., Ltd.","Daiki NOGUCHI, Takashi Fukumoto, Keiji Kubo",2018-04-23,2019-04-12,2021-08-12,,https://patents.google.com/patent/US20210246238A1/en,
US-2019328295-A1,Planar electrodes for invasive biosensors ,Verily Life Sciences Llc,"Zenghe Liu, Todd Whitehurst, Aurang Zeb",2018-04-26,2019-04-22,2019-10-31,,https://patents.google.com/patent/US20190328295A1/en,https://patentimages.storage.googleapis.com/23/8a/77/117b40d1584b09/US20190328295A1-20191031-D00000.png
US-2019333978-A1,Display device ,"Samsung Display Co., Ltd.",Dae Geun LEE,2018-04-26,2019-04-15,2019-10-31,,https://patents.google.com/patent/US20190333978A1/en,https://patentimages.storage.googleapis.com/e3/b1/8c/01f4bf5cb9e591/US20190333978A1-20191031-D00000.png
US-2019323531-A1,Cat tree ,"Demby Development Co., Ltd.",Tsung-Hsiang Wang,2018-04-24,2019-04-18,2019-10-24,,https://patents.google.com/patent/US20190323531A1/en,https://patentimages.storage.googleapis.com/94/7f/9e/ba37fa2123eeb8/US20190323531A1-20191024-D00000.png
US-2019322711-A1,Zinc finger protein compositions for modulation of huntingtin (htt) ,"Sangamo Therapeutics, Inc., Chdi Foundation, Inc.","Steven Froelich, Ignacio Munoz-Sanjuan, Edward J. Rebar, Bryan Zeitler, H. Steve Zhang",2018-04-18,2019-04-17,2019-10-24,,https://patents.google.com/patent/US20190322711A1/en,https://patentimages.storage.googleapis.com/d8/b4/05/e59d92ee194166/US20190322711A1-20191024-D00000.png
US-2021156142-A1,Construction system for a module of a building ,Igor USTINOV,Igor USTINOV,2018-04-17,2019-04-16,2021-05-27,,https://patents.google.com/patent/US20210156142A1/en,https://patentimages.storage.googleapis.com/d4/bc/72/b176b4624e1849/US20210156142A1-20210527-D00000.png
US-2021161997-A1,Treating diseases via targeted modulation of gene signaling networks ,Camp4 Therapeutics Corporation,"David A. Bumcrot, Alfica Sehgal, Alla Sigova, Vaishnavi Rajagopal, Brian Schwartz, Cynthia Smith",2018-04-06,2019-04-08,2021-06-03,,https://patents.google.com/patent/US20210161997A1/en,https://patentimages.storage.googleapis.com/ca/d0/b7/15a97683c3229f/US20210161997A1-20210603-D00000.png
US-2021241908-A1,Multi-sensor based hmi/ai-based system for diagnosis and therapeutic treatment of patients with neurological disease ,Mindmaze Holding Sa,"Martin CIUPA, Tej TADI",2018-04-26,2019-04-24,2021-08-05,,https://patents.google.com/patent/US20210241908A1/en,https://patentimages.storage.googleapis.com/21/62/66/74f179af77fbb6/US20210241908A1-20210805-D00000.png
US-2021094920-A1,Nr2b ligands; method of making; and use thereof ,"The United States Of America, As Represented By The Secretary, Department Of Health And Human Servic","Lisheng Cai, Victor W. Pike, Robert B. Innis",2018-04-26,2019-04-26,2021-04-01,,https://patents.google.com/patent/US20210094920A1/en,https://patentimages.storage.googleapis.com/13/6b/cc/b789af957ffabf/US20210094920A1-20210401-D00001.png
US-2021094891-A1,1-step radiosynthesis of [18f]sfb ,"Rigshospitalet, University Of Copenhagen","Andreas Kjaer, Matthias Manfred HERTH, Jacob Madsen, Ida Nymann PETERSEN",2018-04-06,2019-05-27,2021-04-01,,https://patents.google.com/patent/US20210094891A1/en,https://patentimages.storage.googleapis.com/b6/aa/b2/7459b659a0179c/US20210094891A1-20210401-D00000.png
US-2021116459-A1,Biomarkers and uses thereof ,Oxford University Innovation Limited,"Manu Vatish, Christopher Redman, Ian Sargent, Adam CRIBBS, Gavin COLLETT, Wei Zhang",2018-04-12,2019-04-11,2021-04-22,,https://patents.google.com/patent/US20210116459A1/en,https://patentimages.storage.googleapis.com/bc/e4/79/92c10f672e49d6/US20210116459A1-20210422-D00000.png
US-2021052247-A1,Medical information processing system and medical information processing method ,Canon Medical Systems Corporation,Yoshimasa Kobayashi,2018-04-27,2020-10-23,2021-02-25,,https://patents.google.com/patent/US20210052247A1/en,https://patentimages.storage.googleapis.com/95/87/1a/66a78db81a2603/US20210052247A1-20210225-D00000.png
US-2019316006-A1,Fiber matrix adhesive tape ,A+ Composites GmbH,Markus Brzeski,2018-04-11,2019-04-11,2019-10-17,,https://patents.google.com/patent/US20190316006A1/en,https://patentimages.storage.googleapis.com/7e/1f/02/fd8548faeb2994/US20190316006A1-20191017-D00000.png
US-2021046744-A1,Multilayered article and multilayered container ,"Mitsubishi Gas Chemical Company, Inc.","Takanori Miyabe, Takafumi Oda, Jin Nakamura, Masaki Yamanaka",2018-04-24,2019-04-22,2021-02-18,,https://patents.google.com/patent/US20210046744A1/en,https://patentimages.storage.googleapis.com/e8/4b/8b/126f999ea046a5/US20210046744A1-20210218-D00000.png
US-2019045332-A1,Wireless tracking and positioning system and method thereof ,"Chengdu Yueyang Technology Co., Ltd.",Song Ye,2018-04-10,2018-10-11,2019-02-07,,https://patents.google.com/patent/US20190045332A1/en,https://patentimages.storage.googleapis.com/ed/da/58/cc8464a9693cd3/US20190045332A1-20190207-D00000.png
US-2021071214-A1,Method of producing n-acyl-amino group-containing compound ,"Ajinomoto Co., Inc.","Hidemi Nagata, Keiko Danjou, Jun Takakura, Hiroyuki Nozaki",2018-04-13,2020-09-18,2021-03-11,,https://patents.google.com/patent/US20210071214A1/en,
US-11147242-B2,Animal leash ,"The Pet Salon, Inc.",Charles Ross Simons,2018-04-24,2019-04-23,2021-10-19,2021-10-19,https://patents.google.com/patent/US11147242B2/en,https://patentimages.storage.googleapis.com/80/f1/81/5f42a5b9abd9c3/US11147242-20211019-D00000.png
US-2021032264-A1,Indene derivatives useful in treating pain and inflammation ,Aquinox Pharmaceuticals (Canada) Inc.,"Curtis Harwig, Jeremy D. PETTIGREW, Jennifer Cross, Jeyaprakashnarayanan Seenisamy, Mahesh Narayan Keregadde, Karthikeyan IYANAR",2018-04-06,2019-04-05,2021-02-04,,https://patents.google.com/patent/US20210032264A1/en,
US-2021030900-A1,Targeting compounds and methods for their production ,The University Of Melbourne,"Paul Stephen Donnelly, Nicholas Alan ZIA",2018-04-11,2019-04-11,2021-02-04,,https://patents.google.com/patent/US20210030900A1/en,
US-2021237021-A1,Stable polyurea microcapsule compositions ,International Flavors & Fragrances Inc.,"Niels Akeroyd, Laura French, Robert Allan Hunter, Yabin Lei, Lewis Michael Popplewell, Volkert de Villeneuve, Clementine Marteau-Roussy",2018-04-27,2019-04-26,2021-08-05,,https://patents.google.com/patent/US20210237021A1/en,
US-2021163209-A1,Multiple compartment container having an interface device for mixing contents and method to produce such container ,Compagnie Gervais Danone,"Juan-Felipe JARAMILLO, Alex James Orchard",2018-04-25,2018-04-25,2021-06-03,,https://patents.google.com/patent/US20210163209A1/en,https://patentimages.storage.googleapis.com/22/10/f0/9b79649383dda6/US20210163209A1-20210603-D00000.png
US-2019313687-A1,Ice candy forming tool for pets ,"Doggyman H. A. Co., Ltd.","Akio Hayashi, Masashi Oki",2018-04-13,2018-08-09,2019-10-17,,https://patents.google.com/patent/US20190313687A1/en,https://patentimages.storage.googleapis.com/bd/5c/70/4ba067756397e4/US20190313687A1-20191017-D00000.png
US-2021138092-A1,Selective ligands for tau aggregates ,Karin & Sten Mortstedt Cbd Solutions Ab,Daniel Dungan Sohn,2018-04-11,2019-04-10,2021-05-13,,https://patents.google.com/patent/US20210138092A1/en,https://patentimages.storage.googleapis.com/3e/72/df/0fd6862aef7674/US20210138092A1-20210513-D00000.png
US-10836562-B2,Crystallized plastic valve for an aerosol dispenser and housing therefor ,The Procter & Gamble Company,"Robert Earl Magness, David Andrew Dalton, Douglas Bruce Zeik",2018-04-16,2018-04-16,2020-11-17,2020-11-17,https://patents.google.com/patent/US10836562B2/en,https://patentimages.storage.googleapis.com/4b/9a/7a/ae60a7f6f81bd2/US10836562-20201117-D00000.png
US-10762414-B1,Systems and methods for sharing an artificial intelligence personality ,"Kinoo, Inc.","Lewis James Marggraff, Nelson George Publicover, Mary Jo Marggraff",2018-04-19,2019-04-19,2020-09-01,2020-09-01,https://patents.google.com/patent/US10762414B1/en,https://patentimages.storage.googleapis.com/32/f6/06/d5aaec63b85bbd/US10762414-20200901-D00000.png
US-2021031563-A1,Pneumatic vehicle tire for a vehicle ,Continental Reifen Deutschland Gmbh,"Wolfgang Reese, Thomas Kramer",2018-04-27,2019-02-04,2021-02-04,,https://patents.google.com/patent/US20210031563A1/en,https://patentimages.storage.googleapis.com/34/38/07/27f33d6cf731d2/US20210031563A1-20210204-D00000.png
US-2019314218-A1,Webs for absorbent articles and methods of making the same ,The Procter & Gamble Company,"Kelyn A. ARORA, John L. Hammons, Nathan R. WHITELY, Misael O. AVILES",2018-04-17,2019-04-02,2019-10-17,,https://patents.google.com/patent/US20190314218A1/en,https://patentimages.storage.googleapis.com/18/d7/ab/12a731d2b46910/US20190314218A1-20191017-D00000.png
US-11044911-B2,Phenoxyurea compound and pest control agent ,"Nippon Soda Co., Ltd.","Hironori Furukawa, Takao Iwasa, Tomohiro Amano, Yasuyuki Shiinoki, Hiroko Moroe",2018-04-09,2019-04-03,2021-06-29,2021-06-29,https://patents.google.com/patent/US11044911B2/en,
US-2021226075-A1,Silicon-Based Solar Cell Panel ,Minyan Huang,Minyan Huang,2018-04-25,2018-10-24,2021-07-22,,https://patents.google.com/patent/US20210226075A1/en,https://patentimages.storage.googleapis.com/c7/ec/e5/48d2b862650313/US20210226075A1-20210722-D00000.png
US-2019311228-A1,Cross-modality image synthesis ,Siemens Healthcare Gmbh,"Yu Zhao, Yimo Gao, Shu Liao, Liang Zhao, Zhennan Yan, Yiqiang Zhan, Xiang Sean Zhou",2018-04-05,2019-01-28,2019-10-10,,https://patents.google.com/patent/US20190311228A1/en,https://patentimages.storage.googleapis.com/ee/e4/1a/0c5f2620ca939b/US20190311228A1-20191010-D00000.png
US-10353084-B1,Systems and methods for cooling an imaging system ,General Electric Company,"Grant Richard Wagner, Adam Clark Nathan, Matthew Jason Evangelist, Chad Allan Smith, Mark Alan Frontera",2018-04-02,2018-04-02,2019-07-16,2019-07-16,https://patents.google.com/patent/US10353084B1/en,https://patentimages.storage.googleapis.com/7c/c4/89/83d4627b69bcc0/US10353084-20190716-D00000.png
US-2021347813-A1,Compounds with hiv maturation inhibitory activity ,Viiv Healthcare Uk (No. 5) Limited,"John F. Kadow, B. Narasimhulu Naidu",2018-04-24,2019-04-22,2021-11-11,,https://patents.google.com/patent/US20210347813A1/en,https://patentimages.storage.googleapis.com/84/57/ea/a1d4e10ccd7e74/US20210347813A1-20211111-D00001.png
US-2019314026-A1,Ligation clip with latching and retention features ,Covidien Lp,"Justin Thomas, Eric Brown, Jacob C. Baril, Gregory R. Morck, Roy J. Pilletere, Saumya Banerjee, Matthew A. Dinino",2018-04-11,2019-01-30,2019-10-17,,https://patents.google.com/patent/US20190314026A1/en,https://patentimages.storage.googleapis.com/9b/30/47/f90700ba482566/US20190314026A1-20191017-D00000.png
US-2021148533-A1,Led filament lamp of candle light appearance ,Signify Holding B.V.,"Ties Van Bommel, Rifat Ata Mustafa Hikmet, Robert Jacob Pet",2018-04-11,2019-04-09,2021-05-20,,https://patents.google.com/patent/US20210148533A1/en,https://patentimages.storage.googleapis.com/5e/a0/ef/05f07d5a3090d9/US20210148533A1-20210520-D00000.png
US-2021238302-A1,"High affinity monoclonal antibodies (mabs) against cell surface expressed human carbonic anhydrase ix (hca-ix), and uses thereof ",National Research Council Of Canada,"Anne E. G. Lenferink, Maureen D. O'Connor",2018-04-27,2019-04-26,2021-08-05,,https://patents.google.com/patent/US20210238302A1/en,https://patentimages.storage.googleapis.com/f6/fb/9c/57b2aeb3140687/US20210238302A1-20210805-D00000.png
US-10714690-B2,"Auto-polymerization electric storage material based on dopamine, preparation method thereof and application to electric storage device thereof ",Soochow University,"Jianmei Lu, Jinghui HE",2018-04-11,2019-04-10,2020-07-14,2020-07-14,https://patents.google.com/patent/US10714690B2/en,https://patentimages.storage.googleapis.com/27/7c/da/eacd15976f0f41/US10714690-20200714-D00000.png
US-2021163462-A1,Tri-substituted aryl and heteroaryl derivatives as modulators of pi3-kinase and autophagy pathways ,"Neuropore Therapies, Inc.","Emily M. Stocking, Wolfgang J. Wrasidlo",2018-04-10,2019-04-09,2021-06-03,,https://patents.google.com/patent/US20210163462A1/en,
US-10953850-B1,Seatbelt detection using computer vision ,Ambarella International Lp,"Shimon Pertsel, Patrick Martin",2018-04-05,2018-06-06,2021-03-23,2021-03-23,https://patents.google.com/patent/US10953850B1/en,https://patentimages.storage.googleapis.com/98/e5/67/31d6af72827073/US10953850-20210323-D00000.png
US-10956759-B1,Age detection in vehicles using computer vision ,Ambarella International Lp,"Shimon Pertsel, Patrick Martin",2018-04-05,2018-07-12,2021-03-23,2021-03-23,https://patents.google.com/patent/US10956759B1/en,https://patentimages.storage.googleapis.com/f9/8c/8d/73a91194f9e965/US10956759-20210323-D00000.png
US-10850693-B1,Determining comfort settings in vehicles using computer vision ,Ambarella International Lp,"Shimon Pertsel, Patrick Martin",2018-04-05,2018-08-31,2020-12-01,2020-12-01,https://patents.google.com/patent/US10850693B1/en,https://patentimages.storage.googleapis.com/fa/07/d7/42e19bc3613867/US10850693-20201201-D00000.png
US-2021230236-A1,Proteins for the Treatment of Epithelial Barrier Function Disorders ,"Second Genome, Inc.","Cristina N. Butterfield, Daniela Keilberg, Andrew W. Goodyear, Andrew W. Han",2018-04-06,2019-04-08,2021-07-29,,https://patents.google.com/patent/US20210230236A1/en,https://patentimages.storage.googleapis.com/1e/d6/ca/753ee22ff9df6c/US20210230236A1-20210729-D00000.png
US-2019313606-A1,Protective head cover for animals ,M.P.S. Holding B.V.,Nicole Antoinette Kok-Duson,2018-04-11,2019-04-09,2019-10-17,,https://patents.google.com/patent/US20190313606A1/en,https://patentimages.storage.googleapis.com/46/71/a8/4fe549033487db/US20190313606A1-20191017-D00000.png
US-2021062048-A1,Tapes with elastomeric backing layers ,3M Innovative Properties Company,"Thomas B. Galush, David T. Amos, Edward E. Cole, Daniel R. Fronek, Naiyong Jing, Matthew J. Kryger, Kiu-Yuen Tse, Scott A. Van Wert",2018-04-20,2019-04-11,2021-03-04,,https://patents.google.com/patent/US20210062048A1/en,https://patentimages.storage.googleapis.com/5b/17/d6/dd96b84e42747f/US20210062048A1-20210304-D00000.png
US-2021095240-A1,Cell separation chamber and cell separation system and method ,Aglaris Ltd,"David HORNA TOMÁS, Miquel Costa Ferrando",2018-04-19,2019-04-17,2021-04-01,,https://patents.google.com/patent/US20210095240A1/en,https://patentimages.storage.googleapis.com/79/a7/1e/305d21e2988402/US20210095240A1-20210401-D00000.png
US-2021032501-A1,Adhesive sheet for temporary attachment and method for producing semiconductor device using the same ,"Lg Chem, Ltd.","Sera Kim, Ji Ho HAN, Mi Jang, Kwang Joo Lee",2018-04-12,2019-04-11,2021-02-04,,https://patents.google.com/patent/US20210032501A1/en,https://patentimages.storage.googleapis.com/85/61/29/3a3d1a1831b3e1/US20210032501A1-20210204-D00000.png
US-10642195-B2,Image forming apparatus using intermediate transfer member having grooves and specified dynamic friction coefficient ,Canon Kabushiki Kaisha,"Shohei Ishio, Keisuke Ishizumi, Takayuki Tanaka, Tsuguhiro Yoshida, Shinji Katagiri",2018-04-16,2019-04-09,2020-05-05,2020-05-05,https://patents.google.com/patent/US10642195B2/en,https://patentimages.storage.googleapis.com/ca/d0/1d/df4782fbc3d2c9/US10642195-20200505-D00000.png
US-10964852-B2,LED module and LED lamp including the same ,"Samsung Electronics Co., Ltd.","Jae Sung You, Ho Sun Paek, Ho Young Song, Jun Bum LEE",2018-04-24,2018-12-18,2021-03-30,2021-03-30,https://patents.google.com/patent/US10964852B2/en,https://patentimages.storage.googleapis.com/31/4a/39/751164858b31ea/US10964852-20210330-D00000.png
US-11089921-B2,Modular dispenser system ,"Turtle Wax, Inc.","Robert C. Jack, Daren Herbert",2018-04-17,2019-04-11,2021-08-17,2021-08-17,https://patents.google.com/patent/US11089921B2/en,https://patentimages.storage.googleapis.com/e9/7a/ff/bc31611fee4732/US11089921-20210817-D00000.png
US-2019312254-A1,Protective coating for lithium-containing electrode and methods of making the same ,GM Global Technology Operations LLC,Xingcheng Xiao,2018-04-06,2018-04-06,2019-10-10,,https://patents.google.com/patent/US20190312254A1/en,https://patentimages.storage.googleapis.com/1e/a7/d3/ecb29e12429133/US20190312254A1-20191010-D00000.png
US-11171341-B2,Fuel cell and method of manufacturing fuel cell ,Toyota Jidosha Kabushiki Kaisha,"Takuya Kurihara, Nobuaki Nonoyama, Kenji Sato, Sachio Okada",2018-04-18,2019-04-15,2021-11-09,2021-11-09,https://patents.google.com/patent/US11171341B2/en,https://patentimages.storage.googleapis.com/fc/34/e4/ad86dc3273664b/US11171341-20211109-D00000.png
US-11152551-B2,Electronic device ,Innolux Corporation,"Min-Hsin Lo, Ker-Yih Kao, Ming-Chun Tseng, Hung-Sheng LIAO",2018-04-27,2019-04-16,2021-10-19,2021-10-19,https://patents.google.com/patent/US11152551B2/en,https://patentimages.storage.googleapis.com/5e/5d/5a/abfb13245cd140/US11152551-20211019-D00000.png
US-2021139213-A1,"Stretched film, packaging material, and method for producing stretched film ","Mitsubishi Gas Chemical Company, Inc.","Masaki Yamanaka, Takafumi Oda",2018-04-26,2019-04-25,2021-05-13,,https://patents.google.com/patent/US20210139213A1/en,
